Dates of Breach,End Date of Breach,Individuals Affected,Link to PDF,Name of Entity,Reported Date,Source(s),Start Date of Breach,State Reported
04/02/2019-04/02/2019,2019-04-02 00:00:00,1 in Montana,https://media.dojmt.gov/wp-content/uploads/CON-LEGAL-40716856v1-MT-Notice-Packet-4-15-19.pdf,Intuit Inc,2019-04-15 00:00:00,https://dojmt.gov/consumer/consumers-known-data-breach-incidents/#,2019-04-02 00:00:00,Montana
03/08/2019-03/15/2019,2019-03-15 00:00:00,2 in Montana,https://media.dojmt.gov/wp-content/uploads/CON-Merrick-Bank-Consumer-Notification-Letter-FINAL.pdf,Merrick Bank,2019-04-12 00:00:00,https://dojmt.gov/consumer/consumers-known-data-breach-incidents/#,2019-03-08 00:00:00,Montana
02/26/2019-02/26/2019,2019-02-26 00:00:00,1 in Montana,https://media.dojmt.gov/wp-content/uploads/CON-Gaming-Arts-Notice-of-Data-Event-MT.pdf,Gaming Arts LLC,2019-04-12 00:00:00,https://dojmt.gov/consumer/consumers-known-data-breach-incidents/#,2019-02-26 00:00:00,Montana
04/05/2019-04/05/2019,2019-04-05 00:00:00,1 in Montana,https://media.dojmt.gov/wp-content/uploads/CON-Flywheel-Template-C1.pdf,Flywheel Exchange,2019-04-12 00:00:00,https://dojmt.gov/consumer/consumers-known-data-breach-incidents/#,2019-04-05 00:00:00,Montana
04/05/2019-04/05/2019,2019-04-05 00:00:00,1 in Montana,https://media.dojmt.gov/wp-content/uploads/CON-Imbio-Template-C1.pdf,Imbio LLC,2019-04-12 00:00:00,https://dojmt.gov/consumer/consumers-known-data-breach-incidents/#,2019-04-05 00:00:00,Montana
04/05/2019-04/05/2019,2019-04-05 00:00:00,2 in Montana,https://media.dojmt.gov/wp-content/uploads/CON-Inveshure-Template-C1.pdf,Invenshure,2019-04-12 00:00:00,https://dojmt.gov/consumer/consumers-known-data-breach-incidents/#,2019-04-05 00:00:00,Montana
02/07/2019-02/13/2019,2019-02-13 00:00:00,1 in Montana,https://media.dojmt.gov/wp-content/uploads/CON-MT-AG-Notification-Ltr.pdf,The Hartford Financial Services Group,2019-04-12 00:00:00,https://dojmt.gov/consumer/consumers-known-data-breach-incidents/#,2019-02-07 00:00:00,Montana
03/27/2019-03/27/2019,2019-03-27 00:00:00,1 in Montana,https://media.dojmt.gov/wp-content/uploads/CON-Dakota-County-Montana-Regulatory-Notification-Letter.pdf,"Dakota County, Minnesota",2019-04-12 00:00:00,https://dojmt.gov/consumer/consumers-known-data-breach-incidents/#,2019-03-27 00:00:00,Montana
01/20/2019-01/20/2019,2019-01-20 00:00:00,1 in Montana,https://media.dojmt.gov/wp-content/uploads/CON-AG-MT-Notification-Letter.pdf,Riverplace Counseling Center,2019-04-11 00:00:00,https://dojmt.gov/consumer/consumers-known-data-breach-incidents/#,2019-01-20 00:00:00,Montana
09/20/2018-09/20/2018,2018-09-20 00:00:00,2 in Montana,https://media.dojmt.gov/wp-content/uploads/CON-Heritage-Benefits-Consumer-Notification-Letter.pdf,Acrisure Heritage Insurance Agency,2019-04-10 00:00:00,https://dojmt.gov/consumer/consumers-known-data-breach-incidents/#,2018-09-20 00:00:00,Montana
11/07/2018-11/07/2018,2018-11-07 00:00:00,2 in Montana,https://media.dojmt.gov/wp-content/uploads/CON-CON.pdf,Union Benefit Planners,2019-04-10 00:00:00,https://dojmt.gov/consumer/consumers-known-data-breach-incidents/#,2018-11-07 00:00:00,Montana
10/01/2018-10/31/2018,2018-10-31 00:00:00,1 in Montana,https://media.dojmt.gov/wp-content/uploads/CON-2019.04.09-MT-AG-Notice-WRRH.pdf,Weslaco Regional Rehabilitation Hospital,2019-04-08 00:00:00,https://dojmt.gov/consumer/consumers-known-data-breach-incidents/#,2018-10-01 00:00:00,Montana
10/01/2018-10/31/2018,2018-10-31 00:00:00,1 in Montana,https://media.dojmt.gov/wp-content/uploads/CON-2019.04.09-MT-AG-Notice-WRRH.pdf,Weslaco Regional Rehabilitation Hospital,2019-04-08 00:00:00,https://dojmt.gov/consumer/consumers-known-data-breach-incidents/#,2018-10-01 00:00:00,Montana
02/12/2019-02/19/2019,2019-02-19 00:00:00,46 in Montana,https://media.dojmt.gov/wp-content/uploads/CON-Letter-to-MT-AG.pdf,Canyon Bakehouse,2019-04-09 00:00:00,https://dojmt.gov/consumer/consumers-known-data-breach-incidents/#,2019-02-12 00:00:00,Montana
11/01/2018-11/30/2018,2018-11-30 00:00:00,8 in Montana,https://media.dojmt.gov/wp-content/uploads/CON-America-Juice-Sample-Consumer-Notification-Letter.pdf,America Juice Co.,2019-04-08 00:00:00,https://dojmt.gov/consumer/consumers-known-data-breach-incidents/#,2018-11-01 00:00:00,Montana
03/07/2019-03/07/2019,2019-03-07 00:00:00,1 in Montana,https://media.dojmt.gov/wp-content/uploads/CON-MT-AG.pdf,H&R Block,2019-04-08 00:00:00,https://dojmt.gov/consumer/consumers-known-data-breach-incidents/#,2019-03-07 00:00:00,Montana
09/06/2018-12/02/2018,2018-12-02 00:00:00,Unknown in Montana,https://media.dojmt.gov/wp-content/uploads/CON-Sample-Notice.pdf,Pie Five Pizza,2019-04-05 00:00:00,https://dojmt.gov/consumer/consumers-known-data-breach-incidents/#,2018-09-06 00:00:00,Montana
12/18/2018-02/20/2019,2019-02-20 00:00:00,4 in Montana,https://media.dojmt.gov/wp-content/uploads/CON-Archbright-Consumer-Notification-Letter.pdf,Archbright,2019-04-05 00:00:00,https://dojmt.gov/consumer/consumers-known-data-breach-incidents/#,2018-12-18 00:00:00,Montana
11/14/2018-02/05/2019,2019-02-05 00:00:00,1 in Montana,https://media.dojmt.gov/wp-content/uploads/CON-HRS-Regulator-Notice-MT_Redacted.pdf,Health Recovery Services,2019-05-05 00:00:00,https://dojmt.gov/consumer/consumers-known-data-breach-incidents/#,2018-11-14 00:00:00,Montana
08/01/2018-08/21/2018,2018-08-21 00:00:00,1345 in Montana,https://media.dojmt.gov/wp-content/uploads/CON-Jobscience-Notice-MT.pdf,"Jobscience, Inc.",2019-04-05 00:00:00,https://dojmt.gov/consumer/consumers-known-data-breach-incidents/#,2018-08-01 00:00:00,Montana
11/26/2018-04/04/2019,2019-04-04 00:00:00,1 in Montana,https://media.dojmt.gov/wp-content/uploads/CON-UCLA-Eurofin-Adults-Template.pdf,UCLA Health,2019-04-05 00:00:00,https://dojmt.gov/consumer/consumers-known-data-breach-incidents/#,2018-11-26 00:00:00,Montana
12/01/2018-02/17/2019,2019-02-17 00:00:00,912 in Montana,https://media.dojmt.gov/wp-content/uploads/CON-Coinmama-Montana-Breach_.pdf,Coinmama.com,2019-04-05 00:00:00,https://dojmt.gov/consumer/consumers-known-data-breach-incidents/#,2018-12-01 00:00:00,Montana
10/01/2018-10/31/2018,2018-10-31 00:00:00,1 in Montana,https://media.dojmt.gov/wp-content/uploads/CON-2019.04.09-MT-AG-Notice-WRRH.pdf,Weslaco Regional Rehabilitation Hospital,2019-04-08 00:00:00,https://dojmt.gov/consumer/consumers-known-data-breach-incidents/#,2018-10-01 00:00:00,Montana
02/12/2019-02/19/2019,2019-02-19 00:00:00,46 in Montana,https://media.dojmt.gov/wp-content/uploads/CON-Letter-to-MT-AG.pdf,Canyon Bakehouse,2019-04-09 00:00:00,https://dojmt.gov/consumer/consumers-known-data-breach-incidents/#,2019-02-12 00:00:00,Montana
11/01/2018-11/30/2018,2018-11-30 00:00:00,8 in Montana,https://media.dojmt.gov/wp-content/uploads/CON-America-Juice-Sample-Consumer-Notification-Letter.pdf,America Juice Co.,2019-04-08 00:00:00,https://dojmt.gov/consumer/consumers-known-data-breach-incidents/#,2018-11-01 00:00:00,Montana
03/07/2019-03/07/2019,2019-03-07 00:00:00,1 in Montana,https://media.dojmt.gov/wp-content/uploads/CON-MT-AG.pdf,H&R Block,2019-04-08 00:00:00,https://dojmt.gov/consumer/consumers-known-data-breach-incidents/#,2019-03-07 00:00:00,Montana
09/06/2018-12/02/2018,2018-12-02 00:00:00,Unknown in Montana,https://media.dojmt.gov/wp-content/uploads/CON-Sample-Notice.pdf,Pie Five Pizza,2019-04-05 00:00:00,https://dojmt.gov/consumer/consumers-known-data-breach-incidents/#,2018-09-06 00:00:00,Montana
12/18/2018-02/20/2019,2019-02-20 00:00:00,4 in Montana,https://media.dojmt.gov/wp-content/uploads/CON-Archbright-Consumer-Notification-Letter.pdf,Archbright,2019-04-05 00:00:00,https://dojmt.gov/consumer/consumers-known-data-breach-incidents/#,2018-12-18 00:00:00,Montana
11/14/2018-02/05/2019,2019-02-05 00:00:00,1 in Montana,https://media.dojmt.gov/wp-content/uploads/CON-HRS-Regulator-Notice-MT_Redacted.pdf,Health Recovery Services,2019-05-05 00:00:00,https://dojmt.gov/consumer/consumers-known-data-breach-incidents/#,2018-11-14 00:00:00,Montana
08/01/2018-08/21/2018,2018-08-21 00:00:00,1345 in Montana,https://media.dojmt.gov/wp-content/uploads/CON-Jobscience-Notice-MT.pdf,"Jobscience, Inc.",2019-04-05 00:00:00,https://dojmt.gov/consumer/consumers-known-data-breach-incidents/#,2018-08-01 00:00:00,Montana
11/26/2018-04/04/2019,2019-04-04 00:00:00,1 in Montana,https://media.dojmt.gov/wp-content/uploads/CON-UCLA-Eurofin-Adults-Template.pdf,UCLA Health,2019-04-05 00:00:00,https://dojmt.gov/consumer/consumers-known-data-breach-incidents/#,2018-11-26 00:00:00,Montana
12/01/2018-02/17/2019,2019-02-17 00:00:00,912 in Montana,https://media.dojmt.gov/wp-content/uploads/CON-Coinmama-Montana-Breach_.pdf,Coinmama.com,2019-04-05 00:00:00,https://dojmt.gov/consumer/consumers-known-data-breach-incidents/#,2018-12-01 00:00:00,Montana
10/01/2018-10/31/2018,2018-10-31 00:00:00,1 in Montana,https://media.dojmt.gov/wp-content/uploads/CON-2019.04.09-MT-AG-Notice-WRRH.pdf,Weslaco Regional Rehabilitation Hospital,2019-04-08 00:00:00,https://dojmt.gov/consumer/consumers-known-data-breach-incidents/#,2018-10-01 00:00:00,Montana
02/12/2019-02/19/2019,2019-02-19 00:00:00,46 in Montana,https://media.dojmt.gov/wp-content/uploads/CON-Letter-to-MT-AG.pdf,Canyon Bakehouse,2019-04-09 00:00:00,https://dojmt.gov/consumer/consumers-known-data-breach-incidents/#,2019-02-12 00:00:00,Montana
11/01/2018-11/30/2018,2018-11-30 00:00:00,8 in Montana,https://media.dojmt.gov/wp-content/uploads/CON-America-Juice-Sample-Consumer-Notification-Letter.pdf,America Juice Co.,2019-04-08 00:00:00,https://dojmt.gov/consumer/consumers-known-data-breach-incidents/#,2018-11-01 00:00:00,Montana
03/07/2019-03/07/2019,2019-03-07 00:00:00,1 in Montana,https://media.dojmt.gov/wp-content/uploads/CON-MT-AG.pdf,H&R Block,2019-04-08 00:00:00,https://dojmt.gov/consumer/consumers-known-data-breach-incidents/#,2019-03-07 00:00:00,Montana
09/06/2018-12/02/2018,2018-12-02 00:00:00,Unknown in Montana,https://media.dojmt.gov/wp-content/uploads/CON-Sample-Notice.pdf,Pie Five Pizza,2019-04-05 00:00:00,https://dojmt.gov/consumer/consumers-known-data-breach-incidents/#,2018-09-06 00:00:00,Montana
12/18/2018-02/20/2019,2019-02-20 00:00:00,4 in Montana,https://media.dojmt.gov/wp-content/uploads/CON-Archbright-Consumer-Notification-Letter.pdf,Archbright,2019-04-05 00:00:00,https://dojmt.gov/consumer/consumers-known-data-breach-incidents/#,2018-12-18 00:00:00,Montana
11/14/2018-02/05/2019,2019-02-05 00:00:00,1 in Montana,https://media.dojmt.gov/wp-content/uploads/CON-HRS-Regulator-Notice-MT_Redacted.pdf,Health Recovery Services,2019-05-05 00:00:00,https://dojmt.gov/consumer/consumers-known-data-breach-incidents/#,2018-11-14 00:00:00,Montana
08/01/2018-08/21/2018,2018-08-21 00:00:00,1345 in Montana,https://media.dojmt.gov/wp-content/uploads/CON-Jobscience-Notice-MT.pdf,"Jobscience, Inc.",2019-04-05 00:00:00,https://dojmt.gov/consumer/consumers-known-data-breach-incidents/#,2018-08-01 00:00:00,Montana
11/26/2018-04/04/2019,2019-04-04 00:00:00,1 in Montana,https://media.dojmt.gov/wp-content/uploads/CON-UCLA-Eurofin-Adults-Template.pdf,UCLA Health,2019-04-05 00:00:00,https://dojmt.gov/consumer/consumers-known-data-breach-incidents/#,2018-11-26 00:00:00,Montana
12/01/2018-02/17/2019,2019-02-17 00:00:00,912 in Montana,https://media.dojmt.gov/wp-content/uploads/CON-Coinmama-Montana-Breach_.pdf,Coinmama.com,2019-04-05 00:00:00,https://dojmt.gov/consumer/consumers-known-data-breach-incidents/#,2018-12-01 00:00:00,Montana
12/01/2018-02/17/2019,2019-02-17 00:00:00,912 in Montana,https://media.dojmt.gov/wp-content/uploads/CON-Coinmama-Montana-Breach_.pdf,Coinmama.com,2019-04-05 00:00:00,https://dojmt.gov/consumer/consumers-known-data-breach-incidents/#,2018-12-01 00:00:00,Montana
12/01/2018-02/17/2019,2019-02-17 00:00:00,912 in Montana,https://media.dojmt.gov/wp-content/uploads/CON-Coinmama-Montana-Breach_.pdf,Coinmama.com,2019-04-05 00:00:00,https://dojmt.gov/consumer/consumers-known-data-breach-incidents/#,2018-12-01 00:00:00,Montana
12/01/2018-02/17/2019,2019-02-17 00:00:00,912 in Montana,https://media.dojmt.gov/wp-content/uploads/CON-Coinmama-Montana-Breach_.pdf,Coinmama.com,2019-04-05 00:00:00,https://dojmt.gov/consumer/consumers-known-data-breach-incidents/#,2018-12-01 00:00:00,Montana
12/01/2018-02/17/2019,2019-02-17 00:00:00,912 in Montana,https://media.dojmt.gov/wp-content/uploads/CON-Coinmama-Montana-Breach_.pdf,Coinmama.com,2019-04-05 00:00:00,https://dojmt.gov/consumer/consumers-known-data-breach-incidents/#,2018-12-01 00:00:00,Montana
03/04/2019-03/04/2019,2019-03-04 00:00:00,141 in Montana,https://media.dojmt.gov/wp-content/uploads/CON-Individual-Notification-Letter-April-2019.docx,AeroGrow International Inc,2019-04-04 00:00:00,https://dojmt.gov/consumer/consumers-known-data-breach-incidents/#,2019-03-04 00:00:00,Montana
03/04/2019-03/04/2019,2019-03-04 00:00:00,2 in Montana,https://media.dojmt.gov/wp-content/uploads/CON-Kenra_AG-MT-Notice.pdf,Kenra Professional,2019-04-03 00:00:00,https://dojmt.gov/consumer/consumers-known-data-breach-incidents/#,2019-03-04 00:00:00,Montana
07/19/2018-01/10/2019,2019-01-10 00:00:00,11 in Montana,https://media.dojmt.gov/wp-content/uploads/CON-Auto-Truck-Kargo-Ad-r3prf.pdf,Auto Truck Kargo Equipment LLC,2019-04-02 00:00:00,https://dojmt.gov/consumer/consumers-known-data-breach-incidents/#,2018-07-19 00:00:00,Montana
11/09/2018-11/13/2018,2018-11-13 00:00:00,1 in Montana,https://media.dojmt.gov/wp-content/uploads/MT-Oregon-Endodontic-Group-Notice-of-Data-Event-MT.pdf,Oregon Endodontic Group,2019-04-02 00:00:00,https://dojmt.gov/consumer/consumers-known-data-breach-incidents/#,2018-11-09 00:00:00,Montana
02/07/2018-12/13/2018,2018-12-13 00:00:00,1 in Montana,https://media.dojmt.gov/wp-content/uploads/CON-J2477300.pdf,Key West Hotels LLC,2019-02-02 00:00:00,https://dojmt.gov/consumer/consumers-known-data-breach-incidents/#,2018-02-07 00:00:00,Montana
01/31/2019-02/14/2019,2019-02-14 00:00:00,8 in Montana,https://media.dojmt.gov/wp-content/uploads/CON-Creative-Memories-Notice-of-Data-Event-MT.pdf,CM Group Holdings d/b/a Creative Memories,2019-04-01 00:00:00,https://dojmt.gov/consumer/consumers-known-data-breach-incidents/#,2019-01-31 00:00:00,Montana
01/13/2019-01/16/2019,2019-01-16 00:00:00,Unknown in Montana,https://media.dojmt.gov/wp-content/uploads/CON-FOCUS-MT-AG-Notification.pdf,Fellowship of Catholic University Students (FOCUS),2019-03-29 00:00:00,https://dojmt.gov/consumer/consumers-known-data-breach-incidents/#,2019-01-13 00:00:00,Montana
05/23/2018-03/18/2019,2019-03-18 00:00:00,Unknown in Montana,https://media.dojmt.gov/wp-content/uploads/CON-Website-Notice.pdf,Earl Enterprises,2019-03-29 00:00:00,https://dojmt.gov/consumer/consumers-known-data-breach-incidents/#,2018-05-23 00:00:00,Montana
02/05/2019-02/05/2019,2019-02-05 00:00:00,1 in Montana,https://media.dojmt.gov/wp-content/uploads/CON-12584983-AG-MT-Notification-letter-Final-Gifted-Development-Center-v1.pdf,Gifted Development Center,2019-03-29 00:00:00,https://dojmt.gov/consumer/consumers-known-data-breach-incidents/#,2019-02-05 00:00:00,Montana
01/15/2016-02/21/2018,2018-02-21 00:00:00,9 in Montana,https://media.dojmt.gov/wp-content/uploads/CON-HU1900189-Availity-Mbr-Breach-Notification.pdf,Humana,2019-02-22 00:00:00,https://dojmt.gov/consumer/consumers-known-data-breach-incidents/#,2016-01-15 00:00:00,Montana
07/21/2012-12/11/2018,2018-12-11 00:00:00,1 in Montana,https://media.dojmt.gov/wp-content/uploads/CON-doc-1.pdf,OneMain Financial,2019-03-21 00:00:00,https://dojmt.gov/consumer/consumers-known-data-breach-incidents/#,2012-07-21 00:00:00,Montana
11/13/2018-01/16/2019,2019-01-16 00:00:00,2 in Montana,https://media.dojmt.gov/wp-content/uploads/CON-3.27.19-Montana-Regulator-Notice.pdf,Life Equity LLC,2019-03-27 00:00:00,https://dojmt.gov/consumer/consumers-known-data-breach-incidents/#,2018-11-13 00:00:00,Montana
01/14/2019-01/14/2019,2019-01-14 00:00:00,4 in Montana,https://media.dojmt.gov/wp-content/uploads/CON-Letter-1-SS-Debit-Card-DDA-01081897xB8DF0.pdf,American State Bank,2019-03-26 00:00:00,https://dojmt.gov/consumer/consumers-known-data-breach-incidents/#,2019-01-14 00:00:00,Montana
02/06/2019-02/06/2019,2019-02-06 00:00:00,1 in Montana,https://media.dojmt.gov/wp-content/uploads/CON-MT-AG-Letter.pdf,"Nasif, Hicks, Harris and Co LLP",2019-03-26 00:00:00,https://dojmt.gov/consumer/consumers-known-data-breach-incidents/#,2019-02-06 00:00:00,Montana
12/21/2018-01/23/2019,2019-01-23 00:00:00,2 in Montana,https://media.dojmt.gov/wp-content/uploads/CON-SDC-Notice-of-Data-Event-MT.pdf,Superior Dental Care,2019-03-25 00:00:00,https://dojmt.gov/consumer/consumers-known-data-breach-incidents/#,2018-12-21 00:00:00,Montana
03/07/2019-03/07/2019,2019-03-07 00:00:00,9 in Montana,https://media.dojmt.gov/wp-content/uploads/CON-Grinnell-College-Notification-to-Montana-AG-with-enclosure-7985645x7AB84.pdf,Grinnell College,2019-03-25 00:00:00,https://dojmt.gov/consumer/consumers-known-data-breach-incidents/#,2019-03-07 00:00:00,Montana
01/28/2019-02/15/2019,2019-02-15 00:00:00,16 in Montana,https://media.dojmt.gov/wp-content/uploads/CON-Regulatory-Letter-dated-March-22-2019_Helena-MT.pdf,Brighton Collectibles LLC,2019-03-22 00:00:00,https://dojmt.gov/consumer/consumers-known-data-breach-incidents/#,2019-01-28 00:00:00,Montana
12/22/2018-12/22/2018,2018-12-22 00:00:00,2 in Montana,https://media.dojmt.gov/wp-content/uploads/CON-Copy-of-Data-Breach-Letter.pdf,AG Source,2019-03-22 00:00:00,https://dojmt.gov/consumer/consumers-known-data-breach-incidents/#,2018-12-22 00:00:00,Montana
02/28/2018-12/13/2018,2018-12-13 00:00:00,2 in Montana,https://media.dojmt.gov/wp-content/uploads/CON-Warn-Notice-of-Data-Event-MT.pdf,Warn Industries Inc,2019-03-22 00:00:00,https://dojmt.gov/consumer/consumers-known-data-breach-incidents/#,2018-02-28 00:00:00,Montana
07/01/2018-01/24/2019,2019-01-24 00:00:00,8 in Montana,https://media.dojmt.gov/wp-content/uploads/CON-Navicent-Health-Ad-SSN-r5prf-c-c-c-c-c.pdf,Navicent Health,2019-03-22 00:00:00,https://dojmt.gov/consumer/consumers-known-data-breach-incidents/#,2018-07-01 00:00:00,Montana
10/10/2018-10/12/2018,2018-10-12 00:00:00,17 in Montana,https://media.dojmt.gov/wp-content/uploads/CON-WesternTech_MT-AG-Notice_3.21.19.pdf,Western Technical College,2019-03-21 00:00:00,https://dojmt.gov/consumer/consumers-known-data-breach-incidents/#,2018-10-10 00:00:00,Montana
11/06/2018-01/08/2019,2019-01-08 00:00:00,1 in Montana,https://media.dojmt.gov/wp-content/uploads/CON-Spectrum-Business-Resources-Notification-to-Montana-AG-with-enclosure-7977226x7AB84.pdf,Spectrum Business Resources LLC,2019-03-21 00:00:00,https://dojmt.gov/consumer/consumers-known-data-breach-incidents/#,2018-11-06 00:00:00,Montana
12/23/2018-12/23/2018,2018-12-23 00:00:00,1 in Montana,https://media.dojmt.gov/wp-content/uploads/CON-Tempo-Consumer-Notification-Letter.pdf,Tempo Inc,2019-03-21 00:00:00,https://dojmt.gov/consumer/consumers-known-data-breach-incidents/#,2018-12-23 00:00:00,Montana
12/01/2018-02/01/2019,2019-02-01 00:00:00,5 in Montana,https://media.dojmt.gov/wp-content/uploads/CON-MT-AG-notice-Wenner.pdf,Wenner Group,2019-03-21 00:00:00,https://dojmt.gov/consumer/consumers-known-data-breach-incidents/#,2018-12-01 00:00:00,Montana
02/24/2019-02/24/2019,2019-02-24 00:00:00,4 in Montana,https://media.dojmt.gov/wp-content/uploads/CON-AllClear-ID-Notification-Letter_Identity-Theft-Monitoring-Final.pdf,Eye Buy Direct Inc,2019-03-18 00:00:00,https://dojmt.gov/consumer/consumers-known-data-breach-incidents/#,2019-02-24 00:00:00,Montana
11/08/2018-12/28/2018,2018-12-28 00:00:00,445 in Montana,https://media.dojmt.gov/wp-content/uploads/CON-ZOLL-final-SSN-letter-from-Kroll.pdf,ZOLL Services LLC,2019-03-18 00:00:00,https://dojmt.gov/consumer/consumers-known-data-breach-incidents/#,2018-11-08 00:00:00,Montana
01/08/2019-02/12/2019,2019-02-12 00:00:00,Unknown in Montana,https://media.dojmt.gov/wp-content/uploads/CON-MT-Notice-of-Data-Event-3.pdf,Kathmandu UK Limited,2019-03-18 00:00:00,https://dojmt.gov/consumer/consumers-known-data-breach-incidents/#,2019-01-08 00:00:00,Montana
02/14/2019-02/14/2019,2019-02-14 00:00:00,2 in Montana,https://media.dojmt.gov/wp-content/uploads/CON-CON-Montana-Consumer-Notice-3-15-19.pdf,Cremation Society of Pennsylvania Inc,2019-03-15 00:00:00,https://dojmt.gov/consumer/consumers-known-data-breach-incidents/#,2019-02-14 00:00:00,Montana
07/01/2018-09/30/2018,2018-09-30 00:00:00,2 in Montana,https://media.dojmt.gov/wp-content/uploads/CON-IN-LCP-HITECH-Breach-Notification-Letter.pdf,LCP Transportation,2019-03-20 00:00:00,https://dojmt.gov/consumer/consumers-known-data-breach-incidents/#,2018-07-01 00:00:00,Montana
12/21/2018-02/06/2019,2019-02-06 00:00:00,7 in Montana,https://media.dojmt.gov/wp-content/uploads/CON-Rutland-Regional-Notice-of-Data-Event-MT.pdf,Rutland Regional Medical Center,2019-03-12 00:00:00,https://dojmt.gov/consumer/consumers-known-data-breach-incidents/#,2018-12-21 00:00:00,Montana
12/07/2018-02/25/2019,2019-02-25 00:00:00,39 in Montana,https://media.dojmt.gov/wp-content/uploads/CON-flexPATH_MT-Notice.pdf,flexPATH Strategies LLC,2019-03-15 00:00:00,https://dojmt.gov/consumer/consumers-known-data-breach-incidents/#,2018-12-07 00:00:00,Montana
01/15/2019-01/15/2019,2019-01-15 00:00:00,2 in Montana,https://media.dojmt.gov/wp-content/uploads/CON-Southern-Hills-Eyecare-AG-Notification-letter-MT.pdf,Southern Hills Eye Care,2019-03-15 00:00:00,https://dojmt.gov/consumer/consumers-known-data-breach-incidents/#,2019-01-15 00:00:00,Montana
01/08/2019-01/31/2019,2019-01-31 00:00:00,23 in Montana,https://media.dojmt.gov/wp-content/uploads/CON-Montana-Notice-of-Data-Event.pdf,American Cancer Society Inc,2019-03-01 00:00:00,https://dojmt.gov/consumer/consumers-known-data-breach-incidents/#,2019-01-08 00:00:00,Montana
01/19/2019-01/26/2019,2019-01-26 00:00:00,7 in Montana,https://media.dojmt.gov/wp-content/uploads/CON-2019-03-01-Notification-of-Data-Breach-Carroll-College.pdf,Carroll Saints Shoppe,2019-03-01 00:00:00,https://dojmt.gov/consumer/consumers-known-data-breach-incidents/#,2019-01-19 00:00:00,Montana
08/23/2018-12/17/2018,2018-12-17 00:00:00,5 in Montana,https://media.dojmt.gov/wp-content/uploads/RSC_Re-Solutions_MT-DOI-Notice_3.1.19.pdf,RSC Insurance Brokerage Inc,2019-03-01 00:00:00,https://dojmt.gov/consumer/consumers-known-data-breach-incidents/#,2018-08-23 00:00:00,Montana
01/16/2019-02/03/2019,2019-02-03 00:00:00,1 in Montana,https://media.dojmt.gov/wp-content/uploads/CON-Montana-c.pdf,Environmental Graphics LLC d/b/a Murals Your Way,2019-02-22 00:00:00,https://dojmt.gov/consumer/consumers-known-data-breach-incidents/#,2019-01-16 00:00:00,Montana
07/24/2018-08/02/2018,2018-08-02 00:00:00,3 in Montana,https://media.dojmt.gov/wp-content/uploads/CON-Welk-MT-Notice-of-Data-Event.pdf,Welk Resort Group,2019-02-22 00:00:00,https://dojmt.gov/consumer/consumers-known-data-breach-incidents/#,2018-07-24 00:00:00,Montana
08/20/2018-08/27/2018,2018-08-27 00:00:00,17 in Montana,https://media.dojmt.gov/wp-content/uploads/AG-Adult-No-SSN-X060_v03-c-c.pdf,UConn Health,2019-02-21 00:00:00,https://dojmt.gov/consumer/consumers-known-data-breach-incidents/#,2018-08-20 00:00:00,Montana
01/09/2019-01/09/2019,2019-01-09 00:00:00,11 in Montana,https://media.dojmt.gov/wp-content/uploads/CON-Direct-Distributors-Inc.-Notice-of-Data-Security-Incident.pdf,"Direct Distributors, Inc",2019-02-21 00:00:00,https://dojmt.gov/consumer/consumers-known-data-breach-incidents/#,2019-01-09 00:00:00,Montana
05/28/2018-01/18/2019,2019-01-18 00:00:00,4 in Montana,https://media.dojmt.gov/wp-content/uploads/CON-Rennline-MT.pdf,Rennline Automotive,2019-02-21 00:00:00,https://dojmt.gov/consumer/consumers-known-data-breach-incidents/#,2018-05-28 00:00:00,Montana
02/28/2018-02/28/2018,2018-02-28 00:00:00,26 in Montana,https://media.dojmt.gov/wp-content/uploads/CON-MT.pdf,Phillip Capital Inc,2019-02-21 00:00:00,https://dojmt.gov/consumer/consumers-known-data-breach-incidents/#,2018-02-28 00:00:00,Montana
08/30/2017-04/09/2018,2018-04-09 00:00:00,15 in Montana,https://media.dojmt.gov/wp-content/uploads/CON-Pillow-Pets-General-Master-1.pdf,Pillow Pets,2019-02-20 00:00:00,https://dojmt.gov/consumer/consumers-known-data-breach-incidents/#,2017-08-30 00:00:00,Montana
01/01/2012-01/30/2019,2019-01-30 00:00:00,3 in Montana,https://media.dojmt.gov/wp-content/uploads/CON-MTSA-Individual-notice-MAILED-2-19-2019.pdf,Middle Tennessee School of Anesthesia,2019-02-19 00:00:00,https://dojmt.gov/consumer/consumers-known-data-breach-incidents/#,2012-01-01 00:00:00,Montana
12/06/2018-12/21/2018,2018-12-21 00:00:00,02/19/2019 in Montana,https://media.dojmt.gov/wp-content/uploads/CON-Montana-Individual-Reporting-Letter-Template.pdf,"Sheltered Wings, Inc",2019-02-19 00:00:00,https://dojmt.gov/consumer/consumers-known-data-breach-incidents/#,2018-12-06 00:00:00,Montana
09/08/2018-09/24/2018,2018-09-24 00:00:00,2 in Montana,https://media.dojmt.gov/wp-content/uploads/CON-Pages-from-WIT-MT-AG-Notice_2.19.19.pdf,Wentworth Institute of Technology,2019-02-19 00:00:00,https://dojmt.gov/consumer/consumers-known-data-breach-incidents/#,2018-09-08 00:00:00,Montana
09/06/2018-11/29/2018,2018-11-29 00:00:00,1 in Montana,https://media.dojmt.gov/wp-content/uploads/CON-FirstLease-Inc.-Notice-of-Data-Event-MT.pdf,"FirstLease, Inc",2019-02-15 00:00:00,https://dojmt.gov/consumer/consumers-known-data-breach-incidents/#,2018-09-06 00:00:00,Montana
09/01/2016-09/23/2018,2018-09-23 00:00:00,Unknown in Montana,https://media.dojmt.gov/wp-content/uploads/CON-Print-EZ-MT-Notice.pdf,"Print EZ, Inc",2019-02-15 00:00:00,https://dojmt.gov/consumer/consumers-known-data-breach-incidents/#,2016-09-01 00:00:00,Montana
12/06/2018-12/07/2018,2018-12-07 00:00:00,2 in Montana,https://media.dojmt.gov/wp-content/uploads/CON-Pages-from-Gulfport_-Montana-Notification-Letter.pdf,Memorial Hospital at Gulfport,2019-02-15 00:00:00,https://dojmt.gov/consumer/consumers-known-data-breach-incidents/#,2018-12-06 00:00:00,Montana
11/13/2018-01/11/2019,2019-01-11 00:00:00,34 in Montana,https://media.dojmt.gov/wp-content/uploads/CON-FB-Master-Notice.pdf,"Five Below, Inc",2019-02-14 00:00:00,https://dojmt.gov/consumer/consumers-known-data-breach-incidents/#,2018-11-13 00:00:00,Montana
02/02/2018-11/20/2018,2018-11-20 00:00:00,1191 in Montana,https://media.dojmt.gov/wp-content/uploads/CON-doc.pdf,North 40 Outfitters,2019-02-14 00:00:00,https://dojmt.gov/consumer/consumers-known-data-breach-incidents/#,2018-02-02 00:00:00,Montana
12/14/2018-12/17/2018,2018-12-17 00:00:00,31 in Montana,https://media.dojmt.gov/wp-content/uploads/CON-Coeur-Regulator-Notice-MT-FINAL.pdf,"Coeur Alaska, Inc",2019-02-14 00:00:00,https://dojmt.gov/consumer/consumers-known-data-breach-incidents/#,2018-12-14 00:00:00,Montana
02/01/2018-01/31/2019,2019-01-31 00:00:00,131 in Montana,https://media.dojmt.gov/wp-content/uploads/CON-MT-Notice-of-Data-Event-2.pdf,Stanwich Mortgage Loan Trust,2019-02-12 00:00:00,https://dojmt.gov/consumer/consumers-known-data-breach-incidents/#,2018-02-01 00:00:00,Montana
07/10/2018-07/19/2018,2018-07-19 00:00:00,2 in Montana,https://media.dojmt.gov/wp-content/uploads/CON-Ohio-Living-Regulator-Notice-MT-FINAL.pdf,Ohio Living,2019-02-12 00:00:00,https://dojmt.gov/consumer/consumers-known-data-breach-incidents/#,2018-07-10 00:00:00,Montana
10/28/2018-01/25/2019,2019-01-25 00:00:00,14 in Montana,https://media.dojmt.gov/wp-content/uploads/CON-MT-Notice-of-Data-Event-1.pdf,Cherrydale Fundraising,2019-03-14 00:00:00,https://dojmt.gov/consumer/consumers-known-data-breach-incidents/#,2018-10-28 00:00:00,Montana
05/01/2018-01/22/2019,2019-01-22 00:00:00,Unknown in Montana,https://media.dojmt.gov/wp-content/uploads/Rush-University-Medical-Center-Consumer-Breach-Notification.pdf,Rush University Medical Center,2019-02-28 00:00:00,https://dojmt.gov/consumer/consumers-known-data-breach-incidents/#,2018-05-01 00:00:00,Montana
02/11/2019-02/13/2019,2019-02-13 00:00:00,35 in Montana,https://media.dojmt.gov/wp-content/uploads/Bamboo-Consumer-Data-Breach-Notification.pdf,Bamboo HR LLC,2019-03-04 00:00:00,https://dojmt.gov/consumer/consumers-known-data-breach-incidents/#,2019-02-11 00:00:00,Montana
1/4/2019-1/4/2019,2019-01-04 00:00:00,2 in Montana,https://media.dojmt.gov/wp-content/uploads/CON-St-Francis-Adult-SSN.pdf,St. Francis Physician Services,2019-03-04 00:00:00,https://dojmt.gov/consumer/consumers-known-data-breach-incidents/#,2019-01-04 00:00:00,Montana
12/18/2018-12/19/2018,2018-12-19 00:00:00,4 in Montana,https://media.dojmt.gov/wp-content/uploads/CON-TEMPTU-Notice-of-Data-Event-MT.pdf,TEMPTU Inc,2019-03-04 00:00:00,https://dojmt.gov/consumer/consumers-known-data-breach-incidents/#,2018-12-18 00:00:00,Montana
11/15/2018-11/15/2018,2018-11-15 00:00:00,1 in Montana,https://media.dojmt.gov/wp-content/uploads/CON-ISU-MT-AG-Notice.pdf,The Board of Trustees of Illinois State University,2019-03-05 00:00:00,https://dojmt.gov/consumer/consumers-known-data-breach-incidents/#,2018-11-15 00:00:00,Montana
1/22/2019-1/29/2019,2019-01-29 00:00:00,2.0 in Montana,https://media.dojmt.gov/wp-content/uploads/CON-Covenant-Care-MT-Notice-of-Data-Event.pdf,Covenant Care California,2019-03-06 00:00:00,https://dojmt.gov/consumer/consumers-known-data-breach-incidents/#,2019-01-22 00:00:00,Montana
2/5/2019-2/5/2019,2019-02-05 00:00:00,1.0 in Montana,https://media.dojmt.gov/wp-content/uploads/CON-2019.03.07-MT-AG-Notice-StEliz.pdf,Saint Elizabeth Medical Center Inc,2019-03-07 00:00:00,https://dojmt.gov/consumer/consumers-known-data-breach-incidents/#,2019-02-05 00:00:00,Montana
01/15/2019-01/22/2019,2019-01-22 00:00:00,nan in Montana,https://media.dojmt.gov/wp-content/uploads/Combe-Consuemr-Datat-Breach-Notification.pdf,Combe Incorporated,2019-02-28 00:00:00,https://dojmt.gov/consumer/consumers-known-data-breach-incidents/#,2019-01-15 00:00:00,Montana
12/3/2018-12/3/2018,2018-12-03 00:00:00,1.0 in Montana,https://media.dojmt.gov/wp-content/uploads/CON-Notice-to-Montana.pdf,Beacon Sales Acquisition Inc,2019-03-07 00:00:00,https://dojmt.gov/consumer/consumers-known-data-breach-incidents/#,2018-12-03 00:00:00,Montana
1/31/2019-1/31/2019,2019-01-31 00:00:00,2.0 in Montana,https://media.dojmt.gov/wp-content/uploads/REESE-CON-Regulatory-Letter-dated-March-7-2019-Helena-MT.pdf,Reese Henry & Company Inc,2019-03-07 00:00:00,https://dojmt.gov/consumer/consumers-known-data-breach-incidents/#,2019-01-31 00:00:00,Montana
7/25/2018-2/5/2019,2019-02-05 00:00:00,1.0 in Montana,https://media.dojmt.gov/wp-content/uploads/CON-NOTIF.pdf,Bumblebee Batteries,2019-03-07 00:00:00,https://dojmt.gov/consumer/consumers-known-data-breach-incidents/#,2018-07-25 00:00:00,Montana
5/8/2018-8/1/2018,2018-08-01 00:00:00,2.0 in Montana,https://media.dojmt.gov/wp-content/uploads/CON-MT-Notification.pdf,Advocate Sherman Hospital,2019-03-08 00:00:00,https://dojmt.gov/consumer/consumers-known-data-breach-incidents/#,2018-05-08 00:00:00,Montana
5/9/2018-5/17/2018,2018-05-17 00:00:00,2.0 in Montana,https://media.dojmt.gov/wp-content/uploads/CON-Emerson-Hospital-MT-c.pdf,Emerson Hospital,2019-03-08 00:00:00,https://dojmt.gov/consumer/consumers-known-data-breach-incidents/#,2018-05-09 00:00:00,Montana
8/10/2018-12/14/2018,2018-12-14 00:00:00,1.0 in Montana,https://media.dojmt.gov/wp-content/uploads/CON-MT-Notice-of-Data-Event.pdf,Discipleship Ministries,2019-03-08 00:00:00,https://dojmt.gov/consumer/consumers-known-data-breach-incidents/#,2018-08-10 00:00:00,Montana
6/11/2018-2/26/2019,2019-02-26 00:00:00,17.0 in Montana,https://media.dojmt.gov/wp-content/uploads/CON-Letter-to-Montana-Office-of-Consumer-Protection.pdf,OnCourse Learning Corporation / Relias LLC,2019-03-08 00:00:00,https://dojmt.gov/consumer/consumers-known-data-breach-incidents/#,2018-06-11 00:00:00,Montana
1/9/2019-1/30/2019,2019-01-30 00:00:00,5.0 in Montana,https://media.dojmt.gov/wp-content/uploads/CON-UofMary-MT-AG-Notification.pdf,University of Mary,2019-03-12 00:00:00,https://dojmt.gov/consumer/consumers-known-data-breach-incidents/#,2019-01-09 00:00:00,Montana
1/19/2018-6/30/2018,2018-06-30 00:00:00,29.0 in Montana,https://media.dojmt.gov/wp-content/uploads/CON-IVG-Breach-Notification-Letter.pdf,International Vapor Group,2019-03-12 00:00:00,https://dojmt.gov/consumer/consumers-known-data-breach-incidents/#,2018-01-19 00:00:00,Montana
1/8/2018-8/7/2018,2018-08-07 00:00:00,3.0 in Montana,https://media.dojmt.gov/wp-content/uploads/CON-ABM-Notice-of-Data-Event-MT.pdf,ABM Industries Incorporated,2019-03-12 00:00:00,https://dojmt.gov/consumer/consumers-known-data-breach-incidents/#,2018-01-08 00:00:00,Montana
5/12/2018-9/17/2018,2018-09-17 00:00:00,1.0 in Montana,https://media.dojmt.gov/wp-content/uploads/CON-NOTICE-2.pdf,Texas VSI LLC,2019-03-13 00:00:00,https://dojmt.gov/consumer/consumers-known-data-breach-incidents/#,2018-05-12 00:00:00,Montana
2/09/2019-2/21/2019,2019-02-21 00:00:00,2.0 in Montana,https://media.dojmt.gov/wp-content/uploads/CON-NOTICE.pdf,James Perse Enterprises Inc,2019-03-14 00:00:00,https://dojmt.gov/consumer/consumers-known-data-breach-incidents/#,2019-02-09 00:00:00,Montana
9/01/2018-11/15/2018,2018-11-15 00:00:00,5.0 in Montana,https://media.dojmt.gov/wp-content/uploads/CON-NOTICE-Yaculta-MT-Notice-of-Data-Event-FINAL-1.pdf,Yaculta Companies Inc,2019-03-15 00:00:00,https://dojmt.gov/consumer/consumers-known-data-breach-incidents/#,2018-09-01 00:00:00,Montana
4/5/2015-4/5/2015,2015-04-05 00:00:00,1.0 in Montana, https://media.dojmt.gov/wp-content/uploads/Stanislaus-Surgical-Hospital.pdf ,Stanislaus Surgical Hospital,2015-05-06 00:00:00,https://dojmt.gov/consumer/consumers-known-data-breach-incidents/#,2015-04-05 00:00:00,Montana
6/8/2015-6/8/2015,2015-06-08 00:00:00,13.0 in Montana, https://media.dojmt.gov/wp-content/uploads/State-Farm.pdf ,State Farm (1),2015-06-15 00:00:00,https://dojmt.gov/consumer/consumers-known-data-breach-incidents/#,2015-06-08 00:00:00,Montana
4/1/2015-4/30/2015,2015-04-30 00:00:00,33.0 in Montana, https://media.dojmt.gov/wp-content/uploads/Rombauer-Vineyards.pdf ,Rombauer Vineyards,2015-06-16 00:00:00,https://dojmt.gov/consumer/consumers-known-data-breach-incidents/#,2015-04-01 00:00:00,Montana
8/12/2015-8/12/2015,2015-08-12 00:00:00,6.0 in Montana, https://media.dojmt.gov/wp-content/uploads/Brunswick-Hotel-Tavern.pdf ,Brunswick Hotel & Tavern,2015-08-21 00:00:00,https://dojmt.gov/consumer/consumers-known-data-breach-incidents/#,2015-08-12 00:00:00,Montana
9/15/2015-9/15/2015,2015-09-15 00:00:00,1134 in Montana, https://media.dojmt.gov/wp-content/uploads/T-Mobile-USA-Inc..pdf ,"T-Mobile USA, Inc.",2015-10-01 00:00:00,https://dojmt.gov/consumer/consumers-known-data-breach-incidents/#,2015-09-15 00:00:00,Montana
9/15/2015-9/15/2015,2015-09-15 00:00:00,1 in Montana, https://media.dojmt.gov/wp-content/uploads/Red-Dress-Boutique.pdf ,Red Dress Boutique,2015-10-05 00:00:00,https://dojmt.gov/consumer/consumers-known-data-breach-incidents/#,2015-09-15 00:00:00,Montana
8/19/2015-8/19/2015,2015-08-19 00:00:00,6 in Montana, https://media.dojmt.gov/wp-content/uploads/Dow-Jones-Company.pdf ,Dow Jones & Company,2015-10-09 00:00:00,https://dojmt.gov/consumer/consumers-known-data-breach-incidents/#,2015-08-19 00:00:00,Montana
9/9/2015-9/9/2015,2015-09-09 00:00:00,11 in Montana, https://media.dojmt.gov/wp-content/uploads/Salt-Lake-County-Utah.pdf ,"Salt Lake County, Utah",2015-10-09 00:00:00,https://dojmt.gov/consumer/consumers-known-data-breach-incidents/#,2015-09-09 00:00:00,Montana
6/16/2015-6/16/2015,2015-06-16 00:00:00,13 in Montana, https://media.dojmt.gov/wp-content/uploads/Eyebuy-Direct.pdf ,Eyebuy Direct,2015-10-13 00:00:00,https://dojmt.gov/consumer/consumers-known-data-breach-incidents/#,2015-06-16 00:00:00,Montana
3/24/2015-5/20/2015,2015-05-20 00:00:00,Unknown in Montana, https://media.dojmt.gov/wp-content/uploads/Service-Systems-Associates-SSA.pdf ,Services Systems Associates,2015-10-13 00:00:00,https://dojmt.gov/consumer/consumers-known-data-breach-incidents/#,2015-03-24 00:00:00,Montana
9/23/2015-9/23/2015,2015-09-23 00:00:00,1 in Montana, https://media.dojmt.gov/wp-content/uploads/Schlage-Lock-Company.pdf ,Schlage Lock Company,2015-10-13 00:00:00,https://dojmt.gov/consumer/consumers-known-data-breach-incidents/#,2015-09-23 00:00:00,Montana
10/9/2015-10/9/2015,2015-10-09 00:00:00,1 in Montana, https://media.dojmt.gov/wp-content/uploads/Ameriprise-Financial.pdf ,Ameriprise Financial (1),2015-10-19 00:00:00,https://dojmt.gov/consumer/consumers-known-data-breach-incidents/#,2015-10-09 00:00:00,Montana
6/30/2015-6/30/2015,2015-06-30 00:00:00,23 in Montana, https://media.dojmt.gov/wp-content/uploads/Accuform-Manufacturing.pdf ,"Accuform Manufacturing, Inc.",2015-10-20 00:00:00,https://dojmt.gov/consumer/consumers-known-data-breach-incidents/#,2015-06-30 00:00:00,Montana
1/28/2015-8/3/2015,2015-08-03 00:00:00,22 in Montana, https://media.dojmt.gov/wp-content/uploads/Noble-House-Hotels-and-Resorts.pdf ,Noble House Hotels and Resorts (1),2015-10-22 00:00:00,https://dojmt.gov/consumer/consumers-known-data-breach-incidents/#,2015-01-28 00:00:00,Montana
9/16/2015-9/16/2015,2015-09-16 00:00:00,6 in Montana, https://media.dojmt.gov/wp-content/uploads/Stiletto-Solutions.pdf ,Stiletto Solutions,2015-10-28 00:00:00,https://dojmt.gov/consumer/consumers-known-data-breach-incidents/#,2015-09-16 00:00:00,Montana
9/1/2015-9/30/2015,2015-09-30 00:00:00,1 in Montana, https://media.dojmt.gov/wp-content/uploads/Transcontinental-Fund-Administration.pdf ,Transcontinental Fund (Wolff Co.),2015-10-28 00:00:00,https://dojmt.gov/consumer/consumers-known-data-breach-incidents/#,2015-09-01 00:00:00,Montana
8/31/2015-9/30/2015,2015-09-30 00:00:00,4 in Montana, https://media.dojmt.gov/wp-content/uploads/Dow-Corning.pdf ,Dow Corning Corporation,2015-10-30 00:00:00,https://dojmt.gov/consumer/consumers-known-data-breach-incidents/#,2015-08-31 00:00:00,Montana
10/24/2015-10/25/2015,2015-10-25 00:00:00,3 in Montana, https://media.dojmt.gov/wp-content/uploads/Brandeis-University.pdf ,Brandeis University,2015-11-12 00:00:00,https://dojmt.gov/consumer/consumers-known-data-breach-incidents/#,2015-10-24 00:00:00,Montana
5/18/2015-5/18/2015,2015-05-18 00:00:00,1 in Montana, https://media.dojmt.gov/wp-content/uploads/Integrated-Listening-Systems.pdf ,Integrated Listening Systems,2015-11-12 00:00:00,https://dojmt.gov/consumer/consumers-known-data-breach-incidents/#,2015-05-18 00:00:00,Montana
12/29/2014-8/11/2015,2015-08-11 00:00:00,165 in Montana, https://media.dojmt.gov/wp-content/uploads/Noble-House-Hotels-and-Resorts2.pdf ,Noble House Hotel and Resorts (2),2015-11-13 00:00:00,https://dojmt.gov/consumer/consumers-known-data-breach-incidents/#,2014-12-29 00:00:00,Montana
10/16/2015-10/16/2015,2015-10-16 00:00:00,3 in Montana, https://media.dojmt.gov/wp-content/uploads/Fashion-to-Figure.pdf ,Fashion to Figure,2015-11-13 00:00:00,https://dojmt.gov/consumer/consumers-known-data-breach-incidents/#,2015-10-16 00:00:00,Montana
9/16/2015-9/16/2015,2015-09-16 00:00:00,17 in Montana, https://media.dojmt.gov/wp-content/uploads/OH-Muhlenberg-LLC.pdf ,"OH Muhlenberg, LLC",2015-11-13 00:00:00,https://dojmt.gov/consumer/consumers-known-data-breach-incidents/#,2015-09-16 00:00:00,Montana
9/29/2015-11/2/2015,2015-11-02 00:00:00,1 in Montana, https://media.dojmt.gov/wp-content/uploads/Seattle-Chocolates-Company.pdf ,Seattle Chocolates Company,2015-11-16 00:00:00,https://dojmt.gov/consumer/consumers-known-data-breach-incidents/#,2015-09-29 00:00:00,Montana
10/12/2015-10/20/2015,2015-10-20 00:00:00,36 in Montana, https://media.dojmt.gov/wp-content/uploads/Intuit.pdf ,Intuit (1),2015-11-17 00:00:00,https://dojmt.gov/consumer/consumers-known-data-breach-incidents/#,2015-10-12 00:00:00,Montana
3/9/2015-6/8/2015,2015-06-08 00:00:00,Unknown in Montana, https://media.dojmt.gov/wp-content/uploads/Wilderness-Hotel-and-Golf-Resort.pdf ,Wilderness Hotel and Golf Resort,2015-11-20 00:00:00,https://dojmt.gov/consumer/consumers-known-data-breach-incidents/#,2015-03-09 00:00:00,Montana
4/21/2015-7/27/2015,2015-07-27 00:00:00,Unknown in Montana, https://media.dojmt.gov/wp-content/uploads/Hilton.pdf ,Hilton,2015-11-24 00:00:00,https://dojmt.gov/consumer/consumers-known-data-breach-incidents/#,2015-04-21 00:00:00,Montana
11/18/2014-12/5/2014,2014-12-05 00:00:00,Unknown in Montana, https://media.dojmt.gov/wp-content/uploads/Hilton.pdf ,Hilton,2015-11-24 00:00:00,https://dojmt.gov/consumer/consumers-known-data-breach-incidents/#,2014-11-18 00:00:00,Montana
10/23/2015-10/23/2015,2015-10-23 00:00:00,1 in Montana, https://media.dojmt.gov/wp-content/uploads/Intuit-2.pdf ,Intuit (2),2015-11-25 00:00:00,https://dojmt.gov/consumer/consumers-known-data-breach-incidents/#,2015-10-23 00:00:00,Montana
11/17/2015-11/17/2015,2015-11-17 00:00:00,1 in Montana, https://media.dojmt.gov/wp-content/uploads/Precision-Resource-Company.pdf ,Precision Resource Company,2015-11-30 00:00:00,https://dojmt.gov/consumer/consumers-known-data-breach-incidents/#,2015-11-17 00:00:00,Montana
10/26/2015-11/8/2015,2015-11-08 00:00:00,1 in Montana, https://media.dojmt.gov/wp-content/uploads/Cottage-Health.pdf ,Cottage Health,2015-12-03 00:00:00,https://dojmt.gov/consumer/consumers-known-data-breach-incidents/#,2015-10-26 00:00:00,Montana
9/24/2015-9/24/2015,2015-09-24 00:00:00,2 in Montana, https://media.dojmt.gov/wp-content/uploads/New-England-Calendar-and-Novelty-Company.pdf ,New England Calendar and Novelty Company,2015-12-10 00:00:00,https://dojmt.gov/consumer/consumers-known-data-breach-incidents/#,2015-09-24 00:00:00,Montana
8/5/2015-8/5/2015,2015-08-05 00:00:00,39 in Montana, https://media.dojmt.gov/wp-content/uploads/Toyota-Motor-Credit-Corporation.pdf ,Toyota Motor Credit Corporation (1),2015-12-11 00:00:00,https://dojmt.gov/consumer/consumers-known-data-breach-incidents/#,2015-08-05 00:00:00,Montana
11/17/2015-11/17/2015,2015-11-17 00:00:00,23 in Montana, https://media.dojmt.gov/wp-content/uploads/TuneCore.pdf ,TuneCore,2015-12-11 00:00:00,https://dojmt.gov/consumer/consumers-known-data-breach-incidents/#,2015-11-17 00:00:00,Montana
10/28/2015-10/28/2015,2015-10-28 00:00:00,1 in Montana, https://media.dojmt.gov/wp-content/uploads/Centerra-Group-LLC-ADP.pdf ,"Centerra Group, LLC (ADP)",2015-12-14 00:00:00,https://dojmt.gov/consumer/consumers-known-data-breach-incidents/#,2015-10-28 00:00:00,Montana
10/26/2015-10/26/2015,2015-10-26 00:00:00,2 in Montana, https://media.dojmt.gov/wp-content/uploads/State-Farm-2.pdf ,State Farm (2),2015-12-15 00:00:00,https://dojmt.gov/consumer/consumers-known-data-breach-incidents/#,2015-10-26 00:00:00,Montana
8/30/2015-8/30/2015,2015-08-30 00:00:00,4 in Montana, https://media.dojmt.gov/wp-content/uploads/Gonzaga-University.pdf ,Gonzaga University,2015-12-18 00:00:00,https://dojmt.gov/consumer/consumers-known-data-breach-incidents/#,2015-08-30 00:00:00,Montana
10/15/2015-11/20/2015,2015-11-20 00:00:00,48 in Montana, https://media.dojmt.gov/wp-content/uploads/Dungarees.pdf ,"Dungarees, LLC",2015-12-18 00:00:00,https://dojmt.gov/consumer/consumers-known-data-breach-incidents/#,2015-10-15 00:00:00,Montana
12/8/2015-12/8/2015,2015-12-08 00:00:00,1 in Montana, https://media.dojmt.gov/wp-content/uploads/Thomas-Nelson-Community-College.pdf ,Thomas Nelson Community College,2015-12-18 00:00:00,https://dojmt.gov/consumer/consumers-known-data-breach-incidents/#,2015-12-08 00:00:00,Montana
11/9/2015-12/7/2015,2015-12-07 00:00:00,43 in Montana, https://media.dojmt.gov/wp-content/uploads/Matson-Navigation-Company-and-Horizon-Lines.pdf ,Matson Navigation and Horizon Lines,2015-12-23 00:00:00,https://dojmt.gov/consumer/consumers-known-data-breach-incidents/#,2015-11-09 00:00:00,Montana
8/3/2015-11/18/2015,2015-11-18 00:00:00,5 in Montana, https://media.dojmt.gov/wp-content/uploads/Farm-to-Feet.pdf ,Farm to Feet,2015-12-23 00:00:00,https://dojmt.gov/consumer/consumers-known-data-breach-incidents/#,2015-08-03 00:00:00,Montana
11/27/2015-11/30/2015,2015-11-30 00:00:00,3 in Montana, https://media.dojmt.gov/wp-content/uploads/HDIS.pdf ,HDIS,2015-12-28 00:00:00,https://dojmt.gov/consumer/consumers-known-data-breach-incidents/#,2015-11-27 00:00:00,Montana
10/31/2015-10/31/2015,2015-10-31 00:00:00,1 in Montana, https://media.dojmt.gov/wp-content/uploads/St.-Lukes-Cornwall-Hospital.pdf ,St. Luke's Cornwall Hospital,2015-12-30 00:00:00,https://dojmt.gov/consumer/consumers-known-data-breach-incidents/#,2015-10-31 00:00:00,Montana
11/10/2015-11/17/2015,2015-11-17 00:00:00,6 in Montana, https://media.dojmt.gov/wp-content/uploads/Regional-Income-Tax-Agency.pdf ,Regional Income Tax Agency,2015-12-31 00:00:00,https://dojmt.gov/consumer/consumers-known-data-breach-incidents/#,2015-11-10 00:00:00,Montana
12/1/2015-12/14/2015,2015-12-14 00:00:00,2 in Montana, https://media.dojmt.gov/wp-content/uploads/Hyde-Park-Partners.pdf ,"Hyde Park Partners, Inc. (MROStop LLC)",2016-01-04 00:00:00,https://dojmt.gov/consumer/consumers-known-data-breach-incidents/#,2015-12-01 00:00:00,Montana
11/10/2015-11/10/2015,2015-11-10 00:00:00,1 in Montana, https://media.dojmt.gov/wp-content/uploads/Blucora.pdf ,"Blucora, Inc. (TaxAct)",2016-01-08 00:00:00,https://dojmt.gov/consumer/consumers-known-data-breach-incidents/#,2015-11-10 00:00:00,Montana
12/10/2015-12/10/2015,2015-12-10 00:00:00,1 in Montana, https://media.dojmt.gov/wp-content/uploads/Grunt-Style.pdf ,Grunt Style LLC,2016-01-08 00:00:00,https://dojmt.gov/consumer/consumers-known-data-breach-incidents/#,2015-12-10 00:00:00,Montana
8/1/2015-11/9/2015,2015-11-09 00:00:00,11 in Montana, https://media.dojmt.gov/wp-content/uploads/JB-Autosports-Inc..pdf ,"JB Autosports, Inc.",2016-01-13 00:00:00,https://dojmt.gov/consumer/consumers-known-data-breach-incidents/#,2015-08-01 00:00:00,Montana
12/7/2015-12/8/2015,2015-12-08 00:00:00,80 in Montana, https://media.dojmt.gov/wp-content/uploads/HSBC-Bank-USA.pdf ,"HSBC Bank, USA",2016-01-13 00:00:00,https://dojmt.gov/consumer/consumers-known-data-breach-incidents/#,2015-12-07 00:00:00,Montana
11/26/2015-11/26/2015,2015-11-26 00:00:00,1 in Montana, https://media.dojmt.gov/wp-content/uploads/Livongo.pdf ,"Livongo Health, Inc.",2016-01-14 00:00:00,https://dojmt.gov/consumer/consumers-known-data-breach-incidents/#,2015-11-26 00:00:00,Montana
7/30/2015-12/8/2015,2015-12-08 00:00:00,1 in Montana, https://media.dojmt.gov/wp-content/uploads/Hyatt-Hotel-Corporation.pdf ,Hyatt Hotels Corporation,2016-01-14 00:00:00,https://dojmt.gov/consumer/consumers-known-data-breach-incidents/#,2015-07-30 00:00:00,Montana
9/11/2015-9/12/2015,2015-09-12 00:00:00,10 in Montana, https://media.dojmt.gov/wp-content/uploads/MaineGeneral-Medical-Center.pdf ,MaineGeneral Medical Center,2016-01-15 00:00:00,https://dojmt.gov/consumer/consumers-known-data-breach-incidents/#,2015-09-11 00:00:00,Montana
12/8/2015-12/17/2015,2015-12-17 00:00:00,2 in Montana, https://media.dojmt.gov/wp-content/uploads/Intuit-1.pdf ,Intuit (3),2016-01-15 00:00:00,https://dojmt.gov/consumer/consumers-known-data-breach-incidents/#,2015-12-08 00:00:00,Montana
11/18/2015-11/18/2015,2015-11-18 00:00:00,25196 in Montana, https://media.dojmt.gov/wp-content/uploads/New-West-Health-Services.pdf ,New West Health Services d/b/a New West Medicare,2016-01-15 00:00:00,https://dojmt.gov/consumer/consumers-known-data-breach-incidents/#,2015-11-18 00:00:00,Montana
1/8/2016-1/8/2016,2016-01-08 00:00:00,2 in Montana, https://media.dojmt.gov/wp-content/uploads/Motivate-International-Inc-.pdf ,"Motivate International, Inc.",2016-01-19 00:00:00,https://dojmt.gov/consumer/consumers-known-data-breach-incidents/#,2016-01-08 00:00:00,Montana
9/24/2015-12/26/2015,2015-12-26 00:00:00,17 in Montana, https://media.dojmt.gov/wp-content/uploads/KickyPants.pdf ,"Kicky Pants, Inc. d/b/a KikKee Pants",2016-01-21 00:00:00,https://dojmt.gov/consumer/consumers-known-data-breach-incidents/#,2015-09-24 00:00:00,Montana
1/11/2016-1/11/2016,2016-01-11 00:00:00,5 in Montana, https://media.dojmt.gov/wp-content/uploads/HK-Financial-Services.pdf ,HK Financial Services,2016-01-22 00:00:00,https://dojmt.gov/consumer/consumers-known-data-breach-incidents/#,2016-01-11 00:00:00,Montana
12/1/2015-1/25/2016,2016-01-25 00:00:00,1 in Montana, https://media.dojmt.gov/wp-content/uploads/LifeSafer.pdf ,"#1 A LifeSafer of Montana, Inc. (LifeSafer)",2016-01-26 00:00:00,https://dojmt.gov/consumer/consumers-known-data-breach-incidents/#,2015-12-01 00:00:00,Montana
5/16/2015-12/9/2015,2015-12-09 00:00:00,4 in Montana, https://media.dojmt.gov/wp-content/uploads/Hain-Celestial-Group-Inc..pdf ,"Hain Celestial Group, Inc. (Alba Botanica)",2016-01-28 00:00:00,https://dojmt.gov/consumer/consumers-known-data-breach-incidents/#,2015-05-16 00:00:00,Montana
10/29/2015-11/5/2015,2015-11-05 00:00:00,5 in Montana, https://media.dojmt.gov/wp-content/uploads/Oiselle.pdf ,Oiselle Running Inc.,2016-01-29 00:00:00,https://dojmt.gov/consumer/consumers-known-data-breach-incidents/#,2015-10-29 00:00:00,Montana
12/18/2015-12/18/2015,2015-12-18 00:00:00,1 in Montana, https://media.dojmt.gov/wp-content/uploads/Richardson-Company.pdf ,"Richardson & Company, P.C.",2016-01-29 00:00:00,https://dojmt.gov/consumer/consumers-known-data-breach-incidents/#,2015-12-18 00:00:00,Montana
10/10/2015-12/21/2015,2015-12-21 00:00:00,27 in Montana, https://media.dojmt.gov/wp-content/uploads/TaxSlayer.pdf ,TaxSlayer,2016-01-29 00:00:00,https://dojmt.gov/consumer/consumers-known-data-breach-incidents/#,2015-10-10 00:00:00,Montana
12/28/2015-1/4/2016,2016-01-04 00:00:00,3 in Montana, https://media.dojmt.gov/wp-content/uploads/Toyota-Motor-Credit-Corporation-1.pdf ,Toyota Motor Credit Corporation (2),2016-02-02 00:00:00,https://dojmt.gov/consumer/consumers-known-data-breach-incidents/#,2015-12-28 00:00:00,Montana
1/5/2016-1/5/2016,2016-01-05 00:00:00,3 in Montana, https://media.dojmt.gov/wp-content/uploads/University-of-Mary-Washington.pdf ,University of Mary Washington,2016-02-04 00:00:00,https://dojmt.gov/consumer/consumers-known-data-breach-incidents/#,2016-01-05 00:00:00,Montana
1/15/2016-1/15/2016,2016-01-15 00:00:00,14 in Montana, https://media.dojmt.gov/wp-content/uploads/University-of-Central-Florida.pdf ,University of Central Florida,2016-02-05 00:00:00,https://dojmt.gov/consumer/consumers-known-data-breach-incidents/#,2016-01-15 00:00:00,Montana
10/3/2015-12/18/2015,2015-12-18 00:00:00,431 in Montana, https://media.dojmt.gov/wp-content/uploads/Gyft.pdf ,"Gyft, Inc.",2016-02-05 00:00:00,https://dojmt.gov/consumer/consumers-known-data-breach-incidents/#,2015-10-03 00:00:00,Montana
11/12/2015-11/26/2015,2015-11-26 00:00:00,1 in Montana, https://media.dojmt.gov/wp-content/uploads/Seirus-Innovative-Accessories.pdf ,"Seirus Innovative Accessories, Inc.",2016-02-05 00:00:00,https://dojmt.gov/consumer/consumers-known-data-breach-incidents/#,2015-11-12 00:00:00,Montana
12/30/2015-1/11/2016,2016-01-11 00:00:00,16 in Montana, https://media.dojmt.gov/wp-content/uploads/Shire-Human-Genetic-Therapies-Inc.pdf ,"Shire Human Genetic Therapies, Inc.",2016-02-08 00:00:00,https://dojmt.gov/consumer/consumers-known-data-breach-incidents/#,2015-12-30 00:00:00,Montana
12/16/2015-12/16/2015,2015-12-16 00:00:00,3 in Montana, https://media.dojmt.gov/wp-content/uploads/Baja-Bound-Insurance-Services.pdf ,Baja Bound Insurance Services,2016-02-08 00:00:00,https://dojmt.gov/consumer/consumers-known-data-breach-incidents/#,2015-12-16 00:00:00,Montana
12/3/2015-12/3/2015,2015-12-03 00:00:00,1 in Montana, https://media.dojmt.gov/wp-content/uploads/Lowcountry-Orthopaedics-and-Sports-Medicine.pdf ,Lowcountry Orthopaedics & Sports Medicine,2016-02-09 00:00:00,https://dojmt.gov/consumer/consumers-known-data-breach-incidents/#,2015-12-03 00:00:00,Montana
1/31/2016-2/10/2016,2016-02-10 00:00:00,1 in Montana, https://media.dojmt.gov/wp-content/uploads/Providence.pdf ,"Providence (St. Patrick Hospital, Missoula)",2016-02-10 00:00:00,https://dojmt.gov/consumer/consumers-known-data-breach-incidents/#,2016-01-31 00:00:00,Montana
10/1/2015-11/30/2015,2015-11-30 00:00:00,15 in Montana, https://media.dojmt.gov/wp-content/uploads/Capezio.pdf ,Capezio,2016-02-10 00:00:00,https://dojmt.gov/consumer/consumers-known-data-breach-incidents/#,2015-10-01 00:00:00,Montana
2/5/2016-2/6/2016,2016-02-06 00:00:00,1 in Montana, https://media.dojmt.gov/wp-content/uploads/Polycom-Inc.pdf ,"Polycom, Inc.",2016-02-12 00:00:00,https://dojmt.gov/consumer/consumers-known-data-breach-incidents/#,2016-02-05 00:00:00,Montana
1/22/2016-1/22/2016,2016-01-22 00:00:00,1 in Montana, https://media.dojmt.gov/wp-content/uploads/Seneca-High-School.pdf ,Seneca High School,2016-02-12 00:00:00,https://dojmt.gov/consumer/consumers-known-data-breach-incidents/#,2016-01-22 00:00:00,Montana
12/17/2015-12/17/2015,2015-12-17 00:00:00,103 in Montana, https://media.dojmt.gov/wp-content/uploads/Alliance-Health-Networks.pdf ,"Alliance Health Networks, LLC",2016-02-15 00:00:00,https://dojmt.gov/consumer/consumers-known-data-breach-incidents/#,2015-12-17 00:00:00,Montana
2/4/2016-2/4/2016,2016-02-04 00:00:00,10 in Montana, https://media.dojmt.gov/wp-content/uploads/Tetra-Technologies.pdf ,"Tetra Technologies, Inc.",2016-02-16 00:00:00,https://dojmt.gov/consumer/consumers-known-data-breach-incidents/#,2016-02-04 00:00:00,Montana
11/3/2015-12/11/2015,2015-12-11 00:00:00,34 in Montana, https://media.dojmt.gov/wp-content/uploads/Superior-Labels.pdf ,Superior Labels and Rubberstamps.net,2016-02-19 00:00:00,https://dojmt.gov/consumer/consumers-known-data-breach-incidents/#,2015-11-03 00:00:00,Montana
9/1/2015-9/30/2015,2015-09-30 00:00:00,1 in Montana, https://media.dojmt.gov/wp-content/uploads/L4-Digital.pdf ,L4 Digital,2016-02-24 00:00:00,https://dojmt.gov/consumer/consumers-known-data-breach-incidents/#,2015-09-01 00:00:00,Montana
1/26/2016-1/26/2016,2016-01-26 00:00:00,29 in Montana, https://media.dojmt.gov/wp-content/uploads/Incipio-LLC.pdf ,"Incipio, LLC",2016-02-24 00:00:00,https://dojmt.gov/consumer/consumers-known-data-breach-incidents/#,2016-01-26 00:00:00,Montana
2/6/2016-2/8/2016,2016-02-08 00:00:00,15 in Montana, https://media.dojmt.gov/wp-content/uploads/Northern-State-Bank.pdf ,Northern State Bank,2016-02-25 00:00:00,https://dojmt.gov/consumer/consumers-known-data-breach-incidents/#,2016-02-06 00:00:00,Montana
1/6/2016-1/6/2016,2016-01-06 00:00:00,3 in Montana, https://media.dojmt.gov/wp-content/uploads/Eye-Institute-of-Corpus-Christi.pdf ,Eye Institute of Corpus Christi,2016-02-26 00:00:00,https://dojmt.gov/consumer/consumers-known-data-breach-incidents/#,2016-01-06 00:00:00,Montana
2/25/2016-2/25/2016,2016-02-25 00:00:00,1 in Montana, https://media.dojmt.gov/wp-content/uploads/AmeriPride.pdf ,"AmeriPride Services, Inc.",2016-02-26 00:00:00,https://dojmt.gov/consumer/consumers-known-data-breach-incidents/#,2016-02-25 00:00:00,Montana
2/26/2016-2/27/2016,2016-02-27 00:00:00,314 in Montana, https://media.dojmt.gov/wp-content/uploads/Evening-Post-Industries.pdf ,Evening Post Industries,2016-02-27 00:00:00,https://dojmt.gov/consumer/consumers-known-data-breach-incidents/#,2016-02-26 00:00:00,Montana
11/1/2015-1/13/2016,2016-01-13 00:00:00,54 in Montana, https://media.dojmt.gov/wp-content/uploads/TN-Marketing.pdf ,TN Marketing,2016-02-29 00:00:00,https://dojmt.gov/consumer/consumers-known-data-breach-incidents/#,2015-11-01 00:00:00,Montana
5/4/2014-12/3/2015,2015-12-03 00:00:00,27 in Montana, https://media.dojmt.gov/wp-content/uploads/Landrys.pdf ,"Landry's, Inc. (Golden Nugget Atlantic City, LLC)",2016-02-29 00:00:00,https://dojmt.gov/consumer/consumers-known-data-breach-incidents/#,2014-05-04 00:00:00,Montana
2/15/2016-2/18/2016,2016-02-18 00:00:00,29 in Montana, https://media.dojmt.gov/wp-content/uploads/Online20Pharmacy20Notice.pdf ,"Wal-Mart Stores, Inc.",2016-03-01 00:00:00,https://dojmt.gov/consumer/consumers-known-data-breach-incidents/#,2016-02-15 00:00:00,Montana
2/4/2016-2/4/2016,2016-02-04 00:00:00,1 in Montana, https://media.dojmt.gov/wp-content/uploads/Intuit-3.pdf ,Intuit (4),2016-03-02 00:00:00,https://dojmt.gov/consumer/consumers-known-data-breach-incidents/#,2016-02-04 00:00:00,Montana
2/26/2016-2/26/2016,2016-02-26 00:00:00,1 in Montana, https://media.dojmt.gov/wp-content/uploads/Triple-i.pdf ,Triple-i,2016-03-03 00:00:00,https://dojmt.gov/consumer/consumers-known-data-breach-incidents/#,2016-02-26 00:00:00,Montana
3/4/2016-3/4/2016,2016-03-04 00:00:00,3 in Montana, https://media.dojmt.gov/wp-content/uploads/Numerix.pdf ,Numerex Corp.,2016-03-04 00:00:00,https://dojmt.gov/consumer/consumers-known-data-breach-incidents/#,2016-03-04 00:00:00,Montana
3/3/2016-3/3/2016,2016-03-03 00:00:00,1 in Montana, https://media.dojmt.gov/wp-content/uploads/ISCO-Industries.pdf ,"ISCO Industries, Inc.",2016-03-04 00:00:00,https://dojmt.gov/consumer/consumers-known-data-breach-incidents/#,2016-03-03 00:00:00,Montana
9/2/2014-2/18/2016,2016-02-18 00:00:00,9 in Montana, https://media.dojmt.gov/wp-content/uploads/Rosen-Hotels-Resorts.pdf ,Rosen Hotels & Resorts,2016-03-04 00:00:00,https://dojmt.gov/consumer/consumers-known-data-breach-incidents/#,2014-09-02 00:00:00,Montana
2/22/2016-2/22/2016,2016-02-22 00:00:00,3 in Montana, https://media.dojmt.gov/wp-content/uploads/eClinicalWorks.pdf ,eClinical Works,2016-03-07 00:00:00,https://dojmt.gov/consumer/consumers-known-data-breach-incidents/#,2016-02-22 00:00:00,Montana
2/24/2016-2/24/2016,2016-02-24 00:00:00,4 in Montana, https://media.dojmt.gov/wp-content/uploads/GCI.pdf ,GCI,2016-03-07 00:00:00,https://dojmt.gov/consumer/consumers-known-data-breach-incidents/#,2016-02-24 00:00:00,Montana
2/19/2016-2/19/2016,2016-02-19 00:00:00,1 in Montana, https://media.dojmt.gov/wp-content/uploads/Applied-Systems.pdf ,Applied Systems,2016-03-07 00:00:00,https://dojmt.gov/consumer/consumers-known-data-breach-incidents/#,2016-02-19 00:00:00,Montana
2/9/2016-2/18/2016,2016-02-18 00:00:00,2 in Montana, https://media.dojmt.gov/wp-content/uploads/Intuit-4.pdf ,Intuit (5),2016-03-08 00:00:00,https://dojmt.gov/consumer/consumers-known-data-breach-incidents/#,2016-02-09 00:00:00,Montana
2/15/2016-2/17/2016,2016-02-17 00:00:00,5 in Montana, https://media.dojmt.gov/wp-content/uploads/1800-flowers.pdf ,1-800 Flowers,2016-03-08 00:00:00,https://dojmt.gov/consumer/consumers-known-data-breach-incidents/#,2016-02-15 00:00:00,Montana
3/2/2016-3/2/2016,2016-03-02 00:00:00,1 in Montana, https://media.dojmt.gov/wp-content/uploads/Turner-Construction-Company.pdf ,Turner Construction Company,2016-03-08 00:00:00,https://dojmt.gov/consumer/consumers-known-data-breach-incidents/#,2016-03-02 00:00:00,Montana
2/29/2016-2/29/2016,2016-02-29 00:00:00,1 in Montana, https://media.dojmt.gov/wp-content/uploads/Seagate-US-LLC.pdf ,Seagate US LLC,2016-03-09 00:00:00,https://dojmt.gov/consumer/consumers-known-data-breach-incidents/#,2016-02-29 00:00:00,Montana
2/3/2016-2/3/2016,2016-02-03 00:00:00,4 in Montana, https://media.dojmt.gov/wp-content/uploads/Matrix-Service-Company.pdf ,Matrix Service Company,2016-03-11 00:00:00,https://dojmt.gov/consumer/consumers-known-data-breach-incidents/#,2016-02-03 00:00:00,Montana
3/2/2016-3/2/2016,2016-03-02 00:00:00,1 in Montana, https://media.dojmt.gov/wp-content/uploads/Maxim-Crane-Works.pdf ,Maxim Crane Works,2016-03-11 00:00:00,https://dojmt.gov/consumer/consumers-known-data-breach-incidents/#,2016-03-02 00:00:00,Montana
10/3/2015-10/3/2015,2015-10-03 00:00:00,264 in Montana, https://media.dojmt.gov/wp-content/uploads/21st-Century-Oncology.pdf ,21st Century Oncology,2016-03-14 00:00:00,https://dojmt.gov/consumer/consumers-known-data-breach-incidents/#,2015-10-03 00:00:00,Montana
2/29/2016-2/29/2016,2016-02-29 00:00:00,1 in Montana, https://media.dojmt.gov/wp-content/uploads/Engineering-Solutions-Products.pdf ,Engineering Solutions & Products,2016-03-14 00:00:00,https://dojmt.gov/consumer/consumers-known-data-breach-incidents/#,2016-02-29 00:00:00,Montana
3/3/2016-3/3/2016,2016-03-03 00:00:00,3 in Montana, https://media.dojmt.gov/wp-content/uploads/Intuit-6.pdf ,Intuit (6),2016-03-16 00:00:00,https://dojmt.gov/consumer/consumers-known-data-breach-incidents/#,2016-03-03 00:00:00,Montana
3/15/2016-3/15/2016,2016-03-15 00:00:00,430 in Montana, https://media.dojmt.gov/wp-content/uploads/PayneWest.pdf ,PayneWest Insurance,2016-03-17 00:00:00,https://dojmt.gov/consumer/consumers-known-data-breach-incidents/#,2016-03-15 00:00:00,Montana
2/6/2016-3/8/2016,2016-03-08 00:00:00,6 in Montana, https://media.dojmt.gov/wp-content/uploads/Northern-State-Bank-supplement.pdf ,Northern State Bank (supplemental),2016-03-17 00:00:00,https://dojmt.gov/consumer/consumers-known-data-breach-incidents/#,2016-02-06 00:00:00,Montana
3/7/2016-3/7/2016,2016-03-07 00:00:00,376 in Montana, https://media.dojmt.gov/wp-content/uploads/Advance-Auto-Parts.pdf ,Advance Auto Parts,2016-03-17 00:00:00,https://dojmt.gov/consumer/consumers-known-data-breach-incidents/#,2016-03-07 00:00:00,Montana
2/25/2016-2/25/2016,2016-02-25 00:00:00,1 in Montana, https://media.dojmt.gov/wp-content/uploads/Road-and-Highway-Builders-Sterling-Construction.pdf ,Road and Highway Builders (Sterling Construction),2016-03-21 00:00:00,https://dojmt.gov/consumer/consumers-known-data-breach-incidents/#,2016-02-25 00:00:00,Montana
3/1/2016-3/1/2016,2016-03-01 00:00:00,4 in Montana, https://media.dojmt.gov/wp-content/uploads/Kantar-Group.pdf ,Kantar Group,2016-03-21 00:00:00,https://dojmt.gov/consumer/consumers-known-data-breach-incidents/#,2016-03-01 00:00:00,Montana
3/10/2016-3/10/2016,2016-03-10 00:00:00,1 in Montana, https://media.dojmt.gov/wp-content/uploads/Lanyon-Solutions.pdf ,"Lanyon Solutions, Inc.",2016-03-21 00:00:00,https://dojmt.gov/consumer/consumers-known-data-breach-incidents/#,2016-03-10 00:00:00,Montana
2/7/2016-3/13/2016,2016-03-13 00:00:00,4 in Montana, https://media.dojmt.gov/wp-content/uploads/GlaxoSmithKline-GSK.pdf ,GlaxoSmithKline (GSK),2016-03-25 00:00:00,https://dojmt.gov/consumer/consumers-known-data-breach-incidents/#,2016-02-07 00:00:00,Montana
1/24/2016-2/7/2016,2016-02-07 00:00:00,10 in Montana, https://media.dojmt.gov/wp-content/uploads/Armstrong-Backus-Co.-myPay-Solutions.pdf ,Armstrong Backus & Co. (myPay Solutions),2016-03-25 00:00:00,https://dojmt.gov/consumer/consumers-known-data-breach-incidents/#,2016-01-24 00:00:00,Montana
2/19/2016-2/19/2016,2016-02-19 00:00:00,3098 in Montana, https://media.dojmt.gov/wp-content/uploads/Mann-Mortgage.pdf ,Mann Mortgage,2016-03-25 00:00:00,https://dojmt.gov/consumer/consumers-known-data-breach-incidents/#,2016-02-19 00:00:00,Montana
3/15/2016-3/15/2016,2016-03-15 00:00:00,3 in Montana, https://media.dojmt.gov/wp-content/uploads/Ullrich-Delevati-CPAs.pdf ,Ullrich Delevati CPAs,2016-03-28 00:00:00,https://dojmt.gov/consumer/consumers-known-data-breach-incidents/#,2016-03-15 00:00:00,Montana
3/24/2016-3/24/2016,2016-03-24 00:00:00,12 in Montana, https://media.dojmt.gov/wp-content/uploads/Examination-Management-Services-Inc.-EMSI.pdf ,Examination Management Services Inc. (EMSI),2016-03-30 00:00:00,https://dojmt.gov/consumer/consumers-known-data-breach-incidents/#,2016-03-24 00:00:00,Montana
2/1/2016-2/1/2016,2016-02-01 00:00:00,3 in Montana, https://media.dojmt.gov/wp-content/uploads/Sirius-XM.pdf ,Sirius XM Satellite Radio,2016-03-31 00:00:00,https://dojmt.gov/consumer/consumers-known-data-breach-incidents/#,2016-02-01 00:00:00,Montana
12/3/2015-2/16/2016,2016-02-16 00:00:00,29 in Montana, https://media.dojmt.gov/wp-content/uploads/St.-Vincent-Healthcare.pdf ,St. Vincent Healthcare,2016-03-31 00:00:00,https://dojmt.gov/consumer/consumers-known-data-breach-incidents/#,2015-12-03 00:00:00,Montana
2/9/2016-3/1/2016,2016-03-01 00:00:00,4 in Montana, https://media.dojmt.gov/wp-content/uploads/Block-and-Company-MMF-Industries.pdf ,Block and Company (MMF Industries),2016-03-31 00:00:00,https://dojmt.gov/consumer/consumers-known-data-breach-incidents/#,2016-02-09 00:00:00,Montana
3/21/2016-3/21/2016,2016-03-21 00:00:00,1 in Montana, https://media.dojmt.gov/wp-content/uploads/Clinton-Health-Access-CHAI.pdf ,Clinton Health Access Initiative (CHAI),2016-04-01 00:00:00,https://dojmt.gov/consumer/consumers-known-data-breach-incidents/#,2016-03-21 00:00:00,Montana
3/23/2016-3/23/2016,2016-03-23 00:00:00,2 in Montana, https://media.dojmt.gov/wp-content/uploads/Ryman-Hospitality-Properties.pdf ,Ryman Hospitality Properties,2016-04-01 00:00:00,https://dojmt.gov/consumer/consumers-known-data-breach-incidents/#,2016-03-23 00:00:00,Montana
3/2/2016-3/2/2016,2016-03-02 00:00:00,2 in Montana, https://media.dojmt.gov/wp-content/uploads/Fish-Wildlife-and-Parks.pdf ,"Fish, Wildlife and Parks",2016-04-01 00:00:00,https://dojmt.gov/consumer/consumers-known-data-breach-incidents/#,2016-03-02 00:00:00,Montana
3/24/2016-3/24/2016,2016-03-24 00:00:00,623 in Montana, https://media.dojmt.gov/wp-content/uploads/Great-Falls-Clinic.pdf ,Great Falls Clinic,2016-04-01 00:00:00,https://dojmt.gov/consumer/consumers-known-data-breach-incidents/#,2016-03-24 00:00:00,Montana
2/11/2016-2/11/2016,2016-02-11 00:00:00,3 in Montana, https://media.dojmt.gov/wp-content/uploads/OReilly-School-of-Technology.pdf ,O'Reilly School of Technology (O'Reilly Media Group),2016-04-01 00:00:00,https://dojmt.gov/consumer/consumers-known-data-breach-incidents/#,2016-02-11 00:00:00,Montana
2/15/2016-2/27/2016,2016-02-27 00:00:00,2 in Montana, https://media.dojmt.gov/wp-content/uploads/Next-Generation-Tax-and-Accounting.pdf ,Next Generation Tax and Accounting,2016-04-06 00:00:00,https://dojmt.gov/consumer/consumers-known-data-breach-incidents/#,2016-02-15 00:00:00,Montana
3/8/2016-3/8/2016,2016-03-08 00:00:00,2 in Montana, https://media.dojmt.gov/wp-content/uploads/Whiting-Turner-Contracting-Company.pdf ,Whiting-Turner Contracting Company,2016-04-06 00:00:00,https://dojmt.gov/consumer/consumers-known-data-breach-incidents/#,2016-03-08 00:00:00,Montana
4/4/2016-4/4/2016,2016-04-04 00:00:00,1 in Montana, https://media.dojmt.gov/wp-content/uploads/Midland-Paper-Packaging-Supplies.pdf ,Midland Paper Packaging & Supplies,2016-04-06 00:00:00,https://dojmt.gov/consumer/consumers-known-data-breach-incidents/#,2016-04-04 00:00:00,Montana
3/16/2016-3/16/2016,2016-03-16 00:00:00,5 in Montana, https://media.dojmt.gov/wp-content/uploads/OptumRx.pdf ,"OptumRx, Inc.",2016-04-08 00:00:00,https://dojmt.gov/consumer/consumers-known-data-breach-incidents/#,2016-03-16 00:00:00,Montana
4/6/2016-4/6/2016,2016-04-06 00:00:00,1 in Montana, https://media.dojmt.gov/wp-content/uploads/Rule-Steel.pdf ,"Rule Steel, Inc.",2016-04-11 00:00:00,https://dojmt.gov/consumer/consumers-known-data-breach-incidents/#,2016-04-06 00:00:00,Montana
11/1/2015-11/30/2015,2015-11-30 00:00:00,5 in Montana, https://media.dojmt.gov/wp-content/uploads/OnDeck-Capital.pdf ,OnDeck Capital,2016-04-11 00:00:00,https://dojmt.gov/consumer/consumers-known-data-breach-incidents/#,2015-11-01 00:00:00,Montana
1/22/2016-1/26/2016,2016-01-26 00:00:00,272 in Montana, https://media.dojmt.gov/wp-content/uploads/Schwaab-1.pdf ,Schwaab (DiscountRubberStamps.com),2016-04-11 00:00:00,https://dojmt.gov/consumer/consumers-known-data-breach-incidents/#,2016-01-22 00:00:00,Montana
3/12/2016-3/12/2016,2016-03-12 00:00:00,210 in Montana, https://media.dojmt.gov/wp-content/uploads/Pioneer-News-Group.pdf ,"Pioneer News Group of Seattle, Washington",2016-04-12 00:00:00,https://dojmt.gov/consumer/consumers-known-data-breach-incidents/#,2016-03-12 00:00:00,Montana
3/1/2016-3/31/2016,2016-03-31 00:00:00,1 in Montana, https://media.dojmt.gov/wp-content/uploads/Prime-Therapeutics.pdf ,Prime Therapeutics,2016-04-13 00:00:00,https://dojmt.gov/consumer/consumers-known-data-breach-incidents/#,2016-03-01 00:00:00,Montana
3/4/2016-3/4/2016,2016-03-04 00:00:00,3 in Montana, https://media.dojmt.gov/wp-content/uploads/Academy-of-Art-University.pdf ,Academy of Art University,2016-04-13 00:00:00,https://dojmt.gov/consumer/consumers-known-data-breach-incidents/#,2016-03-04 00:00:00,Montana
3/15/2016-3/15/2016,2016-03-15 00:00:00,2 in Montana, https://media.dojmt.gov/wp-content/uploads/Intuit-7.pdf ,Intuit (7),2016-04-13 00:00:00,https://dojmt.gov/consumer/consumers-known-data-breach-incidents/#,2016-03-15 00:00:00,Montana
3/29/2016-3/29/2016,2016-03-29 00:00:00,185 in Montana, https://media.dojmt.gov/wp-content/uploads/Department-of-Public-Health-and-Human-Services.pdf ,"Department of Health and Human Services, Early Childhood Services Bureau",2016-04-14 00:00:00,https://dojmt.gov/consumer/consumers-known-data-breach-incidents/#,2016-03-29 00:00:00,Montana
4/14/2016-4/14/2016,2016-04-14 00:00:00,2 in Montana, https://media.dojmt.gov/wp-content/uploads/O-C-Tanner.pdf ,O.C. Tanner,2016-04-15 00:00:00,https://dojmt.gov/consumer/consumers-known-data-breach-incidents/#,2016-04-14 00:00:00,Montana
2/29/2016-2/29/2016,2016-02-29 00:00:00,1 in Montana, https://media.dojmt.gov/wp-content/uploads/GoldKey-PHR.pdf ,GoldKey|PHR,2016-04-15 00:00:00,https://dojmt.gov/consumer/consumers-known-data-breach-incidents/#,2016-02-29 00:00:00,Montana
3/10/2016-3/10/2016,2016-03-10 00:00:00,12 in Montana, https://media.dojmt.gov/wp-content/uploads/Staminus-Communications.pdf ,Staminus Communications,2016-04-15 00:00:00,https://dojmt.gov/consumer/consumers-known-data-breach-incidents/#,2016-03-10 00:00:00,Montana
3/31/2016-3/31/2016,2016-03-31 00:00:00,1 in Montana, https://media.dojmt.gov/wp-content/uploads/Addus-HomeCare.pdf ,Addus HomeCare,2016-04-15 00:00:00,https://dojmt.gov/consumer/consumers-known-data-breach-incidents/#,2016-03-31 00:00:00,Montana
4/11/2016-4/11/2016,2016-04-11 00:00:00,1 in Montana, https://media.dojmt.gov/wp-content/uploads/DealerSocket.pdf ,DealerSocket Inc.,2016-04-18 00:00:00,https://dojmt.gov/consumer/consumers-known-data-breach-incidents/#,2016-04-11 00:00:00,Montana
3/1/2016-3/31/2016,2016-03-31 00:00:00,18304 in Montana, https://media.dojmt.gov/wp-content/uploads/doTerra-International.pdf ,"doTERRA International, LLC",2016-04-18 00:00:00,https://dojmt.gov/consumer/consumers-known-data-breach-incidents/#,2016-03-01 00:00:00,Montana
10/1/2015-11/30/2015,2015-11-30 00:00:00,1 in Montana, https://media.dojmt.gov/wp-content/uploads/TTI-Floor-Care-North-America.pdf ,TTI Floor Care North America,2016-04-18 00:00:00,https://dojmt.gov/consumer/consumers-known-data-breach-incidents/#,2015-10-01 00:00:00,Montana
1/7/2016-3/21/2016,2016-03-21 00:00:00,15 in Montana, https://media.dojmt.gov/wp-content/uploads/Fruitful-Yield-Health-Foods.pdf ,FruitfulYield.com; NOW-2-U.com; VitaminExperts.com,2016-04-20 00:00:00,https://dojmt.gov/consumer/consumers-known-data-breach-incidents/#,2016-01-07 00:00:00,Montana
10/15/2015-3/16/2016,2016-03-16 00:00:00,67 in Montana, https://media.dojmt.gov/wp-content/uploads/LuckyPet.pdf ,"LuckyPet, Inc.",2016-04-22 00:00:00,https://dojmt.gov/consumer/consumers-known-data-breach-incidents/#,2015-10-15 00:00:00,Montana
2/4/2016-3/16/2016,2016-03-16 00:00:00,25 in Montana, https://media.dojmt.gov/wp-content/uploads/ProSchools.pdf ,ProSchools,2016-04-22 00:00:00,https://dojmt.gov/consumer/consumers-known-data-breach-incidents/#,2016-02-04 00:00:00,Montana
4/8/2016-4/22/2016,2016-04-22 00:00:00,1 in Montana, https://media.dojmt.gov/wp-content/uploads/Total-Community-Options-dba-InnovAge.pdf ,Total Community Options dba InnovAge,2016-04-26 00:00:00,https://dojmt.gov/consumer/consumers-known-data-breach-incidents/#,2016-04-08 00:00:00,Montana
4/16/2016-4/16/2016,2016-04-16 00:00:00,34 in Montana, https://media.dojmt.gov/wp-content/uploads/Michels-Corporation.pdf ,Michels Corporation,2016-04-27 00:00:00,https://dojmt.gov/consumer/consumers-known-data-breach-incidents/#,2016-04-16 00:00:00,Montana
3/30/2016-4/11/2016,2016-04-11 00:00:00,9 in Montana, https://media.dojmt.gov/wp-content/uploads/Intuit-8.pdf ,Intuit (8),2016-04-28 00:00:00,https://dojmt.gov/consumer/consumers-known-data-breach-incidents/#,2016-03-30 00:00:00,Montana
2/25/2016-2/26/2016,2016-02-26 00:00:00,3 in Montana, https://media.dojmt.gov/wp-content/uploads/EqualizeRCM-Systems-ERCM.pdf ,EqualizeRCM Systems (ERCM),2016-04-28 00:00:00,https://dojmt.gov/consumer/consumers-known-data-breach-incidents/#,2016-02-25 00:00:00,Montana
1/24/2016-3/11/2016,2016-03-11 00:00:00,9 in Montana, https://media.dojmt.gov/wp-content/uploads/Hi-Tec.pdf ,Hi-Tec (1) (Magnum Boots),2016-04-29 00:00:00,https://dojmt.gov/consumer/consumers-known-data-breach-incidents/#,2016-01-24 00:00:00,Montana
3/30/2016-3/30/2016,2016-03-30 00:00:00,1 in Montana, https://media.dojmt.gov/wp-content/uploads/Ken-Waterman-CPA.pdf ,"Ken Waterman, CPA",2016-05-03 00:00:00,https://dojmt.gov/consumer/consumers-known-data-breach-incidents/#,2016-03-30 00:00:00,Montana
4/5/2016-4/5/2016,2016-04-05 00:00:00,68 in Montana, https://media.dojmt.gov/wp-content/uploads/Leavitt-Group.pdf ,Leavitt Group,2016-05-03 00:00:00,https://dojmt.gov/consumer/consumers-known-data-breach-incidents/#,2016-04-05 00:00:00,Montana
12/30/2015-3/22/2016,2016-03-22 00:00:00,1 in Montana, https://media.dojmt.gov/wp-content/uploads/Sanctuary-Clothing.pdf ,Sanctuary Clothing,2016-05-03 00:00:00,https://dojmt.gov/consumer/consumers-known-data-breach-incidents/#,2015-12-30 00:00:00,Montana
3/25/2016-3/25/2016,2016-03-25 00:00:00,6 in Montana, https://media.dojmt.gov/wp-content/uploads/Charles-Schwab-Co.-corrected.pdf ,Charles Schwab & Co.,2016-05-04 00:00:00,https://dojmt.gov/consumer/consumers-known-data-breach-incidents/#,2016-03-25 00:00:00,Montana
4/29/2016-4/29/2016,2016-04-29 00:00:00,1 in Montana, https://media.dojmt.gov/wp-content/uploads/Brunswick-Corporation.pdf ,Brunswick Corporation,2016-05-05 00:00:00,https://dojmt.gov/consumer/consumers-known-data-breach-incidents/#,2016-04-29 00:00:00,Montana
1/25/2016-3/19/2016,2016-03-19 00:00:00,2 in Montana, https://media.dojmt.gov/wp-content/uploads/CertifiKid-LLC.pdf ,CertifiKid LLC,2016-05-05 00:00:00,https://dojmt.gov/consumer/consumers-known-data-breach-incidents/#,2016-01-25 00:00:00,Montana
4/6/2016-4/27/2016,2016-04-27 00:00:00,8 in Montana, https://media.dojmt.gov/wp-content/uploads/Intuit9.pdf ,Intuit (9),2016-05-09 00:00:00,https://dojmt.gov/consumer/consumers-known-data-breach-incidents/#,2016-04-06 00:00:00,Montana
2/8/2016-2/8/2016,2016-02-08 00:00:00,1 in Montana, https://media.dojmt.gov/wp-content/uploads/Group-Benefit-Services.pdf ,Group Benefit Services (GBS),2016-05-09 00:00:00,https://dojmt.gov/consumer/consumers-known-data-breach-incidents/#,2016-02-08 00:00:00,Montana
4/19/2016-5/2/2016,2016-05-02 00:00:00,5 in Montana, https://media.dojmt.gov/wp-content/uploads/Distinct-Software-Solutions-dba-Golf-18-Network.pdf ,Distinct Software Solutions,2016-05-10 00:00:00,https://dojmt.gov/consumer/consumers-known-data-breach-incidents/#,2016-04-19 00:00:00,Montana
2/19/2016-4/6/2016,2016-04-06 00:00:00,10 in Montana, https://media.dojmt.gov/wp-content/uploads/MKK-Consulting-Engineers.pdf ,MKK Consulting Engineers,2016-05-11 00:00:00,https://dojmt.gov/consumer/consumers-known-data-breach-incidents/#,2016-02-19 00:00:00,Montana
3/8/2016-3/8/2016,2016-03-08 00:00:00,20 in Montana, https://media.dojmt.gov/wp-content/uploads/Medical-Colleagues-of-Texas.pdf ,Medical Colleagues of Texas,2016-05-11 00:00:00,https://dojmt.gov/consumer/consumers-known-data-breach-incidents/#,2016-03-08 00:00:00,Montana
4/29/2016-4/29/2016,2016-04-29 00:00:00,1 in Montana, https://media.dojmt.gov/wp-content/uploads/Kalamazoo-College.pdf ,Kalamazoo College,2016-05-11 00:00:00,https://dojmt.gov/consumer/consumers-known-data-breach-incidents/#,2016-04-29 00:00:00,Montana
9/22/2014-1/23/2016,2016-01-23 00:00:00,104 in Montana, https://media.dojmt.gov/wp-content/uploads/Hi-Tec2.pdf ,Hi-Tec (2) (Magnum Boots),2016-05-11 00:00:00,https://dojmt.gov/consumer/consumers-known-data-breach-incidents/#,2014-09-22 00:00:00,Montana
4/11/2016-4/11/2016,2016-04-11 00:00:00,1 in Montana, https://media.dojmt.gov/wp-content/uploads/Curse.pdf ,"Curse, Inc.",2016-05-11 00:00:00,https://dojmt.gov/consumer/consumers-known-data-breach-incidents/#,2016-04-11 00:00:00,Montana
4/13/2016-4/13/2016,2016-04-13 00:00:00,1 in Montana, https://media.dojmt.gov/wp-content/uploads/Renville-County-Hospital-Clinics.pdf ,Renville County Hospital and Clinic,2016-05-12 00:00:00,https://dojmt.gov/consumer/consumers-known-data-breach-incidents/#,2016-04-13 00:00:00,Montana
4/14/2016-4/14/2016,2016-04-14 00:00:00,28 in Montana, https://media.dojmt.gov/wp-content/uploads/MYR-Group.pdf ,"MYR Group (L.E. Myers Co., Sturgeon Electric, GSW Construction)",2016-05-12 00:00:00,https://dojmt.gov/consumer/consumers-known-data-breach-incidents/#,2016-04-14 00:00:00,Montana
2/1/2016-4/19/2016,2016-04-19 00:00:00,5 in Montana, https://media.dojmt.gov/wp-content/uploads/U.-S.-Bank.pdf ,U. S. Bank,2016-05-12 00:00:00,https://dojmt.gov/consumer/consumers-known-data-breach-incidents/#,2016-02-01 00:00:00,Montana
3/18/2016-3/18/2016,2016-03-18 00:00:00,2 in Montana, https://media.dojmt.gov/wp-content/uploads/San-Juan-County-New-Mexico.pdf ,"San Juan County, New Mexico",2016-05-13 00:00:00,https://dojmt.gov/consumer/consumers-known-data-breach-incidents/#,2016-03-18 00:00:00,Montana
3/21/2016-3/21/2016,2016-03-21 00:00:00,1 in Montana, https://media.dojmt.gov/wp-content/uploads/Block-and-Company-MMF-Industries-2.pdf ,Block and Company (MMF Industries) (2),2016-05-13 00:00:00,https://dojmt.gov/consumer/consumers-known-data-breach-incidents/#,2016-03-21 00:00:00,Montana
10/1/2015-4/22/2016,2016-04-22 00:00:00,5 in Montana, https://media.dojmt.gov/wp-content/uploads/Batdorf-Bronson-Coffee-Roasters.pdf ,"Batdorf & Bronson Coffee Roasters (Challain, Inc.)",2016-05-17 00:00:00,https://dojmt.gov/consumer/consumers-known-data-breach-incidents/#,2015-10-01 00:00:00,Montana
4/21/2016-4/21/2016,2016-04-21 00:00:00,1 in Montana, https://media.dojmt.gov/wp-content/uploads/Metropolitan-Jewish-Health-System.pdf ,"Metropolitan Jewish Health System, Inc.",2016-05-19 00:00:00,https://dojmt.gov/consumer/consumers-known-data-breach-incidents/#,2016-04-21 00:00:00,Montana
3/1/2016-4/7/2016,2016-04-07 00:00:00,5 in Montana, https://media.dojmt.gov/wp-content/uploads/Maritz-Holdings-Inc..pdf ,"Maritz Holdings, Inc.",2016-05-23 00:00:00,https://dojmt.gov/consumer/consumers-known-data-breach-incidents/#,2016-03-01 00:00:00,Montana
2/22/2016-4/14/2016,2016-04-14 00:00:00,1 in Montana, https://media.dojmt.gov/wp-content/uploads/Stamford-Podiarty-Group.pdf ,Stamford Podiatry Group,2016-05-24 00:00:00,https://dojmt.gov/consumer/consumers-known-data-breach-incidents/#,2016-02-22 00:00:00,Montana
1/20/2016-4/27/2016,2016-04-27 00:00:00,20 in Montana, https://media.dojmt.gov/wp-content/uploads/Kroger-Co..pdf ,Kroger Co.,2016-05-25 00:00:00,https://dojmt.gov/consumer/consumers-known-data-breach-incidents/#,2016-01-20 00:00:00,Montana
12/7/2015-5/3/2016,2016-05-03 00:00:00,1 in Montana, https://media.dojmt.gov/wp-content/uploads/Match-up-Solutions.pdf ,Match-Up Solutions,2016-05-26 00:00:00,https://dojmt.gov/consumer/consumers-known-data-breach-incidents/#,2015-12-07 00:00:00,Montana
5/2/2016-5/2/2016,2016-05-02 00:00:00,2 in Montana, https://media.dojmt.gov/wp-content/uploads/Intuit10.pdf ,Intuit (10),2016-05-26 00:00:00,https://dojmt.gov/consumer/consumers-known-data-breach-incidents/#,2016-05-02 00:00:00,Montana
4/14/2016-4/14/2016,2016-04-14 00:00:00,3 in Montana, https://media.dojmt.gov/wp-content/uploads/Shoes-West-Distribution-dba-Taos-Footwear.pdf ,"Shoes West Distribution, Inc dba Taos Footwear",2016-05-27 00:00:00,https://dojmt.gov/consumer/consumers-known-data-breach-incidents/#,2016-04-14 00:00:00,Montana
4/7/2016-4/7/2016,2016-04-07 00:00:00,1 in Montana, https://media.dojmt.gov/wp-content/uploads/National-Network-of-Abortion-Funds-NNAF.pdf ,National Network of Abortion Funds (NNAF),2016-05-27 00:00:00,https://dojmt.gov/consumer/consumers-known-data-breach-incidents/#,2016-04-07 00:00:00,Montana
5/23/2016-5/23/2016,2016-05-23 00:00:00,1 in Montana, https://media.dojmt.gov/wp-content/uploads/Extraction-Oil-Gas.pdf ,"Extraction Oil & Gas, LLC",2016-05-31 00:00:00,https://dojmt.gov/consumer/consumers-known-data-breach-incidents/#,2016-05-23 00:00:00,Montana
5/20/2016-5/21/2016,2016-05-21 00:00:00,1 in Montana, https://media.dojmt.gov/wp-content/uploads/Glu-Mobile.pdf ,Glu Mobile,2016-06-01 00:00:00,https://dojmt.gov/consumer/consumers-known-data-breach-incidents/#,2016-05-20 00:00:00,Montana
1/30/2016-3/23/2016,2016-03-23 00:00:00,151 in Montana, https://media.dojmt.gov/wp-content/uploads/Empathia-Inc..pdf ,"Empathia, Inc.",2016-06-03 00:00:00,https://dojmt.gov/consumer/consumers-known-data-breach-incidents/#,2016-01-30 00:00:00,Montana
5/12/2015-4/28/2016,2016-04-28 00:00:00,110 in Montana, https://media.dojmt.gov/wp-content/uploads/Acer-Service-Corporation.pdf ,Acer Service Corporation,2016-06-03 00:00:00,https://dojmt.gov/consumer/consumers-known-data-breach-incidents/#,2015-05-12 00:00:00,Montana
2/14/2014-8/5/2015,2015-08-05 00:00:00,111 in Montana, https://media.dojmt.gov/wp-content/uploads/MEI-GSR-Grand-Sierra-Resort.pdf ,MEI-GSR (Grand Sierra Resort),2016-06-06 00:00:00,https://dojmt.gov/consumer/consumers-known-data-breach-incidents/#,2014-02-14 00:00:00,Montana
3/21/2016-3/21/2016,2016-03-21 00:00:00,1 in Montana, https://media.dojmt.gov/wp-content/uploads/Trump-Hotel-Collection.pdf ,Trump Hotel Collection,2016-06-10 00:00:00,https://dojmt.gov/consumer/consumers-known-data-breach-incidents/#,2016-03-21 00:00:00,Montana
5/17/2016-5/17/2016,2016-05-17 00:00:00,3 in Montana, https://media.dojmt.gov/wp-content/uploads/Intuit11.pdf ,Intuit (11),2016-06-10 00:00:00,https://dojmt.gov/consumer/consumers-known-data-breach-incidents/#,2016-05-17 00:00:00,Montana
5/4/2016-5/19/2016,2016-05-19 00:00:00,1 in Montana, https://media.dojmt.gov/wp-content/uploads/Tiemart.pdf ,Tiemart,2016-06-13 00:00:00,https://dojmt.gov/consumer/consumers-known-data-breach-incidents/#,2016-05-04 00:00:00,Montana
9/1/2013-4/1/2015,2015-04-01 00:00:00,19 in Montana, https://media.dojmt.gov/wp-content/uploads/Universtiy-of-Connecticut.pdf ,University of Connecticut,2016-06-14 00:00:00,https://dojmt.gov/consumer/consumers-known-data-breach-incidents/#,2013-09-01 00:00:00,Montana
4/28/2016-4/28/2016,2016-04-28 00:00:00,2 in Montana, https://media.dojmt.gov/wp-content/uploads/Ameriprise-Financial-Services-2.pdf ,AmeriPrise Financial (2),2016-06-14 00:00:00,https://dojmt.gov/consumer/consumers-known-data-breach-incidents/#,2016-04-28 00:00:00,Montana
5/13/2014-5/13/2014,2014-05-13 00:00:00,1 in Montana, https://media.dojmt.gov/wp-content/uploads/Uber.pdf ,Uber,2016-06-15 00:00:00,https://dojmt.gov/consumer/consumers-known-data-breach-incidents/#,2014-05-13 00:00:00,Montana
3/8/2016-4/4/2016,2016-04-04 00:00:00,1 in Montana, https://media.dojmt.gov/wp-content/uploads/Southcentral-Foundation-SCF.pdf ,Southcentral Foundation (SCF),2016-06-17 00:00:00,https://dojmt.gov/consumer/consumers-known-data-breach-incidents/#,2016-03-08 00:00:00,Montana
6/2/2016-6/2/2016,2016-06-02 00:00:00,2 in Montana, https://media.dojmt.gov/wp-content/uploads/Intuit12.pdf ,Intuit (12),2016-06-21 00:00:00,https://dojmt.gov/consumer/consumers-known-data-breach-incidents/#,2016-06-02 00:00:00,Montana
6/17/2016-6/17/2016,2016-06-17 00:00:00,1 in Montana, https://media.dojmt.gov/wp-content/uploads/Gamesa-Wind.pdf ,"Gamesa Wind US, LLC",2016-06-27 00:00:00,https://dojmt.gov/consumer/consumers-known-data-breach-incidents/#,2016-06-17 00:00:00,Montana
10/15/2015-3/21/2016,2016-03-21 00:00:00,Unknown in Montana, https://media.dojmt.gov/wp-content/uploads/Hard-Rock-Hotel-Casino-Las-Vegas.pdf ,Hard Rock Hotel & Casino Las Vegas,2016-06-27 00:00:00,https://dojmt.gov/consumer/consumers-known-data-breach-incidents/#,2015-10-15 00:00:00,Montana
3/25/2014-6/1/2016,2016-06-01 00:00:00,1 in Montana, https://media.dojmt.gov/wp-content/uploads/Jefferson-Medical-Associates.pdf ,Jefferson Medical Associates (JMA),2016-06-28 00:00:00,https://dojmt.gov/consumer/consumers-known-data-breach-incidents/#,2014-03-25 00:00:00,Montana
4/18/2016-5/27/2016,2016-05-27 00:00:00,1 in Montana, https://media.dojmt.gov/wp-content/uploads/Rayner-Foos-Kruse-and-Irwin-CPAs-RFKI-2.pdf ,"Rayner, Foos, Kruse and Irwin, CPAs (RFKI)",2016-06-28 00:00:00,https://dojmt.gov/consumer/consumers-known-data-breach-incidents/#,2016-04-18 00:00:00,Montana
2/8/2016-2/8/2016,2016-02-08 00:00:00,1 in Montana, https://media.dojmt.gov/wp-content/uploads/Patterson-Dental-Supply-MGH.pdf ,Patterson Dental Supply (Massachusetts General Hospital),2016-06-29 00:00:00,https://dojmt.gov/consumer/consumers-known-data-breach-incidents/#,2016-02-08 00:00:00,Montana
10/21/2015-4/7/2016,2016-04-07 00:00:00,7 in Montana, https://media.dojmt.gov/wp-content/uploads/KontrolFreek-LLC.pdf ,KontrolFreek,2016-06-30 00:00:00,https://dojmt.gov/consumer/consumers-known-data-breach-incidents/#,2015-10-21 00:00:00,Montana
6/8/2016-6/8/2016,2016-06-08 00:00:00,289 in Montana, https://media.dojmt.gov/wp-content/uploads/NLU-Products-LLC-BGZ-Brands.pdf ,"NLU Products, LLC (BGZ Brands)",2016-07-05 00:00:00,https://dojmt.gov/consumer/consumers-known-data-breach-incidents/#,2016-06-08 00:00:00,Montana
5/20/2016-6/2/2016,2016-06-02 00:00:00,3 in Montana, https://media.dojmt.gov/wp-content/uploads/Blue-Cross-Blue-Shield-of-North-Dakota.pdf ,Blue Cross Blue Shield of North Dakota,2016-07-06 00:00:00,https://dojmt.gov/consumer/consumers-known-data-breach-incidents/#,2016-05-20 00:00:00,Montana
11/30/2015-6/8/2016,2016-06-08 00:00:00,Unknown in Montana, https://media.dojmt.gov/wp-content/uploads/Wendys.pdf ,Wendy's,2016-07-07 00:00:00,https://dojmt.gov/consumer/consumers-known-data-breach-incidents/#,2015-11-30 00:00:00,Montana
4/18/2015-1/29/2016,2016-01-29 00:00:00,3 in Montana, https://media.dojmt.gov/wp-content/uploads/American-Association-for-the-Advancement-of-Science-Comnet-Marketing-Group.pdf ,American Association for Advancement of Science (Comnet Marketing Group),2016-07-08 00:00:00,https://dojmt.gov/consumer/consumers-known-data-breach-incidents/#,2015-04-18 00:00:00,Montana
6/3/2016-6/3/2016,2016-06-03 00:00:00,2 in Montana, https://media.dojmt.gov/wp-content/uploads/North-Carolina-State-University.pdf ,North Carolina State University,2016-07-08 00:00:00,https://dojmt.gov/consumer/consumers-known-data-breach-incidents/#,2016-06-03 00:00:00,Montana
5/11/2016-5/11/2016,2016-05-11 00:00:00,1 in Montana, https://media.dojmt.gov/wp-content/uploads/Medtronic.pdf ,Medtronic,2016-07-08 00:00:00,https://dojmt.gov/consumer/consumers-known-data-breach-incidents/#,2016-05-11 00:00:00,Montana
12/23/2015-6/14/2016,2016-06-14 00:00:00,31 in Montana, https://media.dojmt.gov/wp-content/uploads/Omni-Hotels-and-Resorts.pdf ,Omni Hotel and Resorts,2016-07-08 00:00:00,https://dojmt.gov/consumer/consumers-known-data-breach-incidents/#,2015-12-23 00:00:00,Montana
6/16/2016-6/16/2016,2016-06-16 00:00:00,1 in Montana, https://media.dojmt.gov/wp-content/uploads/Career-Education-Corporation.pdf ,Career Education Corporation,2016-07-11 00:00:00,https://dojmt.gov/consumer/consumers-known-data-breach-incidents/#,2016-06-16 00:00:00,Montana
4/22/2016-4/24/2016,2016-04-24 00:00:00,1 in Montana, https://media.dojmt.gov/wp-content/uploads/Comnet-Marketing-Group.pdf ,Comnet Marketing Group,2016-07-12 00:00:00,https://dojmt.gov/consumer/consumers-known-data-breach-incidents/#,2016-04-22 00:00:00,Montana
4/26/2016-4/26/2016,2016-04-26 00:00:00,1 in Montana, https://media.dojmt.gov/wp-content/uploads/Primoris-Services-Corporation.pdf ,Primoris Services Corporation,2016-07-13 00:00:00,https://dojmt.gov/consumer/consumers-known-data-breach-incidents/#,2016-04-26 00:00:00,Montana
5/1/2016-6/14/2016,2016-06-14 00:00:00,15 in Montana, https://media.dojmt.gov/wp-content/uploads/IAP-Worldwide-Ingenuity-and-Purpose.pdf ,IAP Worldwide (Ingenuity and Purpose),2016-07-14 00:00:00,https://dojmt.gov/consumer/consumers-known-data-breach-incidents/#,2016-05-01 00:00:00,Montana
4/23/2016-4/24/2016,2016-04-24 00:00:00,4 in Montana, https://media.dojmt.gov/wp-content/uploads/Project-Management-Institute-PMI.pdf ,Project Management Institute (PMI),2016-07-14 00:00:00,https://dojmt.gov/consumer/consumers-known-data-breach-incidents/#,2016-04-23 00:00:00,Montana
4/28/2015-5/4/2016,2016-05-04 00:00:00,21 in Montana, https://media.dojmt.gov/wp-content/uploads/MatadorRecordings-dba-Matador-Direct.pdf ,"Matador Recordings, LLC d/b/a Matador Direct",2016-07-15 00:00:00,https://dojmt.gov/consumer/consumers-known-data-breach-incidents/#,2015-04-28 00:00:00,Montana
4/21/2016-6/13/2016,2016-06-13 00:00:00,23 in Montana, https://media.dojmt.gov/wp-content/uploads/San-Antonio-Shoemakers-Inc.pdf ,"San Antonio Shoemakers, Inc. (SAS)",2016-07-19 00:00:00,https://dojmt.gov/consumer/consumers-known-data-breach-incidents/#,2016-04-21 00:00:00,Montana
5/30/2016-5/30/2016,2016-05-30 00:00:00,2 in Montana, https://media.dojmt.gov/wp-content/uploads/Internet-Chess-Club-ICC.pdf ,"Internet Chess Club, Inc.",2016-07-19 00:00:00,https://dojmt.gov/consumer/consumers-known-data-breach-incidents/#,2016-05-30 00:00:00,Montana
3/1/2016-7/19/2016,2016-07-19 00:00:00,Unknown in Montana, https://media.dojmt.gov/wp-content/uploads/CiCi-Enterprises-Inc-1.pdf ,"CiCi Enterprises, LP",2016-07-19 00:00:00,https://dojmt.gov/consumer/consumers-known-data-breach-incidents/#,2016-03-01 00:00:00,Montana
4/23/2016-4/24/2016,2016-04-24 00:00:00,2 in Montana, https://media.dojmt.gov/wp-content/uploads/Institute-of-Management-Accountants-IMA.pdf ,Institute of Management Accountants (IMA),2016-07-20 00:00:00,https://dojmt.gov/consumer/consumers-known-data-breach-incidents/#,2016-04-23 00:00:00,Montana
6/6/2016-6/7/2016,2016-06-07 00:00:00,17 in Montana, https://media.dojmt.gov/wp-content/uploads/Skagit-Farmers-Supply-SFS.pdf ,Skagit Farmers Supply (SFS),2016-07-20 00:00:00,https://dojmt.gov/consumer/consumers-known-data-breach-incidents/#,2016-06-06 00:00:00,Montana
5/16/2016-5/16/2016,2016-05-16 00:00:00,42 in Montana, https://media.dojmt.gov/wp-content/uploads/US-Fire-CoverX-Corporation.pdf ,United States Fire Insurance (CoverX Corporation),2016-07-21 00:00:00,https://dojmt.gov/consumer/consumers-known-data-breach-incidents/#,2016-05-16 00:00:00,Montana
7/7/2016-7/7/2016,2016-07-07 00:00:00,8 in Montana, https://media.dojmt.gov/wp-content/uploads/inVentiv-Health-Inc..pdf ,"inVentiv Health, Inc.",2016-07-21 00:00:00,https://dojmt.gov/consumer/consumers-known-data-breach-incidents/#,2016-07-07 00:00:00,Montana
6/23/2016-6/23/2016,2016-06-23 00:00:00,1 in Montana, https://media.dojmt.gov/wp-content/uploads/American-College-of-Emergency-Physicians-ACEP.pdf ,American College of Emergency Physicians (ACEP) (ComNet Marketing),2016-07-22 00:00:00,https://dojmt.gov/consumer/consumers-known-data-breach-incidents/#,2016-06-23 00:00:00,Montana
4/23/2016-4/24/2016,2016-04-24 00:00:00,2 in Montana, https://media.dojmt.gov/wp-content/uploads/Specialty-Equipment-Market-Assoc-SEMA.pdf ,Specialty Equipment Market Association (SEMA),2016-07-27 00:00:00,https://dojmt.gov/consumer/consumers-known-data-breach-incidents/#,2016-04-23 00:00:00,Montana
4/22/2016-4/24/2016,2016-04-24 00:00:00,2 in Montana, https://media.dojmt.gov/wp-content/uploads/Academy-of-Nutrition-Dietetics.pdf ,Academy of Nutrition & Dietetics,2016-07-28 00:00:00,https://dojmt.gov/consumer/consumers-known-data-breach-incidents/#,2016-04-22 00:00:00,Montana
5/3/2016-6/29/2016,2016-06-29 00:00:00,8 in Montana, https://media.dojmt.gov/wp-content/uploads/MedAltus-LLC.pdf ,"MedAltus, LLC",2016-07-29 00:00:00,https://dojmt.gov/consumer/consumers-known-data-breach-incidents/#,2016-05-03 00:00:00,Montana
7/21/2016-7/21/2016,2016-07-21 00:00:00,1 in Montana, https://media.dojmt.gov/wp-content/uploads/Nordic-Consulting-Partners-Inc.pdf ,"Nordic Consulting Partners, Inc.",2016-07-29 00:00:00,https://dojmt.gov/consumer/consumers-known-data-breach-incidents/#,2016-07-21 00:00:00,Montana
7/1/2015-7/27/2016,2016-07-27 00:00:00,1 in Montana, https://media.dojmt.gov/wp-content/uploads/Pro-Performance-Sports-LLC.pdf ,"Pro Performance Sports, LLC",2016-07-30 00:00:00,https://dojmt.gov/consumer/consumers-known-data-breach-incidents/#,2015-07-01 00:00:00,Montana
7/27/2016-7/27/2016,2016-07-27 00:00:00,1 in Montana, https://media.dojmt.gov/wp-content/uploads/Green-Plains-Inc.pdf ,"Green Plains, Inc.",2016-08-01 00:00:00,https://dojmt.gov/consumer/consumers-known-data-breach-incidents/#,2016-07-27 00:00:00,Montana
6/23/2016-7/7/2016,2016-07-07 00:00:00,2155 in Montana, https://media.dojmt.gov/wp-content/uploads/Banner-Health.pdf ,Banner Health,2016-08-03 00:00:00,https://dojmt.gov/consumer/consumers-known-data-breach-incidents/#,2016-06-23 00:00:00,Montana
11/13/2015-6/10/2016,2016-06-10 00:00:00,3 in Montana, https://media.dojmt.gov/wp-content/uploads/Travel-Caddy-Inc-dba-Travelon.pdf ,"Travel Caddy, Inc. dba Travelon",2016-08-04 00:00:00,https://dojmt.gov/consumer/consumers-known-data-breach-incidents/#,2015-11-13 00:00:00,Montana
5/23/2016-7/6/2016,2016-07-06 00:00:00,818 in Montana, https://media.dojmt.gov/wp-content/uploads/HDV-Vest-Investment-Services.pdf ,HD Vest Investment Services,2016-08-04 00:00:00,https://dojmt.gov/consumer/consumers-known-data-breach-incidents/#,2016-05-23 00:00:00,Montana
7/16/2016-7/22/2016,2016-07-22 00:00:00,2 in Montana, https://media.dojmt.gov/wp-content/uploads/EBSCO-Sign.pdf ,EBSCO Sign Group a/k/a OutdoorSigns America,2016-08-08 00:00:00,https://dojmt.gov/consumer/consumers-known-data-breach-incidents/#,2016-07-16 00:00:00,Montana
6/13/2016-6/13/2016,2016-06-13 00:00:00,1 in Montana, https://media.dojmt.gov/wp-content/uploads/Rotech-Healthcare.pdf ,Rotech Healthcare,2016-08-10 00:00:00,https://dojmt.gov/consumer/consumers-known-data-breach-incidents/#,2016-06-13 00:00:00,Montana
6/15/2016-6/15/2016,2016-06-15 00:00:00,Unknown in Montana, https://media.dojmt.gov/wp-content/uploads/Taleff-Murphy.pdf ,"Taleff & Murphy, P.C.",2016-08-10 00:00:00,https://dojmt.gov/consumer/consumers-known-data-breach-incidents/#,2016-06-15 00:00:00,Montana
7/23/2016-7/25/2016,2016-07-25 00:00:00,1 in Montana, https://media.dojmt.gov/wp-content/uploads/USAA-Federal-Savings-Bank.pdf ,USAA Federal Savings Bank,2016-08-11 00:00:00,https://dojmt.gov/consumer/consumers-known-data-breach-incidents/#,2016-07-23 00:00:00,Montana
6/25/2016-7/22/2016,2016-07-22 00:00:00,10 in Montana, https://media.dojmt.gov/wp-content/uploads/PAX-Labs.pdf ,PAX Labs,2016-08-12 00:00:00,https://dojmt.gov/consumer/consumers-known-data-breach-incidents/#,2016-06-25 00:00:00,Montana
12/2/2015-6/12/2016,2016-06-12 00:00:00,Unknown in Montana, https://media.dojmt.gov/wp-content/uploads/HEI-Hotels-and-Resorts.pdf ,HEI Hotels & Resorts,2016-08-12 00:00:00,https://dojmt.gov/consumer/consumers-known-data-breach-incidents/#,2015-12-02 00:00:00,Montana
4/18/2016-4/21/2016,2016-04-21 00:00:00,45 in Montana, https://media.dojmt.gov/wp-content/uploads/Bon-Secours-Health-System.pdf ,Bon Secours Health System/R-C Healthcare Management,2016-08-12 00:00:00,https://dojmt.gov/consumer/consumers-known-data-breach-incidents/#,2016-04-18 00:00:00,Montana
3/30/2016-6/13/2016,2016-06-13 00:00:00,586 in Montana, https://media.dojmt.gov/wp-content/uploads/Valley-Anesthesiology-Consultants.pdf ,Valley Anesthesiology and Pain Consultants (VAPC),2016-08-12 00:00:00,https://dojmt.gov/consumer/consumers-known-data-breach-incidents/#,2016-03-30 00:00:00,Montana
10/9/2015-8/1/2016,2016-08-01 00:00:00,135 in Montana, https://media.dojmt.gov/wp-content/uploads/Anderson-Tackman-Co..pdf ,Schwan's Home Service,2016-08-15 00:00:00,https://dojmt.gov/consumer/consumers-known-data-breach-incidents/#,2015-10-09 00:00:00,Montana
7/25/2016-7/25/2016,2016-07-25 00:00:00,4 in Montana, https://media.dojmt.gov/wp-content/uploads/Schwans.pdf ,"Precision Pipeline, LLC, subsidiary of MasTec, Inc.",2016-08-15 00:00:00,https://dojmt.gov/consumer/consumers-known-data-breach-incidents/#,2016-07-25 00:00:00,Montana
7/6/2016-7/6/2016,2016-07-06 00:00:00,4 in Montana, https://media.dojmt.gov/wp-content/uploads/Precision-Pipeline.pdf ,"Anderson, Tackman & Co.",2016-08-15 00:00:00,https://dojmt.gov/consumer/consumers-known-data-breach-incidents/#,2016-07-06 00:00:00,Montana
7/16/2016-8/18/2016,2016-08-18 00:00:00,35 in Montana, https://media.dojmt.gov/wp-content/uploads/Presnell-Gage.pdf ,"Presnell Gage, PLLC",2016-08-18 00:00:00,https://dojmt.gov/consumer/consumers-known-data-breach-incidents/#,2016-07-16 00:00:00,Montana
3/24/2016-7/29/2016,2016-07-29 00:00:00,7 in Montana, https://media.dojmt.gov/wp-content/uploads/DXE-Medical-1.pdf ,DXE Medical,2016-08-18 00:00:00,https://dojmt.gov/consumer/consumers-known-data-breach-incidents/#,2016-03-24 00:00:00,Montana
6/19/2016-7/22/2016,2016-07-22 00:00:00,1 in Montana, https://media.dojmt.gov/wp-content/uploads/Matouk.pdf ,"Matouk Factory Store, Inc.",2016-08-18 00:00:00,https://dojmt.gov/consumer/consumers-known-data-breach-incidents/#,2016-06-19 00:00:00,Montana
5/21/2016-7/6/2016,2016-07-06 00:00:00,2072 in Montana, https://media.dojmt.gov/wp-content/uploads/Newkirk-Symphonix.pdf ,Newkirk - Symphonix,2016-08-19 00:00:00,https://dojmt.gov/consumer/consumers-known-data-breach-incidents/#,2016-05-21 00:00:00,Montana
8/3/2016-8/3/2016,2016-08-03 00:00:00,6 in Montana, https://media.dojmt.gov/wp-content/uploads/Intuit13.pdf ,Intuit (13),2016-08-19 00:00:00,https://dojmt.gov/consumer/consumers-known-data-breach-incidents/#,2016-08-03 00:00:00,Montana
7/15/2016-7/15/2016,2016-07-15 00:00:00,8492 in Montana, https://media.dojmt.gov/wp-content/uploads/Eddie-Bauer.pdf ,"Eddie Bauer, LLC",2016-08-19 00:00:00,https://dojmt.gov/consumer/consumers-known-data-breach-incidents/#,2016-07-15 00:00:00,Montana
6/28/2016-6/28/2016,2016-06-28 00:00:00,19 in Montana, https://media.dojmt.gov/wp-content/uploads/Toyota-Motor-Credit-Corporation3.pdf ,Toyota Motor Credit Corporation (3),2016-08-22 00:00:00,https://dojmt.gov/consumer/consumers-known-data-breach-incidents/#,2016-06-28 00:00:00,Montana
3/4/2016-6/24/2016,2016-06-24 00:00:00,6 in Montana, https://media.dojmt.gov/wp-content/uploads/SCAN-Health-Plan.pdf ,SCAN Health Plan,2016-08-22 00:00:00,https://dojmt.gov/consumer/consumers-known-data-breach-incidents/#,2016-03-04 00:00:00,Montana
10/21/2015-4/7/2016,2016-04-07 00:00:00,59 in Montana, https://media.dojmt.gov/wp-content/uploads/KontrolFreek-LLC2.pdf ,KontrolFreek LLC (2),2016-08-22 00:00:00,https://dojmt.gov/consumer/consumers-known-data-breach-incidents/#,2015-10-21 00:00:00,Montana
4/26/2016-6/8/2016,2016-06-08 00:00:00,1 in Montana, https://media.dojmt.gov/wp-content/uploads/Noble-House-3.pdf ,Noble House Hotels & Resorts (3),2016-08-24 00:00:00,https://dojmt.gov/consumer/consumers-known-data-breach-incidents/#,2016-04-26 00:00:00,Montana
7/27/2016-8/2/2016,2016-08-02 00:00:00,1 in Montana, https://media.dojmt.gov/wp-content/uploads/Michelle-Pecora-CPA.pdf ,Michelle A. Pecora CPA,2016-08-25 00:00:00,https://dojmt.gov/consumer/consumers-known-data-breach-incidents/#,2016-07-27 00:00:00,Montana
11/24/2015-11/24/2015,2015-11-24 00:00:00,9 in Montana, https://media.dojmt.gov/wp-content/uploads/Exterran.pdf ,Exterran,2016-08-26 00:00:00,https://dojmt.gov/consumer/consumers-known-data-breach-incidents/#,2015-11-24 00:00:00,Montana
2/16/2016-7/7/2016,2016-07-07 00:00:00,276 in Montana, https://media.dojmt.gov/wp-content/uploads/Gray-Television.pdf ,Kimpton Hotels & Restaurants,2016-08-31 00:00:00,https://dojmt.gov/consumer/consumers-known-data-breach-incidents/#,2016-02-16 00:00:00,Montana
8/12/2016-8/12/2016,2016-08-12 00:00:00,34 in Montana, https://media.dojmt.gov/wp-content/uploads/CHI-Franciscan-Healthcare-Highline-Medical-Center-R-C-Healthcare-Management.pdf ,Gray Television,2016-08-31 00:00:00,https://dojmt.gov/consumer/consumers-known-data-breach-incidents/#,2016-08-12 00:00:00,Montana
4/21/2016-6/13/2016,2016-06-13 00:00:00,15 in Montana, https://media.dojmt.gov/wp-content/uploads/M-Holdings-Securities.pdf ,CHI Franciscan Healthcare Highline Medical Center (R-C Healthcare Management),2016-08-31 00:00:00,https://dojmt.gov/consumer/consumers-known-data-breach-incidents/#,2016-04-21 00:00:00,Montana
8/1/2016-8/1/2016,2016-08-01 00:00:00,7 in Montana, https://media.dojmt.gov/wp-content/uploads/Kimpton-Hotels-Restaurants.pdf ,M Holdings Securities,2016-08-31 00:00:00,https://dojmt.gov/consumer/consumers-known-data-breach-incidents/#,2016-08-01 00:00:00,Montana
4/25/2016-8/3/2016,2016-08-03 00:00:00,50 in Montana, https://media.dojmt.gov/wp-content/uploads/Noble-House-4.pdf ,Noble House Hotels & Resorts (4),2016-09-02 00:00:00,https://dojmt.gov/consumer/consumers-known-data-breach-incidents/#,2016-04-25 00:00:00,Montana
7/6/2016-7/7/2016,2016-07-07 00:00:00,1 in Montana, https://media.dojmt.gov/wp-content/uploads/Burrell-Behavioral-Health.pdf ,Burrell Behavioral Health,2016-09-06 00:00:00,https://dojmt.gov/consumer/consumers-known-data-breach-incidents/#,2016-07-06 00:00:00,Montana
3/28/2016-6/5/2016,2016-06-05 00:00:00,3 in Montana, https://media.dojmt.gov/wp-content/uploads/King-of-Prussia-Dental-Association-KOP.pdf ,King of Prussia Dental Association (KOP),2016-09-08 00:00:00,https://dojmt.gov/consumer/consumers-known-data-breach-incidents/#,2016-03-28 00:00:00,Montana
4/13/2016-4/14/2016,2016-04-14 00:00:00,7 in Montana, https://media.dojmt.gov/wp-content/uploads/City-of-Plummer.pdf ,"City of Plummer, Idaho",2016-09-09 00:00:00,https://dojmt.gov/consumer/consumers-known-data-breach-incidents/#,2016-04-13 00:00:00,Montana
5/1/2016-6/14/2016,2016-06-14 00:00:00,2 in Montana, https://media.dojmt.gov/wp-content/uploads/IAP-Worldwide-Ingenuity-and-Purpose2.pdf ,IAP Worldwide (Ingenuity and Purpose) (2),2016-09-09 00:00:00,https://dojmt.gov/consumer/consumers-known-data-breach-incidents/#,2016-05-01 00:00:00,Montana
8/10/2016-8/10/2016,2016-08-10 00:00:00,4 in Montana, https://media.dojmt.gov/wp-content/uploads/Rebecca-Minkoff.pdf ,Rebecca Minkoff,2016-09-09 00:00:00,https://dojmt.gov/consumer/consumers-known-data-breach-incidents/#,2016-08-10 00:00:00,Montana
8/18/2014-7/21/2016,2016-07-21 00:00:00,3 in Montana, https://media.dojmt.gov/wp-content/uploads/Asante-Health-System.pdf ,Asante Health System,2016-09-09 00:00:00,https://dojmt.gov/consumer/consumers-known-data-breach-incidents/#,2014-08-18 00:00:00,Montana
8/8/2016-8/9/2016,2016-08-09 00:00:00,1 in Montana, https://media.dojmt.gov/wp-content/uploads/Pratap-Kurra-MD.pdf ,"Pratap Kurrar, M.D.",2016-09-12 00:00:00,https://dojmt.gov/consumer/consumers-known-data-breach-incidents/#,2016-08-08 00:00:00,Montana
8/3/2016-8/9/2016,2016-08-09 00:00:00,4 in Montana, https://media.dojmt.gov/wp-content/uploads/Wheeler-Egger-CPAs.pdf ,"Wheeler & Egger, CPAs",2016-09-13 00:00:00,https://dojmt.gov/consumer/consumers-known-data-breach-incidents/#,2016-08-03 00:00:00,Montana
4/25/2016-4/25/2016,2016-04-25 00:00:00,6 in Montana, https://media.dojmt.gov/wp-content/uploads/Ursus-Holdings-LLC.pdf ,Ursus Holdings,2016-09-15 00:00:00,https://dojmt.gov/consumer/consumers-known-data-breach-incidents/#,2016-04-25 00:00:00,Montana
6/29/2016-7/17/2016,2016-07-17 00:00:00,1 in Montana, https://media.dojmt.gov/wp-content/uploads/Capital-One.pdf ,Capital One,2016-09-15 00:00:00,https://dojmt.gov/consumer/consumers-known-data-breach-incidents/#,2016-06-29 00:00:00,Montana
8/11/2016-8/16/2016,2016-08-16 00:00:00,28 in Montana, https://media.dojmt.gov/wp-content/uploads/Lulus-Fashion-Lounge.pdf ,Lulu's Fashion Lounge,2016-09-16 00:00:00,https://dojmt.gov/consumer/consumers-known-data-breach-incidents/#,2016-08-11 00:00:00,Montana
8/22/2016-8/22/2016,2016-08-22 00:00:00,40370 in Montana, https://media.dojmt.gov/wp-content/uploads/ACTIVEOutdoors.pdf ,ACTIVEOutdoors,2016-09-19 00:00:00,https://dojmt.gov/consumer/consumers-known-data-breach-incidents/#,2016-08-22 00:00:00,Montana
7/11/2016-7/11/2016,2016-07-11 00:00:00,1 in Montana, https://media.dojmt.gov/wp-content/uploads/Stallcup-Associates-CPAs.pdf ,"Stallcup & Associates, CPAs",2016-09-21 00:00:00,https://dojmt.gov/consumer/consumers-known-data-breach-incidents/#,2016-07-11 00:00:00,Montana
8/2/2016-8/2/2016,2016-08-02 00:00:00,20 in Montana, https://media.dojmt.gov/wp-content/uploads/Central-Ohio-Urology-Group-COUG.pdf ,Central Ohio Urology Group (COUG),2016-09-22 00:00:00,https://dojmt.gov/consumer/consumers-known-data-breach-incidents/#,2016-08-02 00:00:00,Montana
8/11/2016-8/11/2016,2016-08-11 00:00:00,3 in Montana, https://media.dojmt.gov/wp-content/uploads/Napa-Valley-Dentistry.pdf ,"Napa Valley Dentristry of Napa, California",2016-09-22 00:00:00,https://dojmt.gov/consumer/consumers-known-data-breach-incidents/#,2016-08-11 00:00:00,Montana
9/1/2014-10/1/2014,2014-10-01 00:00:00,Unknown in Montana, http://consumerfed.org/yahoo-users-face-massive-data-breach/ ,YAHOO,2016-09-22 00:00:00,https://dojmt.gov/consumer/consumers-known-data-breach-incidents/#,2014-09-01 00:00:00,Montana
9/5/2016-9/12/2016,2016-09-12 00:00:00,4 in Montana, https://media.dojmt.gov/wp-content/uploads/Intuit14.pdf ,Intuit (14),2016-09-23 00:00:00,https://dojmt.gov/consumer/consumers-known-data-breach-incidents/#,2016-09-05 00:00:00,Montana
8/15/2016-9/8/2016,2016-09-08 00:00:00,15 in Montana, https://media.dojmt.gov/wp-content/uploads/Novation-Settlement-Solutions.pdf ,Novation Settlement Solutions,2016-09-23 00:00:00,https://dojmt.gov/consumer/consumers-known-data-breach-incidents/#,2016-08-15 00:00:00,Montana
8/9/2016-8/9/2016,2016-08-09 00:00:00,1 in Montana, https://media.dojmt.gov/wp-content/uploads/BECU.pdf ,BECU (Boeing Employees' Credit Union),2016-09-26 00:00:00,https://dojmt.gov/consumer/consumers-known-data-breach-incidents/#,2016-08-09 00:00:00,Montana
7/21/2016-7/21/2016,2016-07-21 00:00:00,1 in Montana, https://media.dojmt.gov/wp-content/uploads/Santora-CPA-and-SimpleBooks-Corp..pdf ,Santoro CPA and SimpleBooks Corp.,2016-09-27 00:00:00,https://dojmt.gov/consumer/consumers-known-data-breach-incidents/#,2016-07-21 00:00:00,Montana
8/8/2016-8/8/2016,2016-08-08 00:00:00,1 in Montana, https://media.dojmt.gov/wp-content/uploads/Thomasville-Eye-Center.pdf ,Thomasville Eye Center,2016-09-28 00:00:00,https://dojmt.gov/consumer/consumers-known-data-breach-incidents/#,2016-08-08 00:00:00,Montana
4/17/2016-8/26/2016,2016-08-26 00:00:00,12 in Montana, https://media.dojmt.gov/wp-content/uploads/VF-Outlet.pdf ,VF Outlet,2016-09-28 00:00:00,https://dojmt.gov/consumer/consumers-known-data-breach-incidents/#,2016-04-17 00:00:00,Montana
9/19/2012-6/10/2016,2016-06-10 00:00:00,19 in Montana, https://media.dojmt.gov/wp-content/uploads/Hutton-Hotel.pdf ,Hutton Hotel,2016-09-29 00:00:00,https://dojmt.gov/consumer/consumers-known-data-breach-incidents/#,2012-09-19 00:00:00,Montana
5/1/2016-7/12/2016,2016-07-12 00:00:00,9 in Montana, https://media.dojmt.gov/wp-content/uploads/Dale-A-Wein-Prof-LLC.pdf ,"Dale A. Wein, Prof. LLC",2016-10-01 00:00:00,https://dojmt.gov/consumer/consumers-known-data-breach-incidents/#,2016-05-01 00:00:00,Montana
8/22/2016-8/22/2016,2016-08-22 00:00:00,2 in Montana, https://media.dojmt.gov/wp-content/uploads/Francisco-Jaume-D.O..pdf ,"Francisco Jaume, D.O.",2016-10-03 00:00:00,https://dojmt.gov/consumer/consumers-known-data-breach-incidents/#,2016-08-22 00:00:00,Montana
9/12/2016-9/12/2016,2016-09-12 00:00:00,2 in Montana, https://media.dojmt.gov/wp-content/uploads/Vaupell.pdf ,Vaupell Holdings,2016-10-03 00:00:00,https://dojmt.gov/consumer/consumers-known-data-breach-incidents/#,2016-09-12 00:00:00,Montana
7/6/2016-7/6/2016,2016-07-06 00:00:00,3 in Montana, https://media.dojmt.gov/wp-content/uploads/Borden-Perlman-Insurance.pdf ,Borden Perlman Salisbury & Kelly Insurance,2016-10-05 00:00:00,https://dojmt.gov/consumer/consumers-known-data-breach-incidents/#,2016-07-06 00:00:00,Montana
7/28/2016-8/1/2016,2016-08-01 00:00:00,2 in Montana, https://media.dojmt.gov/wp-content/uploads/HD-Vest-Investment-Services-2.pdf ,HD Vest Investment Services (2),2016-10-05 00:00:00,https://dojmt.gov/consumer/consumers-known-data-breach-incidents/#,2016-07-28 00:00:00,Montana
9/12/2016-9/12/2016,2016-09-12 00:00:00,1 in Montana, https://media.dojmt.gov/wp-content/uploads/University-of-Montana.pdf ,University of Montana,2016-10-06 00:00:00,https://dojmt.gov/consumer/consumers-known-data-breach-incidents/#,2016-09-12 00:00:00,Montana
9/4/2016-9/22/2016,2016-09-22 00:00:00,2 in Montana, https://media.dojmt.gov/wp-content/uploads/MicroDAQ.pdf ,MicroDAQ,2016-10-07 00:00:00,https://dojmt.gov/consumer/consumers-known-data-breach-incidents/#,2016-09-04 00:00:00,Montana
7/25/2016-9/23/2016,2016-09-23 00:00:00,2 in Montana, https://media.dojmt.gov/wp-content/uploads/Vera-Bradley.pdf ,Vera Bradley,2016-10-12 00:00:00,https://dojmt.gov/consumer/consumers-known-data-breach-incidents/#,2016-07-25 00:00:00,Montana
7/11/2016-7/26/2016,2016-07-26 00:00:00,3 in Montana, https://media.dojmt.gov/wp-content/uploads/Curtis-F.-Robinson-M.D..pdf ,"Curtis F. Robinson, M.D.",2016-10-13 00:00:00,https://dojmt.gov/consumer/consumers-known-data-breach-incidents/#,2016-07-11 00:00:00,Montana
8/15/2016-8/15/2016,2016-08-15 00:00:00,2 in Montana, https://media.dojmt.gov/wp-content/uploads/Integrity-Transitional-Hospital.pdf ,Integrity Transitional Hospital,2016-10-14 00:00:00,https://dojmt.gov/consumer/consumers-known-data-breach-incidents/#,2016-08-15 00:00:00,Montana
7/28/2016-7/28/2016,2016-07-28 00:00:00,1 in Montana, https://media.dojmt.gov/wp-content/uploads/Gibson-Insurance-Agency.pdf ,Gibson Insurance Agency,2016-10-14 00:00:00,https://dojmt.gov/consumer/consumers-known-data-breach-incidents/#,2016-07-28 00:00:00,Montana
9/13/2016-9/13/2016,2016-09-13 00:00:00,4 in Montana, https://media.dojmt.gov/wp-content/uploads/Intuit15.pdf ,Intuit (15),2016-10-17 00:00:00,https://dojmt.gov/consumer/consumers-known-data-breach-incidents/#,2016-09-13 00:00:00,Montana
2/16/2016-8/20/2016,2016-08-20 00:00:00,1 in Montana, https://media.dojmt.gov/wp-content/uploads/Atlanta-Falcons-Football-Club.pdf ,Atlanta Falcons Football Club,2016-10-17 00:00:00,https://dojmt.gov/consumer/consumers-known-data-breach-incidents/#,2016-02-16 00:00:00,Montana
5/29/2016-7/22/2016,2016-07-22 00:00:00,114 in Montana, https://media.dojmt.gov/wp-content/uploads/Eastwood-Company.pdf ,Eastwood Company,2016-10-19 00:00:00,https://dojmt.gov/consumer/consumers-known-data-breach-incidents/#,2016-05-29 00:00:00,Montana
9/18/2016-9/23/2016,2016-09-23 00:00:00,3 in Montana, https://media.dojmt.gov/wp-content/uploads/Natural-Life-Collections.pdf ,Natural Life Collections,2016-10-20 00:00:00,https://dojmt.gov/consumer/consumers-known-data-breach-incidents/#,2016-09-18 00:00:00,Montana
4/15/2016-6/30/2016,2016-06-30 00:00:00,106 in Montana, https://media.dojmt.gov/wp-content/uploads/Rocky-Mountain-Credit-Union.pdf ,Rocky Mountain Credit Union,2016-10-20 00:00:00,https://dojmt.gov/consumer/consumers-known-data-breach-incidents/#,2016-04-15 00:00:00,Montana
9/27/2016-9/27/2016,2016-09-27 00:00:00,1 in Montana, https://media.dojmt.gov/wp-content/uploads/State-Farm-Mutual-Automobile-Insurance-Company.pdf ,State Farm Mutual Automobile Insurance Company,2016-10-20 00:00:00,https://dojmt.gov/consumer/consumers-known-data-breach-incidents/#,2016-09-27 00:00:00,Montana
9/20/2016-9/20/2016,2016-09-20 00:00:00,1 in Montana, https://media.dojmt.gov/wp-content/uploads/Ameriprise-Financial-Services.pdf ,Ameriprise Financial,2016-10-21 00:00:00,https://dojmt.gov/consumer/consumers-known-data-breach-incidents/#,2016-09-20 00:00:00,Montana
9/13/2016-9/13/2016,2016-09-13 00:00:00,1 in Montana, https://media.dojmt.gov/wp-content/uploads/Pacific-Concepts-Group-dba-National-Satellite-Center.pdf ,Pacific Concepts Group d/b/a National Satellite Center,2016-10-21 00:00:00,https://dojmt.gov/consumer/consumers-known-data-breach-incidents/#,2016-09-13 00:00:00,Montana
10/14/2016-10/15/2016,2016-10-15 00:00:00,55 in Montana, https://media.dojmt.gov/wp-content/uploads/National-Wholesale ,"National Wholesale Company, Inc.",2016-11-03 00:00:00,https://dojmt.gov/consumer/consumers-known-data-breach-incidents/#,2016-10-14 00:00:00,Montana
8/28/2016-10/3/2016,2016-10-03 00:00:00,2 in Montana, https://media.dojmt.gov/wp-content/uploads/Christian-Louboutin.pdf ,Christian Louboutin LLC,2016-11-03 00:00:00,https://dojmt.gov/consumer/consumers-known-data-breach-incidents/#,2016-08-28 00:00:00,Montana
7/12/2016-10/3/2016,2016-10-03 00:00:00,4 in Montana, https://media.dojmt.gov/wp-content/uploads/Sentinel-Hotel.pdf ,Sentinel Hotel,2016-11-04 00:00:00,https://dojmt.gov/consumer/consumers-known-data-breach-incidents/#,2016-07-12 00:00:00,Montana
8/10/2016-10/7/2016,2016-10-07 00:00:00,15 in Montana, https://media.dojmt.gov/wp-content/uploads/Rebecca-Minkoff-LLC.pdf ,Rebecca Minkoff LLC (2),2016-11-07 00:00:00,https://dojmt.gov/consumer/consumers-known-data-breach-incidents/#,2016-08-10 00:00:00,Montana
10/8/2016-10/31/2016,2016-10-31 00:00:00,3 in Montana, https://media.dojmt.gov/wp-content/uploads/Baker-Overby-Moore-Inc.-P.S..pdf ,"Baker, Overby & Moore, Inc., P.S.",2016-11-08 00:00:00,https://dojmt.gov/consumer/consumers-known-data-breach-incidents/#,2016-10-08 00:00:00,Montana
8/4/2016-8/30/2016,2016-08-30 00:00:00,45 in Montana, https://media.dojmt.gov/wp-content/uploads/Honigs-Whistle-Stop.pdf ,Honig's Whistle Stop,2016-11-09 00:00:00,https://dojmt.gov/consumer/consumers-known-data-breach-incidents/#,2016-08-04 00:00:00,Montana
9/7/2016-10/24/2016,2016-10-24 00:00:00,83 in Montana, https://media.dojmt.gov/wp-content/uploads/Eileen-Fisher.pdf ,"Eileen Fisher, Inc.",2016-11-09 00:00:00,https://dojmt.gov/consumer/consumers-known-data-breach-incidents/#,2016-09-07 00:00:00,Montana
9/13/2016-9/13/2016,2016-09-13 00:00:00,4 in Montana, https://media.dojmt.gov/wp-content/uploads/Politi-Magnifico-LLC.pdf ,"Politi & Magnifico, LLC",2016-11-09 00:00:00,https://dojmt.gov/consumer/consumers-known-data-breach-incidents/#,2016-09-13 00:00:00,Montana
7/14/2016-7/21/2016,2016-07-21 00:00:00,71 in Montana, https://media.dojmt.gov/wp-content/uploads/UFCW-Local-655-Food-Employers-Joint-Pension-Plan.pdf ,UFCW Local 655 Employers Joint Pension Plan,2016-11-09 00:00:00,https://dojmt.gov/consumer/consumers-known-data-breach-incidents/#,2016-07-14 00:00:00,Montana
10/11/2016-10/11/2016,2016-10-11 00:00:00,1 in Montana, https://media.dojmt.gov/wp-content/uploads/Baxter-Credit-Union.pdf ,Baxter Credit Union,2016-11-10 00:00:00,https://dojmt.gov/consumer/consumers-known-data-breach-incidents/#,2016-10-11 00:00:00,Montana
10/31/2016-10/31/2016,2016-10-31 00:00:00,2 in Montana, https://media.dojmt.gov/wp-content/uploads/Sirius-XM-Radio.pdf ,Sirius XM Radio Inc.,2016-11-11 00:00:00,https://dojmt.gov/consumer/consumers-known-data-breach-incidents/#,2016-10-31 00:00:00,Montana
9/9/2016-9/9/2016,2016-09-09 00:00:00,34 in Montana, https://media.dojmt.gov/wp-content/uploads/Aetna.pdf ,Aetna,2016-11-16 00:00:00,https://dojmt.gov/consumer/consumers-known-data-breach-incidents/#,2016-09-09 00:00:00,Montana
10/4/2016-11/1/2016,2016-11-01 00:00:00,5 in Montana, https://media.dojmt.gov/wp-content/uploads/Yummie.pdf ,Yummie,2016-11-16 00:00:00,https://dojmt.gov/consumer/consumers-known-data-breach-incidents/#,2016-10-04 00:00:00,Montana
7/26/2016-7/27/2016,2016-07-27 00:00:00,1 in Montana, https://media.dojmt.gov/wp-content/uploads/Eye-Institute-of-Marin.pdf ,Eye Institute of Marin,2016-11-16 00:00:00,https://dojmt.gov/consumer/consumers-known-data-breach-incidents/#,2016-07-26 00:00:00,Montana
10/5/2016-10/5/2016,2016-10-05 00:00:00,2 in Montana, https://media.dojmt.gov/wp-content/uploads/NRSC.pdf ,NRSC,2016-11-17 00:00:00,https://dojmt.gov/consumer/consumers-known-data-breach-incidents/#,2016-10-05 00:00:00,Montana
10/3/2016-11/9/2016,2016-11-09 00:00:00,83 in Montana, https://media.dojmt.gov/wp-content/uploads/Springfield-Armory-1.pdf ,Springfield Armory,2016-11-18 00:00:00,https://dojmt.gov/consumer/consumers-known-data-breach-incidents/#,2016-10-03 00:00:00,Montana
10/3/2015-10/9/2016,2016-10-09 00:00:00,83 in Montana, https://media.dojmt.gov/wp-content/uploads/Springfield-Armory.pdf ,Springfield Armory,2016-11-18 00:00:00,https://dojmt.gov/consumer/consumers-known-data-breach-incidents/#,2015-10-03 00:00:00,Montana
11/13/2016-11/13/2016,2016-11-13 00:00:00,460 in Montana, https://media.dojmt.gov/wp-content/uploads/Michigan-State-University.pdf ,Michigan State University,2016-11-21 00:00:00,https://dojmt.gov/consumer/consumers-known-data-breach-incidents/#,2016-11-13 00:00:00,Montana
10/17/2016-10/17/2016,2016-10-17 00:00:00,2 in Montana, https://media.dojmt.gov/wp-content/uploads/Ameriprise-Financial-Services-Inc..pdf ,"Ameriprise Financial Services, Inc.",2016-11-21 00:00:00,https://dojmt.gov/consumer/consumers-known-data-breach-incidents/#,2016-10-17 00:00:00,Montana
10/24/2016-11/9/2016,2016-11-09 00:00:00,Unknown in Montana, https://media.dojmt.gov/wp-content/uploads/Madison-Square-Garden-Company.pdf ,Madison Square Garden Company,2016-11-22 00:00:00,https://dojmt.gov/consumer/consumers-known-data-breach-incidents/#,2016-10-24 00:00:00,Montana
9/26/2016-11/5/2016,2016-11-05 00:00:00,25 in Montana, https://media.dojmt.gov/wp-content/uploads/Back-Country-Gear.pdf ,Backcountry Gear,2016-11-23 00:00:00,https://dojmt.gov/consumer/consumers-known-data-breach-incidents/#,2016-09-26 00:00:00,Montana
9/4/2016-9/12/2016,2016-09-12 00:00:00,4 in Montana, https://media.dojmt.gov/wp-content/uploads/Primerica.pdf ,Primerica,2016-11-23 00:00:00,https://dojmt.gov/consumer/consumers-known-data-breach-incidents/#,2016-09-04 00:00:00,Montana
7/16/2016-8/5/2016,2016-08-05 00:00:00,6 in Montana, https://media.dojmt.gov/wp-content/uploads/State-Street.pdf ,State Street,2016-11-28 00:00:00,https://dojmt.gov/consumer/consumers-known-data-breach-incidents/#,2016-07-16 00:00:00,Montana
2/10/2016-6/2/2016,2016-06-02 00:00:00,4 in Montana, https://media.dojmt.gov/wp-content/uploads/Swervepoint.pdf ,SwervePoint,2016-11-29 00:00:00,https://dojmt.gov/consumer/consumers-known-data-breach-incidents/#,2016-02-10 00:00:00,Montana
9/1/2016-10/19/2016,2016-10-19 00:00:00,53 in Montana, https://media.dojmt.gov/wp-content/uploads/Lang-Companies-Inc..pdf ,"Lang Companies, Inc.",2016-11-30 00:00:00,https://dojmt.gov/consumer/consumers-known-data-breach-incidents/#,2016-09-01 00:00:00,Montana
10/15/2016-10/31/2016,2016-10-31 00:00:00,1 in Montana, https://media.dojmt.gov/wp-content/uploads/Baylor-College-of-Medicine.pdf ,Baylor College of Medicine,2016-11-30 00:00:00,https://dojmt.gov/consumer/consumers-known-data-breach-incidents/#,2016-10-15 00:00:00,Montana
,,nan in Montana,,,,https://dojmt.gov/consumer/consumers-known-data-breach-incidents/#,,Montana
10/17/2016-11/2/2016,2016-11-02 00:00:00,1 in Montana, https://media.dojmt.gov/wp-content/uploads/Guilmartin-DiPiro-Sokolowski-LLC.pdf ,"Guilmartin, DiPiro & Sokolowski, LLC",2016-12-02 00:00:00,https://dojmt.gov/consumer/consumers-known-data-breach-incidents/#,2016-10-17 00:00:00,Montana
11/9/2016-12/22/2016,2016-12-22 00:00:00,3 in Montana, https://media.dojmt.gov/wp-content/uploads/Intuit16.pdf ,"Intuit, Inc.",2016-12-02 00:00:00,https://dojmt.gov/consumer/consumers-known-data-breach-incidents/#,2016-11-09 00:00:00,Montana
11/15/2016-11/15/2016,2016-11-15 00:00:00,2 in Montana, https://media.dojmt.gov/wp-content/uploads/Citrix-Systems-1.pdf ,Citrix Systems,2016-12-06 00:00:00,https://dojmt.gov/consumer/consumers-known-data-breach-incidents/#,2016-11-15 00:00:00,Montana
6/14/2014-10/22/2016,2016-10-22 00:00:00,1 in Montana, https://media.dojmt.gov/wp-content/uploads/Asante-Health-System-2.pdf ,Asante Health System,2016-12-09 00:00:00,https://dojmt.gov/consumer/consumers-known-data-breach-incidents/#,2014-06-14 00:00:00,Montana
11/23/2016-11/23/2016,2016-11-23 00:00:00,4 in Montana, https://media.dojmt.gov/wp-content/uploads/Intuit17.pdf ,"Intuit, Inc.",2016-12-12 00:00:00,https://dojmt.gov/consumer/consumers-known-data-breach-incidents/#,2016-11-23 00:00:00,Montana
9/24/2016-11/28/2016,2016-11-28 00:00:00,22 in Montana, https://media.dojmt.gov/wp-content/uploads/BraceAbility.pdf ,"BraceAbility, Inc.",2016-12-13 00:00:00,https://dojmt.gov/consumer/consumers-known-data-breach-incidents/#,2016-09-24 00:00:00,Montana
8/28/2016-8/28/2016,2016-08-28 00:00:00,1 in Montana, https://media.dojmt.gov/wp-content/uploads/USGB-LLC.pdf ,"USGB, LLC",2016-12-15 00:00:00,https://dojmt.gov/consumer/consumers-known-data-breach-incidents/#,2016-08-28 00:00:00,Montana
10/27/2016-10/27/2016,2016-10-27 00:00:00,1 in Montana, https://media.dojmt.gov/wp-content/uploads/Tropicana-St.-Louis-LLC.pdf ,"Tropicana St. Louis, LLC",2016-12-15 00:00:00,https://dojmt.gov/consumer/consumers-known-data-breach-incidents/#,2016-10-27 00:00:00,Montana
10/14/2016-10/18/2016,2016-10-18 00:00:00,7 in Montana, https://media.dojmt.gov/wp-content/uploads/Southcentral-Foundation-SCF-2.pdf ,Southcentral Foundation,2016-12-16 00:00:00,https://dojmt.gov/consumer/consumers-known-data-breach-incidents/#,2016-10-14 00:00:00,Montana
9/21/2016-9/29/2016,2016-09-29 00:00:00,4 in Montana, https://media.dojmt.gov/wp-content/uploads/The-Federal-Savings-Bank.pdf ,The Federal Savings Bank,2016-12-16 00:00:00,https://dojmt.gov/consumer/consumers-known-data-breach-incidents/#,2016-09-21 00:00:00,Montana
9/13/2016-9/13/2016,2016-09-13 00:00:00,9 in Montana, https://media.dojmt.gov/wp-content/uploads/Bomberg-Roach-Hanson-PLLC.pdf ,"Bomberg, Roach & Hanson, PLLC",2016-12-16 00:00:00,https://dojmt.gov/consumer/consumers-known-data-breach-incidents/#,2016-09-13 00:00:00,Montana
7/1/2016-7/31/2016,2016-07-31 00:00:00,169 in Montana, https://media.dojmt.gov/wp-content/uploads/Western-Union.pdf ,"Western Union Financial Services, Inc.",2016-12-20 00:00:00,https://dojmt.gov/consumer/consumers-known-data-breach-incidents/#,2016-07-01 00:00:00,Montana
10/12/2016-10/12/2016,2016-10-12 00:00:00,6 in Montana, https://media.dojmt.gov/wp-content/uploads/Luther-College.pdf ,Luther College,2016-12-20 00:00:00,https://dojmt.gov/consumer/consumers-known-data-breach-incidents/#,2016-10-12 00:00:00,Montana
12/13/2016-12/13/2016,2016-12-13 00:00:00,175 in Montana, https://media.dojmt.gov/wp-content/uploads/Hash-OBrien-Biby-Murray-PLLP.pdf ,"Hash, O'Brien, Biby & Murray, PLLP",2016-12-21 00:00:00,https://dojmt.gov/consumer/consumers-known-data-breach-incidents/#,2016-12-13 00:00:00,Montana
9/20/2016-9/20/2016,2016-09-20 00:00:00,36 in Montana, https://media.dojmt.gov/wp-content/uploads/Dover-Federal-Credit-Union.pdf ,Dover Federal Credit Union,2016-12-22 00:00:00,https://dojmt.gov/consumer/consumers-known-data-breach-incidents/#,2016-09-20 00:00:00,Montana
11/15/2016-11/15/2016,2016-11-15 00:00:00,1 in Montana, https://media.dojmt.gov/wp-content/uploads/Claremont-University-Consortium.pdf ,Claremont University Consortium,2016-12-22 00:00:00,https://dojmt.gov/consumer/consumers-known-data-breach-incidents/#,2016-11-15 00:00:00,Montana
10/25/2016-10/25/2016,2016-10-25 00:00:00,1 in Montana, https://media.dojmt.gov/wp-content/uploads/Brandywine-Pediatrics.pdf ,"Brandywine Pediatrics, P.A.",2016-12-23 00:00:00,https://dojmt.gov/consumer/consumers-known-data-breach-incidents/#,2016-10-25 00:00:00,Montana
10/28/2016-10/28/2016,2016-10-28 00:00:00,2 in Montana, https://media.dojmt.gov/wp-content/uploads/Madison-Trust-Company.pdf ,Madison Trust Company,2016-12-27 00:00:00,https://dojmt.gov/consumer/consumers-known-data-breach-incidents/#,2016-10-28 00:00:00,Montana
6/6/2016-10/28/2016,2016-10-28 00:00:00,4 in Montana, https://media.dojmt.gov/wp-content/uploads/Safe-For-Home-Products-LLC-DBA-Naturepedic.pdf ,Naturepedic,2016-12-27 00:00:00,https://dojmt.gov/consumer/consumers-known-data-breach-incidents/#,2016-06-06 00:00:00,Montana
7/30/2016-10/12/2016,2016-10-12 00:00:00,18 in Montana, https://media.dojmt.gov/wp-content/uploads/The-Topps-Company-Inc..pdf ,"The Topps Company, Inc.",2016-12-27 00:00:00,https://dojmt.gov/consumer/consumers-known-data-breach-incidents/#,2016-07-30 00:00:00,Montana
5/16/2016-10/18/2016,2016-10-18 00:00:00,3 in Montana, https://media.dojmt.gov/wp-content/uploads/Unison-Home.pdf ,Unison Home,2016-12-28 00:00:00,https://dojmt.gov/consumer/consumers-known-data-breach-incidents/#,2016-05-16 00:00:00,Montana
7/12/2016-11/30/2016,2016-11-30 00:00:00,61 in Montana, https://media.dojmt.gov/wp-content/uploads/Graphik-Dimensions.pdf ,"Graphik Dimensions, Ltd.",2016-12-28 00:00:00,https://dojmt.gov/consumer/consumers-known-data-breach-incidents/#,2016-07-12 00:00:00,Montana
11/1/2016-11/1/2016,2016-11-01 00:00:00,2 in Montana, https://media.dojmt.gov/wp-content/uploads/Cascade-Management-Inc.pdf ,"Cascade Management, Inc.",2016-12-28 00:00:00,https://dojmt.gov/consumer/consumers-known-data-breach-incidents/#,2016-11-01 00:00:00,Montana
11/30/2016-11/30/2016,2016-11-30 00:00:00,1 in Montana, https://media.dojmt.gov/wp-content/uploads/CommonBond.pdf ,CommonBond,2016-12-29 00:00:00,https://dojmt.gov/consumer/consumers-known-data-breach-incidents/#,2016-11-30 00:00:00,Montana
11/7/2016-11/7/2016,2016-11-07 00:00:00,18 in Montana, https://media.dojmt.gov/wp-content/uploads/Community-Health-Plan-of-Washington.pdf ,Community Health Plan of Washington,2016-12-29 00:00:00,https://dojmt.gov/consumer/consumers-known-data-breach-incidents/#,2016-11-07 00:00:00,Montana
4/23/2016-4/24/2016,2016-04-24 00:00:00,2 in Montana, https://media.dojmt.gov/wp-content/uploads/American-Pharmacists-Association.pdf ,American Pharmacists Association,2016-12-29 00:00:00,https://dojmt.gov/consumer/consumers-known-data-breach-incidents/#,2016-04-23 00:00:00,Montana
10/3/2016-10/3/2016,2016-10-03 00:00:00,29 in Montana, https://media.dojmt.gov/wp-content/uploads/Sheet-Metal-Workers-Local-Union-104.pdf ,Sheet Metal Workers' Local Union 104,2016-12-30 00:00:00,https://dojmt.gov/consumer/consumers-known-data-breach-incidents/#,2016-10-03 00:00:00,Montana
12/6/2016-12/6/2016,2016-12-06 00:00:00,1 in Montana, https://media.dojmt.gov/wp-content/uploads/Ameriprise-Financial-Services-Inc.-2.pdf ,"Ameriprise Financial Services, Inc.",2017-01-03 00:00:00,https://dojmt.gov/consumer/consumers-known-data-breach-incidents/#,2016-12-06 00:00:00,Montana
9/25/2016-10/31/2016,2016-10-31 00:00:00,21 in Montana, https://media.dojmt.gov/wp-content/uploads/LASOC-Legal-Aid-Society-of-Orange-County.pdf ,LASOC - Legal Aid Society of Orange County,2017-01-06 00:00:00,https://dojmt.gov/consumer/consumers-known-data-breach-incidents/#,2016-09-25 00:00:00,Montana
10/29/2016-11/7/2016,2016-11-07 00:00:00,17 in Montana, https://media.dojmt.gov/wp-content/uploads/DealerBuilt.pdf ,DealerBuilt,2017-01-09 00:00:00,https://dojmt.gov/consumer/consumers-known-data-breach-incidents/#,2016-10-29 00:00:00,Montana
5/2/2016-11/22/2016,2016-11-22 00:00:00,1411 in Montana, https://media.dojmt.gov/wp-content/uploads/Spiraledge-SwimOutlet-and-YogaOutlet.com_.pdf ,Spiraledge - Swim Outlet.com & YogaOutlet.com,2017-01-12 00:00:00,https://dojmt.gov/consumer/consumers-known-data-breach-incidents/#,2016-05-02 00:00:00,Montana
10/10/2016-10/10/2016,2016-10-10 00:00:00,1 in Montana, https://media.dojmt.gov/wp-content/uploads/Contech-Engineerd-Solutions.pdf ,Contech Engineered Solutions,2017-01-17 00:00:00,https://dojmt.gov/consumer/consumers-known-data-breach-incidents/#,2016-10-10 00:00:00,Montana
12/22/2016-12/28/2016,2016-12-28 00:00:00,3 in Montana, https://media.dojmt.gov/wp-content/uploads/Breville-USA-Inc..pdf ,"Breville USA, Inc.",2017-01-17 00:00:00,https://dojmt.gov/consumer/consumers-known-data-breach-incidents/#,2016-12-22 00:00:00,Montana
12/23/2015-12/23/2015,2015-12-23 00:00:00,2 in Montana, https://media.dojmt.gov/wp-content/uploads/CoPilot-Provider-Support-Services-1.pdf ,CoPilot Provider Support Services,2017-01-18 00:00:00,https://dojmt.gov/consumer/consumers-known-data-breach-incidents/#,2015-12-23 00:00:00,Montana
11/29/2016-11/29/2016,2016-11-29 00:00:00,66 in Montana, https://media.dojmt.gov/wp-content/uploads/Center-for-Mental-Health.pdf ,Center for Mental Health,2017-01-19 00:00:00,https://dojmt.gov/consumer/consumers-known-data-breach-incidents/#,2016-11-29 00:00:00,Montana
1/17/2017-1/17/2017,2017-01-17 00:00:00,4 in Montana, https://media.dojmt.gov/wp-content/uploads/Intuit-5.pdf ,"Intuit, Inc.",2017-01-26 00:00:00,https://dojmt.gov/consumer/consumers-known-data-breach-incidents/#,2017-01-17 00:00:00,Montana
11/16/2016-12/22/2016,2016-12-22 00:00:00,1 in Montana, https://media.dojmt.gov/wp-content/uploads/Capital-One-2.pdf ,Capital One,2017-01-26 00:00:00,https://dojmt.gov/consumer/consumers-known-data-breach-incidents/#,2016-11-16 00:00:00,Montana
3/1/2015-12/1/2016,2016-12-01 00:00:00,77 in Montana, https://media.dojmt.gov/wp-content/uploads/Synergy-Specialists.pdf ,"Charles Komar & Sons, Inc.",2017-01-26 00:00:00,https://dojmt.gov/consumer/consumers-known-data-breach-incidents/#,2015-03-01 00:00:00,Montana
12/9/2016-12/9/2016,2016-12-09 00:00:00,1 in Montana, https://media.dojmt.gov/wp-content/uploads/Synergy-Specialists.pdf ,Synergy Specialists Medical Group,2017-01-26 00:00:00,https://dojmt.gov/consumer/consumers-known-data-breach-incidents/#,2016-12-09 00:00:00,Montana
1/25/2017-1/25/2017,2017-01-25 00:00:00,6 in Montana, https://media.dojmt.gov/wp-content/uploads/Distribution-International.pdf ,Distribution International,2017-01-27 00:00:00,https://dojmt.gov/consumer/consumers-known-data-breach-incidents/#,2017-01-25 00:00:00,Montana
1/25/2017-1/25/2017,2017-01-25 00:00:00,6 in Montana, https://media.dojmt.gov/wp-content/uploads/Campbell-County-Health.pdf ,Campbell County Health,2017-01-27 00:00:00,https://dojmt.gov/consumer/consumers-known-data-breach-incidents/#,2017-01-25 00:00:00,Montana
4/25/2016-9/14/2016,2016-09-14 00:00:00,28 in Montana, https://media.dojmt.gov/wp-content/uploads/International-Code-Council.pdf ,International Code Council,2017-01-27 00:00:00,https://dojmt.gov/consumer/consumers-known-data-breach-incidents/#,2016-04-25 00:00:00,Montana
12/12/2016-12/12/2016,2016-12-12 00:00:00,1 in Montana, https://media.dojmt.gov/wp-content/uploads/Axis-Insurance-Services-LLC.pdf ,"Axis Insurance Services, LLC",2017-01-30 00:00:00,https://dojmt.gov/consumer/consumers-known-data-breach-incidents/#,2016-12-12 00:00:00,Montana
1/17/2017-1/17/2017,2017-01-17 00:00:00,6 in Montana, https://media.dojmt.gov/wp-content/uploads/Kuhana.pdf ,"Kuhana Associates, LLC",2017-01-30 00:00:00,https://dojmt.gov/consumer/consumers-known-data-breach-incidents/#,2017-01-17 00:00:00,Montana
1/18/2017-1/18/2017,2017-01-18 00:00:00,1 in Montana, https://media.dojmt.gov/wp-content/uploads/Persante.pdf ,Persante,2017-01-31 00:00:00,https://dojmt.gov/consumer/consumers-known-data-breach-incidents/#,2017-01-18 00:00:00,Montana
12/21/2016-12/21/2016,2016-12-21 00:00:00,67 in Montana, https://media.dojmt.gov/wp-content/uploads/Hutchinson-and-Bloodgood-LLP.pdf ,Hutchinson and Bloodgood LLP,2017-02-01 00:00:00,https://dojmt.gov/consumer/consumers-known-data-breach-incidents/#,2016-12-21 00:00:00,Montana
1/11/2017-1/11/2017,2017-01-11 00:00:00,7 in Montana, https://media.dojmt.gov/wp-content/uploads/Aero-Air.pdf ,Aero Air,2017-02-02 00:00:00,https://dojmt.gov/consumer/consumers-known-data-breach-incidents/#,2017-01-11 00:00:00,Montana
6/23/2016-12/13/2016,2016-12-13 00:00:00,3 in Montana, https://media.dojmt.gov/wp-content/uploads/King-McNamara-Moriarty.pdf ,King McNamara Moriarty,2017-02-02 00:00:00,https://dojmt.gov/consumer/consumers-known-data-breach-incidents/#,2016-06-23 00:00:00,Montana
2/2/2017-2/2/2017,2017-02-02 00:00:00,1 in Montana, https://media.dojmt.gov/wp-content/uploads/Corporate-Travel-Planners.pdf ,Corporate Travel Planners,2017-02-03 00:00:00,https://dojmt.gov/consumer/consumers-known-data-breach-incidents/#,2017-02-02 00:00:00,Montana
11/16/2016-11/16/2016,2016-11-16 00:00:00,9 in Montana, https://media.dojmt.gov/wp-content/uploads/Conover.pdf ,"Conover Capital Management, LLC / Conover Securities Corporation",2017-02-03 00:00:00,https://dojmt.gov/consumer/consumers-known-data-breach-incidents/#,2016-11-16 00:00:00,Montana
9/1/2016-1/9/2017,2017-01-09 00:00:00,353 in Montana, https://media.dojmt.gov/wp-content/uploads/Capital-One-3.pdf ,Capital One,2017-02-06 00:00:00,https://dojmt.gov/consumer/consumers-known-data-breach-incidents/#,2016-09-01 00:00:00,Montana
1/23/2017-1/23/2017,2017-01-23 00:00:00,2 in Montana, https://media.dojmt.gov/wp-content/uploads/Sky-Climber-LLC.pdf ,"Sky Climber, LLC",2017-02-06 00:00:00,https://dojmt.gov/consumer/consumers-known-data-breach-incidents/#,2017-01-23 00:00:00,Montana
12/31/2016-12/31/2016,2016-12-31 00:00:00,10 in Montana, https://media.dojmt.gov/wp-content/uploads/Berkeley.pdf ,Berkeley College,2017-02-06 00:00:00,https://dojmt.gov/consumer/consumers-known-data-breach-incidents/#,2016-12-31 00:00:00,Montana
12/1/2016-12/7/2016,2016-12-07 00:00:00,4 in Montana, https://media.dojmt.gov/wp-content/uploads/The-Federal-Savings-Bank-2.pdf ,The Federal Savings Bank,2017-02-07 00:00:00,https://dojmt.gov/consumer/consumers-known-data-breach-incidents/#,2016-12-01 00:00:00,Montana
3/1/2016-5/31/2016,2016-05-31 00:00:00,1 in Montana, https://media.dojmt.gov/wp-content/uploads/Land-Title.pdf ,Land Title,2017-02-07 00:00:00,https://dojmt.gov/consumer/consumers-known-data-breach-incidents/#,2016-03-01 00:00:00,Montana
11/21/2016-11/21/2016,2016-11-21 00:00:00,7 in Montana, https://media.dojmt.gov/wp-content/uploads/Boeing.pdf ,Boeing,2017-02-08 00:00:00,https://dojmt.gov/consumer/consumers-known-data-breach-incidents/#,2016-11-21 00:00:00,Montana
1/25/2017-1/25/2017,2017-01-25 00:00:00,3 in Montana, https://media.dojmt.gov/wp-content/uploads/SouthEast-Alaska-Regional-Health-Consortium.pdf ,SouthEast Alaska Regional Health Consortium,2017-02-08 00:00:00,https://dojmt.gov/consumer/consumers-known-data-breach-incidents/#,2017-01-25 00:00:00,Montana
2/2/2017-2/2/2017,2017-02-02 00:00:00,3 in Montana, https://media.dojmt.gov/wp-content/uploads/College-of-Southern-Idaho.pdf ,College of Southern Idaho,2017-02-08 00:00:00,https://dojmt.gov/consumer/consumers-known-data-breach-incidents/#,2017-02-02 00:00:00,Montana
1/20/2017-1/20/2017,2017-01-20 00:00:00,2 in Montana, https://media.dojmt.gov/wp-content/uploads/Klondex-Mines.pdf ,Klondex Mines,2017-02-09 00:00:00,https://dojmt.gov/consumer/consumers-known-data-breach-incidents/#,2017-01-20 00:00:00,Montana
1/24/2017-2/8/2017,2017-02-08 00:00:00,1 in Montana, https://media.dojmt.gov/wp-content/uploads/TechWise.pdf ,TechWise,2017-02-10 00:00:00,https://dojmt.gov/consumer/consumers-known-data-breach-incidents/#,2017-01-24 00:00:00,Montana
1/17/2017-1/17/2017,2017-01-17 00:00:00,1 in Montana, https://media.dojmt.gov/wp-content/uploads/TransPerfect-Global-Inc..pdf ,"TransPerfect Global, Inc.",2017-02-10 00:00:00,https://dojmt.gov/consumer/consumers-known-data-breach-incidents/#,2017-01-17 00:00:00,Montana
2/10/2017-2/10/2017,2017-02-10 00:00:00,1 in Montana, https://media.dojmt.gov/wp-content/uploads/Frosch-International-Travel.pdf ,Frosch International Travel,2017-02-13 00:00:00,https://dojmt.gov/consumer/consumers-known-data-breach-incidents/#,2017-02-10 00:00:00,Montana
1/19/2017-1/13/2017,2017-01-13 00:00:00,1 in Montana, https://media.dojmt.gov/wp-content/uploads/Petro-49.pdf ,Petro 49,2017-02-13 00:00:00,https://dojmt.gov/consumer/consumers-known-data-breach-incidents/#,2017-01-19 00:00:00,Montana
1/9/2017-1/10/2017,2017-01-10 00:00:00,1 in Montana, https://media.dojmt.gov/wp-content/uploads/Evanson-Asset-Management.pdf ,Evanson Asset Management,2017-02-14 00:00:00,https://dojmt.gov/consumer/consumers-known-data-breach-incidents/#,2017-01-09 00:00:00,Montana
1/25/2017-1/25/2017,2017-01-25 00:00:00,30 in Montana, https://media.dojmt.gov/wp-content/uploads/Driveline.pdf ,"Driveline Retail Merchandising, Inc.",2017-02-14 00:00:00,https://dojmt.gov/consumer/consumers-known-data-breach-incidents/#,2017-01-25 00:00:00,Montana
11/30/2016-1/17/2017,2017-01-17 00:00:00,26 in Montana, https://media.dojmt.gov/wp-content/uploads/The-Honest-Kitchen.pdf ,The Honest Kitchen,2017-02-15 00:00:00,https://dojmt.gov/consumer/consumers-known-data-breach-incidents/#,2016-11-30 00:00:00,Montana
2/1/2016-12/31/2016,2016-12-31 00:00:00,203 in Montana, https://media.dojmt.gov/wp-content/uploads/New-Englad-Biolabs-NEB.pdf ,New England Biolabs (NEB),2017-02-17 00:00:00,https://dojmt.gov/consumer/consumers-known-data-breach-incidents/#,2016-02-01 00:00:00,Montana
12/26/2016-1/25/2017,2017-01-25 00:00:00,7 in Montana, https://media.dojmt.gov/wp-content/uploads/Family-Services-Rochester.pdf ,Family Service Rochester,2017-02-17 00:00:00,https://dojmt.gov/consumer/consumers-known-data-breach-incidents/#,2016-12-26 00:00:00,Montana
2/2/2017-2/3/2017,2017-02-03 00:00:00,2 in Montana, https://media.dojmt.gov/wp-content/uploads/Amplify.pdf ,"Amplify Education, Inc.",2017-02-17 00:00:00,https://dojmt.gov/consumer/consumers-known-data-breach-incidents/#,2017-02-02 00:00:00,Montana
2/1/2016-12/31/2016,2016-12-31 00:00:00,107 in Montana, https://media.dojmt.gov/wp-content/uploads/Century-LLC.pdf ,"Century, LLC",2017-02-19 00:00:00,https://dojmt.gov/consumer/consumers-known-data-breach-incidents/#,2016-02-01 00:00:00,Montana
2/8/2017-2/8/2017,2017-02-08 00:00:00,1 in Montana, https://media.dojmt.gov/wp-content/uploads/Citizens-Memorial.pdf ,Citizens Memorial Hospital,2017-02-20 00:00:00,https://dojmt.gov/consumer/consumers-known-data-breach-incidents/#,2017-02-08 00:00:00,Montana
1/30/2017-2/1/2017,2017-02-01 00:00:00,26 in Montana, https://media.dojmt.gov/wp-content/uploads/CenturyLink.pdf ,CenturyLink,2017-02-20 00:00:00,https://dojmt.gov/consumer/consumers-known-data-breach-incidents/#,2017-01-30 00:00:00,Montana
2/1/2016-12/31/2016,2016-12-31 00:00:00,53 in Montana, https://media.dojmt.gov/wp-content/uploads/Movie-Mars.pdf ,MovieMars.com,2017-02-21 00:00:00,https://dojmt.gov/consumer/consumers-known-data-breach-incidents/#,2016-02-01 00:00:00,Montana
1/1/2017-1/1/2017,2017-01-01 00:00:00,10 in Montana, https://media.dojmt.gov/wp-content/uploads/Emory-Healthcare.pdf ,Emory Healthcare,2017-02-21 00:00:00,https://dojmt.gov/consumer/consumers-known-data-breach-incidents/#,2017-01-01 00:00:00,Montana
2/17/2017-2/17/2017,2017-02-17 00:00:00,75 in Montana, https://media.dojmt.gov/wp-content/uploads/TRG.pdf ,TRG,2017-02-22 00:00:00,https://dojmt.gov/consumer/consumers-known-data-breach-incidents/#,2017-02-17 00:00:00,Montana
1/2/2017-2/2/2017,2017-02-02 00:00:00,1 in Montana, https://media.dojmt.gov/wp-content/uploads/Federal-Direct-Tax-Services-1.pdf ,Federal Direct Tax Services,2017-02-22 00:00:00,https://dojmt.gov/consumer/consumers-known-data-breach-incidents/#,2017-01-02 00:00:00,Montana
1/27/2017-1/27/2017,2017-01-27 00:00:00,5 in Montana, https://media.dojmt.gov/wp-content/uploads/Roxy-Trading-Inc..pdf ,"Roxy Trading, Inc.",2017-02-22 00:00:00,https://dojmt.gov/consumer/consumers-known-data-breach-incidents/#,2017-01-27 00:00:00,Montana
2/9/2017-2/9/2017,2017-02-09 00:00:00,3 in Montana, https://media.dojmt.gov/wp-content/uploads/Arabella-Advisors.pdf ,Arabella Advisors,2017-02-22 00:00:00,https://dojmt.gov/consumer/consumers-known-data-breach-incidents/#,2017-02-09 00:00:00,Montana
2/3/2017-2/3/2017,2017-02-03 00:00:00,49 in Montana, https://media.dojmt.gov/wp-content/uploads/InterMountain-Management.pdf ,InterMountain Management,2017-02-22 00:00:00,https://dojmt.gov/consumer/consumers-known-data-breach-incidents/#,2017-02-03 00:00:00,Montana
4/24/2016-12/14/2016,2016-12-14 00:00:00,210 in Montana, https://media.dojmt.gov/wp-content/uploads/Intex-Recreation-Corp.pdf ,Intex Recreation Corp,2017-02-22 00:00:00,https://dojmt.gov/consumer/consumers-known-data-breach-incidents/#,2016-04-24 00:00:00,Montana
2/1/2016-12/31/2016,2016-12-31 00:00:00,69 in Montana, https://media.dojmt.gov/wp-content/uploads/Bluemercury-Inc.pdf ,"Bluemercury, Inc.",2017-02-23 00:00:00,https://dojmt.gov/consumer/consumers-known-data-breach-incidents/#,2016-02-01 00:00:00,Montana
2/20/2017-2/20/2017,2017-02-20 00:00:00,129 in Montana, https://media.dojmt.gov/wp-content/uploads/Nomad-Global-Communication-Solutions.pdf ,Nomad Global Communications Solutions,2017-02-23 00:00:00,https://dojmt.gov/consumer/consumers-known-data-breach-incidents/#,2017-02-20 00:00:00,Montana
11/2/2016-1/27/2017,2017-01-27 00:00:00,1 in Montana, https://media.dojmt.gov/wp-content/uploads/SunTrust.pdf ,SunTrust,2017-02-23 00:00:00,https://dojmt.gov/consumer/consumers-known-data-breach-incidents/#,2016-11-02 00:00:00,Montana
6/1/2013-12/31/2016,2016-12-31 00:00:00,193 in Montana, https://media.dojmt.gov/wp-content/uploads/Abbott-Nutrition.pdf ,Abbott Nutrition,2017-02-23 00:00:00,https://dojmt.gov/consumer/consumers-known-data-breach-incidents/#,2013-06-01 00:00:00,Montana
2/1/2016-12/31/2016,2016-12-31 00:00:00,107 in Montana, https://media.dojmt.gov/wp-content/uploads/Nutrex-Hawaii-Inc.pdf ,"Nutrex Hawaii, Inc.",2017-02-24 00:00:00,https://dojmt.gov/consumer/consumers-known-data-breach-incidents/#,2016-02-01 00:00:00,Montana
11/29/2016-1/17/2017,2017-01-17 00:00:00,13 in Montana, https://media.dojmt.gov/wp-content/uploads/JoFit.pdf ,JoFit,2017-02-24 00:00:00,https://dojmt.gov/consumer/consumers-known-data-breach-incidents/#,2016-11-29 00:00:00,Montana
1/2/2017-2/2/2017,2017-02-02 00:00:00,1 in Montana, https://media.dojmt.gov/wp-content/uploads/Federal-Direct-Tax-Services.pdf ,Federal Direct Tax Services,2017-02-24 00:00:00,https://dojmt.gov/consumer/consumers-known-data-breach-incidents/#,2017-01-02 00:00:00,Montana
10/23/2016-1/1/2017,2017-01-01 00:00:00,Unknown in Montana, https://media.dojmt.gov/wp-content/uploads/Benchmark.pdf ,Benchmark,2017-02-24 00:00:00,https://dojmt.gov/consumer/consumers-known-data-breach-incidents/#,2016-10-23 00:00:00,Montana
1/24/2017-1/24/2017,2017-01-24 00:00:00,3 in Montana, https://media.dojmt.gov/wp-content/uploads/John-Deere-Financial.pdf ,John Deere Financial,2017-02-24 00:00:00,https://dojmt.gov/consumer/consumers-known-data-breach-incidents/#,2017-01-24 00:00:00,Montana
7/15/2015-12/14/2016,2016-12-14 00:00:00,73 in Montana, https://media.dojmt.gov/wp-content/uploads/Roberts-Hawaii.pdf ,Roberts Hawaii,2017-02-24 00:00:00,https://dojmt.gov/consumer/consumers-known-data-breach-incidents/#,2015-07-15 00:00:00,Montana
2/1/2016-12/31/2016,2016-12-31 00:00:00,1 in Montana, https://media.dojmt.gov/wp-content/uploads/Liberty-Hardware-Manufacturing-Corporation.pdf ,Liberty Hardware Manufacturing Corporation,2017-02-24 00:00:00,https://dojmt.gov/consumer/consumers-known-data-breach-incidents/#,2016-02-01 00:00:00,Montana
10/6/2016-10/6/2016,2016-10-06 00:00:00,2 in Montana, https://media.dojmt.gov/wp-content/uploads/United-States-Anti-Doping-Agency.pdf ,United States Anti-Doping Agency,2017-02-24 00:00:00,https://dojmt.gov/consumer/consumers-known-data-breach-incidents/#,2016-10-06 00:00:00,Montana
2/8/2017-2/10/2017,2017-02-10 00:00:00,602 in Montana, https://media.dojmt.gov/wp-content/uploads/Rods-Western-Palace.pdf ,Rod's Western Palace,2017-02-24 00:00:00,https://dojmt.gov/consumer/consumers-known-data-breach-incidents/#,2017-02-08 00:00:00,Montana
2/1/2016-12/31/2016,2016-12-31 00:00:00,93 in Montana, https://media.dojmt.gov/wp-content/uploads/Atlantic-Cigar-Co.pdf ,Atlantic Cigar Co.,2017-02-27 00:00:00,https://dojmt.gov/consumer/consumers-known-data-breach-incidents/#,2016-02-01 00:00:00,Montana
2/1/2016-12/31/2016,2016-12-31 00:00:00,57 in Montana, https://media.dojmt.gov/wp-content/uploads/Alpha-Industries.pdf ,Alpha Industries,2017-02-27 00:00:00,https://dojmt.gov/consumer/consumers-known-data-breach-incidents/#,2016-02-01 00:00:00,Montana
2/10/2017-2/10/2017,2017-02-10 00:00:00,1 in Montana, https://media.dojmt.gov/wp-content/uploads/Wisenbaker-Builder-Services.pdf ,Wisenbaker Builder Services,2017-02-27 00:00:00,https://dojmt.gov/consumer/consumers-known-data-breach-incidents/#,2017-02-10 00:00:00,Montana
12/25/2016-1/14/2017,2017-01-14 00:00:00,17 in Montana, https://media.dojmt.gov/wp-content/uploads/Ambassador-Title-Service_RTS-Title-Escrow_DRI-Title-Escrow.pdf ,"Ambassador Title Service, RTS Title & Escrow, DRI Title & Escrow",2017-02-28 00:00:00,https://dojmt.gov/consumer/consumers-known-data-breach-incidents/#,2016-12-25 00:00:00,Montana
8/2/2016-2/22/2017,2017-02-22 00:00:00,1 in Montana, https://media.dojmt.gov/wp-content/uploads/Amquip-Crane-Rental.pdf ,AmQuip Crane Rental,2017-03-01 00:00:00,https://dojmt.gov/consumer/consumers-known-data-breach-incidents/#,2016-08-02 00:00:00,Montana
2/13/2017-2/13/2017,2017-02-13 00:00:00,2 in Montana, https://media.dojmt.gov/wp-content/uploads/Lexington-County-Health-Services-District-Inc..pdf ,"Lexington County Health Services District, Inc.",2017-03-02 00:00:00,https://dojmt.gov/consumer/consumers-known-data-breach-incidents/#,2017-02-13 00:00:00,Montana
1/30/2016-1/30/2017,2017-01-30 00:00:00,1 in Montana, https://media.dojmt.gov/wp-content/uploads/Iowa-Mutual-Insurance.pdf ,Iowa Mutual Insurance Company,2017-03-02 00:00:00,https://dojmt.gov/consumer/consumers-known-data-breach-incidents/#,2016-01-30 00:00:00,Montana
2/1/2016-12/31/2016,2016-12-31 00:00:00,10 in Montana, https://media.dojmt.gov/wp-content/uploads/Theisens-Supply-Inc.-1.pdf ,"Theisen's Supply, Inc.",2017-03-03 00:00:00,https://dojmt.gov/consumer/consumers-known-data-breach-incidents/#,2016-02-01 00:00:00,Montana
2/19/2017-2/19/2017,2017-02-19 00:00:00,3 in Montana, https://media.dojmt.gov/wp-content/uploads/Daytona-State-College.pdf ,Daytona State College,2017-03-03 00:00:00,https://dojmt.gov/consumer/consumers-known-data-breach-incidents/#,2017-02-19 00:00:00,Montana
2/1/2016-12/31/2016,2016-12-31 00:00:00,267 in Montana, https://media.dojmt.gov/wp-content/uploads/West-Music.pdf ,West Music Company,2017-03-03 00:00:00,https://dojmt.gov/consumer/consumers-known-data-breach-incidents/#,2016-02-01 00:00:00,Montana
2/14/2017-2/14/2017,2017-02-14 00:00:00,5 in Montana, https://media.dojmt.gov/wp-content/uploads/Carla-Cross-LLC.pdf ,"Carl Cross, LLC",2017-03-03 00:00:00,https://dojmt.gov/consumer/consumers-known-data-breach-incidents/#,2017-02-14 00:00:00,Montana
2/1/2016-12/31/2016,2016-12-31 00:00:00,217 in Montana, https://media.dojmt.gov/wp-content/uploads/Bambeco-Inc..pdf ,"Bambeco, Inc.",2017-03-06 00:00:00,https://dojmt.gov/consumer/consumers-known-data-breach-incidents/#,2016-02-01 00:00:00,Montana
1/24/2017-1/24/2017,2017-01-24 00:00:00,3 in Montana, https://media.dojmt.gov/wp-content/uploads/University-of-Idaho.pdf ,University of Idaho,2017-03-06 00:00:00,https://dojmt.gov/consumer/consumers-known-data-breach-incidents/#,2017-01-24 00:00:00,Montana
2/1/2016-12/31/2016,2016-12-31 00:00:00,5 in Montana, https://media.dojmt.gov/wp-content/uploads/Atwood-Distributing-LP.pdf ,"Atwood Distributing, Inc.",2017-03-07 00:00:00,https://dojmt.gov/consumer/consumers-known-data-breach-incidents/#,2016-02-01 00:00:00,Montana
2/4/2017-2/21/2017,2017-02-21 00:00:00,4 in Montana, https://media.dojmt.gov/wp-content/uploads/Maxim-Capital-Enterprises-Inc..pdf ,"Maxim Capital Enterprises, Inc.",2017-03-07 00:00:00,https://dojmt.gov/consumer/consumers-known-data-breach-incidents/#,2017-02-04 00:00:00,Montana
2/1/2016-12/31/2016,2016-12-31 00:00:00,114 in Montana, https://media.dojmt.gov/wp-content/uploads/Vapour-Organic-Beauty-LLC.pdf ,"Vapour Organic Beauty, LLC",2017-03-08 00:00:00,https://dojmt.gov/consumer/consumers-known-data-breach-incidents/#,2016-02-01 00:00:00,Montana
2/1/2016-12/31/2016,2016-12-31 00:00:00,70 in Montana, https://media.dojmt.gov/wp-content/uploads/Sport-Smart.pdf ,Sport-Smart.com,2017-03-08 00:00:00,https://dojmt.gov/consumer/consumers-known-data-breach-incidents/#,2016-02-01 00:00:00,Montana
2/1/2016-12/31/2016,2016-12-31 00:00:00,67 in Montana, https://media.dojmt.gov/wp-content/uploads/Running-Supply-Inc..pdf ,"Running Supply, Inc.",2017-03-08 00:00:00,https://dojmt.gov/consumer/consumers-known-data-breach-incidents/#,2016-02-01 00:00:00,Montana
2/1/2016-12/31/2016,2016-12-31 00:00:00,4 in Montana, https://media.dojmt.gov/wp-content/uploads/Purdys-Chocolatier.pdf ,R.C. Purdy Chocolates Ltd. dba Purdys Chocolatier,2017-03-08 00:00:00,https://dojmt.gov/consumer/consumers-known-data-breach-incidents/#,2016-02-01 00:00:00,Montana
12/14/2016-2/6/2017,2017-02-06 00:00:00,4136 in Montana, https://media.dojmt.gov/wp-content/uploads/prAna.pdf ,prAna,2017-03-08 00:00:00,https://dojmt.gov/consumer/consumers-known-data-breach-incidents/#,2016-12-14 00:00:00,Montana
6/15/2016-1/30/2017,2017-01-30 00:00:00,2 in Montana, https://media.dojmt.gov/wp-content/uploads/Friedman-Perry-CPAs.pdf ,"Friedman & Perry, CPA's",2017-03-09 00:00:00,https://dojmt.gov/consumer/consumers-known-data-breach-incidents/#,2016-06-15 00:00:00,Montana
12/29/2016-12/29/2016,2016-12-29 00:00:00,2 in Montana, https://media.dojmt.gov/wp-content/uploads/HealthTexas-Provider-Network-Denton-Heart-Group.pdf ,HealthTexas Provider Network (Denton Heart Group),2017-03-10 00:00:00,https://dojmt.gov/consumer/consumers-known-data-breach-incidents/#,2016-12-29 00:00:00,Montana
12/20/2016-12/27/2016,2016-12-27 00:00:00,4 in Montana, https://media.dojmt.gov/wp-content/uploads/Wall-Titus-LLC.pdf ,"Wall Titus, LLC",2017-03-10 00:00:00,https://dojmt.gov/consumer/consumers-known-data-breach-incidents/#,2016-12-20 00:00:00,Montana
3/10/2017-3/10/2017,2017-03-10 00:00:00,307 in Montana, https://media.dojmt.gov/wp-content/uploads/ADF-International.pdf ,ADF International,2017-03-13 00:00:00,https://dojmt.gov/consumer/consumers-known-data-breach-incidents/#,2017-03-10 00:00:00,Montana
11/21/2016-2/6/2017,2017-02-06 00:00:00,1 in Montana, https://media.dojmt.gov/wp-content/uploads/Ondracek-Company.pdf ,Ondracek & Company,2017-03-13 00:00:00,https://dojmt.gov/consumer/consumers-known-data-breach-incidents/#,2016-11-21 00:00:00,Montana
1/25/2017-1/25/2017,2017-01-25 00:00:00,3 in Montana, https://media.dojmt.gov/wp-content/uploads/Geokinetics.pdf ,"Geokinetics, Inc.",2017-03-14 00:00:00,https://dojmt.gov/consumer/consumers-known-data-breach-incidents/#,2017-01-25 00:00:00,Montana
2/1/2016-12/31/2016,2016-12-31 00:00:00,345 in Montana, https://media.dojmt.gov/wp-content/uploads/Plow-Hearth.pdf ,Plow & Hearth,2017-03-14 00:00:00,https://dojmt.gov/consumer/consumers-known-data-breach-incidents/#,2016-02-01 00:00:00,Montana
12/31/2013-2/4/2017,2017-02-04 00:00:00,27 in Montana, https://media.dojmt.gov/wp-content/uploads/Zest-Dental-Solutions.pdf ,Zest Dental Solution,2017-03-14 00:00:00,https://dojmt.gov/consumer/consumers-known-data-breach-incidents/#,2013-12-31 00:00:00,Montana
2/21/2017-3/21/2017,2017-03-21 00:00:00,1 in Montana, https://media.dojmt.gov/wp-content/uploads/Vertex-Wireless.pdf ,Vertex Wireless,2017-03-15 00:00:00,https://dojmt.gov/consumer/consumers-known-data-breach-incidents/#,2017-02-21 00:00:00,Montana
12/15/2016-12/15/2016,2016-12-15 00:00:00,1 in Montana, https://media.dojmt.gov/wp-content/uploads/Ameriprise-Financial-Services-Inc.-3.pdf ,"Ameriprise Financial Services, Inc.",2017-03-15 00:00:00,https://dojmt.gov/consumer/consumers-known-data-breach-incidents/#,2016-12-15 00:00:00,Montana
2/21/2017-2/21/2017,2017-02-21 00:00:00,1 in Montana, https://media.dojmt.gov/wp-content/uploads/Therafit-Shoes.pdf ,Therafit Shoes,2017-03-16 00:00:00,https://dojmt.gov/consumer/consumers-known-data-breach-incidents/#,2017-02-21 00:00:00,Montana
3/3/2017-3/3/2017,2017-03-03 00:00:00,1 in Montana, https://media.dojmt.gov/wp-content/uploads/Colorado-Nonprofit-Development-Center.pdf ,Colorado Nonprofit Development Center,2017-03-16 00:00:00,https://dojmt.gov/consumer/consumers-known-data-breach-incidents/#,2017-03-03 00:00:00,Montana
2/11/2017-2/11/2017,2017-02-11 00:00:00,1 in Montana, https://media.dojmt.gov/wp-content/uploads/Northwest-Christian-Schools.pdf ,"Northwest Christian Schools, Inc.",2017-03-16 00:00:00,https://dojmt.gov/consumer/consumers-known-data-breach-incidents/#,2017-02-11 00:00:00,Montana
3/3/2017-3/6/2017,2017-03-06 00:00:00,9 in Montana, https://media.dojmt.gov/wp-content/uploads/American-Tire-Distributors.pdf ,American Tire Distributors,2017-03-17 00:00:00,https://dojmt.gov/consumer/consumers-known-data-breach-incidents/#,2017-03-03 00:00:00,Montana
1/22/2017-1/22/2017,2017-01-22 00:00:00,62 in Montana, https://media.dojmt.gov/wp-content/uploads/Urology-Austin.pdf ,Urology Austin,2017-03-20 00:00:00,https://dojmt.gov/consumer/consumers-known-data-breach-incidents/#,2017-01-22 00:00:00,Montana
10/20/2016-2/3/2017,2017-02-03 00:00:00,1 in Montana, https://media.dojmt.gov/wp-content/uploads/People-for-People.pdf ,People for People,2017-03-20 00:00:00,https://dojmt.gov/consumer/consumers-known-data-breach-incidents/#,2016-10-20 00:00:00,Montana
10/26/2016-1/31/2017,2017-01-31 00:00:00,332 in Montana, https://media.dojmt.gov/wp-content/uploads/Bulletproof-360-Inc..pdf ,"Bulletproof 360, Inc.",2017-03-21 00:00:00,https://dojmt.gov/consumer/consumers-known-data-breach-incidents/#,2016-10-26 00:00:00,Montana
1/27/2017-2/2/2017,2017-02-02 00:00:00,7 in Montana, https://media.dojmt.gov/wp-content/uploads/Campbell-Taylor-Company.pdf ,Campbell Taylor & Company,2017-03-21 00:00:00,https://dojmt.gov/consumer/consumers-known-data-breach-incidents/#,2017-01-27 00:00:00,Montana
3/5/2017-3/5/2017,2017-03-05 00:00:00,26 in Montana, https://media.dojmt.gov/wp-content/uploads/Rudd-Company.pdf ,"Rudd & Company, PLLC",2017-03-22 00:00:00,https://dojmt.gov/consumer/consumers-known-data-breach-incidents/#,2017-03-05 00:00:00,Montana
9/1/2016-2/28/2017,2017-02-28 00:00:00,1 in Montana, https://media.dojmt.gov/wp-content/uploads/Coachella.com_.pdf ,Coachella.com,2017-03-23 00:00:00,https://dojmt.gov/consumer/consumers-known-data-breach-incidents/#,2016-09-01 00:00:00,Montana
1/24/2017-1/24/2017,2017-01-24 00:00:00,4 in Montana, https://media.dojmt.gov/wp-content/uploads/Washington-University-School-of-Medicine.pdf ,Washington University School of Medicine,2017-03-24 00:00:00,https://dojmt.gov/consumer/consumers-known-data-breach-incidents/#,2017-01-24 00:00:00,Montana
1/4/2017-2/10/2017,2017-02-10 00:00:00,7 in Montana, https://media.dojmt.gov/wp-content/uploads/Commonwealth-Health-Corporation.pdf ,Commonwealth Health,2017-03-24 00:00:00,https://dojmt.gov/consumer/consumers-known-data-breach-incidents/#,2017-01-04 00:00:00,Montana
8/18/2016-2/20/2017,2017-02-20 00:00:00,14 in Montana, https://media.dojmt.gov/wp-content/uploads/Virginia-Gift-Brands.pdf ,Virginia Gift Brands,2017-03-27 00:00:00,https://dojmt.gov/consumer/consumers-known-data-breach-incidents/#,2016-08-18 00:00:00,Montana
3/20/2017-3/27/2017,2017-03-27 00:00:00,2 in Montana, https://media.dojmt.gov/wp-content/uploads/Ameriflight.pdf ,Ameriflight,2017-03-28 00:00:00,https://dojmt.gov/consumer/consumers-known-data-breach-incidents/#,2017-03-20 00:00:00,Montana
2/15/2017-2/15/2017,2017-02-15 00:00:00,2 in Montana, https://media.dojmt.gov/wp-content/uploads/Maloney-Kennedy-PLLC.pdf ,"Maloney & Kennedy, PLLC",2017-03-29 00:00:00,https://dojmt.gov/consumer/consumers-known-data-breach-incidents/#,2017-02-15 00:00:00,Montana
2/2/2017-2/13/2017,2017-02-13 00:00:00,1 in Montana, https://media.dojmt.gov/wp-content/uploads/Krehbiel-and-Associates-CPA.pdf ,Krehbiel and Associates CPA,2017-03-30 00:00:00,https://dojmt.gov/consumer/consumers-known-data-breach-incidents/#,2017-02-02 00:00:00,Montana
2/26/2017-3/1/2017,2017-03-01 00:00:00,3 in Montana, https://media.dojmt.gov/wp-content/uploads/PenServ-Plan-Services-Inc..pdf ,"PenServe Plan Services, Inc.",2017-03-31 00:00:00,https://dojmt.gov/consumer/consumers-known-data-breach-incidents/#,2017-02-26 00:00:00,Montana
2/8/2017-3/15/2017,2017-03-15 00:00:00,1 in Montana, https://media.dojmt.gov/wp-content/uploads/Extreme-Ranch-Inc..pdf ,"Extreme Ranch, Inc.",2017-04-01 00:00:00,https://dojmt.gov/consumer/consumers-known-data-breach-incidents/#,2017-02-08 00:00:00,Montana
3/2/2017-4/6/2017,2017-04-06 00:00:00,2 in Montana, https://media.dojmt.gov/wp-content/uploads/C-Kirk-Holt-Associates.pdf ,C. Kirk Holt & Associates,2017-04-04 00:00:00,https://dojmt.gov/consumer/consumers-known-data-breach-incidents/#,2017-03-02 00:00:00,Montana
2/2/2016-12/31/2016,2016-12-31 00:00:00,12 in Montana, https://media.dojmt.gov/wp-content/uploads/Glasswasherparts.com_.pdf ,GlassWasherParts.com,2017-04-05 00:00:00,https://dojmt.gov/consumer/consumers-known-data-breach-incidents/#,2016-02-02 00:00:00,Montana
2/2/2016-12/31/2016,2016-12-31 00:00:00,887 in Montana, https://media.dojmt.gov/wp-content/uploads/Tempur-Pedic.pdf ,Tempur-Pedic,2017-04-05 00:00:00,https://dojmt.gov/consumer/consumers-known-data-breach-incidents/#,2016-02-02 00:00:00,Montana
8/27/2016-2/15/2017,2017-02-15 00:00:00,8 in Montana, https://media.dojmt.gov/wp-content/uploads/One-World-Distribution.pdf ,"One World Distribution, Inc.",2017-04-07 00:00:00,https://dojmt.gov/consumer/consumers-known-data-breach-incidents/#,2016-08-27 00:00:00,Montana
1/30/2017-2/11/2017,2017-02-11 00:00:00,7 in Montana, https://media.dojmt.gov/wp-content/uploads/Lake-Kennedy-McCulloch-CPAs.pdf ,Lake Kennedy McCulloch CPA's,2017-04-07 00:00:00,https://dojmt.gov/consumer/consumers-known-data-breach-incidents/#,2017-01-30 00:00:00,Montana
2/7/2017-2/10/2017,2017-02-10 00:00:00,1 in Montana, https://media.dojmt.gov/wp-content/uploads/FPI-Management.pdf ,"FPI Management, Inc.",2017-04-10 00:00:00,https://dojmt.gov/consumer/consumers-known-data-breach-incidents/#,2017-02-07 00:00:00,Montana
3/27/2016-3/27/2017,2017-03-27 00:00:00,2 in Montana, https://media.dojmt.gov/wp-content/uploads/Citibank.pdf ,Citibank,2017-04-11 00:00:00,https://dojmt.gov/consumer/consumers-known-data-breach-incidents/#,2016-03-27 00:00:00,Montana
2/3/2017-2/3/2017,2017-02-03 00:00:00,1 in Montana, https://media.dojmt.gov/wp-content/uploads/BankSouth-Mortgage.pdf ,BankSouth Mortgage,2017-04-11 00:00:00,https://dojmt.gov/consumer/consumers-known-data-breach-incidents/#,2017-02-03 00:00:00,Montana
2/28/2017-4/10/2017,2017-04-10 00:00:00,1 in Montana, https://media.dojmt.gov/wp-content/uploads/DataFile-Technologies.pdf ,DataFile Technologies,2017-04-12 00:00:00,https://dojmt.gov/consumer/consumers-known-data-breach-incidents/#,2017-02-28 00:00:00,Montana
3/14/2017-3/14/2017,2017-03-14 00:00:00,7 in Montana, https://media.dojmt.gov/wp-content/uploads/Alamo-Capital.pdf ,Alamo Capital,2017-04-13 00:00:00,https://dojmt.gov/consumer/consumers-known-data-breach-incidents/#,2017-03-14 00:00:00,Montana
3/24/2017-4/7/2017,2017-04-07 00:00:00,24 in Montana, https://media.dojmt.gov/wp-content/uploads/Bluestem-Brands.pdf ,"Bluestem Brands, Inc.",2017-04-13 00:00:00,https://dojmt.gov/consumer/consumers-known-data-breach-incidents/#,2017-03-24 00:00:00,Montana
3/27/2017-3/27/2017,2017-03-27 00:00:00,1 in Montana, https://media.dojmt.gov/wp-content/uploads/Tidewater-Transit-Company.pdf ,Tidewater Transit Company,2017-04-13 00:00:00,https://dojmt.gov/consumer/consumers-known-data-breach-incidents/#,2017-03-27 00:00:00,Montana
2/13/2017-2/13/2017,2017-02-13 00:00:00,18 in Montana, https://media.dojmt.gov/wp-content/uploads/Delta-Career-Education-Corporation.pdf ,Delta Career Education Corporation,2017-04-14 00:00:00,https://dojmt.gov/consumer/consumers-known-data-breach-incidents/#,2017-02-13 00:00:00,Montana
9/29/2016-12/29/2016,2016-12-29 00:00:00,3949 in Montana, https://media.dojmt.gov/wp-content/uploads/Combat-Brands.pdf ,Six Continents Hotels,2017-04-14 00:00:00,https://dojmt.gov/consumer/consumers-known-data-breach-incidents/#,2016-09-29 00:00:00,Montana
7/1/2015-2/23/2017,2017-02-23 00:00:00,132 in Montana, https://media.dojmt.gov/wp-content/uploads/Combat-Brands.pdf ,Combat Brands,2017-04-14 00:00:00,https://dojmt.gov/consumer/consumers-known-data-breach-incidents/#,2015-07-01 00:00:00,Montana
1/16/2017-1/16/2017,2017-01-16 00:00:00,1 in Montana, https://media.dojmt.gov/wp-content/uploads/Johnson-Hearn-Viinegar-Gee.pdf ,"Johnson, Hearn, Vinegar & Gee",2017-04-14 00:00:00,https://dojmt.gov/consumer/consumers-known-data-breach-incidents/#,2017-01-16 00:00:00,Montana
3/30/2017-3/30/2017,2017-03-30 00:00:00,1 in Montana, https://media.dojmt.gov/wp-content/uploads/Intuit-2-1.pdf ,Intuit,2017-04-17 00:00:00,https://dojmt.gov/consumer/consumers-known-data-breach-incidents/#,2017-03-30 00:00:00,Montana
12/26/2015-4/2/2017,2017-04-02 00:00:00,7 in Montana, https://media.dojmt.gov/wp-content/uploads/NMG.pdf ,Neiman Marcus Group (NMG),2017-04-17 00:00:00,https://dojmt.gov/consumer/consumers-known-data-breach-incidents/#,2015-12-26 00:00:00,Montana
1/23/2017-2/22/2017,2017-02-22 00:00:00,7 in Montana, https://media.dojmt.gov/wp-content/uploads/Pacific-Lutheran-University.pdf ,Pacific Lutheran University,2017-04-18 00:00:00,https://dojmt.gov/consumer/consumers-known-data-breach-incidents/#,2017-01-23 00:00:00,Montana
4/18/2016-3/29/2017,2017-03-29 00:00:00,1 in Montana, https://media.dojmt.gov/wp-content/uploads/Northdrop-Grumman-Systems.pdf ,Northdrop Grumman Systems,2017-04-19 00:00:00,https://dojmt.gov/consumer/consumers-known-data-breach-incidents/#,2016-04-18 00:00:00,Montana
10/1/2016-12/23/2016,2016-12-23 00:00:00,159 in Montana, https://media.dojmt.gov/wp-content/uploads/ILKB-Inc..pdf ,"ILKB, LLC",2017-04-19 00:00:00,https://dojmt.gov/consumer/consumers-known-data-breach-incidents/#,2016-10-01 00:00:00,Montana
4/11/2017-4/11/2017,2017-04-11 00:00:00,8 in Montana, https://media.dojmt.gov/wp-content/uploads/Lifespan.pdf ,George Fox University,2017-04-21 00:00:00,https://dojmt.gov/consumer/consumers-known-data-breach-incidents/#,2017-04-11 00:00:00,Montana
3/8/2016-3/8/2017,2017-03-08 00:00:00,5 in Montana, https://media.dojmt.gov/wp-content/uploads/Humana.pdf ,"Wild, Maney & Resnick",2017-04-21 00:00:00,https://dojmt.gov/consumer/consumers-known-data-breach-incidents/#,2016-03-08 00:00:00,Montana
2/25/2017-4/21/2017,2017-04-21 00:00:00,2 in Montana, https://media.dojmt.gov/wp-content/uploads/George-Fox-University.pdf ,Lifespan,2017-04-21 00:00:00,https://dojmt.gov/consumer/consumers-known-data-breach-incidents/#,2017-02-25 00:00:00,Montana
3/8/2017-4/3/2017,2017-04-03 00:00:00,5 in Montana, https://media.dojmt.gov/wp-content/uploads/Wild-Maney-Resnick.pdf ,Humana,2017-04-21 00:00:00,https://dojmt.gov/consumer/consumers-known-data-breach-incidents/#,2017-03-08 00:00:00,Montana
3/24/2017-3/24/2017,2017-03-24 00:00:00,1 in Montana, https://media.dojmt.gov/wp-content/uploads/Donaldson-Company.pdf ,Donaldson Company,2017-04-24 00:00:00,https://dojmt.gov/consumer/consumers-known-data-breach-incidents/#,2017-03-24 00:00:00,Montana
2/21/2017-2/21/2017,2017-02-21 00:00:00,3 in Montana, https://media.dojmt.gov/wp-content/uploads/Hill-Country-Memorial-Hospital.pdf ,Hill Country Memorial Hospital,2017-04-25 00:00:00,https://dojmt.gov/consumer/consumers-known-data-breach-incidents/#,2017-02-21 00:00:00,Montana
3/16/2017-3/16/2017,2017-03-16 00:00:00,1 in Montana, https://media.dojmt.gov/wp-content/uploads/Motl-Marketing.pdf ,Motl Marketing,2017-04-25 00:00:00,https://dojmt.gov/consumer/consumers-known-data-breach-incidents/#,2017-03-16 00:00:00,Montana
1/30/2017-1/30/2017,2017-01-30 00:00:00,3 in Montana, https://media.dojmt.gov/wp-content/uploads/Pacific-Quest.pdf ,Pacific Quest,2017-04-27 00:00:00,https://dojmt.gov/consumer/consumers-known-data-breach-incidents/#,2017-01-30 00:00:00,Montana
3/30/2017-3/30/2017,2017-03-30 00:00:00,90 in Montana, https://media.dojmt.gov/wp-content/uploads/Gannett-Company-Inc.pdf ,"Gannett Company, Inc.",2017-04-28 00:00:00,https://dojmt.gov/consumer/consumers-known-data-breach-incidents/#,2017-03-30 00:00:00,Montana
2/1/2016-12/31/2016,2016-12-31 00:00:00,282 in Montana, https://media.dojmt.gov/wp-content/uploads/Marbles.pdf ,"Marbles, LLC",2017-04-28 00:00:00,https://dojmt.gov/consumer/consumers-known-data-breach-incidents/#,2016-02-01 00:00:00,Montana
3/17/2017-3/17/2017,2017-03-17 00:00:00,11 in Montana, https://media.dojmt.gov/wp-content/uploads/Harrisburg-Gastroenterology.pdf ,Harrisburg Gastroenterology,2017-04-28 00:00:00,https://dojmt.gov/consumer/consumers-known-data-breach-incidents/#,2017-03-17 00:00:00,Montana
5/1/2016-12/31/2016,2016-12-31 00:00:00,7 in Montana, https://media.dojmt.gov/wp-content/uploads/Jackson-Hewitt.pdf ,Jackson Hewitt,2017-04-29 00:00:00,https://dojmt.gov/consumer/consumers-known-data-breach-incidents/#,2016-05-01 00:00:00,Montana
2/21/2017-3/3/2017,2017-03-03 00:00:00,2 in Montana, https://media.dojmt.gov/wp-content/uploads/Capital-One-4.pdf ,Yale Capital Corp,2017-05-01 00:00:00,https://dojmt.gov/consumer/consumers-known-data-breach-incidents/#,2017-02-21 00:00:00,Montana
2/28/2017-3/2/2017,2017-03-02 00:00:00,1 in Montana, https://media.dojmt.gov/wp-content/uploads/Yale-Capital-Corp.pdf ,Nova Southeastern University,2017-05-01 00:00:00,https://dojmt.gov/consumer/consumers-known-data-breach-incidents/#,2017-02-28 00:00:00,Montana
9/7/2016-12/28/2016,2016-12-28 00:00:00,1 in Montana, https://media.dojmt.gov/wp-content/uploads/Nova-Southeastern-University.pdf ,Capital One,2017-05-01 00:00:00,https://dojmt.gov/consumer/consumers-known-data-breach-incidents/#,2016-09-07 00:00:00,Montana
11/22/2016-4/4/2017,2017-04-04 00:00:00,35 in Montana, https://media.dojmt.gov/wp-content/uploads/Agri-Beef.pdf ,Agri Beef,2017-05-02 00:00:00,https://dojmt.gov/consumer/consumers-known-data-breach-incidents/#,2016-11-22 00:00:00,Montana
4/10/2017-4/10/2017,2017-04-10 00:00:00,1 in Montana, https://media.dojmt.gov/wp-content/uploads/Wesleyan-College.pdf ,Wesleyan College,2017-05-03 00:00:00,https://dojmt.gov/consumer/consumers-known-data-breach-incidents/#,2017-04-10 00:00:00,Montana
1/12/2017-4/2/2017,2017-04-02 00:00:00,31 in Montana, https://media.dojmt.gov/wp-content/uploads/Genpact.pdf ,Genpact (Scottrade Bank),2017-05-04 00:00:00,https://dojmt.gov/consumer/consumers-known-data-breach-incidents/#,2017-01-12 00:00:00,Montana
4/12/2016-3/2/2017,2017-03-02 00:00:00,48 in Montana, https://media.dojmt.gov/wp-content/uploads/RM-Acquisition-LLC.pdf ,"RM Acquisition, LLC",2017-05-05 00:00:00,https://dojmt.gov/consumer/consumers-known-data-breach-incidents/#,2016-04-12 00:00:00,Montana
3/28/2017-3/28/2017,2017-03-28 00:00:00,1 in Montana, https://media.dojmt.gov/wp-content/uploads/PolkBeder.pdf ,PolkBeder,2017-05-08 00:00:00,https://dojmt.gov/consumer/consumers-known-data-breach-incidents/#,2017-03-28 00:00:00,Montana
1/1/2016-4/30/2017,2017-04-30 00:00:00,11 in Montana, https://media.dojmt.gov/wp-content/uploads/Tatcha.pdf ,Tatcha,2017-05-09 00:00:00,https://dojmt.gov/consumer/consumers-known-data-breach-incidents/#,2016-01-01 00:00:00,Montana
4/27/2017-4/27/2017,2017-04-27 00:00:00,3 in Montana, https://media.dojmt.gov/wp-content/uploads/Bechtel-Oil-Gas-Chemicals-Construction.pdf ,"Bechtel Oil, Gas & Chemicals Construction Services",2017-05-10 00:00:00,https://dojmt.gov/consumer/consumers-known-data-breach-incidents/#,2017-04-27 00:00:00,Montana
5/2/2016-5/16/2017,2017-05-16 00:00:00,18 in Montana, https://media.dojmt.gov/wp-content/uploads/TALX.pdf ,TALX,2017-05-11 00:00:00,https://dojmt.gov/consumer/consumers-known-data-breach-incidents/#,2016-05-02 00:00:00,Montana
2/16/2017-5/15/2017,2017-05-15 00:00:00,57 in Montana, https://media.dojmt.gov/wp-content/uploads/University-of-New-Mexico-Foundation.pdf ,University of New Mexico Foundation,2017-05-15 00:00:00,https://dojmt.gov/consumer/consumers-known-data-breach-incidents/#,2017-02-16 00:00:00,Montana
12/20/2016-3/3/2017,2017-03-03 00:00:00,92 in Montana, https://media.dojmt.gov/wp-content/uploads/KURU-Footwear.pdf ,KURU Footwear,2017-05-15 00:00:00,https://dojmt.gov/consumer/consumers-known-data-breach-incidents/#,2016-12-20 00:00:00,Montana
4/3/2017-5/16/2017,2017-05-16 00:00:00,54 in Montana, https://media.dojmt.gov/wp-content/uploads/Nicopure-Labs.pdf ,Nicopure Labs,2017-05-16 00:00:00,https://dojmt.gov/consumer/consumers-known-data-breach-incidents/#,2017-04-03 00:00:00,Montana
1/30/2017-4/11/2017,2017-04-11 00:00:00,16 in Montana, https://media.dojmt.gov/wp-content/uploads/Rite-Aid-Online-Store.pdf ,Rite Aid Online Store,2017-05-17 00:00:00,https://dojmt.gov/consumer/consumers-known-data-breach-incidents/#,2017-01-30 00:00:00,Montana
3/23/2017-3/23/2017,2017-03-23 00:00:00,6 in Montana, https://media.dojmt.gov/wp-content/uploads/Barton-Oaks-Dental-Group.pdf ,Barton Oaks Dental Group,2017-05-18 00:00:00,https://dojmt.gov/consumer/consumers-known-data-breach-incidents/#,2017-03-23 00:00:00,Montana
3/23/2016-3/27/2017,2017-03-27 00:00:00,1 in Montana, https://media.dojmt.gov/wp-content/uploads/Childrens-Mercy-Hospital.pdf ,Children's Mercy Hospital,2017-05-19 00:00:00,https://dojmt.gov/consumer/consumers-known-data-breach-incidents/#,2016-03-23 00:00:00,Montana
1/25/2017-2/20/2017,2017-02-20 00:00:00,50 in Montana, https://media.dojmt.gov/wp-content/uploads/ATT.pdf ,AT&T,2017-05-19 00:00:00,https://dojmt.gov/consumer/consumers-known-data-breach-incidents/#,2017-01-25 00:00:00,Montana
4/19/2017-4/19/2017,2017-04-19 00:00:00,1 in Montana, https://media.dojmt.gov/wp-content/uploads/US-Bank.pdf ,US Bank,2017-05-24 00:00:00,https://dojmt.gov/consumer/consumers-known-data-breach-incidents/#,2017-04-19 00:00:00,Montana
6/1/2000-5/24/2017,2017-05-24 00:00:00,2 in Montana, https://media.dojmt.gov/wp-content/uploads/Options-Express.pdf ,Options Express,2017-05-24 00:00:00,https://dojmt.gov/consumer/consumers-known-data-breach-incidents/#,2000-06-01 00:00:00,Montana
5/15/2017-5/24/2017,2017-05-24 00:00:00,18 in Montana, https://media.dojmt.gov/wp-content/uploads/BMO-Harris.pdf ,BMO Harris,2017-05-24 00:00:00,https://dojmt.gov/consumer/consumers-known-data-breach-incidents/#,2017-05-15 00:00:00,Montana
3/22/2017-4/21/2017,2017-04-21 00:00:00,56 in Montana, https://media.dojmt.gov/wp-content/uploads/Char-Broil.pdf ,Char-Broil,2017-05-24 00:00:00,https://dojmt.gov/consumer/consumers-known-data-breach-incidents/#,2017-03-22 00:00:00,Montana
1/1/2016-3/25/2017,2017-03-25 00:00:00,105 in Montana, https://media.dojmt.gov/wp-content/uploads/Fast-Health.pdf ,Fast Health,2017-05-26 00:00:00,https://dojmt.gov/consumer/consumers-known-data-breach-incidents/#,2016-01-01 00:00:00,Montana
1/1/2017-5/3/2017,2017-05-03 00:00:00,9 in Montana, https://media.dojmt.gov/wp-content/uploads/Frontier-Airlines.pdf ,Frontier Airlines,2017-05-31 00:00:00,https://dojmt.gov/consumer/consumers-known-data-breach-incidents/#,2017-01-01 00:00:00,Montana
2/10/2017-4/30/2017,2017-04-30 00:00:00,1 in Montana, https://media.dojmt.gov/wp-content/uploads/Trojan-Battery.pdf ,Trojan Battery Sales,2017-06-01 00:00:00,https://dojmt.gov/consumer/consumers-known-data-breach-incidents/#,2017-02-10 00:00:00,Montana
2/22/2017-3/9/2017,2017-03-09 00:00:00,1 in Montana, https://media.dojmt.gov/wp-content/uploads/Township-of-Springfield.pdf ,"Township of Springfield, NJ",2017-06-02 00:00:00,https://dojmt.gov/consumer/consumers-known-data-breach-incidents/#,2017-02-22 00:00:00,Montana
4/28/2017-5/30/2017,2017-05-30 00:00:00,36 in Montana, https://media.dojmt.gov/wp-content/uploads/Signature-Hardware.pdf ,"Signature Hardware, Inc.",2017-06-02 00:00:00,https://dojmt.gov/consumer/consumers-known-data-breach-incidents/#,2017-04-28 00:00:00,Montana
6/1/2016-5/5/2017,2017-05-05 00:00:00,41 in Montana, https://media.dojmt.gov/wp-content/uploads/Crimson-Trace-Corporation.pdf ,Crimson Trace Corporation,2017-06-02 00:00:00,https://dojmt.gov/consumer/consumers-known-data-breach-incidents/#,2016-06-01 00:00:00,Montana
1/9/2017-3/10/2017,2017-03-10 00:00:00,10 in Montana, https://media.dojmt.gov/wp-content/uploads/Townsends.pdf ,Townsends,2017-06-05 00:00:00,https://dojmt.gov/consumer/consumers-known-data-breach-incidents/#,2017-01-09 00:00:00,Montana
3/24/2017-4/18/2017,2017-04-18 00:00:00,Unknown in Montana, https://media.dojmt.gov/wp-content/uploads/Chipotle-Mexican-Grill.pdf ,Chipotle Mexican Grill,2017-06-05 00:00:00,https://dojmt.gov/consumer/consumers-known-data-breach-incidents/#,2017-03-24 00:00:00,Montana
8/10/2016-2/9/2017,2017-02-09 00:00:00,3075 in Montana, https://media.dojmt.gov/wp-content/uploads/GameStop.pdf ,"GameStop, Inc.",2017-06-05 00:00:00,https://dojmt.gov/consumer/consumers-known-data-breach-incidents/#,2016-08-10 00:00:00,Montana
11/14/2016-4/17/2017,2017-04-17 00:00:00,134 in Montana, https://media.dojmt.gov/wp-content/uploads/Indigo-Wild.pdf ,Indigo Wild,2017-06-06 00:00:00,https://dojmt.gov/consumer/consumers-known-data-breach-incidents/#,2016-11-14 00:00:00,Montana
4/17/2017-4/17/2017,2017-04-17 00:00:00,23 in Montana, https://media.dojmt.gov/wp-content/uploads/Airway-Oxygen.pdf ,"Airway Oxygen, Inc.",2017-06-06 00:00:00,https://dojmt.gov/consumer/consumers-known-data-breach-incidents/#,2017-04-17 00:00:00,Montana
11/16/2016-5/1/2017,2017-05-01 00:00:00,18 in Montana, https://media.dojmt.gov/wp-content/uploads/Jewelry.com_.pdf ,Jewelry.com,2017-06-07 00:00:00,https://dojmt.gov/consumer/consumers-known-data-breach-incidents/#,2016-11-16 00:00:00,Montana
11/12/2016-4/11/2017,2017-04-11 00:00:00,2 in Montana, https://media.dojmt.gov/wp-content/uploads/Onia.pdf ,Onia,2017-06-08 00:00:00,https://dojmt.gov/consumer/consumers-known-data-breach-incidents/#,2016-11-12 00:00:00,Montana
3/19/2017-3/19/2017,2017-03-19 00:00:00,2 in Montana, https://media.dojmt.gov/wp-content/uploads/The-Forum-for-Youth-Investment.pdf ,The Forum for Youth Investment,2017-06-08 00:00:00,https://dojmt.gov/consumer/consumers-known-data-breach-incidents/#,2017-03-19 00:00:00,Montana
4/21/2017-4/26/2017,2017-04-26 00:00:00,6498 in Montana, https://media.dojmt.gov/wp-content/uploads/Washington-State-University.pdf ,Washington State University,2017-06-09 00:00:00,https://dojmt.gov/consumer/consumers-known-data-breach-incidents/#,2017-04-21 00:00:00,Montana
4/14/2017-4/14/2017,2017-04-14 00:00:00,1 in Montana, https://media.dojmt.gov/wp-content/uploads/Cove-Family-Sports-Medicine.pdf ,Cove Family & Sports Medicine,2017-06-12 00:00:00,https://dojmt.gov/consumer/consumers-known-data-breach-incidents/#,2017-04-14 00:00:00,Montana
6/3/2017-6/4/2017,2017-06-04 00:00:00,1 in Montana, https://media.dojmt.gov/wp-content/uploads/Bridge-Investment-Group.pdf ,Bridge Investment Group,2017-06-12 00:00:00,https://dojmt.gov/consumer/consumers-known-data-breach-incidents/#,2017-06-03 00:00:00,Montana
3/29/2017-5/15/2017,2017-05-15 00:00:00,4 in Montana, https://media.dojmt.gov/wp-content/uploads/Leavitt-Group-Enterprises.pdf ,Leavitt Group Enterprises,2017-06-12 00:00:00,https://dojmt.gov/consumer/consumers-known-data-breach-incidents/#,2017-03-29 00:00:00,Montana
2/28/2017-3/31/2017,2017-03-31 00:00:00,11 in Montana, https://media.dojmt.gov/wp-content/uploads/Intuit-3-1.pdf ,Intuit,2017-06-13 00:00:00,https://dojmt.gov/consumer/consumers-known-data-breach-incidents/#,2017-02-28 00:00:00,Montana
4/27/2017-6/7/2017,2017-06-07 00:00:00,3 in Montana, https://media.dojmt.gov/wp-content/uploads/Southern-Tide.pdf ,Southern Tide,2017-06-15 00:00:00,https://dojmt.gov/consumer/consumers-known-data-breach-incidents/#,2017-04-27 00:00:00,Montana
5/1/2017-5/3/2017,2017-05-03 00:00:00,2 in Montana, https://media.dojmt.gov/wp-content/uploads/SVHS.pdf ,SVHS,2017-06-15 00:00:00,https://dojmt.gov/consumer/consumers-known-data-breach-incidents/#,2017-05-01 00:00:00,Montana
8/1/2016-1/31/2017,2017-01-31 00:00:00,4 in Montana, https://media.dojmt.gov/wp-content/uploads/UBT.pdf ,UBT,2017-06-15 00:00:00,https://dojmt.gov/consumer/consumers-known-data-breach-incidents/#,2016-08-01 00:00:00,Montana
5/18/2017-5/18/2017,2017-05-18 00:00:00,1 in Montana, https://media.dojmt.gov/wp-content/uploads/The-Nielsen-Company.pdf ,The Nielsen Company,2017-06-19 00:00:00,https://dojmt.gov/consumer/consumers-known-data-breach-incidents/#,2017-05-18 00:00:00,Montana
4/18/2017-4/19/2017,2017-04-19 00:00:00,5 in Montana, https://media.dojmt.gov/wp-content/uploads/Torrance-Memorial-Medical-Center.pdf ,Torrance Memorial Medical Center,2017-06-19 00:00:00,https://dojmt.gov/consumer/consumers-known-data-breach-incidents/#,2017-04-18 00:00:00,Montana
4/24/2017-4/24/2017,2017-04-24 00:00:00,2 in Montana, https://media.dojmt.gov/wp-content/uploads/Family-Tree-Health-Clinic.pdf ,Family Tree Health Clinic,2017-06-19 00:00:00,https://dojmt.gov/consumer/consumers-known-data-breach-incidents/#,2017-04-24 00:00:00,Montana
6/1/2017-6/1/2017,2017-06-01 00:00:00,1 in Montana, https://media.dojmt.gov/wp-content/uploads/Occidental-College.pdf ,Occidental College,2017-06-19 00:00:00,https://dojmt.gov/consumer/consumers-known-data-breach-incidents/#,2017-06-01 00:00:00,Montana
11/15/2016-3/30/2017,2017-03-30 00:00:00,45 in Montana, https://media.dojmt.gov/wp-content/uploads/Home-Point-Financial-Corporation.pdf ,Home Point Financial Corporation,2017-06-20 00:00:00,https://dojmt.gov/consumer/consumers-known-data-breach-incidents/#,2016-11-15 00:00:00,Montana
2/18/2017-2/20/2017,2017-02-20 00:00:00,15 in Montana, https://media.dojmt.gov/wp-content/uploads/Atlantic-Digestive-Specialists.pdf ,Atlantic Digestive Specialists,2017-06-20 00:00:00,https://dojmt.gov/consumer/consumers-known-data-breach-incidents/#,2017-02-18 00:00:00,Montana
4/27/2017-4/27/2017,2017-04-27 00:00:00,11 in Montana, https://media.dojmt.gov/wp-content/uploads/Aetna-1.pdf ,Aetna,2017-06-21 00:00:00,https://dojmt.gov/consumer/consumers-known-data-breach-incidents/#,2017-04-27 00:00:00,Montana
6/9/2017-6/9/2017,2017-06-09 00:00:00,108 in Montana, https://media.dojmt.gov/wp-content/uploads/Caliber-Home-Loans-Inc..pdf ,"Caliber Home Loans, Inc.",2017-06-23 00:00:00,https://dojmt.gov/consumer/consumers-known-data-breach-incidents/#,2017-06-09 00:00:00,Montana
2/12/2017-4/24/2017,2017-04-24 00:00:00,8 in Montana, https://media.dojmt.gov/wp-content/uploads/Plastic-Surgery-Associates.pdf ,Plastic Surgery Associates,2017-06-27 00:00:00,https://dojmt.gov/consumer/consumers-known-data-breach-incidents/#,2017-02-12 00:00:00,Montana
4/28/2017-6/22/2017,2017-06-22 00:00:00,6 in Montana, https://media.dojmt.gov/wp-content/uploads/TD-Bank.pdf ,TD Bank,2017-06-27 00:00:00,https://dojmt.gov/consumer/consumers-known-data-breach-incidents/#,2017-04-28 00:00:00,Montana
5/31/2017-5/31/2017,2017-05-31 00:00:00,1 in Montana, https://media.dojmt.gov/wp-content/uploads/Epiq.pdf ,Epiq,2017-06-27 00:00:00,https://dojmt.gov/consumer/consumers-known-data-breach-incidents/#,2017-05-31 00:00:00,Montana
1/3/2017-5/18/2017,2017-05-18 00:00:00,12 in Montana, https://media.dojmt.gov/wp-content/uploads/Condie-Stoker.pdf ,Condie Stoker,2017-06-27 00:00:00,https://dojmt.gov/consumer/consumers-known-data-breach-incidents/#,2017-01-03 00:00:00,Montana
5/15/2017-5/15/2017,2017-05-15 00:00:00,12 in Montana, https://media.dojmt.gov/wp-content/uploads/Paul-Stuart.pdf ,Paul Stuart,2017-06-29 00:00:00,https://dojmt.gov/consumer/consumers-known-data-breach-incidents/#,2017-05-15 00:00:00,Montana
6/16/2017-6/19/2017,2017-06-19 00:00:00,1 in Montana, https://media.dojmt.gov/wp-content/uploads/State-Farm-1.pdf ,State Farm,2017-06-29 00:00:00,https://dojmt.gov/consumer/consumers-known-data-breach-incidents/#,2017-06-16 00:00:00,Montana
8/10/2016-3/9/2017,2017-03-09 00:00:00,3 in Montana, https://media.dojmt.gov/wp-content/uploads/Miraval-Arizona-Resort-and-Spa.pdf ,Miraval Arizona Resort and Spa,2017-06-29 00:00:00,https://dojmt.gov/consumer/consumers-known-data-breach-incidents/#,2016-08-10 00:00:00,Montana
6/1/2017-6/1/2017,2017-06-01 00:00:00,14 in Montana, https://media.dojmt.gov/wp-content/uploads/Xtant-Medical-Holdings.pdf ,Xtant Medical Holdings,2017-06-30 00:00:00,https://dojmt.gov/consumer/consumers-known-data-breach-incidents/#,2017-06-01 00:00:00,Montana
5/3/2017-5/3/2017,2017-05-03 00:00:00,1 in Montana, https://media.dojmt.gov/wp-content/uploads/Community-Link.pdf ,Community Link,2017-06-30 00:00:00,https://dojmt.gov/consumer/consumers-known-data-breach-incidents/#,2017-05-03 00:00:00,Montana
5/4/2017-5/4/2017,2017-05-04 00:00:00,29 in Montana, https://media.dojmt.gov/wp-content/uploads/PVHS-ICM-Employee-Health-and-Wellness.pdf ,PVHS-ICM Employee Health and Wellness,2017-06-30 00:00:00,https://dojmt.gov/consumer/consumers-known-data-breach-incidents/#,2017-05-04 00:00:00,Montana
2/17/2017-5/19/2017,2017-05-19 00:00:00,7 in Montana, https://media.dojmt.gov/wp-content/uploads/Betty-Lous.pdf ,Betty Lou's,2017-06-30 00:00:00,https://dojmt.gov/consumer/consumers-known-data-breach-incidents/#,2017-02-17 00:00:00,Montana
6/23/2017-6/23/2017,2017-06-23 00:00:00,1 in Montana, https://media.dojmt.gov/wp-content/uploads/Auburn-University.pdf ,Auburn University,2017-07-03 00:00:00,https://dojmt.gov/consumer/consumers-known-data-breach-incidents/#,2017-06-23 00:00:00,Montana
2/1/2016-12/31/2016,2016-12-31 00:00:00,209 in Montana, https://media.dojmt.gov/wp-content/uploads/Kayser-Roth-Inc..pdf ,"Kayser-Roth, Inc.",2017-07-03 00:00:00,https://dojmt.gov/consumer/consumers-known-data-breach-incidents/#,2016-02-01 00:00:00,Montana
8/29/2016-3/9/2017,2017-03-09 00:00:00,71 in Montana, https://media.dojmt.gov/wp-content/uploads/Loews-Hotels-Co..pdf ,Loews Hotels,2017-07-06 00:00:00,https://dojmt.gov/consumer/consumers-known-data-breach-incidents/#,2016-08-29 00:00:00,Montana
8/10/2016-3/9/2017,2017-03-09 00:00:00,1 in Montana, https://media.dojmt.gov/wp-content/uploads/Google.pdf ,Google,2017-07-06 00:00:00,https://dojmt.gov/consumer/consumers-known-data-breach-incidents/#,2016-08-10 00:00:00,Montana
8/10/2016-3/9/2017,2017-03-09 00:00:00,20 in Montana, https://media.dojmt.gov/wp-content/uploads/Aqua-Aston-Hospitality.pdf ,Aqua-Aston Hospitality,2017-07-06 00:00:00,https://dojmt.gov/consumer/consumers-known-data-breach-incidents/#,2016-08-10 00:00:00,Montana
3/10/2017-6/7/2017,2017-06-07 00:00:00,236 in Montana, https://media.dojmt.gov/wp-content/uploads/Spark-Pay-Capital-One-2.pdf ,Spark Pay (Capital One),2017-07-06 00:00:00,https://dojmt.gov/consumer/consumers-known-data-breach-incidents/#,2017-03-10 00:00:00,Montana
2/1/2016-5/31/2017,2017-05-31 00:00:00,13 in Montana, https://media.dojmt.gov/wp-content/uploads/Peachtree-Neurological-Clinic.pdf ,Peachtree Neurological Clinic,2017-07-06 00:00:00,https://dojmt.gov/consumer/consumers-known-data-breach-incidents/#,2016-02-01 00:00:00,Montana
8/10/2016-3/9/2017,2017-03-09 00:00:00,500 in Montana, https://media.dojmt.gov/wp-content/uploads/Preferred-Hotel-Group.pdf ,Preferred Hotel Group,2017-07-06 00:00:00,https://dojmt.gov/consumer/consumers-known-data-breach-incidents/#,2016-08-10 00:00:00,Montana
8/10/2016-3/9/2017,2017-03-09 00:00:00,1 in Montana, https://media.dojmt.gov/wp-content/uploads/Sabre-Hospitality.pdf ,21c Museum Hotels,2017-07-06 00:00:00,https://dojmt.gov/consumer/consumers-known-data-breach-incidents/#,2016-08-10 00:00:00,Montana
8/10/2016-3/9/2017,2017-03-09 00:00:00,5 in Montana, https://media.dojmt.gov/wp-content/uploads/Hard-Rock-Hotels-Casinos.pdf ,Hard Rock Hotels & Casinos,2017-07-07 00:00:00,https://dojmt.gov/consumer/consumers-known-data-breach-incidents/#,2016-08-10 00:00:00,Montana
4/18/2016-4/19/2017,2017-04-19 00:00:00,5 in Montana, https://media.dojmt.gov/wp-content/uploads/Torrance-Memoral-Medical-Center.pdf ,Torrance Memorial Medical Center,2017-07-07 00:00:00,https://dojmt.gov/consumer/consumers-known-data-breach-incidents/#,2016-04-18 00:00:00,Montana
3/8/2016-4/13/2017,2017-04-13 00:00:00,12 in Montana, https://media.dojmt.gov/wp-content/uploads/Golf-Ski.pdf ,Golf & Ski,2017-07-07 00:00:00,https://dojmt.gov/consumer/consumers-known-data-breach-incidents/#,2016-03-08 00:00:00,Montana
8/10/2016-3/9/2017,2017-03-09 00:00:00,7 in Montana, https://media.dojmt.gov/wp-content/uploads/Four-Seasons-Hotels.pdf ,Four Seasons Hotels,2017-07-07 00:00:00,https://dojmt.gov/consumer/consumers-known-data-breach-incidents/#,2016-08-10 00:00:00,Montana
8/10/2016-3/9/2017,2017-03-09 00:00:00,1 in Montana, https://media.dojmt.gov/wp-content/uploads/Halekulani-Corporation.pdf ,Halekulani Corporation,2017-07-07 00:00:00,https://dojmt.gov/consumer/consumers-known-data-breach-incidents/#,2016-08-10 00:00:00,Montana
6/23/2017-6/23/2017,2017-06-23 00:00:00,4 in Montana, https://media.dojmt.gov/wp-content/uploads/Costco.pdf ,Costco,2017-07-10 00:00:00,https://dojmt.gov/consumer/consumers-known-data-breach-incidents/#,2017-06-23 00:00:00,Montana
8/1/2016-10/15/2016,2016-10-15 00:00:00,2 in Montana, https://media.dojmt.gov/wp-content/uploads/Movement-Mortgage.pdf ,Movement Mortgage,2017-07-10 00:00:00,https://dojmt.gov/consumer/consumers-known-data-breach-incidents/#,2016-08-01 00:00:00,Montana
6/13/2017-6/21/2017,2017-06-21 00:00:00,1 in Montana, https://media.dojmt.gov/wp-content/uploads/Pacfic-Science-Center.pdf ,Pacific Science Center,2017-07-10 00:00:00,https://dojmt.gov/consumer/consumers-known-data-breach-incidents/#,2017-06-13 00:00:00,Montana
5/12/2017-5/12/2017,2017-05-12 00:00:00,1 in Montana, https://media.dojmt.gov/wp-content/uploads/LOGAN-Community-Resources.pdf ,LOGAN Community Resources,2017-07-11 00:00:00,https://dojmt.gov/consumer/consumers-known-data-breach-incidents/#,2017-05-12 00:00:00,Montana
8/10/2016-3/9/2017,2017-03-09 00:00:00,17 in Montana, https://media.dojmt.gov/wp-content/uploads/Trump-Towers.pdf ,Trump Towers,2017-07-11 00:00:00,https://dojmt.gov/consumer/consumers-known-data-breach-incidents/#,2016-08-10 00:00:00,Montana
8/10/2016-3/9/2017,2017-03-09 00:00:00,7 in Montana, https://media.dojmt.gov/wp-content/uploads/Club-Quarters-Hotels.pdf ,Club Quarters Hotels,2017-07-12 00:00:00,https://dojmt.gov/consumer/consumers-known-data-breach-incidents/#,2016-08-10 00:00:00,Montana
5/30/2017-5/30/2017,2017-05-30 00:00:00,125 in Montana, https://media.dojmt.gov/wp-content/uploads/Harvest-Bible-Church.pdf ,Harvest Bible Church,2017-07-13 00:00:00,https://dojmt.gov/consumer/consumers-known-data-breach-incidents/#,2017-05-30 00:00:00,Montana
8/10/2016-3/9/2018,2018-03-09 00:00:00,8 in Montana, https://media.dojmt.gov/wp-content/uploads/SBE-ENT-Holdings.pdf ,SBE ENT Holdings,2017-07-14 00:00:00,https://dojmt.gov/consumer/consumers-known-data-breach-incidents/#,2016-08-10 00:00:00,Montana
3/1/2017-6/30/2017,2017-06-30 00:00:00,1 in Montana, https://media.dojmt.gov/wp-content/uploads/Bedrock-Manufacturing-Company.pdf ,Bedrock Manufacturing Company,2017-07-14 00:00:00,https://dojmt.gov/consumer/consumers-known-data-breach-incidents/#,2017-03-01 00:00:00,Montana
8/10/2016-3/9/2017,2017-03-09 00:00:00,165 in Montana, https://media.dojmt.gov/wp-content/uploads/Two-Roads-Hospitality.pdf ,Two Roads Hospitality,2017-07-14 00:00:00,https://dojmt.gov/consumer/consumers-known-data-breach-incidents/#,2016-08-10 00:00:00,Montana
6/29/2017-7/3/2017,2017-07-03 00:00:00,5 in Montana, https://media.dojmt.gov/wp-content/uploads/Apartment-Management-Consultants.pdf ,Apartment Management Consultants,2017-07-14 00:00:00,https://dojmt.gov/consumer/consumers-known-data-breach-incidents/#,2017-06-29 00:00:00,Montana
8/10/2016-3/9/2017,2017-03-09 00:00:00,22 in Montana, https://media.dojmt.gov/wp-content/uploads/Remington-Lodging-Hospitality.pdf ,Remington Lodging & Hospitality,2017-07-17 00:00:00,https://dojmt.gov/consumer/consumers-known-data-breach-incidents/#,2016-08-10 00:00:00,Montana
10/12/2016-5/31/2017,2017-05-31 00:00:00,58 in Montana, https://media.dojmt.gov/wp-content/uploads/SportsMem.pdf ,SportsMem,2017-07-18 00:00:00,https://dojmt.gov/consumer/consumers-known-data-breach-incidents/#,2016-10-12 00:00:00,Montana
8/10/2016-3/9/2017,2017-03-09 00:00:00,3 in Montana, https://media.dojmt.gov/wp-content/uploads/Sage-Hospitality.pdf ,Sage Hospitality,2017-07-18 00:00:00,https://dojmt.gov/consumer/consumers-known-data-breach-incidents/#,2016-08-10 00:00:00,Montana
4/12/2017-4/12/2017,2017-04-12 00:00:00,11 in Montana, https://media.dojmt.gov/wp-content/uploads/Whitinger-Company.pdf ,Whitinger & Company,2017-07-18 00:00:00,https://dojmt.gov/consumer/consumers-known-data-breach-incidents/#,2017-04-12 00:00:00,Montana
5/6/2017-5/10/2017,2017-05-10 00:00:00,794 in Montana, https://media.dojmt.gov/wp-content/uploads/Keller-Williams-Realty.pdf ,Keller Williams Realty,2017-07-18 00:00:00,https://dojmt.gov/consumer/consumers-known-data-breach-incidents/#,2017-05-06 00:00:00,Montana
6/7/2017-6/7/2017,2017-06-07 00:00:00,2 in Montana, https://media.dojmt.gov/wp-content/uploads/de-Arrigoitia-Co.pdf ,de Arrigoitia & Co,2017-07-19 00:00:00,https://dojmt.gov/consumer/consumers-known-data-breach-incidents/#,2017-06-07 00:00:00,Montana
8/10/2016-3/9/2017,2017-03-09 00:00:00,2 in Montana, https://media.dojmt.gov/wp-content/uploads/Verizon.pdf ,Verizon,2017-07-20 00:00:00,https://dojmt.gov/consumer/consumers-known-data-breach-incidents/#,2016-08-10 00:00:00,Montana
5/31/2017-6/8/2017,2017-06-08 00:00:00,376 in Montana, https://media.dojmt.gov/wp-content/uploads/39DollarGlass.com_.pdf ,39DollarGlasses.com,2017-07-21 00:00:00,https://dojmt.gov/consumer/consumers-known-data-breach-incidents/#,2017-05-31 00:00:00,Montana
8/10/2016-3/9/2017,2017-03-09 00:00:00,7 in Montana, https://media.dojmt.gov/wp-content/uploads/Sydell-Partners.pdf ,Sydell Partners,2017-07-21 00:00:00,https://dojmt.gov/consumer/consumers-known-data-breach-incidents/#,2016-08-10 00:00:00,Montana
8/10/2016-3/9/2017,2017-03-09 00:00:00,16 in Montana, https://media.dojmt.gov/wp-content/uploads/Standard-International-Management.pdf ,Standard International Management,2017-07-21 00:00:00,https://dojmt.gov/consumer/consumers-known-data-breach-incidents/#,2016-08-10 00:00:00,Montana
7/10/2016-3/9/2017,2017-03-09 00:00:00,1 in Montana, https://media.dojmt.gov/wp-content/uploads/Hartz-Hotel-Services.pdf ,Hartz Hotel Services,2017-07-24 00:00:00,https://dojmt.gov/consumer/consumers-known-data-breach-incidents/#,2016-07-10 00:00:00,Montana
7/4/2017-7/4/2017,2017-07-04 00:00:00,Unknown in Montana, https://media.dojmt.gov/wp-content/uploads/Avanti.pdf ,Avanti Markets,2017-07-25 00:00:00,https://dojmt.gov/consumer/consumers-known-data-breach-incidents/#,2017-07-04 00:00:00,Montana
6/6/2017-6/6/2017,2017-06-06 00:00:00,4 in Montana, https://media.dojmt.gov/wp-content/uploads/Kelvin-J-Palmer-Co.pdf ,Kevin J Palmer & Co.,2017-07-25 00:00:00,https://dojmt.gov/consumer/consumers-known-data-breach-incidents/#,2017-06-06 00:00:00,Montana
8/10/2016-3/9/2017,2017-03-09 00:00:00,8 in Montana, https://media.dojmt.gov/wp-content/uploads/Woodside-Hotels-Resorts.pdf ,Woodside Hotels and Resorts,2017-07-25 00:00:00,https://dojmt.gov/consumer/consumers-known-data-breach-incidents/#,2016-08-10 00:00:00,Montana
6/29/2017-6/29/2017,2017-06-29 00:00:00,5 in Montana, https://media.dojmt.gov/wp-content/uploads/Hamilton-Zanze-Company.pdf ,Hamilton Zanze & Company,2017-07-25 00:00:00,https://dojmt.gov/consumer/consumers-known-data-breach-incidents/#,2017-06-29 00:00:00,Montana
5/23/2017-5/23/2017,2017-05-23 00:00:00,6 in Montana, https://media.dojmt.gov/wp-content/uploads/Delek-US-Holdings.pdf ,Delek US Holdings,2017-07-26 00:00:00,https://dojmt.gov/consumer/consumers-known-data-breach-incidents/#,2017-05-23 00:00:00,Montana
4/21/2017-4/21/2017,2017-04-21 00:00:00,2 in Montana, https://media.dojmt.gov/wp-content/uploads/Kentucky-Wesleyan-College.pdf ,Kentucky Wesleyan College,2017-07-26 00:00:00,https://dojmt.gov/consumer/consumers-known-data-breach-incidents/#,2017-04-21 00:00:00,Montana
12/21/2016-4/11/2017,2017-04-11 00:00:00,7 in Montana, https://media.dojmt.gov/wp-content/uploads/Galt-House-Hotel.pdf ,Galt House Hotels,2017-07-26 00:00:00,https://dojmt.gov/consumer/consumers-known-data-breach-incidents/#,2016-12-21 00:00:00,Montana
5/2/2017-5/2/2017,2017-05-02 00:00:00,376 in Montana, https://media.dojmt.gov/wp-content/uploads/HydroFlask.pdf ,Hydro Flask,2017-07-26 00:00:00,https://dojmt.gov/consumer/consumers-known-data-breach-incidents/#,2017-05-02 00:00:00,Montana
8/10/2016-3/9/2017,2017-03-09 00:00:00,25 in Montana, https://media.dojmt.gov/wp-content/uploads/Kimpton-Hotels-Restaurants.-2pdf.pdf ,Kimpton Hotels & Restaurants,2017-07-28 00:00:00,https://dojmt.gov/consumer/consumers-known-data-breach-incidents/#,2016-08-10 00:00:00,Montana
8/10/2016-3/9/2017,2017-03-09 00:00:00,8 in Montana, https://media.dojmt.gov/wp-content/uploads/Stout-Street.pdf ,Stout Street Hospitality,2017-07-28 00:00:00,https://dojmt.gov/consumer/consumers-known-data-breach-incidents/#,2016-08-10 00:00:00,Montana
8/10/2016-3/9/2017,2017-03-09 00:00:00,11 in Montana, https://media.dojmt.gov/wp-content/uploads/Westgate-Resorts.pdf ,Westgage Resorts,2017-07-28 00:00:00,https://dojmt.gov/consumer/consumers-known-data-breach-incidents/#,2016-08-10 00:00:00,Montana
8/10/2016-3/9/2017,2017-03-09 00:00:00,16 in Montana, https://media.dojmt.gov/wp-content/uploads/Noble-House-5.pdf ,Noble House (5),2017-07-28 00:00:00,https://dojmt.gov/consumer/consumers-known-data-breach-incidents/#,2016-08-10 00:00:00,Montana
8/10/2016-3/9/2017,2017-03-09 00:00:00,Unknown in Montana, https://media.dojmt.gov/wp-content/uploads/Yellowstone-Park-Hotel.pdf ,Yellowstone Park Hotel,2017-07-31 00:00:00,https://dojmt.gov/consumer/consumers-known-data-breach-incidents/#,2016-08-10 00:00:00,Montana
8/10/2016-3/9/2017,2017-03-09 00:00:00,Unknown in Montana, https://media.dojmt.gov/wp-content/uploads/Yavapai-Lodge.pdf ,Yavapai Lodge,2017-07-31 00:00:00,https://dojmt.gov/consumer/consumers-known-data-breach-incidents/#,2016-08-10 00:00:00,Montana
8/10/2016-3/9/2017,2017-03-09 00:00:00,Unknown in Montana, https://media.dojmt.gov/wp-content/uploads/Wuksachi-Lodge.pdf ,Wuksachi Lodge,2017-07-31 00:00:00,https://dojmt.gov/consumer/consumers-known-data-breach-incidents/#,2016-08-10 00:00:00,Montana
8/10/2016-3/9/2017,2017-03-09 00:00:00,Unknown in Montana, https://media.dojmt.gov/wp-content/uploads/Wheeling-Island-Hotel.pdf ,Wheeling Island Hotel,2017-07-31 00:00:00,https://dojmt.gov/consumer/consumers-known-data-breach-incidents/#,2016-08-10 00:00:00,Montana
12/18/2015-7/5/2017,2017-07-05 00:00:00,1 in Montana, https://media.dojmt.gov/wp-content/uploads/Boy-Scouts-of-America.pdf ,Boy Scouts of America,2017-07-31 00:00:00,https://dojmt.gov/consumer/consumers-known-data-breach-incidents/#,2015-12-18 00:00:00,Montana
8/10/2016-3/9/2017,2017-03-09 00:00:00,Unknown in Montana, https://media.dojmt.gov/wp-content/uploads/Asbury-Hotel.pdf ,Asbury Hotel,2017-07-31 00:00:00,https://dojmt.gov/consumer/consumers-known-data-breach-incidents/#,2016-08-10 00:00:00,Montana
8/10/2016-3/9/2017,2017-03-09 00:00:00,Unknown in Montana, https://media.dojmt.gov/wp-content/uploads/Trailer-Village-RV-Park.pdf ,Trailer Village RV Park,2017-07-31 00:00:00,https://dojmt.gov/consumer/consumers-known-data-breach-incidents/#,2016-08-10 00:00:00,Montana
8/10/2016-3/9/2017,2017-03-09 00:00:00,Unknown in Montana, https://media.dojmt.gov/wp-content/uploads/The-Lodge-at-Geneva.pdf ,The Lodge at Geneva,2017-07-31 00:00:00,https://dojmt.gov/consumer/consumers-known-data-breach-incidents/#,2016-08-10 00:00:00,Montana
8/10/2016-3/9/2017,2017-03-09 00:00:00,Unknown in Montana, https://media.dojmt.gov/wp-content/uploads/Tenaya-Lodge.pdf ,Tenaya Lodge,2017-07-31 00:00:00,https://dojmt.gov/consumer/consumers-known-data-breach-incidents/#,2016-08-10 00:00:00,Montana
8/10/2016-3/9/2017,2017-03-09 00:00:00,Unknown in Montana, https://media.dojmt.gov/wp-content/uploads/Skyland-Resort.pdf ,Skyland Resort,2017-07-31 00:00:00,https://dojmt.gov/consumer/consumers-known-data-breach-incidents/#,2016-08-10 00:00:00,Montana
8/10/2016-3/9/2017,2017-03-09 00:00:00,Unknown in Montana, https://media.dojmt.gov/wp-content/uploads/Sea-Crest-Beach-Hotel.pdf ,Sea Crest Beach Hotel,2017-07-31 00:00:00,https://dojmt.gov/consumer/consumers-known-data-breach-incidents/#,2016-08-10 00:00:00,Montana
8/10/2016-3/9/2017,2017-03-09 00:00:00,Unknown in Montana, https://media.dojmt.gov/wp-content/uploads/Rocky-Mountain-Park-Inn.pdf ,Rocky Mountain Park Inn,2017-07-31 00:00:00,https://dojmt.gov/consumer/consumers-known-data-breach-incidents/#,2016-08-10 00:00:00,Montana
8/10/2016-3/9/2017,2017-03-09 00:00:00,Unknown in Montana, https://media.dojmt.gov/wp-content/uploads/Pine-Lodge.pdf ,Pine Lodge,2017-07-31 00:00:00,https://dojmt.gov/consumer/consumers-known-data-breach-incidents/#,2016-08-10 00:00:00,Montana
8/10/2016-3/9/2017,2017-03-09 00:00:00,Unknown in Montana, https://media.dojmt.gov/wp-content/uploads/Lewis-Mountain-Cabins.pdf ,Lewis Mountain Cabins,2017-07-31 00:00:00,https://dojmt.gov/consumer/consumers-known-data-breach-incidents/#,2016-08-10 00:00:00,Montana
8/10/2016-3/9/2017,2017-03-09 00:00:00,Unknown in Montana, https://media.dojmt.gov/wp-content/uploads/Kalaloch-Lodge.pdf ,Kalaloch Lodge,2017-07-31 00:00:00,https://dojmt.gov/consumer/consumers-known-data-breach-incidents/#,2016-08-10 00:00:00,Montana
8/10/2016-3/9/2017,2017-03-09 00:00:00,Unknown in Montana, https://media.dojmt.gov/wp-content/uploads/Honey-Creek-Resort-State-Park.pdf ,Honey Creek Resort State Park,2017-07-31 00:00:00,https://dojmt.gov/consumer/consumers-known-data-breach-incidents/#,2016-08-10 00:00:00,Montana
8/10/2016-3/9/2017,2017-03-09 00:00:00,Unknown in Montana, https://media.dojmt.gov/wp-content/uploads/Gray-Wolf-Inn-Suites.pdf ,Gray Wolf Inn & Suites,2017-07-31 00:00:00,https://dojmt.gov/consumer/consumers-known-data-breach-incidents/#,2016-08-10 00:00:00,Montana
8/10/2016-3/9/2017,2017-03-09 00:00:00,Unknown in Montana, https://media.dojmt.gov/wp-content/uploads/Grant-Grove-Village.pdf ,Grant Grove Village,2017-07-31 00:00:00,https://dojmt.gov/consumer/consumers-known-data-breach-incidents/#,2016-08-10 00:00:00,Montana
8/10/2016-3/9/2017,2017-03-09 00:00:00,Unknown in Montana, https://media.dojmt.gov/wp-content/uploads/Gideon-Putnam-Hotel.pdf ,Gideon Putnam Hotel,2017-07-31 00:00:00,https://dojmt.gov/consumer/consumers-known-data-breach-incidents/#,2016-08-10 00:00:00,Montana
8/10/2016-3/9/2017,2017-03-09 00:00:00,Unknown in Montana, https://media.dojmt.gov/wp-content/uploads/Explorer-Cabins-at-Yellowstone.pdf ,Explorer Cabins at Yellowstone,2017-07-31 00:00:00,https://dojmt.gov/consumer/consumers-known-data-breach-incidents/#,2016-08-10 00:00:00,Montana
8/10/2016-3/9/2017,2017-03-09 00:00:00,Unknown in Montana, https://media.dojmt.gov/wp-content/uploads/Cedar-Grove.pdf ,Cedar Grove,2017-07-31 00:00:00,https://dojmt.gov/consumer/consumers-known-data-breach-incidents/#,2016-08-10 00:00:00,Montana
8/10/2016-3/9/2017,2017-03-09 00:00:00,Unknown in Montana, https://media.dojmt.gov/wp-content/uploads/Big-Meadows-Lodge.pdf ,Big Meadows Lodge,2017-07-31 00:00:00,https://dojmt.gov/consumer/consumers-known-data-breach-incidents/#,2016-08-10 00:00:00,Montana
1/27/2017-4/20/2017,2017-04-20 00:00:00,4 in Montana, https://media.dojmt.gov/wp-content/uploads/Capital-One-1.pdf ,Capital One,2017-07-31 00:00:00,https://dojmt.gov/consumer/consumers-known-data-breach-incidents/#,2017-01-27 00:00:00,Montana
10/27/2016-5/24/2017,2017-05-24 00:00:00,9 in Montana, https://media.dojmt.gov/wp-content/uploads/Juliska.pdf ,Juliska,2017-08-03 00:00:00,https://dojmt.gov/consumer/consumers-known-data-breach-incidents/#,2016-10-27 00:00:00,Montana
5/31/2017-6/1/2017,2017-06-01 00:00:00,1 in Montana, https://media.dojmt.gov/wp-content/uploads/QBE-North-America.pdf ,QBE North America,2017-08-04 00:00:00,https://dojmt.gov/consumer/consumers-known-data-breach-incidents/#,2017-05-31 00:00:00,Montana
2/26/2017-6/25/2017,2017-06-25 00:00:00,3 in Montana, https://media.dojmt.gov/wp-content/uploads/State-Industrial-Products.pdf ,State Industrial Products,2017-08-04 00:00:00,https://dojmt.gov/consumer/consumers-known-data-breach-incidents/#,2017-02-26 00:00:00,Montana
9/16/2016-4/28/2017,2017-04-28 00:00:00,2 in Montana, https://media.dojmt.gov/wp-content/uploads/Hyatt-Centric-The-Loop.pdf ,Hyatt Centric The Loop,2017-08-07 00:00:00,https://dojmt.gov/consumer/consumers-known-data-breach-incidents/#,2016-09-16 00:00:00,Montana
4/27/2017-6/16/2017,2017-06-16 00:00:00,3 in Montana, https://media.dojmt.gov/wp-content/uploads/Shoe-Station.pdf ,Shoe Station,2017-08-08 00:00:00,https://dojmt.gov/consumer/consumers-known-data-breach-incidents/#,2017-04-27 00:00:00,Montana
10/23/2017-7/1/2017,2017-07-01 00:00:00,19 in Montana, https://media.dojmt.gov/wp-content/uploads/Kayser-Roth-Inc.pdf ,"Kayser-Roth, Inc.",2017-08-09 00:00:00,https://dojmt.gov/consumer/consumers-known-data-breach-incidents/#,2017-10-23 00:00:00,Montana
1/1/2007-6/28/2017,2017-06-28 00:00:00,9 in Montana, https://media.dojmt.gov/wp-content/uploads/Wooster-Ashland-Regional-Council-of-Governments.pdf ,Wooster-Ashland Regional Council of Government,2017-08-09 00:00:00,https://dojmt.gov/consumer/consumers-known-data-breach-incidents/#,2007-01-01 00:00:00,Montana
7/17/2017-7/17/2017,2017-07-17 00:00:00,5 in Montana, https://media.dojmt.gov/wp-content/uploads/Evers-Robinson.pdf ,Logan Simpson,2017-08-10 00:00:00,https://dojmt.gov/consumer/consumers-known-data-breach-incidents/#,2017-07-17 00:00:00,Montana
8/10/2016-3/9/2017,2017-03-09 00:00:00,11 in Montana, https://media.dojmt.gov/wp-content/uploads/Pacifica.pdf ,Pacifica,2017-08-11 00:00:00,https://dojmt.gov/consumer/consumers-known-data-breach-incidents/#,2016-08-10 00:00:00,Montana
4/16/2017-6/19/2017,2017-06-19 00:00:00,14 in Montana, https://media.dojmt.gov/wp-content/uploads/Marine-Corps-Association-Foundation.pdf ,Marine Corps Association & Foundation,2017-08-11 00:00:00,https://dojmt.gov/consumer/consumers-known-data-breach-incidents/#,2017-04-16 00:00:00,Montana
5/19/2017-7/26/2017,2017-07-26 00:00:00,40 in Montana, https://media.dojmt.gov/wp-content/uploads/True-Benefits.pdf ,True Benefits,2017-08-14 00:00:00,https://dojmt.gov/consumer/consumers-known-data-breach-incidents/#,2017-05-19 00:00:00,Montana
5/23/2017-5/23/2017,2017-05-23 00:00:00,3 in Montana, https://media.dojmt.gov/wp-content/uploads/Ameriprise-Financial-Services-1.pdf ,Ameriprise Financial Services,2017-08-15 00:00:00,https://dojmt.gov/consumer/consumers-known-data-breach-incidents/#,2017-05-23 00:00:00,Montana
7/19/2017-7/19/2017,2017-07-19 00:00:00,1 in Montana, https://media.dojmt.gov/wp-content/uploads/Piersol-Construction.pdf ,Piersol Construction,2017-08-15 00:00:00,https://dojmt.gov/consumer/consumers-known-data-breach-incidents/#,2017-07-19 00:00:00,Montana
8/10/2016-3/9/2017,2017-03-09 00:00:00,12 in Montana, https://media.dojmt.gov/wp-content/uploads/Benjamin-Hotel.pdf ,Benjamin Hotel,2017-08-16 00:00:00,https://dojmt.gov/consumer/consumers-known-data-breach-incidents/#,2016-08-10 00:00:00,Montana
4/1/2015-6/23/2017,2017-06-23 00:00:00,22 in Montana, https://media.dojmt.gov/wp-content/uploads/Native-Shoes.pdf ,Native Shoes,2017-08-16 00:00:00,https://dojmt.gov/consumer/consumers-known-data-breach-incidents/#,2015-04-01 00:00:00,Montana
6/18/2017-6/18/2017,2017-06-18 00:00:00,15 in Montana, https://media.dojmt.gov/wp-content/uploads/Salina-Family-Healthcare-Center.pdf ,Salina Family Healthcare Center,2017-08-16 00:00:00,https://dojmt.gov/consumer/consumers-known-data-breach-incidents/#,2017-06-18 00:00:00,Montana
6/9/2016-6/6/2017,2017-06-06 00:00:00,11 in Montana, https://media.dojmt.gov/wp-content/uploads/Equipmentfr.com_.pdf ,Equipmentfr.com,2017-08-17 00:00:00,https://dojmt.gov/consumer/consumers-known-data-breach-incidents/#,2016-06-09 00:00:00,Montana
12/25/2016-6/6/2017,2017-06-06 00:00:00,11 in Montana, https://media.dojmt.gov/wp-content/uploads/Joie.com_.pdf ,Joie.com,2017-08-17 00:00:00,https://dojmt.gov/consumer/consumers-known-data-breach-incidents/#,2016-12-25 00:00:00,Montana
7/17/2017-8/16/2017,2017-08-16 00:00:00,1 in Montana, https://media.dojmt.gov/wp-content/uploads/Arizona-Tile.pdf ,Arizona Tile,2017-08-21 00:00:00,https://dojmt.gov/consumer/consumers-known-data-breach-incidents/#,2017-07-17 00:00:00,Montana
3/1/2017-4/30/2017,2017-04-30 00:00:00,5269 in Montana, https://media.dojmt.gov/wp-content/uploads/Rutherford-MacDonald-Olson.pdf ,"Rutherford, MacDonald & Olson",2017-08-23 00:00:00,https://dojmt.gov/consumer/consumers-known-data-breach-incidents/#,2017-03-01 00:00:00,Montana
2/1/2016-12/31/2016,2016-12-31 00:00:00,2 in Montana, https://media.dojmt.gov/wp-content/uploads/Anaheim-Portofino-Inn-Suites.pdf ,Piano Works,2017-08-24 00:00:00,https://dojmt.gov/consumer/consumers-known-data-breach-incidents/#,2016-02-01 00:00:00,Montana
8/10/2016-3/9/2017,2017-03-09 00:00:00,1 in Montana, https://media.dojmt.gov/wp-content/uploads/Queen-Mary-Hotel.pdf ,Anaheim Portofino Inn & Suites,2017-08-24 00:00:00,https://dojmt.gov/consumer/consumers-known-data-breach-incidents/#,2016-08-10 00:00:00,Montana
8/10/2016-3/9/2017,2017-03-09 00:00:00,10 in Montana, https://media.dojmt.gov/wp-content/uploads/Hard-Rock-Hotel-San-Diego.pdf ,Queen Mary Hotel,2017-08-24 00:00:00,https://dojmt.gov/consumer/consumers-known-data-breach-incidents/#,2016-08-10 00:00:00,Montana
8/10/2016-3/9/2017,2017-03-09 00:00:00,1 in Montana, https://media.dojmt.gov/wp-content/uploads/Anza-Calabasas-Hotel.pdf ,Hard Rock Sand Diego,2017-08-24 00:00:00,https://dojmt.gov/consumer/consumers-known-data-breach-incidents/#,2016-08-10 00:00:00,Montana
8/10/2016-3/9/2017,2017-03-09 00:00:00,4 in Montana, https://media.dojmt.gov/wp-content/uploads/Crescent-Mortgage-Company.pdf ,Anza Calabasas Hotel,2017-08-24 00:00:00,https://dojmt.gov/consumer/consumers-known-data-breach-incidents/#,2016-08-10 00:00:00,Montana
7/14/2017-8/5/2017,2017-08-05 00:00:00,18 in Montana, https://media.dojmt.gov/wp-content/uploads/Piano-Works.pdf ,Crescent Mortgage Company,2017-08-24 00:00:00,https://dojmt.gov/consumer/consumers-known-data-breach-incidents/#,2017-07-14 00:00:00,Montana
5/16/2016-7/10/2017,2017-07-10 00:00:00,2 in Montana, https://media.dojmt.gov/wp-content/uploads/GT-Distributors.pdf ,GT Distributors,2017-08-25 00:00:00,https://dojmt.gov/consumer/consumers-known-data-breach-incidents/#,2016-05-16 00:00:00,Montana
7/21/2017-8/7/2017,2017-08-07 00:00:00,43 in Montana, https://media.dojmt.gov/wp-content/uploads/Credco-1.pdf ,Credco,2017-08-28 00:00:00,https://dojmt.gov/consumer/consumers-known-data-breach-incidents/#,2017-07-21 00:00:00,Montana
3/15/2017-8/2/2017,2017-08-02 00:00:00,41 in Montana, https://media.dojmt.gov/wp-content/uploads/Zymo.pdf ,Zymo,2017-08-28 00:00:00,https://dojmt.gov/consumer/consumers-known-data-breach-incidents/#,2017-03-15 00:00:00,Montana
8/10/2016-3/9/2017,2017-03-09 00:00:00,6 in Montana, https://media.dojmt.gov/wp-content/uploads/Roosevelt-Hotel.pdf ,Roosevelt Hotel,2017-08-28 00:00:00,https://dojmt.gov/consumer/consumers-known-data-breach-incidents/#,2016-08-10 00:00:00,Montana
8/10/2016-3/9/2017,2017-03-09 00:00:00,1 in Montana, https://media.dojmt.gov/wp-content/uploads/Bicycle-Hotel-Casino.pdf ,The Bicycle Hotel & Casino,2017-08-28 00:00:00,https://dojmt.gov/consumer/consumers-known-data-breach-incidents/#,2016-08-10 00:00:00,Montana
7/10/2016-7/10/2017,2017-07-10 00:00:00,74 in Montana, https://media.dojmt.gov/wp-content/uploads/Cornerstone-Business-Management-Solutions.pdf ,Cornerstone Business & Management Solutions,2017-08-28 00:00:00,https://dojmt.gov/consumer/consumers-known-data-breach-incidents/#,2016-07-10 00:00:00,Montana
7/6/2017-7/6/2017,2017-07-06 00:00:00,17 in Montana, https://media.dojmt.gov/wp-content/uploads/Wells-Fargo.pdf ,Wells Fargo,2017-08-29 00:00:00,https://dojmt.gov/consumer/consumers-known-data-breach-incidents/#,2017-07-06 00:00:00,Montana
8/10/2016-3/9/2017,2017-03-09 00:00:00,5 in Montana, https://media.dojmt.gov/wp-content/uploads/Red-Roof-Inns.pdf ,Red Roof Inns,2017-08-29 00:00:00,https://dojmt.gov/consumer/consumers-known-data-breach-incidents/#,2016-08-10 00:00:00,Montana
7/5/2017-7/12/2017,2017-07-12 00:00:00,27 in Montana, https://media.dojmt.gov/wp-content/uploads/Nationstar-Mortgage.pdf.pdf ,Nationstar Mortgage,2017-08-31 00:00:00,https://dojmt.gov/consumer/consumers-known-data-breach-incidents/#,2017-07-05 00:00:00,Montana
5/25/2017-7/25/2017,2017-07-25 00:00:00,1 in Montana, https://media.dojmt.gov/wp-content/uploads/Kroeschell.pdf ,Kroeschell,2017-08-31 00:00:00,https://dojmt.gov/consumer/consumers-known-data-breach-incidents/#,2017-05-25 00:00:00,Montana
4/15/2017-5/25/2017,2017-05-25 00:00:00,1 in Montana, https://media.dojmt.gov/wp-content/uploads/Neurology-Foundation.pdf ,Neurology Foundation,2017-09-01 00:00:00,https://dojmt.gov/consumer/consumers-known-data-breach-incidents/#,2017-04-15 00:00:00,Montana
11/1/2016-7/31/2017,2017-07-31 00:00:00,12 in Montana, https://media.dojmt.gov/wp-content/uploads/Akira.pdf ,Akira,2017-09-01 00:00:00,https://dojmt.gov/consumer/consumers-known-data-breach-incidents/#,2016-11-01 00:00:00,Montana
7/5/2017-9/1/2017,2017-09-01 00:00:00,2 in Montana, https://media.dojmt.gov/wp-content/uploads/Hand-Rehabilitation-Services.pdf ,Hand Rehabilitation Services,2017-09-01 00:00:00,https://dojmt.gov/consumer/consumers-known-data-breach-incidents/#,2017-07-05 00:00:00,Montana
4/24/2016-6/8/2017,2017-06-08 00:00:00,39 in Montana, https://media.dojmt.gov/wp-content/uploads/Classic-Firearms.pdf ,Classic Firearms,2017-09-01 00:00:00,https://dojmt.gov/consumer/consumers-known-data-breach-incidents/#,2016-04-24 00:00:00,Montana
8/10/2016-3/9/2017,2017-03-09 00:00:00,8 in Montana, https://media.dojmt.gov/wp-content/uploads/Evans-Hotels.pdf ,Evans Hotels,2017-09-01 00:00:00,https://dojmt.gov/consumer/consumers-known-data-breach-incidents/#,2016-08-10 00:00:00,Montana
5/23/2017-5/23/2017,2017-05-23 00:00:00,46 in Montana, https://media.dojmt.gov/wp-content/uploads/Barer-Law-Offices.pdf ,Barer Law Offices,2017-09-05 00:00:00,https://dojmt.gov/consumer/consumers-known-data-breach-incidents/#,2017-05-23 00:00:00,Montana
8/10/2016-3/9/2017,2017-03-09 00:00:00,5 in Montana, https://media.dojmt.gov/wp-content/uploads/Sixty-Hotels.pdf ,Sixty Hotels,2017-09-05 00:00:00,https://dojmt.gov/consumer/consumers-known-data-breach-incidents/#,2016-08-10 00:00:00,Montana
8/7/2016-8/7/2017,2017-08-07 00:00:00,1 in Montana, https://media.dojmt.gov/wp-content/uploads/Fiduciary-Management.pdf ,Fiduciary Management,2017-09-06 00:00:00,https://dojmt.gov/consumer/consumers-known-data-breach-incidents/#,2016-08-07 00:00:00,Montana
7/11/2016-8/4/2017,2017-08-04 00:00:00,8 in Montana, https://media.dojmt.gov/wp-content/uploads/reThink-Group.pdf ,reThink Group,2017-09-06 00:00:00,https://dojmt.gov/consumer/consumers-known-data-breach-incidents/#,2016-07-11 00:00:00,Montana
8/23/2017-8/24/2017,2017-08-24 00:00:00,2 in Montana, https://media.dojmt.gov/wp-content/uploads/Major-League-Lacrosse.pdf ,Major League Lacrosse,2017-09-07 00:00:00,https://dojmt.gov/consumer/consumers-known-data-breach-incidents/#,2017-08-23 00:00:00,Montana
7/15/2017-8/21/2017,2017-08-21 00:00:00,66 in Montana, https://media.dojmt.gov/wp-content/uploads/SRI-1.pdf ,SRI,2017-09-07 00:00:00,https://dojmt.gov/consumer/consumers-known-data-breach-incidents/#,2017-07-15 00:00:00,Montana
9/1/2017-9/5/2017,2017-09-05 00:00:00,1 in Montana, https://media.dojmt.gov/wp-content/uploads/Jacuzzi.pdf ,Jacuzzi,2017-09-11 00:00:00,https://dojmt.gov/consumer/consumers-known-data-breach-incidents/#,2017-09-01 00:00:00,Montana
5/12/2017-8/22/2017,2017-08-22 00:00:00,8 in Montana, https://media.dojmt.gov/wp-content/uploads/Frontier-Natural-Products.pdf ,Frontier Natural Products,2017-09-11 00:00:00,https://dojmt.gov/consumer/consumers-known-data-breach-incidents/#,2017-05-12 00:00:00,Montana
6/1/2017-8/23/2017,2017-08-23 00:00:00,13 in Montana, https://media.dojmt.gov/wp-content/uploads/Signator-Investors.pdf ,Signator Investors,2017-09-11 00:00:00,https://dojmt.gov/consumer/consumers-known-data-breach-incidents/#,2017-06-01 00:00:00,Montana
1/27/2017-4/20/2017,2017-04-20 00:00:00,4 in Montana, https://media.dojmt.gov/wp-content/uploads/Capital-One-2-1.pdf ,Capital One 360,2017-09-12 00:00:00,https://dojmt.gov/consumer/consumers-known-data-breach-incidents/#,2017-01-27 00:00:00,Montana
6/20/2017-6/29/2017,2017-06-29 00:00:00,1 in Montana, https://media.dojmt.gov/wp-content/uploads/Morehead-Memorial-Hospital.pdf ,Morehead Memorial Hospital,2017-09-15 00:00:00,https://dojmt.gov/consumer/consumers-known-data-breach-incidents/#,2017-06-20 00:00:00,Montana
8/30/2017-8/30/2017,2017-08-30 00:00:00,1 in Montana, https://media.dojmt.gov/wp-content/uploads/E-J-Gallo-Winery.pdf ,E&J Gallo Winery,2017-09-15 00:00:00,https://dojmt.gov/consumer/consumers-known-data-breach-incidents/#,2017-08-30 00:00:00,Montana
8/9/2017-8/9/2017,2017-08-09 00:00:00,1 in Montana, https://media.dojmt.gov/wp-content/uploads/PeaceHealth-Southwest-Medical-Center.pdf ,PeaceHealth Southwest Medical Center,2017-09-18 00:00:00,https://dojmt.gov/consumer/consumers-known-data-breach-incidents/#,2017-08-09 00:00:00,Montana
8/23/2017-8/25/2017,2017-08-25 00:00:00,57 in Montana, https://media.dojmt.gov/wp-content/uploads/W.W.-Grainger.pdf ,"W.W. Grainger, Inc.",2017-09-18 00:00:00,https://dojmt.gov/consumer/consumers-known-data-breach-incidents/#,2017-08-23 00:00:00,Montana
8/25/2017-8/25/2017,2017-08-25 00:00:00,3 in Montana, https://media.dojmt.gov/wp-content/uploads/ABB.pdf ,ABB,2017-09-18 00:00:00,https://dojmt.gov/consumer/consumers-known-data-breach-incidents/#,2017-08-25 00:00:00,Montana
8/24/2017-8/24/2017,2017-08-24 00:00:00,2 in Montana, https://media.dojmt.gov/wp-content/uploads/Richard-Munoz-CPA.pdf ,"Richard Munoz, CPA",2017-09-20 00:00:00,https://dojmt.gov/consumer/consumers-known-data-breach-incidents/#,2017-08-24 00:00:00,Montana
8/28/2017-8/28/2017,2017-08-28 00:00:00,2 in Montana, https://media.dojmt.gov/wp-content/uploads/Clifton-Larson-Allen.pdf ,Clifton Larson Allen,2017-09-20 00:00:00,https://dojmt.gov/consumer/consumers-known-data-breach-incidents/#,2017-08-28 00:00:00,Montana
9/17/2016-7/20/2017,2017-07-20 00:00:00,6 in Montana, https://media.dojmt.gov/wp-content/uploads/Best-Western-Plus-Wine-Country-Hotel.pdf ,Best Western Plus Wine Country Hotel & Suites,2017-09-21 00:00:00,https://dojmt.gov/consumer/consumers-known-data-breach-incidents/#,2016-09-17 00:00:00,Montana
8/8/2017-8/8/2017,2017-08-08 00:00:00,1 in Montana, https://media.dojmt.gov/wp-content/uploads/NCI-Group.pdf ,NCI Group,2017-09-22 00:00:00,https://dojmt.gov/consumer/consumers-known-data-breach-incidents/#,2017-08-08 00:00:00,Montana
7/6/2017-9/6/2017,2017-09-06 00:00:00,1 in Montana, https://media.dojmt.gov/wp-content/uploads/Aero-Tech-Light-Bulb-Co.pdf ,Aero-Tech Light Bulb Co.,2017-09-22 00:00:00,https://dojmt.gov/consumer/consumers-known-data-breach-incidents/#,2017-07-06 00:00:00,Montana
5/4/2016-6/12/2017,2017-06-12 00:00:00,1 in Montana, https://media.dojmt.gov/wp-content/uploads/Capital-One-3-1.pdf ,Capital One,2017-09-22 00:00:00,https://dojmt.gov/consumer/consumers-known-data-breach-incidents/#,2016-05-04 00:00:00,Montana
8/1/2017-8/31/2017,2017-08-31 00:00:00,8 in Montana, https://media.dojmt.gov/wp-content/uploads/Century-Martial-Arts.pdf ,Century Martial Arts,2017-09-25 00:00:00,https://dojmt.gov/consumer/consumers-known-data-breach-incidents/#,2017-08-01 00:00:00,Montana
11/15/2016-3/3/2017,2017-03-03 00:00:00,1 in Montana, https://media.dojmt.gov/wp-content/uploads/The-Hartford.pdf ,The Hartford,2017-09-26 00:00:00,https://dojmt.gov/consumer/consumers-known-data-breach-incidents/#,2016-11-15 00:00:00,Montana
8/28/2017-8/28/2017,2017-08-28 00:00:00,1 in Montana, https://media.dojmt.gov/wp-content/uploads/PerfectServe.pdf ,PerfectServe,2017-09-27 00:00:00,https://dojmt.gov/consumer/consumers-known-data-breach-incidents/#,2017-08-28 00:00:00,Montana
7/21/2017-7/21/2017,2017-07-21 00:00:00,43 in Montana, https://media.dojmt.gov/wp-content/uploads/Cheddars-Casual-Cafe.pdf ,Cheddar's Casual Cafe,2017-09-29 00:00:00,https://dojmt.gov/consumer/consumers-known-data-breach-incidents/#,2017-07-21 00:00:00,Montana
7/25/2017-7/28/2017,2017-07-28 00:00:00,4 in Montana, https://media.dojmt.gov/wp-content/uploads/Briggs-Stratton.pdf ,Briggs & Stratton,2017-09-29 00:00:00,https://dojmt.gov/consumer/consumers-known-data-breach-incidents/#,2017-07-25 00:00:00,Montana
6/1/2017-6/1/2017,2017-06-01 00:00:00,26 in Montana, https://media.dojmt.gov/wp-content/uploads/BSI-Financial-Services.pdf ,BSI Financial Services,2017-09-29 00:00:00,https://dojmt.gov/consumer/consumers-known-data-breach-incidents/#,2017-06-01 00:00:00,Montana
8/1/2017-8/30/2017,2017-08-30 00:00:00,291 in Montana, https://media.dojmt.gov/wp-content/uploads/FlexShopper.pdf ,FlexShopper,2017-10-03 00:00:00,https://dojmt.gov/consumer/consumers-known-data-breach-incidents/#,2017-08-01 00:00:00,Montana
6/20/2014-7/26/2017,2017-07-26 00:00:00,85 in Montana, https://media.dojmt.gov/wp-content/uploads/Online-Traffic-Schools.pdf ,Online Traffic Schools,2017-10-04 00:00:00,https://dojmt.gov/consumer/consumers-known-data-breach-incidents/#,2014-06-20 00:00:00,Montana
9/18/2017-9/18/2017,2017-09-18 00:00:00,Unknown in Montana, https://media.dojmt.gov/wp-content/uploads/Sonic.pdf ,Sonic,2017-10-04 00:00:00,https://dojmt.gov/consumer/consumers-known-data-breach-incidents/#,2017-09-18 00:00:00,Montana
9/5/2017-9/5/2017,2017-09-05 00:00:00,6 in Montana, https://media.dojmt.gov/wp-content/uploads/Cabrillo-Community-College.pdf ,Cabrillo Community College,2017-10-05 00:00:00,https://dojmt.gov/consumer/consumers-known-data-breach-incidents/#,2017-09-05 00:00:00,Montana
8/22/2017-9/15/2017,2017-09-15 00:00:00,1 in Montana, https://media.dojmt.gov/wp-content/uploads/Aegis-Living.pdf ,Aegis Living,2017-10-05 00:00:00,https://dojmt.gov/consumer/consumers-known-data-breach-incidents/#,2017-08-22 00:00:00,Montana
9/12/2017-9/15/2017,2017-09-15 00:00:00,1 in Montana, https://media.dojmt.gov/wp-content/uploads/Lake-Champlain-Chocolates.pdf ,Lake Champlain Chocolates,2017-10-05 00:00:00,https://dojmt.gov/consumer/consumers-known-data-breach-incidents/#,2017-09-12 00:00:00,Montana
5/27/2017-9/12/2017,2017-09-12 00:00:00,123 in Montana, https://media.dojmt.gov/wp-content/uploads/Cricut.pdf ,Cricut,2017-10-05 00:00:00,https://dojmt.gov/consumer/consumers-known-data-breach-incidents/#,2017-05-27 00:00:00,Montana
12/1/2014-12/31/2016,2016-12-31 00:00:00,2 in Montana, https://media.dojmt.gov/wp-content/uploads/Navy-Federal-Credit-Union.pdf ,Navy Federal Credit Union,2017-10-06 00:00:00,https://dojmt.gov/consumer/consumers-known-data-breach-incidents/#,2014-12-01 00:00:00,Montana
7/26/2016-8/9/2017,2017-08-09 00:00:00,1 in Montana, https://media.dojmt.gov/wp-content/uploads/Nutrex-Hawaii.pdf ,Nutrex Hawaii,2017-10-06 00:00:00,https://dojmt.gov/consumer/consumers-known-data-breach-incidents/#,2016-07-26 00:00:00,Montana
11/12/2016-9/6/2017,2017-09-06 00:00:00,495 in Montana, https://media.dojmt.gov/wp-content/uploads/Catholic-United-Financial.pdf ,Catholic United Financial,2017-10-06 00:00:00,https://dojmt.gov/consumer/consumers-known-data-breach-incidents/#,2016-11-12 00:00:00,Montana
8/25/2017-9/29/2017,2017-09-29 00:00:00,181 in Montana, https://media.dojmt.gov/wp-content/uploads/Tommie-Copper.pdf ,Tommie Copper,2017-10-06 00:00:00,https://dojmt.gov/consumer/consumers-known-data-breach-incidents/#,2017-08-25 00:00:00,Montana
7/27/2017-8/11/2017,2017-08-11 00:00:00,4 in Montana, https://media.dojmt.gov/wp-content/uploads/Rivermend.pdf ,RiverMend Health,2017-10-09 00:00:00,https://dojmt.gov/consumer/consumers-known-data-breach-incidents/#,2017-07-27 00:00:00,Montana
1/2/2017-8/9/2017,2017-08-09 00:00:00,6 in Montana, https://media.dojmt.gov/wp-content/uploads/ABC-Carpet-and-Home.pdf ,ABC Carpet and Home,2017-10-09 00:00:00,https://dojmt.gov/consumer/consumers-known-data-breach-incidents/#,2017-01-02 00:00:00,Montana
7/21/2017-8/9/2017,2017-08-09 00:00:00,4 in Montana, https://media.dojmt.gov/wp-content/uploads/Atlantic-Cigar-Company.pdf ,Atlantic Cigar Company,2017-10-10 00:00:00,https://dojmt.gov/consumer/consumers-known-data-breach-incidents/#,2017-07-21 00:00:00,Montana
9/26/2017-9/26/2017,2017-09-26 00:00:00,25 in Montana, https://media.dojmt.gov/wp-content/uploads/Droege-Computing-Service.pdf ,Droege Computing Service,2017-10-11 00:00:00,https://dojmt.gov/consumer/consumers-known-data-breach-incidents/#,2017-09-26 00:00:00,Montana
3/1/2017-7/31/2017,2017-07-31 00:00:00,3 in Montana, https://media.dojmt.gov/wp-content/uploads/Phillips-Temro-Industries.pdf ,Phillips & Temro Industries,2017-10-11 00:00:00,https://dojmt.gov/consumer/consumers-known-data-breach-incidents/#,2017-03-01 00:00:00,Montana
3/18/2017-7/2/2017,2017-07-02 00:00:00,14 in Montana, https://media.dojmt.gov/wp-content/uploads/Hyatt-Hotels.pdf ,Hyatt Hotels,2017-10-12 00:00:00,https://dojmt.gov/consumer/consumers-known-data-breach-incidents/#,2017-03-18 00:00:00,Montana
7/21/2017-8/9/2017,2017-08-09 00:00:00,2 in Montana, https://media.dojmt.gov/wp-content/uploads/West-Music-1.pdf ,West Music,2017-10-13 00:00:00,https://dojmt.gov/consumer/consumers-known-data-breach-incidents/#,2017-07-21 00:00:00,Montana
8/10/2016-3/9/2017,2017-03-09 00:00:00,3 in Montana, https://media.dojmt.gov/wp-content/uploads/Rivertide-Suites.pdf ,Rivertide Suites,2017-10-13 00:00:00,https://dojmt.gov/consumer/consumers-known-data-breach-incidents/#,2016-08-10 00:00:00,Montana
3/24/2017-8/21/2017,2017-08-21 00:00:00,2 in Montana, https://media.dojmt.gov/wp-content/uploads/International-Council-of-Shopping-Centers.pdf ,International Council of Shopping Centers,2017-10-16 00:00:00,https://dojmt.gov/consumer/consumers-known-data-breach-incidents/#,2017-03-24 00:00:00,Montana
9/9/2017-9/9/2017,2017-09-09 00:00:00,1 in Montana, https://media.dojmt.gov/wp-content/uploads/Mark-Schaefer-Associates-1.pdf ,Mark Schaefer Associates,2017-10-16 00:00:00,https://dojmt.gov/consumer/consumers-known-data-breach-incidents/#,2017-09-09 00:00:00,Montana
2/1/2016-10/16/2017,2017-10-16 00:00:00,1 in Montana, https://media.dojmt.gov/wp-content/uploads/Designers-and-Planners.pdf ,Designers and Planners,2017-10-16 00:00:00,https://dojmt.gov/consumer/consumers-known-data-breach-incidents/#,2016-02-01 00:00:00,Montana
10/1/2017-10/2/2017,2017-10-02 00:00:00,255 in Montana, https://media.dojmt.gov/wp-content/uploads/Pizza-Hut.pdf ,Pizza Hut,2017-10-16 00:00:00,https://dojmt.gov/consumer/consumers-known-data-breach-incidents/#,2017-10-01 00:00:00,Montana
1/14/2014-9/29/2017,2017-09-29 00:00:00,2 in Montana, https://media.dojmt.gov/wp-content/uploads/Coincafe.pdf ,Coincafe,2017-10-18 00:00:00,https://dojmt.gov/consumer/consumers-known-data-breach-incidents/#,2014-01-14 00:00:00,Montana
8/5/2017-8/7/2017,2017-08-07 00:00:00,1 in Montana, https://media.dojmt.gov/wp-content/uploads/LightHouse-Management-Services.pdf ,Lighthouse Management Services,2017-10-20 00:00:00,https://dojmt.gov/consumer/consumers-known-data-breach-incidents/#,2017-08-05 00:00:00,Montana
10/11/2016-10/11/2017,2017-10-11 00:00:00,1 in Montana, https://media.dojmt.gov/wp-content/uploads/Advisory-Research.pdf ,Advisory Research,2017-10-24 00:00:00,https://dojmt.gov/consumer/consumers-known-data-breach-incidents/#,2016-10-11 00:00:00,Montana
11/1/2016-9/30/2017,2017-09-30 00:00:00,1 in Montana, https://media.dojmt.gov/wp-content/uploads/Memory4Less.pdf ,Memory4Less,2017-10-24 00:00:00,https://dojmt.gov/consumer/consumers-known-data-breach-incidents/#,2016-11-01 00:00:00,Montana
5/29/2017-8/25/2017,2017-08-25 00:00:00,26 in Montana, https://media.dojmt.gov/wp-content/uploads/Interstate-Plastics.pdf ,Interstate Plastics,2017-10-27 00:00:00,https://dojmt.gov/consumer/consumers-known-data-breach-incidents/#,2017-05-29 00:00:00,Montana
10/10/2017-10/10/2017,2017-10-10 00:00:00,5 in Montana, https://media.dojmt.gov/wp-content/uploads/Workfront.pdf ,Workfront,2017-10-27 00:00:00,https://dojmt.gov/consumer/consumers-known-data-breach-incidents/#,2017-10-10 00:00:00,Montana
9/27/2017-9/27/2017,2017-09-27 00:00:00,2 in Montana, https://media.dojmt.gov/wp-content/uploads/Human-Good.pdf ,Human Good,2017-10-30 00:00:00,https://dojmt.gov/consumer/consumers-known-data-breach-incidents/#,2017-09-27 00:00:00,Montana
6/4/2016-8/26/2017,2017-08-26 00:00:00,1 in Montana, https://media.dojmt.gov/wp-content/uploads/Sonabank.pdf ,Sonabank,2017-10-31 00:00:00,https://dojmt.gov/consumer/consumers-known-data-breach-incidents/#,2016-06-04 00:00:00,Montana
8/1/2016-3/17/2017,2017-03-17 00:00:00,1 in Montana, https://media.dojmt.gov/wp-content/uploads/GlaxoSmithKline.pdf ,GlaxoSmithKline,2017-10-31 00:00:00,https://dojmt.gov/consumer/consumers-known-data-breach-incidents/#,2016-08-01 00:00:00,Montana
8/25/2016-9/15/2017,2017-09-15 00:00:00,24 in Montana, https://media.dojmt.gov/wp-content/uploads/Rain-Bird.pdf ,Rain Bird,2017-11-01 00:00:00,https://dojmt.gov/consumer/consumers-known-data-breach-incidents/#,2016-08-25 00:00:00,Montana
9/7/2017-9/7/2017,2017-09-07 00:00:00,84 in Montana, https://media.dojmt.gov/wp-content/uploads/Tween-Brands-1.pdf ,Tween Brands,2017-11-03 00:00:00,https://dojmt.gov/consumer/consumers-known-data-breach-incidents/#,2017-09-07 00:00:00,Montana
8/10/2016-3/9/2017,2017-03-09 00:00:00,3 in Montana, https://media.dojmt.gov/wp-content/uploads/Oxford.pdf ,Oxford,2017-11-03 00:00:00,https://dojmt.gov/consumer/consumers-known-data-breach-incidents/#,2016-08-10 00:00:00,Montana
6/26/2017-6/26/2017,2017-06-26 00:00:00,3 in Montana, https://media.dojmt.gov/wp-content/uploads/Little-River-Healthcare.pdf ,Little River Healthcare,2017-11-07 00:00:00,https://dojmt.gov/consumer/consumers-known-data-breach-incidents/#,2017-06-26 00:00:00,Montana
10/15/2016-10/31/2017,2017-10-31 00:00:00,4 in Montana, https://media.dojmt.gov/wp-content/uploads/Baylor-College-of-Medicine-2.pdf ,Baylor College of Medicine,2017-11-08 00:00:00,https://dojmt.gov/consumer/consumers-known-data-breach-incidents/#,2016-10-15 00:00:00,Montana
7/2/2017-10/10/2017,2017-10-10 00:00:00,6 in Montana, https://media.dojmt.gov/wp-content/uploads/InTouch-Credit-Union.pdf ,InTouch Credit Union,2017-11-08 00:00:00,https://dojmt.gov/consumer/consumers-known-data-breach-incidents/#,2017-07-02 00:00:00,Montana
8/10/2016-3/9/2017,2017-03-09 00:00:00,1 in Montana, https://media.dojmt.gov/wp-content/uploads/The-Whitehall-Hotel.pdf ,The Whitehall Hotel,2017-11-10 00:00:00,https://dojmt.gov/consumer/consumers-known-data-breach-incidents/#,2016-08-10 00:00:00,Montana
5/15/2017-7/25/2017,2017-07-25 00:00:00,3 in Montana, https://media.dojmt.gov/wp-content/uploads/HBO.pdf ,HBO,2017-11-13 00:00:00,https://dojmt.gov/consumer/consumers-known-data-breach-incidents/#,2017-05-15 00:00:00,Montana
6/30/2015-11/2/2017,2017-11-02 00:00:00,4 in Montana, https://media.dojmt.gov/wp-content/uploads/GCI-1.pdf ,GCI,2017-11-13 00:00:00,https://dojmt.gov/consumer/consumers-known-data-breach-incidents/#,2015-06-30 00:00:00,Montana
6/18/2016-9/19/2017,2017-09-19 00:00:00,4026 in Montana, https://media.dojmt.gov/wp-content/uploads/GNAC.pdf ,GNAC,2017-11-13 00:00:00,https://dojmt.gov/consumer/consumers-known-data-breach-incidents/#,2016-06-18 00:00:00,Montana
7/21/2017-7/28/2017,2017-07-28 00:00:00,1 in Montana, https://media.dojmt.gov/wp-content/uploads/Brinderson-LP.pdf ,Medical College of Wisconsin,2017-11-17 00:00:00,https://dojmt.gov/consumer/consumers-known-data-breach-incidents/#,2017-07-21 00:00:00,Montana
11/8/2017-11/8/2017,2017-11-08 00:00:00,3 in Montana, https://media.dojmt.gov/wp-content/uploads/Medical-College-of-Wisconsin.pdf ,Academy of Art University,2017-11-17 00:00:00,https://dojmt.gov/consumer/consumers-known-data-breach-incidents/#,2017-11-08 00:00:00,Montana
2/3/2017-10/24/2017,2017-10-24 00:00:00,21 in Montana, https://media.dojmt.gov/wp-content/uploads/Academy-of-Art-University-1.pdf ,Brinderson LP,2017-11-17 00:00:00,https://dojmt.gov/consumer/consumers-known-data-breach-incidents/#,2017-02-03 00:00:00,Montana
8/10/2016-3/9/2017,2017-03-09 00:00:00,4 in Montana, https://media.dojmt.gov/wp-content/uploads/JRK-Hotel-Group.pdf ,JRK Hotel Group,2017-11-20 00:00:00,https://dojmt.gov/consumer/consumers-known-data-breach-incidents/#,2016-08-10 00:00:00,Montana
10/13/2016-11/15/2016,2016-11-15 00:00:00,81 in Montana, https://media.dojmt.gov/wp-content/uploads/Uber-2.pdf ,Uber,2017-11-21 00:00:00,https://dojmt.gov/consumer/consumers-known-data-breach-incidents/#,2016-10-13 00:00:00,Montana
9/26/2017-9/26/2017,2017-09-26 00:00:00,1 in Montana, https://media.dojmt.gov/wp-content/uploads/Pulmonary-Specialists-of-Louisville.pdf ,Pulmonary Specialists of Louisville,2017-11-28 00:00:00,https://dojmt.gov/consumer/consumers-known-data-breach-incidents/#,2017-09-26 00:00:00,Montana
7/1/2017-10/6/2017,2017-10-06 00:00:00,32 in Montana, https://media.dojmt.gov/wp-content/uploads/Combat-Brands-2-1.pdf ,Combat Brands,2017-11-29 00:00:00,https://dojmt.gov/consumer/consumers-known-data-breach-incidents/#,2017-07-01 00:00:00,Montana
8/29/2017-11/3/2017,2017-11-03 00:00:00,1 in Montana, https://media.dojmt.gov/wp-content/uploads/IdeaStream.pdf ,IdeaStream,2017-11-30 00:00:00,https://dojmt.gov/consumer/consumers-known-data-breach-incidents/#,2017-08-29 00:00:00,Montana
9/22/2017-11/3/2017,2017-11-03 00:00:00,5 in Montana, https://media.dojmt.gov/wp-content/uploads/Amazing-Grass.pdf ,Amazing Grass,2017-11-30 00:00:00,https://dojmt.gov/consumer/consumers-known-data-breach-incidents/#,2017-09-22 00:00:00,Montana
6/16/2016-11/6/2017,2017-11-06 00:00:00,78 in Montana, https://media.dojmt.gov/wp-content/uploads/JAM-Paper-Envelope.pdf ,JAM Paper & Envelope,2017-12-01 00:00:00,https://dojmt.gov/consumer/consumers-known-data-breach-incidents/#,2016-06-16 00:00:00,Montana
10/5/2017-10/5/2017,2017-10-05 00:00:00,2 in Montana, https://media.dojmt.gov/wp-content/uploads/Bank-of-the-West.pdf ,Bank of the West,2017-12-05 00:00:00,https://dojmt.gov/consumer/consumers-known-data-breach-incidents/#,2017-10-05 00:00:00,Montana
6/22/2017-8/15/2017,2017-08-15 00:00:00,10 in Montana, https://media.dojmt.gov/wp-content/uploads/MFTStamps.pdf ,MFT Stamps (Gorilla),2017-12-07 00:00:00,https://dojmt.gov/consumer/consumers-known-data-breach-incidents/#,2017-06-22 00:00:00,Montana
10/7/2017-10/7/2017,2017-10-07 00:00:00,1 in Montana, https://media.dojmt.gov/wp-content/uploads/Eye-Physicians.pdf ,Eye Physicians,2017-12-07 00:00:00,https://dojmt.gov/consumer/consumers-known-data-breach-incidents/#,2017-10-07 00:00:00,Montana
10/21/2017-11/27/2017,2017-11-27 00:00:00,11 in Montana, https://media.dojmt.gov/wp-content/uploads/National-Capital-Poison-Center-1.pdf ,National Capital Poison Center,2017-12-08 00:00:00,https://dojmt.gov/consumer/consumers-known-data-breach-incidents/#,2017-10-21 00:00:00,Montana
9/13/2017-9/28/2017,2017-09-28 00:00:00,11 in Montana, https://media.dojmt.gov/wp-content/uploads/WEI-Mortgage.pdf ,WEI Mortgage,2017-12-08 00:00:00,https://dojmt.gov/consumer/consumers-known-data-breach-incidents/#,2017-09-13 00:00:00,Montana
11/27/2017-11/27/2017,2017-11-27 00:00:00,25 in Montana, https://media.dojmt.gov/wp-content/uploads/Farm-Bureau-Financial-Services.pdf ,Farm Bureau Financial Services,2017-12-08 00:00:00,https://dojmt.gov/consumer/consumers-known-data-breach-incidents/#,2017-11-27 00:00:00,Montana
12/1/2017-12/1/2017,2017-12-01 00:00:00,1 in Montana, https://media.dojmt.gov/wp-content/uploads/The-Board-of-Pensions-of-the-Presbyterian-Church-U.S.A.pdf ,The Board of Pensions of the Presbyterian Church (U.S.A.),2017-12-11 00:00:00,https://dojmt.gov/consumer/consumers-known-data-breach-incidents/#,2017-12-01 00:00:00,Montana
1/1/2014-11/10/2017,2017-11-10 00:00:00,275 in Montana, https://media.dojmt.gov/wp-content/uploads/TIO-Networks-USA-1.pdf ,"TIO Networks USA (Bank of America, PageOnce)",2017-12-12 00:00:00,https://dojmt.gov/consumer/consumers-known-data-breach-incidents/#,2014-01-01 00:00:00,Montana
10/10/2017-11/15/2017,2017-11-15 00:00:00,1 in Montana, https://media.dojmt.gov/wp-content/uploads/U-Haul-Co.-Solo-Tire.pdf ,U-Haul Co. (Solo Tire),2017-12-12 00:00:00,https://dojmt.gov/consumer/consumers-known-data-breach-incidents/#,2017-10-10 00:00:00,Montana
10/18/2015-10/18/2017,2017-10-18 00:00:00,1 in Montana, https://media.dojmt.gov/wp-content/uploads/Emory-Healthcare-UAriz.pdf ,Emory Healthcare (University of Arizona College of Medicine),2017-12-15 00:00:00,https://dojmt.gov/consumer/consumers-known-data-breach-incidents/#,2015-10-18 00:00:00,Montana
9/5/2015-11/2/2017,2017-11-02 00:00:00,2 in Montana, https://media.dojmt.gov/wp-content/uploads/TRS-Healthcare.pdf ,TRS Healthcare,2017-12-15 00:00:00,https://dojmt.gov/consumer/consumers-known-data-breach-incidents/#,2015-09-05 00:00:00,Montana
8/3/2017-9/27/2017,2017-09-27 00:00:00,3 in Montana, https://media.dojmt.gov/wp-content/uploads/DJI-Technology-Inc.pdf ,"DJI Technology, Inc.",2017-12-18 00:00:00,https://dojmt.gov/consumer/consumers-known-data-breach-incidents/#,2017-08-03 00:00:00,Montana
11/20/2017-12/15/2017,2017-12-15 00:00:00,1 in Montana, https://media.dojmt.gov/wp-content/uploads/Boeing-2.pdf ,The Boeing Company,2017-12-20 00:00:00,https://dojmt.gov/consumer/consumers-known-data-breach-incidents/#,2017-11-20 00:00:00,Montana
4/25/2017-12/11/2017,2017-12-11 00:00:00,41 in Montana, https://media.dojmt.gov/wp-content/uploads/Liveglam.pdf ,Liveglam,2017-12-29 00:00:00,https://dojmt.gov/consumer/consumers-known-data-breach-incidents/#,2017-04-25 00:00:00,Montana
12/2/2017-12/2/2017,2017-12-02 00:00:00,9 in Montana, https://media.dojmt.gov/wp-content/uploads/Multnomah-Athletic-Club.pdf ,Multnomah Athletic Club,2018-01-02 00:00:00,https://dojmt.gov/consumer/consumers-known-data-breach-incidents/#,2017-12-02 00:00:00,Montana
10/13/2017-10/13/2017,2017-10-13 00:00:00,1 in Montana, https://media.dojmt.gov/wp-content/uploads/Mr.-Cooper_Redacted.pdf ,Mr. Cooper,2018-01-05 00:00:00,https://dojmt.gov/consumer/consumers-known-data-breach-incidents/#,2017-10-13 00:00:00,Montana
4/23/2015-10/26/2017,2017-10-26 00:00:00,36 in Montana, https://media.dojmt.gov/wp-content/uploads/Beautyblinders.pdf ,Beautyblinders,2018-01-05 00:00:00,https://dojmt.gov/consumer/consumers-known-data-breach-incidents/#,2015-04-23 00:00:00,Montana
11/11/2017-11/11/2017,2017-11-11 00:00:00,202 in Montana, https://media.dojmt.gov/wp-content/uploads/Montana-State-University-Billings.pdf ,Montana State University Billings,2018-01-05 00:00:00,https://dojmt.gov/consumer/consumers-known-data-breach-incidents/#,2017-11-11 00:00:00,Montana
9/1/2017-11/13/2017,2017-11-13 00:00:00,Unknown in Montana, https://media.dojmt.gov/wp-content/uploads/Columbia-Falls-School-District.pdf ,Columbia Falls School District,2018-01-05 00:00:00,https://dojmt.gov/consumer/consumers-known-data-breach-incidents/#,2017-09-01 00:00:00,Montana
11/8/2017-11/8/2017,2017-11-08 00:00:00,5 in Montana, https://media.dojmt.gov/wp-content/uploads/Cetera-Advisors-LLC.pdf ,Cetera Advisors LLC,2018-01-08 00:00:00,https://dojmt.gov/consumer/consumers-known-data-breach-incidents/#,2017-11-08 00:00:00,Montana
11/29/2017-11/29/2017,2017-11-29 00:00:00,6 in Montana, https://media.dojmt.gov/wp-content/uploads/talentReef-Inc.pdf ,talentReef Inc,2018-01-09 00:00:00,https://dojmt.gov/consumer/consumers-known-data-breach-incidents/#,2017-11-29 00:00:00,Montana
7/18/2016-9/8/2017,2017-09-08 00:00:00,8 in Montana, https://media.dojmt.gov/wp-content/uploads/Broward-College.pdf ,Broward College,2018-01-10 00:00:00,https://dojmt.gov/consumer/consumers-known-data-breach-incidents/#,2016-07-18 00:00:00,Montana
11/1/2016-11/30/2017,2017-11-30 00:00:00,3 in Montana, https://media.dojmt.gov/wp-content/uploads/Alton-Lane.pdf ,Alton Lane,2018-01-10 00:00:00,https://dojmt.gov/consumer/consumers-known-data-breach-incidents/#,2016-11-01 00:00:00,Montana
11/1/2017-11/30/2017,2017-11-30 00:00:00,1 in Montana, https://media.dojmt.gov/wp-content/uploads/Capital-One-Bank.pdf ,Capital One Bank,2018-01-10 00:00:00,https://dojmt.gov/consumer/consumers-known-data-breach-incidents/#,2017-11-01 00:00:00,Montana
10/30/2017-11/13/2017,2017-11-13 00:00:00,2 in Montana, https://media.dojmt.gov/wp-content/uploads/Arthur-Ventures-Management-LLC.pdf ,Arthur Ventures Management LLC,2018-01-12 00:00:00,https://dojmt.gov/consumer/consumers-known-data-breach-incidents/#,2017-10-30 00:00:00,Montana
6/9/2017-10/2/2017,2017-10-02 00:00:00,249 in Montana, https://media.dojmt.gov/wp-content/uploads/Guaranteed-Rate-Inc..pdf ,"Guaranteed Rate, Inc.",2018-01-12 00:00:00,https://dojmt.gov/consumer/consumers-known-data-breach-incidents/#,2017-06-09 00:00:00,Montana
6/8/2017-12/22/2017,2017-12-22 00:00:00,Unknown in Montana, https://media.dojmt.gov/wp-content/uploads/Jasons-Deli-Inc.pdf ,"Jason's Deli, Inc",2018-01-12 00:00:00,https://dojmt.gov/consumer/consumers-known-data-breach-incidents/#,2017-06-08 00:00:00,Montana
10/12/2017-10/27/2017,2017-10-27 00:00:00,60 in Montana, https://media.dojmt.gov/wp-content/uploads/Pension-Fund.pdf ,Pension Fund of the Christian Church,2018-01-16 00:00:00,https://dojmt.gov/consumer/consumers-known-data-breach-incidents/#,2017-10-12 00:00:00,Montana
9/14/2017-9/18/2017,2017-09-18 00:00:00,1 in Montana, https://media.dojmt.gov/wp-content/uploads/Employer-Leasing-Company.pdf ,Employer Leasing Company,2018-01-18 00:00:00,https://dojmt.gov/consumer/consumers-known-data-breach-incidents/#,2017-09-14 00:00:00,Montana
12/5/2017-12/5/2017,2017-12-05 00:00:00,1 in Montana, https://media.dojmt.gov/wp-content/uploads/San-Diego-County-Office-of-Education.pdf ,San Diego County Office of Education,2018-01-18 00:00:00,https://dojmt.gov/consumer/consumers-known-data-breach-incidents/#,2017-12-05 00:00:00,Montana
7/19/2017-7/21/2017,2017-07-21 00:00:00,921 in Montana, https://media.dojmt.gov/wp-content/uploads/Rosewood-Hotel-Group-1.pdf ,QBE North America,2018-01-19 00:00:00,https://dojmt.gov/consumer/consumers-known-data-breach-incidents/#,2017-07-19 00:00:00,Montana
5/29/2016-1/11/2017,2017-01-11 00:00:00,5 in Montana, https://media.dojmt.gov/wp-content/uploads/Mindlance-Inc.-1.pdf ,Rosewood Hotel Group,2018-01-19 00:00:00,https://dojmt.gov/consumer/consumers-known-data-breach-incidents/#,2016-05-29 00:00:00,Montana
12/28/2017-12/29/2017,2017-12-29 00:00:00,2 in Montana, https://media.dojmt.gov/wp-content/uploads/Westminster-Ingleside-King-Farm-Pres-Retirement-Communities.pdf ,"Mindlance, Inc.",2018-01-19 00:00:00,https://dojmt.gov/consumer/consumers-known-data-breach-incidents/#,2017-12-28 00:00:00,Montana
11/21/2017-11/21/2017,2017-11-21 00:00:00,6 in Montana, https://media.dojmt.gov/wp-content/uploads/QBE-North-America-2.pdf ,"Westminster Ingleside King Farm Presbyterian Retirement Communities, Inc.",2018-01-19 00:00:00,https://dojmt.gov/consumer/consumers-known-data-breach-incidents/#,2017-11-21 00:00:00,Montana
11/17/2017-1/9/2018,2018-01-09 00:00:00,2 in Montana, https://media.dojmt.gov/wp-content/uploads/National-Registy-of-Emergency-Medical-Technicians.pdf ,National Registry of Emergency Medical Technicians,2018-01-25 00:00:00,https://dojmt.gov/consumer/consumers-known-data-breach-incidents/#,2017-11-17 00:00:00,Montana
10/31/2017-12/1/2017,2017-12-01 00:00:00,26 in Montana, https://media.dojmt.gov/wp-content/uploads/Goldleaf.pdf ,Goldleaf,2018-01-26 00:00:00,https://dojmt.gov/consumer/consumers-known-data-breach-incidents/#,2017-10-31 00:00:00,Montana
10/3/2017-12/22/2017,2017-12-22 00:00:00,2 in Montana, https://media.dojmt.gov/wp-content/uploads/RBC-Travelocity.pdf ,RBC Travelocity,2018-01-26 00:00:00,https://dojmt.gov/consumer/consumers-known-data-breach-incidents/#,2017-10-03 00:00:00,Montana
12/1/2017-12/15/2017,2017-12-15 00:00:00,12 in Montana, https://media.dojmt.gov/wp-content/uploads/KLX-Inc.pdf ,"KLX, Inc",2018-01-31 00:00:00,https://dojmt.gov/consumer/consumers-known-data-breach-incidents/#,2017-12-01 00:00:00,Montana
1/1/2016-1/18/2018,2018-01-18 00:00:00,1 in Montana, https://media.dojmt.gov/wp-content/uploads/Blink-Health-Inc..pdf ,Blink Health Inc.,2018-02-05 00:00:00,https://dojmt.gov/consumer/consumers-known-data-breach-incidents/#,2016-01-01 00:00:00,Montana
12/22/2017-12/22/2017,2017-12-22 00:00:00,605 in Montana, https://media.dojmt.gov/wp-content/uploads/PAR-Electrical-Contractors.pdf ,PAR Electrical Contractors,2018-02-05 00:00:00,https://dojmt.gov/consumer/consumers-known-data-breach-incidents/#,2017-12-22 00:00:00,Montana
9/21/2017-10/29/2017,2017-10-29 00:00:00,1 in Montana, https://media.dojmt.gov/wp-content/uploads/1st-Mariner-Bank.pdf ,First Mariner Bank,2018-02-05 00:00:00,https://dojmt.gov/consumer/consumers-known-data-breach-incidents/#,2017-09-21 00:00:00,Montana
1/25/2016-1/1/2018,2018-01-01 00:00:00,1 in Montana, https://media.dojmt.gov/wp-content/uploads/Kinetics-Systems-Inc.pdf ,Kinetics Systems Inc,2018-02-06 00:00:00,https://dojmt.gov/consumer/consumers-known-data-breach-incidents/#,2016-01-25 00:00:00,Montana
1/12/2018-1/12/2018,2018-01-12 00:00:00,1 in Montana, https://media.dojmt.gov/wp-content/uploads/Ameriprise-Financial-1.pdf ,Ameriprise Financial,2018-02-06 00:00:00,https://dojmt.gov/consumer/consumers-known-data-breach-incidents/#,2018-01-12 00:00:00,Montana
1/26/2018-1/26/2018,2018-01-26 00:00:00,4 in Montana, https://media.dojmt.gov/wp-content/uploads/Corporate-Employment-Resources-Inc..pdf ,"Corporate Employment Resources, Inc.",2018-02-08 00:00:00,https://dojmt.gov/consumer/consumers-known-data-breach-incidents/#,2018-01-26 00:00:00,Montana
12/4/2017-12/19/2017,2017-12-19 00:00:00,7 in Montana, https://media.dojmt.gov/wp-content/uploads/Makeup-Geek-LLC.pdf ,"Makeup Geek, LLC",2018-02-08 00:00:00,https://dojmt.gov/consumer/consumers-known-data-breach-incidents/#,2017-12-04 00:00:00,Montana
1/29/2018-1/29/2018,2018-01-29 00:00:00,2 in Montana, https://media.dojmt.gov/wp-content/uploads/Medical-Science-Computing-LLC.pdf ,"Medical Science and Computing, LLC",2018-02-13 00:00:00,https://dojmt.gov/consumer/consumers-known-data-breach-incidents/#,2018-01-29 00:00:00,Montana
1/26/2018-1/26/2018,2018-01-26 00:00:00,1 in Montana, https://media.dojmt.gov/wp-content/uploads/Thomas-Edison-State-University.pdf ,Thomas Edison State University,2018-02-13 00:00:00,https://dojmt.gov/consumer/consumers-known-data-breach-incidents/#,2018-01-26 00:00:00,Montana
12/6/2017-1/30/2018,2018-01-30 00:00:00,1 in Montana, https://media.dojmt.gov/wp-content/uploads/Flexible-Benefit-Service-Corporation.pdf ,"Flexible Benefit Service Corporation (""Flex"")",2018-02-14 00:00:00,https://dojmt.gov/consumer/consumers-known-data-breach-incidents/#,2017-12-06 00:00:00,Montana
1/22/2018-1/22/2018,2018-01-22 00:00:00,1 in Montana, https://media.dojmt.gov/wp-content/uploads/PACCAR.pdf ,PACCAR,2018-02-14 00:00:00,https://dojmt.gov/consumer/consumers-known-data-breach-incidents/#,2018-01-22 00:00:00,Montana
1/4/2018-1/18/2018,2018-01-18 00:00:00,19 in Montana, https://media.dojmt.gov/wp-content/uploads/Chapman-Mortgage-Services.pdf ,Chapman Mortgage Services (Motto Mortgage of Billings),2018-02-15 00:00:00,https://dojmt.gov/consumer/consumers-known-data-breach-incidents/#,2018-01-04 00:00:00,Montana
6/27/2016-12/21/2017,2017-12-21 00:00:00,9 in Montana, https://media.dojmt.gov/wp-content/uploads/LendKey.pdf ,"LendKey Technologies, Inc.",2018-02-15 00:00:00,https://dojmt.gov/consumer/consumers-known-data-breach-incidents/#,2016-06-27 00:00:00,Montana
11/16/2017-11/17/2017,2017-11-17 00:00:00,1 in Montana, https://media.dojmt.gov/wp-content/uploads/Bialy-Thomas-and-Associates.pdf ,Bialy/Thomas & Associates,2018-02-16 00:00:00,https://dojmt.gov/consumer/consumers-known-data-breach-incidents/#,2017-11-16 00:00:00,Montana
1/18/2018-1/18/2018,2018-01-18 00:00:00,200 in Montana, https://media.dojmt.gov/wp-content/uploads/Bed-Bath-Beyond.pdf ,Bed Bath & Beyond,2018-02-21 00:00:00,https://dojmt.gov/consumer/consumers-known-data-breach-incidents/#,2018-01-18 00:00:00,Montana
12/17/2017-12/17/2017,2017-12-17 00:00:00,4 in Montana, https://media.dojmt.gov/wp-content/uploads/Santa-Cruz-Biotechnology-Inc..pdf ,"Santa Cruz Biotechnology, Inc.",2018-02-22 00:00:00,https://dojmt.gov/consumer/consumers-known-data-breach-incidents/#,2017-12-17 00:00:00,Montana
1/29/2018-1/29/2018,2018-01-29 00:00:00,5 in Montana, https://media.dojmt.gov/wp-content/uploads/Walmart.pdf ,"Walmart, Inc.",2018-02-22 00:00:00,https://dojmt.gov/consumer/consumers-known-data-breach-incidents/#,2018-01-29 00:00:00,Montana
2/5/2018-2/5/2018,2018-02-05 00:00:00,7 in Montana, https://media.dojmt.gov/wp-content/uploads/University-of-WI.pdf ,University of Wisconsin-Superior,2018-02-22 00:00:00,https://dojmt.gov/consumer/consumers-known-data-breach-incidents/#,2018-02-05 00:00:00,Montana
12/1/2016-9/30/2017,2017-09-30 00:00:00,1 in Montana, https://media.dojmt.gov/wp-content/uploads/Active-Network.pdf ,Active Network,2018-02-23 00:00:00,https://dojmt.gov/consumer/consumers-known-data-breach-incidents/#,2016-12-01 00:00:00,Montana
1/20/2017-1/29/2018,2018-01-29 00:00:00,1289 in Montana, https://media.dojmt.gov/wp-content/uploads/North-40-Outfitters.pdf ,North 40 Outfitters,2018-02-23 00:00:00,https://dojmt.gov/consumer/consumers-known-data-breach-incidents/#,2017-01-20 00:00:00,Montana
1/5/2018-1/5/2018,2018-01-05 00:00:00,1 in Montana, https://media.dojmt.gov/wp-content/uploads/Country-Mutual-Insurance-Company-Country-Financial.pdf ,Country Mutual Insurance Company (Country Financial),2018-02-23 00:00:00,https://dojmt.gov/consumer/consumers-known-data-breach-incidents/#,2018-01-05 00:00:00,Montana
1/26/2018-1/26/2018,2018-01-26 00:00:00,2 in Montana, https://media.dojmt.gov/wp-content/uploads/Nelson-CPA.pdf ,Nelson CPA,2018-02-26 00:00:00,https://dojmt.gov/consumer/consumers-known-data-breach-incidents/#,2018-01-26 00:00:00,Montana
8/14/2017-8/18/2017,2017-08-18 00:00:00,Unknown in Montana, https://media.dojmt.gov/wp-content/uploads/FastHealth.pdf ,FastHealth,2018-02-27 00:00:00,https://dojmt.gov/consumer/consumers-known-data-breach-incidents/#,2017-08-14 00:00:00,Montana
2/21/2018-2/21/2018,2018-02-21 00:00:00,1 in Montana, https://media.dojmt.gov/wp-content/uploads/Association-for-Supervision-and-Curriculum-Development-ASCD.pdf ,Association for Supervision and Curriculum Development (ASCD),2018-02-27 00:00:00,https://dojmt.gov/consumer/consumers-known-data-breach-incidents/#,2018-02-21 00:00:00,Montana
12/7/2017-1/4/2018,2018-01-04 00:00:00,2 in Montana, https://media.dojmt.gov/wp-content/uploads/Ventiv-Technology-Inc.pdf ,Ventiv Technology Inc,2018-02-28 00:00:00,https://dojmt.gov/consumer/consumers-known-data-breach-incidents/#,2017-12-07 00:00:00,Montana
1/8/2018-1/8/2018,2018-01-08 00:00:00,1 in Montana, https://media.dojmt.gov/wp-content/uploads/St.-Peters-Surgery-and-Endoscopy-Center.pdf ,St. Peter's Ambulatory Surgery Center,2018-02-28 00:00:00,https://dojmt.gov/consumer/consumers-known-data-breach-incidents/#,2018-01-08 00:00:00,Montana
7/29/2017-9/7/2017,2017-09-07 00:00:00,377052 in Montana, https://media.dojmt.gov/wp-content/uploads/Centris-Federal-Credit-Union.pdf ,Equifax,2018-03-01 00:00:00,https://dojmt.gov/consumer/consumers-known-data-breach-incidents/#,2017-07-29 00:00:00,Montana
1/18/2018-1/18/2018,2018-01-18 00:00:00,5 in Montana, https://media.dojmt.gov/wp-content/uploads/Equifax-update-March-1-2018.pdf ,Centris Federal Credit Union,2018-03-01 00:00:00,https://dojmt.gov/consumer/consumers-known-data-breach-incidents/#,2018-01-18 00:00:00,Montana
2/2/2018-2/2/2018,2018-02-02 00:00:00,3 in Montana, https://media.dojmt.gov/wp-content/uploads/Beachbody.pdf ,"Beachbody, LLC",2018-03-02 00:00:00,https://dojmt.gov/consumer/consumers-known-data-breach-incidents/#,2018-02-02 00:00:00,Montana
1/31/2018-1/31/2018,2018-01-31 00:00:00,7 in Montana, https://media.dojmt.gov/wp-content/uploads/ASI-Construction-Notification-Letter.pdf ,ASI Construction LLC,2018-03-02 00:00:00,https://dojmt.gov/consumer/consumers-known-data-breach-incidents/#,2018-01-31 00:00:00,Montana
1/5/2018-2/2/2018,2018-02-02 00:00:00,2 in Montana, https://media.dojmt.gov/wp-content/uploads/Cary-Williams-CPA.pdf ,Cary E. Williams CPA,2018-03-02 00:00:00,https://dojmt.gov/consumer/consumers-known-data-breach-incidents/#,2018-01-05 00:00:00,Montana
1/22/2018-1/22/2018,2018-01-22 00:00:00,2 in Montana, https://media.dojmt.gov/wp-content/uploads/Curtin-Maritime-Corp.pdf ,Curtin Maritime Corp,2018-03-05 00:00:00,https://dojmt.gov/consumer/consumers-known-data-breach-incidents/#,2018-01-22 00:00:00,Montana
2/13/2018-2/13/2018,2018-02-13 00:00:00,4 in Montana, https://media.dojmt.gov/wp-content/uploads/Badger-Daylighting-LTD.pdf ,Badger Daylighting LTD,2018-03-05 00:00:00,https://dojmt.gov/consumer/consumers-known-data-breach-incidents/#,2018-02-13 00:00:00,Montana
10/27/2017-12/23/2017,2017-12-23 00:00:00,9 in Montana, https://media.dojmt.gov/wp-content/uploads/Interstate-Plastics-2nd-notice.pdf ,Interstate Plastics,2018-03-06 00:00:00,https://dojmt.gov/consumer/consumers-known-data-breach-incidents/#,2017-10-27 00:00:00,Montana
12/26/2017-1/12/2018,2018-01-12 00:00:00,36 in Montana, https://media.dojmt.gov/wp-content/uploads/Fresno-State.pdf ,Fresno State,2018-03-06 00:00:00,https://dojmt.gov/consumer/consumers-known-data-breach-incidents/#,2017-12-26 00:00:00,Montana
1/2/2018-2/22/2018,2018-02-22 00:00:00,3 in Montana, https://media.dojmt.gov/wp-content/uploads/Chopra-Enterprises-LLC.pdf ,Chopra Enterprises LLC,2018-03-06 00:00:00,https://dojmt.gov/consumer/consumers-known-data-breach-incidents/#,2018-01-02 00:00:00,Montana
8/1/2017-8/1/2017,2017-08-01 00:00:00,47 in Montana, https://media.dojmt.gov/wp-content/uploads/Food-Industry-Self-Insurance-Fund.pdf ,ABM Industries,2018-03-08 00:00:00,https://dojmt.gov/consumer/consumers-known-data-breach-incidents/#,2017-08-01 00:00:00,Montana
2/7/2018-2/7/2018,2018-02-07 00:00:00,1 in Montana, https://media.dojmt.gov/wp-content/uploads/CNU-Online-Holdings-LLC-NetCredit.pdf ,Food Industry Self Insurance Fund,2018-03-08 00:00:00,https://dojmt.gov/consumer/consumers-known-data-breach-incidents/#,2018-02-07 00:00:00,Montana
2/20/2018-2/20/2018,2018-02-20 00:00:00,6 in Montana, https://media.dojmt.gov/wp-content/uploads/ABM-Industries-1.pdf ,"CNU Online Holdings, LLC d/b/a Net Credit",2018-03-08 00:00:00,https://dojmt.gov/consumer/consumers-known-data-breach-incidents/#,2018-02-20 00:00:00,Montana
2/22/2018-2/22/2018,2018-02-22 00:00:00,5 in Montana, https://media.dojmt.gov/wp-content/uploads/Clarfeld-Financial-Advisors.pdf ,Clarfeld Financial Advisors,2018-03-09 00:00:00,https://dojmt.gov/consumer/consumers-known-data-breach-incidents/#,2018-02-22 00:00:00,Montana
3/2/2018-3/2/2018,2018-03-02 00:00:00,1 in Montana, https://media.dojmt.gov/wp-content/uploads/Dover-Business-Services.pdf ,Dover Business Services (DBS),2018-03-09 00:00:00,https://dojmt.gov/consumer/consumers-known-data-breach-incidents/#,2018-03-02 00:00:00,Montana
2/26/2018-2/26/2018,2018-02-26 00:00:00,1 in Montana, https://media.dojmt.gov/wp-content/uploads/TravelCorp.pdf ,The Travel Corporation (TravelCorp),2018-03-09 00:00:00,https://dojmt.gov/consumer/consumers-known-data-breach-incidents/#,2018-02-26 00:00:00,Montana
1/13/2018-2/13/2018,2018-02-13 00:00:00,7 in Montana, https://media.dojmt.gov/wp-content/uploads/DiLorenzo-CPA.pdf ,DiLorenzo CPA,2018-03-09 00:00:00,https://dojmt.gov/consumer/consumers-known-data-breach-incidents/#,2018-01-13 00:00:00,Montana
2/25/2018-2/25/2018,2018-02-25 00:00:00,1 in Montana, https://media.dojmt.gov/wp-content/uploads/Intuit-Inc.pdf ,Intuit inc,2018-03-14 00:00:00,https://dojmt.gov/consumer/consumers-known-data-breach-incidents/#,2018-02-25 00:00:00,Montana
1/21/2018-2/1/2018,2018-02-01 00:00:00,13 in Montana, https://media.dojmt.gov/wp-content/uploads/Nampa-School-District-1.pdf ,Nampa School District,2018-03-14 00:00:00,https://dojmt.gov/consumer/consumers-known-data-breach-incidents/#,2018-01-21 00:00:00,Montana
11/1/2017-2/14/2018,2018-02-14 00:00:00,2 in Montana, https://media.dojmt.gov/wp-content/uploads/Island-Outdoor-LLC.pdf ,Island Outdoor LLC,2018-03-15 00:00:00,https://dojmt.gov/consumer/consumers-known-data-breach-incidents/#,2017-11-01 00:00:00,Montana
1/17/2018-3/9/2018,2018-03-09 00:00:00,1 in Montana, https://media.dojmt.gov/wp-content/uploads/Skamania-Public-Utility-District.pdf ,Skamania Public Utility District,2018-03-16 00:00:00,https://dojmt.gov/consumer/consumers-known-data-breach-incidents/#,2018-01-17 00:00:00,Montana
1/18/2018-1/18/2018,2018-01-18 00:00:00,3 in Montana, https://media.dojmt.gov/wp-content/uploads/GY-Agemni-LLC.pdf ,GY Agemni LLC,2018-03-16 00:00:00,https://dojmt.gov/consumer/consumers-known-data-breach-incidents/#,2018-01-18 00:00:00,Montana
3/15/2017-1/30/2018,2018-01-30 00:00:00,99 in Montana, https://media.dojmt.gov/wp-content/uploads/Bronson-LLC.pdf ,Bronson Nutritionals LLC,2018-03-19 00:00:00,https://dojmt.gov/consumer/consumers-known-data-breach-incidents/#,2017-03-15 00:00:00,Montana
9/1/2017-11/13/2017,2017-11-13 00:00:00,1125 in Montana, https://media.dojmt.gov/wp-content/uploads/Columbia-Falls-School-District-2nd-Notice.pdf ,Columbia Falls School District,2018-03-19 00:00:00,https://dojmt.gov/consumer/consumers-known-data-breach-incidents/#,2017-09-01 00:00:00,Montana
3/2/2018-3/2/2018,2018-03-02 00:00:00,1 in Montana, https://media.dojmt.gov/wp-content/uploads/Community-First-Bank.pdf ,Community First Bank,2018-03-20 00:00:00,https://dojmt.gov/consumer/consumers-known-data-breach-incidents/#,2018-03-02 00:00:00,Montana
9/20/2017-9/20/2017,2017-09-20 00:00:00,1 in Montana, https://media.dojmt.gov/wp-content/uploads/Clinical-Pathology-Laboratories-Southeast-Inc.pdf ,Clinical Pathology Laboratories Southeast Inc,2018-03-21 00:00:00,https://dojmt.gov/consumer/consumers-known-data-breach-incidents/#,2017-09-20 00:00:00,Montana
10/31/2017-2/1/2018,2018-02-01 00:00:00,16 in Montana, https://media.dojmt.gov/wp-content/uploads/Bigfoot.pdf ,Bigfoot Gun Belts,2018-03-23 00:00:00,https://dojmt.gov/consumer/consumers-known-data-breach-incidents/#,2017-10-31 00:00:00,Montana
1/31/2018-2/23/2018,2018-02-23 00:00:00,2 in Montana, https://media.dojmt.gov/wp-content/uploads/Northwest-Asset-Managment.pdf ,Northwest Asset Management,2018-03-23 00:00:00,https://dojmt.gov/consumer/consumers-known-data-breach-incidents/#,2018-01-31 00:00:00,Montana
2/16/2018-2/16/2018,2018-02-16 00:00:00,1 in Montana, https://media.dojmt.gov/wp-content/uploads/King-Associates-CPA-P.C..pdf ,"Kings & Associates CPA, PC",2018-03-23 00:00:00,https://dojmt.gov/consumer/consumers-known-data-breach-incidents/#,2018-02-16 00:00:00,Montana
2/22/2017-3/5/2018,2018-03-05 00:00:00,169 in Montana, https://media.dojmt.gov/wp-content/uploads/Manduka.pdf ,Manduka,2018-03-26 00:00:00,https://dojmt.gov/consumer/consumers-known-data-breach-incidents/#,2017-02-22 00:00:00,Montana
4/1/2017-8/31/2017,2017-08-31 00:00:00,2 in Montana, https://media.dojmt.gov/wp-content/uploads/JC-Penny.pdf ,JC Penny,2018-03-27 00:00:00,https://dojmt.gov/consumer/consumers-known-data-breach-incidents/#,2017-04-01 00:00:00,Montana
2/16/2017-3/22/2018,2018-03-22 00:00:00,1 in Montana, https://media.dojmt.gov/wp-content/uploads/Mintie-Corporation.pdf ,Mintie Corporation,2018-03-27 00:00:00,https://dojmt.gov/consumer/consumers-known-data-breach-incidents/#,2017-02-16 00:00:00,Montana
2/11/2018-2/26/2018,2018-02-26 00:00:00,1 in Montana, https://media.dojmt.gov/wp-content/uploads/Branton-de-Jong-and-Associates.pdf ,Branton de Jong and Associates,2018-03-27 00:00:00,https://dojmt.gov/consumer/consumers-known-data-breach-incidents/#,2018-02-11 00:00:00,Montana
9/1/2017-3/1/2018,2018-03-01 00:00:00,88 in Montana, https://media.dojmt.gov/wp-content/uploads/Fred-Usinger-Inc.pdf ,Fred Usinger Inc,2018-03-29 00:00:00,https://dojmt.gov/consumer/consumers-known-data-breach-incidents/#,2017-09-01 00:00:00,Montana
2/10/2017-2/12/2018,2018-02-12 00:00:00,5 in Montana, https://media.dojmt.gov/wp-content/uploads/The-Retirement-Advantage-Inc.pdf ,The Retirement Advantage Inc,2018-03-29 00:00:00,https://dojmt.gov/consumer/consumers-known-data-breach-incidents/#,2017-02-10 00:00:00,Montana
11/1/2017-2/20/2018,2018-02-20 00:00:00,23 in Montana, https://media.dojmt.gov/wp-content/uploads/Funding-Circle-Dun-Bradstreet-Inc..pdf ,"Funding Circle USA, Inc. (Dun & Bradstreet, Inc.)",2018-03-30 00:00:00,https://dojmt.gov/consumer/consumers-known-data-breach-incidents/#,2017-11-01 00:00:00,Montana
7/6/2017-10/13/2017,2017-10-13 00:00:00,1 in Montana, https://media.dojmt.gov/wp-content/uploads/ThermoFisher-Scientific.pdf ,ThermoFisher Scientific,2018-03-30 00:00:00,https://dojmt.gov/consumer/consumers-known-data-breach-incidents/#,2017-07-06 00:00:00,Montana
1/23/2018-2/26/2018,2018-02-26 00:00:00,6 in Montana, https://media.dojmt.gov/wp-content/uploads/Mendes-Haney-LLP.pdf ,Mendes & Haney LLP,2018-03-30 00:00:00,https://dojmt.gov/consumer/consumers-known-data-breach-incidents/#,2018-01-23 00:00:00,Montana
1/29/2018-2/9/2018,2018-02-09 00:00:00,2 in Montana, https://media.dojmt.gov/wp-content/uploads/Lincoln-Financial-Group.pdf ,Lincoln Financial Group,2018-04-03 00:00:00,https://dojmt.gov/consumer/consumers-known-data-breach-incidents/#,2018-01-29 00:00:00,Montana
3/30/2018-3/30/2018,2018-03-30 00:00:00,4 in Montana, https://media.dojmt.gov/wp-content/uploads/Bearing-Distributors-Inc.-BDI.pdf ,"Bearing Distributors, Inc. (BDI)",2018-04-06 00:00:00,https://dojmt.gov/consumer/consumers-known-data-breach-incidents/#,2018-03-30 00:00:00,Montana
2/21/2018-2/21/2018,2018-02-21 00:00:00,2 in Montana, https://media.dojmt.gov/wp-content/uploads/Archbright.pdf ,Archbright,2018-04-06 00:00:00,https://dojmt.gov/consumer/consumers-known-data-breach-incidents/#,2018-02-21 00:00:00,Montana
3/15/2018-3/15/2018,2018-03-15 00:00:00,5 in Montana, https://media.dojmt.gov/wp-content/uploads/Blue-Beacon.pdf ,Blue Beacon International,2018-04-06 00:00:00,https://dojmt.gov/consumer/consumers-known-data-breach-incidents/#,2018-03-15 00:00:00,Montana
6/6/2017-6/6/2017,2017-06-06 00:00:00,55 in Montana, https://media.dojmt.gov/wp-content/uploads/Buxbaum-Daue.pdf ,Buxbaum Daue PLLC,2018-04-11 00:00:00,https://dojmt.gov/consumer/consumers-known-data-breach-incidents/#,2017-06-06 00:00:00,Montana
2/20/2018-3/15/2018,2018-03-15 00:00:00,7 in Montana, https://media.dojmt.gov/wp-content/uploads/Pierre-Fabre.pdf ,"Pierre Fabre (PF@-Com, Inc.)",2018-04-11 00:00:00,https://dojmt.gov/consumer/consumers-known-data-breach-incidents/#,2018-02-20 00:00:00,Montana
9/26/2017-10/12/2017,2017-10-12 00:00:00,711 in Montana, https://media.dojmt.gov/wp-content/uploads/Best-Buy.pdf ,"Best Buy Co., Inc.",2018-04-12 00:00:00,https://dojmt.gov/consumer/consumers-known-data-breach-incidents/#,2017-09-26 00:00:00,Montana
9/26/2017-10/12/2017,2017-10-12 00:00:00,6310 in Montana, https://media.dojmt.gov/wp-content/uploads/Delta-Air-Lines.pdf ,Delta Air Lines,2018-04-12 00:00:00,https://dojmt.gov/consumer/consumers-known-data-breach-incidents/#,2017-09-26 00:00:00,Montana
10/31/2017-10/31/2017,2017-10-31 00:00:00,2 in Montana, https://media.dojmt.gov/wp-content/uploads/Golter-Law-Office.pdf ,Golter Law Office,2018-04-13 00:00:00,https://dojmt.gov/consumer/consumers-known-data-breach-incidents/#,2017-10-31 00:00:00,Montana
10/20/2017-12/15/2017,2017-12-15 00:00:00,285 in Montana, https://media.dojmt.gov/wp-content/uploads/MedWatch.pdf ,"MedWatch, LLC",2018-04-13 00:00:00,https://dojmt.gov/consumer/consumers-known-data-breach-incidents/#,2017-10-20 00:00:00,Montana
3/14/2018-3/14/2018,2018-03-14 00:00:00,182 in Montana, https://media.dojmt.gov/wp-content/uploads/Inogen.pdf ,"Inogen, Inc.",2018-04-13 00:00:00,https://dojmt.gov/consumer/consumers-known-data-breach-incidents/#,2018-03-14 00:00:00,Montana
8/1/2017-12/1/2017,2017-12-01 00:00:00,6 in Montana, https://media.dojmt.gov/wp-content/uploads/Tara-at-Home.pdf ,Tara at Home (Temp=Tations LLC),2018-04-16 00:00:00,https://dojmt.gov/consumer/consumers-known-data-breach-incidents/#,2017-08-01 00:00:00,Montana
9/26/2017-10/12/2017,2017-10-12 00:00:00,65 in Montana, https://media.dojmt.gov/wp-content/uploads/Grainger.pdf ,"Grainger, Inc.",2018-04-17 00:00:00,https://dojmt.gov/consumer/consumers-known-data-breach-incidents/#,2017-09-26 00:00:00,Montana
3/16/2018-3/16/2018,2018-03-16 00:00:00,1 in Montana, https://media.dojmt.gov/wp-content/uploads/TIAA-1.pdf ,TIAA,2018-04-17 00:00:00,https://dojmt.gov/consumer/consumers-known-data-breach-incidents/#,2018-03-16 00:00:00,Montana
4/20/2015-1/16/2018,2018-01-16 00:00:00,1 in Montana, https://media.dojmt.gov/wp-content/uploads/Strategic-Analysis.pdf ,"Strategic Analysis, Inc.",2018-04-19 00:00:00,https://dojmt.gov/consumer/consumers-known-data-breach-incidents/#,2015-04-20 00:00:00,Montana
10/15/2017-10/15/2017,2017-10-15 00:00:00,5 in Montana, https://media.dojmt.gov/wp-content/uploads/AEL.pdf ,American Esoteric Laboratories (AEL),2018-04-20 00:00:00,https://dojmt.gov/consumer/consumers-known-data-breach-incidents/#,2017-10-15 00:00:00,Montana
2/23/2018-2/23/2018,2018-02-23 00:00:00,3 in Montana, https://media.dojmt.gov/wp-content/uploads/Capital-Digestive-Care.pdf ,Capital Digestive Care,2018-04-23 00:00:00,https://dojmt.gov/consumer/consumers-known-data-breach-incidents/#,2018-02-23 00:00:00,Montana
3/11/2018-3/11/2018,2018-03-11 00:00:00,140 in Montana, https://media.dojmt.gov/wp-content/uploads/MCR-Investors-LLC.pdf ,MCR Investors LLC,2018-04-23 00:00:00,https://dojmt.gov/consumer/consumers-known-data-breach-incidents/#,2018-03-11 00:00:00,Montana
9/27/2017-10/12/2017,2017-10-12 00:00:00,268 in Montana, https://media.dojmt.gov/wp-content/uploads/Sears-Holding-Kmart.pdf ,Sears Holdings (Kmart.com),2018-04-25 00:00:00,https://dojmt.gov/consumer/consumers-known-data-breach-incidents/#,2017-09-27 00:00:00,Montana
3/23/2018-3/23/2018,2018-03-23 00:00:00,4 in Montana, https://media.dojmt.gov/wp-content/uploads/CashNetUSA.pdf ,CashNetUSA,2018-04-27 00:00:00,https://dojmt.gov/consumer/consumers-known-data-breach-incidents/#,2018-03-23 00:00:00,Montana
12/2/2017-1/4/2018,2018-01-04 00:00:00,3 in Montana, https://media.dojmt.gov/wp-content/uploads/Childrens-Mercy-Hospital-2.pdf ,Children's Mercy Hospital,2018-04-30 00:00:00,https://dojmt.gov/consumer/consumers-known-data-breach-incidents/#,2017-12-02 00:00:00,Montana
10/19/2017-11/9/2017,2017-11-09 00:00:00,3 in Montana, https://media.dojmt.gov/wp-content/uploads/Building-Profits-LLC.pdf ,Building Profits LLC,2018-04-30 00:00:00,https://dojmt.gov/consumer/consumers-known-data-breach-incidents/#,2017-10-19 00:00:00,Montana
2/9/2018-2/9/2018,2018-02-09 00:00:00,17 in Montana, https://media.dojmt.gov/wp-content/uploads/Blattner-Energy-Inc..pdf ,"Blattner Energy, Inc.",2018-04-30 00:00:00,https://dojmt.gov/consumer/consumers-known-data-breach-incidents/#,2018-02-09 00:00:00,Montana
2/28/2018-2/28/2018,2018-02-28 00:00:00,2 in Montana, https://media.dojmt.gov/wp-content/uploads/SA-Stone-Wealth-1.pdf ,SA Stone Wealth,2018-04-30 00:00:00,https://dojmt.gov/consumer/consumers-known-data-breach-incidents/#,2018-02-28 00:00:00,Montana
6/15/2017-4/6/2018,2018-04-06 00:00:00,18 in Montana, https://media.dojmt.gov/wp-content/uploads/Bennett-Thrasher-LLP.pdf ,Bennett Thrasher LLP,2018-04-30 00:00:00,https://dojmt.gov/consumer/consumers-known-data-breach-incidents/#,2017-06-15 00:00:00,Montana
2/20/2018-2/28/2018,2018-02-28 00:00:00,3 in Montana, https://media.dojmt.gov/wp-content/uploads/LPL-Financial-LLC-Update-4-30-18.pdf ,LPL Financial LLC,2018-04-30 00:00:00,https://dojmt.gov/consumer/consumers-known-data-breach-incidents/#,2018-02-20 00:00:00,Montana
4/15/2018-4/15/2018,2018-04-15 00:00:00,29 in Montana, https://media.dojmt.gov/wp-content/uploads/SunTrust-2.pdf ,SunTrust Bank,2018-05-02 00:00:00,https://dojmt.gov/consumer/consumers-known-data-breach-incidents/#,2018-04-15 00:00:00,Montana
10/1/2017-12/22/2017,2017-12-22 00:00:00,634 in Montana, https://media.dojmt.gov/wp-content/uploads/Orbitz-5-7-18-1.pdf ,"Orbitz (American Express, RBC Royal Bank, Interval International, Inc., World Travel Holdings, Inc.Alaska Airline, Southwest Airline)",2018-05-04 00:00:00,https://dojmt.gov/consumer/consumers-known-data-breach-incidents/#,2017-10-01 00:00:00,Montana
4/25/2018-4/25/2018,2018-04-25 00:00:00,1 in Montana, https://media.dojmt.gov/wp-content/uploads/DigiPen.pdf ,DigiPen Institute of Technology,2018-05-07 00:00:00,https://dojmt.gov/consumer/consumers-known-data-breach-incidents/#,2018-04-25 00:00:00,Montana
3/18/2018-3/18/2018,2018-03-18 00:00:00,1 in Montana, https://media.dojmt.gov/wp-content/uploads/Malleys-Chocolates.pdf ,Malley's Chocolates,2018-05-07 00:00:00,https://dojmt.gov/consumer/consumers-known-data-breach-incidents/#,2018-03-18 00:00:00,Montana
11/19/2017-2/16/2018,2018-02-16 00:00:00,29 in Montana, https://media.dojmt.gov/wp-content/uploads/RENA.pdf ,"Rail Europe North America, Inc. (RENA)",2018-05-07 00:00:00,https://dojmt.gov/consumer/consumers-known-data-breach-incidents/#,2017-11-19 00:00:00,Montana
11/22/2017-12/8/2017,2017-12-08 00:00:00,22 in Montana, https://media.dojmt.gov/wp-content/uploads/CPT-Group-Inc..pdf ,"CPT Group, Inc.",2018-05-08 00:00:00,https://dojmt.gov/consumer/consumers-known-data-breach-incidents/#,2017-11-22 00:00:00,Montana
3/9/2018-3/9/2018,2018-03-09 00:00:00,1 in Montana, https://media.dojmt.gov/wp-content/uploads/USACS.pdf ,"USACS Management Group, Ltd.",2018-05-08 00:00:00,https://dojmt.gov/consumer/consumers-known-data-breach-incidents/#,2018-03-09 00:00:00,Montana
1/10/2018-3/25/2018,2018-03-25 00:00:00,2 in Montana, https://media.dojmt.gov/wp-content/uploads/Deephaven.pdf ,Deephaven Mortgage LLC,2018-05-08 00:00:00,https://dojmt.gov/consumer/consumers-known-data-breach-incidents/#,2018-01-10 00:00:00,Montana
12/31/2017-1/31/2018,2018-01-31 00:00:00,1017 in Montana, https://media.dojmt.gov/wp-content/uploads/Global-University.pdf ,Global University,2018-05-08 00:00:00,https://dojmt.gov/consumer/consumers-known-data-breach-incidents/#,2017-12-31 00:00:00,Montana
1/10/2018-2/8/2018,2018-02-08 00:00:00,3 in Montana, https://media.dojmt.gov/wp-content/uploads/Equias.pdf ,"Equias Alliance, LLC",2018-05-08 00:00:00,https://dojmt.gov/consumer/consumers-known-data-breach-incidents/#,2018-01-10 00:00:00,Montana
4/26/2018-4/29/2018,2018-04-29 00:00:00,8 in Montana, https://media.dojmt.gov/wp-content/uploads/Farmgirl-Flowers.pdf ,Farmgirl Flowers,2018-05-09 00:00:00,https://dojmt.gov/consumer/consumers-known-data-breach-incidents/#,2018-04-26 00:00:00,Montana
3/26/2018-3/26/2018,2018-03-26 00:00:00,1 in Montana, https://media.dojmt.gov/wp-content/uploads/Melissa-James-Bookkeeping-Tax.pdf ,"Melissa James, EA, LLC",2018-05-09 00:00:00,https://dojmt.gov/consumer/consumers-known-data-breach-incidents/#,2018-03-26 00:00:00,Montana
4/12/2018-4/19/2018,2018-04-19 00:00:00,3908 in Montana, https://media.dojmt.gov/wp-content/uploads/TaskRabbit.pdf ,"TaskRabbit, Inc.",2018-05-09 00:00:00,https://dojmt.gov/consumer/consumers-known-data-breach-incidents/#,2018-04-12 00:00:00,Montana
4/18/2018-4/18/2018,2018-04-18 00:00:00,2 in Montana, https://media.dojmt.gov/wp-content/uploads/Seterus.pdf ,Seterus,2018-05-10 00:00:00,https://dojmt.gov/consumer/consumers-known-data-breach-incidents/#,2018-04-18 00:00:00,Montana
9/27/2016-3/18/2018,2018-03-18 00:00:00,28 in Montana, https://media.dojmt.gov/wp-content/uploads/LifeBridge-Health.pdf ,LifeBridge Health,2018-05-15 00:00:00,https://dojmt.gov/consumer/consumers-known-data-breach-incidents/#,2016-09-27 00:00:00,Montana
1/16/2018-1/16/2018,2018-01-16 00:00:00,2 in Montana, https://media.dojmt.gov/wp-content/uploads/University-of-Toledo.pdf ,University of Toledo,2018-05-16 00:00:00,https://dojmt.gov/consumer/consumers-known-data-breach-incidents/#,2018-01-16 00:00:00,Montana
5/9/2018-5/9/2018,2018-05-09 00:00:00,1 in Montana, https://media.dojmt.gov/wp-content/uploads/Cactus-Wellhead-LLC.pdf ,"Cactus Wellhead, LLC",2018-05-17 00:00:00,https://dojmt.gov/consumer/consumers-known-data-breach-incidents/#,2018-05-09 00:00:00,Montana
3/1/2018-4/30/2018,2018-04-30 00:00:00,Unknown in Montana, https://media.dojmt.gov/wp-content/uploads/Brinker-International-Chilis.pdf ,Brinker International (Chili's),2018-05-18 00:00:00,https://dojmt.gov/consumer/consumers-known-data-breach-incidents/#,2018-03-01 00:00:00,Montana
1/15/2015-2/9/2015,2015-02-09 00:00:00,90 in Montana, https://media.dojmt.gov/wp-content/uploads/Bombas.pdf ,"Bombas, LLC",2018-05-18 00:00:00,https://dojmt.gov/consumer/consumers-known-data-breach-incidents/#,2015-01-15 00:00:00,Montana
1/22/2018-1/22/2018,2018-01-22 00:00:00,1 in Montana, https://media.dojmt.gov/wp-content/uploads/Crius.pdf ,"Crius Energy, LLC",2018-05-18 00:00:00,https://dojmt.gov/consumer/consumers-known-data-breach-incidents/#,2018-01-22 00:00:00,Montana
4/26/2018-5/8/2018,2018-05-08 00:00:00,4 in Montana, https://media.dojmt.gov/wp-content/uploads/International-Management-Advisors-Ltd..pdf ,"International Management Advisors, Ltd.",2018-05-18 00:00:00,https://dojmt.gov/consumer/consumers-known-data-breach-incidents/#,2018-04-26 00:00:00,Montana
9/1/2017-9/1/2017,2017-09-01 00:00:00,1 in Montana, https://media.dojmt.gov/wp-content/uploads/Coca-Cola.pdf ,The Coca-Cola Company,2018-05-21 00:00:00,https://dojmt.gov/consumer/consumers-known-data-breach-incidents/#,2017-09-01 00:00:00,Montana
3/7/2018-3/7/2018,2018-03-07 00:00:00,4 in Montana, https://media.dojmt.gov/wp-content/uploads/Employee-Benefits-Corporation.pdf ,Employee Benefits Corporation,2018-05-22 00:00:00,https://dojmt.gov/consumer/consumers-known-data-breach-incidents/#,2018-03-07 00:00:00,Montana
3/23/2018-3/23/2018,2018-03-23 00:00:00,1 in Montana, https://media.dojmt.gov/wp-content/uploads/Medical-Center-of-Houston.pdf ,"Medical Clinic of Houston, L.L.P.",2018-05-22 00:00:00,https://dojmt.gov/consumer/consumers-known-data-breach-incidents/#,2018-03-23 00:00:00,Montana
3/4/2018-3/5/2018,2018-03-05 00:00:00,8 in Montana, https://media.dojmt.gov/wp-content/uploads/RM-Mechanical.pdf ,"RM Mechanical, Inc.",2018-05-23 00:00:00,https://dojmt.gov/consumer/consumers-known-data-breach-incidents/#,2018-03-04 00:00:00,Montana
3/9/2018-3/9/2018,2018-03-09 00:00:00,12 in Montana, https://media.dojmt.gov/wp-content/uploads/The-Oregon-Clinic.pdf ,The Oregon Clinic,2018-05-23 00:00:00,https://dojmt.gov/consumer/consumers-known-data-breach-incidents/#,2018-03-09 00:00:00,Montana
11/13/2017-11/14/2017,2017-11-14 00:00:00,2 in Montana, https://media.dojmt.gov/wp-content/uploads/32BJ.pdf ,SEIU 32BJ,2018-05-25 00:00:00,https://dojmt.gov/consumer/consumers-known-data-breach-incidents/#,2017-11-13 00:00:00,Montana
4/12/2018-4/12/2018,2018-04-12 00:00:00,1 in Montana, https://media.dojmt.gov/wp-content/uploads/The-Hartford-1.pdf ,The Hartford,2018-05-29 00:00:00,https://dojmt.gov/consumer/consumers-known-data-breach-incidents/#,2018-04-12 00:00:00,Montana
4/18/2018-5/1/2018,2018-05-01 00:00:00,4 in Montana, https://media.dojmt.gov/wp-content/uploads/Uno-Alla-Volta.pdf ,"Uno Alla Volta, LLC",2018-05-29 00:00:00,https://dojmt.gov/consumer/consumers-known-data-breach-incidents/#,2018-04-18 00:00:00,Montana
6/22/2017-2/16/2018,2018-02-16 00:00:00,18 in Montana, https://media.dojmt.gov/wp-content/uploads/Rail-Europe.pdf ,Rail Europe,2018-05-30 00:00:00,https://dojmt.gov/consumer/consumers-known-data-breach-incidents/#,2017-06-22 00:00:00,Montana
2/9/2018-3/30/2018,2018-03-30 00:00:00,9 in Montana, https://media.dojmt.gov/wp-content/uploads/Temecula.pdf ,"Temecula Motorsports, Inc.",2018-05-31 00:00:00,https://dojmt.gov/consumer/consumers-known-data-breach-incidents/#,2018-02-09 00:00:00,Montana
2/12/2018-2/15/2018,2018-02-15 00:00:00,7 in Montana, https://media.dojmt.gov/wp-content/uploads/St.-Marys-Health-Inc.-dba-St.-Vincent-Evansville.pdf ,"St. Mary's Health, Inc. d/b/a St. Vincent Evansville",2018-05-31 00:00:00,https://dojmt.gov/consumer/consumers-known-data-breach-incidents/#,2018-02-12 00:00:00,Montana
12/1/2017-12/31/2017,2017-12-31 00:00:00,330 in Montana, https://media.dojmt.gov/wp-content/uploads/Advanced-Technology-Group.pdf ,Advanced Technology Group,2018-05-31 00:00:00,https://dojmt.gov/consumer/consumers-known-data-breach-incidents/#,2017-12-01 00:00:00,Montana
9/9/2017-1/24/2018,2018-01-24 00:00:00,4 in Montana, https://media.dojmt.gov/wp-content/uploads/Stein-Eriksen-Lodge-Hotel.pdf ,Stein Eriksen Lodge Hotel,2018-06-01 00:00:00,https://dojmt.gov/consumer/consumers-known-data-breach-incidents/#,2017-09-09 00:00:00,Montana
12/20/2017-4/17/2018,2018-04-17 00:00:00,2 in Montana, https://media.dojmt.gov/wp-content/uploads/Walgreens-Rite-Aid.pdf ,Walgreens (Rite Aid),2018-06-01 00:00:00,https://dojmt.gov/consumer/consumers-known-data-breach-incidents/#,2017-12-20 00:00:00,Montana
3/21/2018-5/3/2018,2018-05-03 00:00:00,527 in Montana, https://media.dojmt.gov/wp-content/uploads/Aimbridge-Hospitality-Holdings-LLC.pdf ,"Aimbridge Hospitality Holdings, LLC",2018-06-07 00:00:00,https://dojmt.gov/consumer/consumers-known-data-breach-incidents/#,2018-03-21 00:00:00,Montana
9/1/2017-5/7/2018,2018-05-07 00:00:00,140 in Montana, https://media.dojmt.gov/wp-content/uploads/Systeme.pdf ,"Systeme Software, Inc.",2018-06-07 00:00:00,https://dojmt.gov/consumer/consumers-known-data-breach-incidents/#,2017-09-01 00:00:00,Montana
4/1/2018-4/30/2018,2018-04-30 00:00:00,2 in Montana, https://media.dojmt.gov/wp-content/uploads/Quad-C-Management-Inc..pdf ,"Quad-C Management, Inc.",2018-06-07 00:00:00,https://dojmt.gov/consumer/consumers-known-data-breach-incidents/#,2018-04-01 00:00:00,Montana
5/15/2018-5/16/2018,2018-05-16 00:00:00,5 in Montana, https://media.dojmt.gov/wp-content/uploads/Securus.pdf ,Securus Technologies,2018-06-08 00:00:00,https://dojmt.gov/consumer/consumers-known-data-breach-incidents/#,2018-05-15 00:00:00,Montana
5/10/2018-5/12/2018,2018-05-12 00:00:00,18 in Montana, https://media.dojmt.gov/wp-content/uploads/Elmcroft-Senior-Living.pdf ,"Elmcroft Senior Living, Inc.",2018-06-08 00:00:00,https://dojmt.gov/consumer/consumers-known-data-breach-incidents/#,2018-05-10 00:00:00,Montana
4/24/2018-4/24/2018,2018-04-24 00:00:00,3 in Montana, https://media.dojmt.gov/wp-content/uploads/Wilkins-Reinicke-Co.pdf ,"Wilkins, Reinicke & Co., P.C.",2018-06-08 00:00:00,https://dojmt.gov/consumer/consumers-known-data-breach-incidents/#,2018-04-24 00:00:00,Montana
4/8/2018-5/14/2018,2018-05-14 00:00:00,3 in Montana, https://media.dojmt.gov/wp-content/uploads/shopPOPdisplays-Inc..pdf ,"shopPOPdisplays, Inc.",2018-06-11 00:00:00,https://dojmt.gov/consumer/consumers-known-data-breach-incidents/#,2018-04-08 00:00:00,Montana
4/27/2018-4/27/2018,2018-04-27 00:00:00,1 in Montana, https://media.dojmt.gov/wp-content/uploads/Old-Second-Bank.pdf ,Old Second National Bank,2018-06-11 00:00:00,https://dojmt.gov/consumer/consumers-known-data-breach-incidents/#,2018-04-27 00:00:00,Montana
12/20/2017-12/20/2017,2017-12-20 00:00:00,1 in Montana, https://media.dojmt.gov/wp-content/uploads/Weichert.pdf ,Weichert Companies,2018-06-11 00:00:00,https://dojmt.gov/consumer/consumers-known-data-breach-incidents/#,2017-12-20 00:00:00,Montana
11/25/2017-11/25/2017,2017-11-25 00:00:00,503 in Montana, https://media.dojmt.gov/wp-content/uploads/Corporation-Service-Company-3.pdf ,Corporation Service Company (CSC),2018-06-11 00:00:00,https://dojmt.gov/consumer/consumers-known-data-breach-incidents/#,2017-11-25 00:00:00,Montana
4/5/2018-4/5/2018,2018-04-05 00:00:00,1 in Montana, https://media.dojmt.gov/wp-content/uploads/Marion-County-Bank.pdf ,Marion County Bank,2018-06-12 00:00:00,https://dojmt.gov/consumer/consumers-known-data-breach-incidents/#,2018-04-05 00:00:00,Montana
8/1/2013-4/10/2018,2018-04-10 00:00:00,2 in Montana, https://media.dojmt.gov/wp-content/uploads/Anthem-Inc..pdf ,"Anthem, Inc.",2018-06-12 00:00:00,https://dojmt.gov/consumer/consumers-known-data-breach-incidents/#,2013-08-01 00:00:00,Montana
4/24/2018-4/24/2018,2018-04-24 00:00:00,9 in Montana, https://media.dojmt.gov/wp-content/uploads/Dignity-Health.pdf ,Dignity Health,2018-06-13 00:00:00,https://dojmt.gov/consumer/consumers-known-data-breach-incidents/#,2018-04-24 00:00:00,Montana
4/11/2018-4/13/2018,2018-04-13 00:00:00,8 in Montana, https://media.dojmt.gov/wp-content/uploads/HealthEquity.pdf ,"HealthEquity, Inc.",2018-06-13 00:00:00,https://dojmt.gov/consumer/consumers-known-data-breach-incidents/#,2018-04-11 00:00:00,Montana
4/23/2018-4/23/2018,2018-04-23 00:00:00,1 in Montana, https://media.dojmt.gov/wp-content/uploads/Black-River-Medical-Center.pdf ,Black River Medical Center,2018-06-13 00:00:00,https://dojmt.gov/consumer/consumers-known-data-breach-incidents/#,2018-04-23 00:00:00,Montana
11/1/2017-11/30/2017,2017-11-30 00:00:00,2 in Montana, https://media.dojmt.gov/wp-content/uploads/Guaranteed-Rate-Inc.-2nd-Event.pdf ,"Guaranteed Rate, Inc.",2018-06-13 00:00:00,https://dojmt.gov/consumer/consumers-known-data-breach-incidents/#,2017-11-01 00:00:00,Montana
4/12/2018-5/16/2018,2018-05-16 00:00:00,3 in Montana, https://media.dojmt.gov/wp-content/uploads/OFD-Foods.pdf ,"OFD Foods, LLC.",2018-06-14 00:00:00,https://dojmt.gov/consumer/consumers-known-data-breach-incidents/#,2018-04-12 00:00:00,Montana
3/22/2018-3/22/2018,2018-03-22 00:00:00,6 in Montana, https://media.dojmt.gov/wp-content/uploads/Med-Associates.pdf ,"Med Associates, Inc.",2018-06-14 00:00:00,https://dojmt.gov/consumer/consumers-known-data-breach-incidents/#,2018-03-22 00:00:00,Montana
10/2/2017-11/28/2017,2017-11-28 00:00:00,6 in Montana, https://media.dojmt.gov/wp-content/uploads/National-Restaurant-Association-1.pdf ,National Restaurant Association,2018-06-14 00:00:00,https://dojmt.gov/consumer/consumers-known-data-breach-incidents/#,2017-10-02 00:00:00,Montana
7/11/2017-4/23/2018,2018-04-23 00:00:00,2 in Montana, https://media.dojmt.gov/wp-content/uploads/Central-Christian-College-of-Kansas.pdf ,Central Christian College of Kansas,2018-06-15 00:00:00,https://dojmt.gov/consumer/consumers-known-data-breach-incidents/#,2017-07-11 00:00:00,Montana
10/23/2017-10/27/2017,2017-10-27 00:00:00,71 in Montana, https://media.dojmt.gov/wp-content/uploads/Great-Banc.pdf ,GreatBanc Trust Company,2018-06-15 00:00:00,https://dojmt.gov/consumer/consumers-known-data-breach-incidents/#,2017-10-23 00:00:00,Montana
5/7/2018-5/7/2018,2018-05-07 00:00:00,10 in Montana, https://media.dojmt.gov/wp-content/uploads/City-of-Goodyear.pdf ,"City of Goodyear, Arizona",2018-06-19 00:00:00,https://dojmt.gov/consumer/consumers-known-data-breach-incidents/#,2018-05-07 00:00:00,Montana
11/26/2017-3/27/2018,2018-03-27 00:00:00,7 in Montana, https://media.dojmt.gov/wp-content/uploads/Capital-One-6.2018-notification.pdf ,Capital One Bank,2018-06-19 00:00:00,https://dojmt.gov/consumer/consumers-known-data-breach-incidents/#,2017-11-26 00:00:00,Montana
10/2/2017-7/14/2018,2018-07-14 00:00:00,5 in Montana, https://media.dojmt.gov/wp-content/uploads/Orrston-Bank-1.pdf ,Orrston Bank,2018-06-19 00:00:00,https://dojmt.gov/consumer/consumers-known-data-breach-incidents/#,2017-10-02 00:00:00,Montana
5/18/2018-5/18/2018,2018-05-18 00:00:00,1 in Montana, https://media.dojmt.gov/wp-content/uploads/NorthStar-Anesthesia.pdf ,Notre Dame de Namur University,2018-06-20 00:00:00,https://dojmt.gov/consumer/consumers-known-data-breach-incidents/#,2018-05-18 00:00:00,Montana
5/31/2018-5/31/2018,2018-05-31 00:00:00,20 in Montana, https://media.dojmt.gov/wp-content/uploads/Notre-Dame.pdf ,"RevUp Group, LLC",2018-06-20 00:00:00,https://dojmt.gov/consumer/consumers-known-data-breach-incidents/#,2018-05-31 00:00:00,Montana
4/3/2018-4/24/2018,2018-04-24 00:00:00,1 in Montana, https://media.dojmt.gov/wp-content/uploads/RevUp-Group-LLP.pdf ,NorthStar Anesthesia,2018-06-20 00:00:00,https://dojmt.gov/consumer/consumers-known-data-breach-incidents/#,2018-04-03 00:00:00,Montana
6/3/2018-6/4/2018,2018-06-04 00:00:00,1 in Montana, https://media.dojmt.gov/wp-content/uploads/Humana-Go365.com_.pdf ,"Humana, Go365.com",2018-06-21 00:00:00,https://dojmt.gov/consumer/consumers-known-data-breach-incidents/#,2018-06-03 00:00:00,Montana
1/9/2018-3/15/2018,2018-03-15 00:00:00,5 in Montana, https://media.dojmt.gov/wp-content/uploads/ATI-Holdings-LLC.pdf ,"ATI Holdings, LLC",2018-06-21 00:00:00,https://dojmt.gov/consumer/consumers-known-data-breach-incidents/#,2018-01-09 00:00:00,Montana
5/1/2018-5/10/2018,2018-05-10 00:00:00,381 in Montana, https://media.dojmt.gov/wp-content/uploads/Terteling-Company-Inc..pdf ,"Terteling Company, Inc. (Western States Equipment Company, Agri-Service, LLC, 36th Street Garden Center & Bistro, Red Horse Mountian Ranch",2018-06-22 00:00:00,https://dojmt.gov/consumer/consumers-known-data-breach-incidents/#,2018-05-01 00:00:00,Montana
2/1/2018-3/15/2018,2018-03-15 00:00:00,1 in Montana, https://media.dojmt.gov/wp-content/uploads/Capital-Integration-Systems-LLC-CAIS.pdf ,Capital Integration Systems LLC (CAIS),2018-06-22 00:00:00,https://dojmt.gov/consumer/consumers-known-data-breach-incidents/#,2018-02-01 00:00:00,Montana
4/18/2018-5/4/2018,2018-05-04 00:00:00,5 in Montana, https://media.dojmt.gov/wp-content/uploads/Solera-National-Bank.pdf ,Solera National Bank,2018-06-26 00:00:00,https://dojmt.gov/consumer/consumers-known-data-breach-incidents/#,2018-04-18 00:00:00,Montana
2/5/2018-5/18/2018,2018-05-18 00:00:00,2 in Montana, https://media.dojmt.gov/wp-content/uploads/SOS-Intl-LLC.pdf ,"SOS International, LLC",2018-06-28 00:00:00,https://dojmt.gov/consumer/consumers-known-data-breach-incidents/#,2018-02-05 00:00:00,Montana
4/27/2018-4/27/2018,2018-04-27 00:00:00,3 in Montana, https://media.dojmt.gov/wp-content/uploads/Trust-Co-of-Illinois.pdf ,Trust Company of Illinois (TCI),2018-06-29 00:00:00,https://dojmt.gov/consumer/consumers-known-data-breach-incidents/#,2018-04-27 00:00:00,Montana
4/29/2016-2/21/2018,2018-02-21 00:00:00,1 in Montana, https://media.dojmt.gov/wp-content/uploads/Waller-Assoc.pdf ,"Waller & Associates, Inc.",2018-06-29 00:00:00,https://dojmt.gov/consumer/consumers-known-data-breach-incidents/#,2016-04-29 00:00:00,Montana
9/15/2017-9/18/2017,2017-09-18 00:00:00,1 in Montana, https://media.dojmt.gov/wp-content/uploads/Hasbro-Inc..pdf ,"Hasbro, Inc.",2018-06-29 00:00:00,https://dojmt.gov/consumer/consumers-known-data-breach-incidents/#,2017-09-15 00:00:00,Montana
2/26/2018-4/26/2018,2018-04-26 00:00:00,1 in Montana, https://media.dojmt.gov/wp-content/uploads/Lockton-Companies.pdf ,Lockton Companies,2018-06-29 00:00:00,https://dojmt.gov/consumer/consumers-known-data-breach-incidents/#,2018-02-26 00:00:00,Montana
6/20/2018-6/20/2018,2018-06-20 00:00:00,29 in Montana, https://media.dojmt.gov/wp-content/uploads/Northwest-University.pdf ,Northwest University,2018-06-29 00:00:00,https://dojmt.gov/consumer/consumers-known-data-breach-incidents/#,2018-06-20 00:00:00,Montana
4/26/2018-6/12/2018,2018-06-12 00:00:00,136 in Montana, https://media.dojmt.gov/wp-content/uploads/Macys.pdf ,"Macy's, Inc.",2018-07-02 00:00:00,https://dojmt.gov/consumer/consumers-known-data-breach-incidents/#,2018-04-26 00:00:00,Montana
4/11/2018-4/11/2018,2018-04-11 00:00:00,189 in Montana, https://media.dojmt.gov/wp-content/uploads/International-Mission-Board.pdf ,International Mission Board (IMB),2018-07-05 00:00:00,https://dojmt.gov/consumer/consumers-known-data-breach-incidents/#,2018-04-11 00:00:00,Montana
3/14/2018-4/23/2018,2018-04-23 00:00:00,8 in Montana, https://media.dojmt.gov/wp-content/uploads/211-LA-County.pdf ,211 LA County,2018-07-05 00:00:00,https://dojmt.gov/consumer/consumers-known-data-breach-incidents/#,2018-03-14 00:00:00,Montana
1/12/2018-2/8/2018,2018-02-08 00:00:00,6 in Montana, https://media.dojmt.gov/wp-content/uploads/Coty-Inc..pdf ,"Coty, Inc.",2018-07-06 00:00:00,https://dojmt.gov/consumer/consumers-known-data-breach-incidents/#,2018-01-12 00:00:00,Montana
2/12/2018-2/12/2018,2018-02-12 00:00:00,2 in Montana, https://media.dojmt.gov/wp-content/uploads/C-TEC.pdf ,Career and Technology Education Centers of Licking County (C-TEC),2018-07-06 00:00:00,https://dojmt.gov/consumer/consumers-known-data-breach-incidents/#,2018-02-12 00:00:00,Montana
2/14/2018-2/14/2018,2018-02-14 00:00:00,1 in Montana, https://media.dojmt.gov/wp-content/uploads/TerraSond.pdf ,TerraSond Limited,2018-07-10 00:00:00,https://dojmt.gov/consumer/consumers-known-data-breach-incidents/#,2018-02-14 00:00:00,Montana
3/29/2018-5/4/2018,2018-05-04 00:00:00,13 in Montana, https://media.dojmt.gov/wp-content/uploads/MedEvolve.pdf ,MedEvolve,2018-07-10 00:00:00,https://dojmt.gov/consumer/consumers-known-data-breach-incidents/#,2018-03-29 00:00:00,Montana
11/10/2017-1/22/2018,2018-01-22 00:00:00,136 in Montana, https://media.dojmt.gov/wp-content/uploads/Tommie-Copper-Inc..pdf ,"Tommie Copper, Inc.",2018-07-11 00:00:00,https://dojmt.gov/consumer/consumers-known-data-breach-incidents/#,2017-11-10 00:00:00,Montana
5/29/2018-6/13/2018,2018-06-13 00:00:00,3 in Montana, https://media.dojmt.gov/wp-content/uploads/Fruitful-Yield.pdf ,"Fruitful Yield, Inc. (NOW-2-U.com, VitaminExperts.com, FruitfulYield.com)",2018-07-11 00:00:00,https://dojmt.gov/consumer/consumers-known-data-breach-incidents/#,2018-05-29 00:00:00,Montana
12/19/2017-4/10/2018,2018-04-10 00:00:00,1 in Montana, https://media.dojmt.gov/wp-content/uploads/Vertical-Limit.pdf ,Vertical Limit Construction,2018-07-11 00:00:00,https://dojmt.gov/consumer/consumers-known-data-breach-incidents/#,2017-12-19 00:00:00,Montana
4/20/2018-5/22/2018,2018-05-22 00:00:00,1730 in Montana, https://media.dojmt.gov/wp-content/uploads/ComplyRight.pdf ,"ComplyRight, Inc.",2018-07-12 00:00:00,https://dojmt.gov/consumer/consumers-known-data-breach-incidents/#,2018-04-20 00:00:00,Montana
5/26/2018-6/25/2018,2018-06-25 00:00:00,1 in Montana, https://media.dojmt.gov/wp-content/uploads/Dollar-Shave-Club-Inc..pdf ,"Dollar Shave Club, Inc.",2018-07-16 00:00:00,https://dojmt.gov/consumer/consumers-known-data-breach-incidents/#,2018-05-26 00:00:00,Montana
9/12/2017-5/18/2018,2018-05-18 00:00:00,4 in Montana, https://media.dojmt.gov/wp-content/uploads/EBSCO.pdf ,"EBSCO Sign Group, Inc. (outdoorsignsamerica.com)",2018-07-16 00:00:00,https://dojmt.gov/consumer/consumers-known-data-breach-incidents/#,2017-09-12 00:00:00,Montana
7/1/2017-10/24/2017,2017-10-24 00:00:00,2651 in Montana, https://media.dojmt.gov/wp-content/uploads/City-of-Bozeman.pdf ,City of Bozeman,2018-07-16 00:00:00,https://dojmt.gov/consumer/consumers-known-data-breach-incidents/#,2017-07-01 00:00:00,Montana
5/2/2018-5/23/2018,2018-05-23 00:00:00,1 in Montana, https://media.dojmt.gov/wp-content/uploads/CBIZ.pdf ,"CBIZ MHM, LLC",2018-07-18 00:00:00,https://dojmt.gov/consumer/consumers-known-data-breach-incidents/#,2018-05-02 00:00:00,Montana
6/28/2018-6/28/2018,2018-06-28 00:00:00,1 in Montana, https://media.dojmt.gov/wp-content/uploads/Simma.pdf ,Simma Flottemesh & Orensteinin,2018-07-19 00:00:00,https://dojmt.gov/consumer/consumers-known-data-breach-incidents/#,2018-06-28 00:00:00,Montana
4/20/2018-5/14/2018,2018-05-14 00:00:00,4 in Montana, https://media.dojmt.gov/wp-content/uploads/Helly-Hansen.pdf ,Helly Hansen (hellyhansen.com),2018-07-19 00:00:00,https://dojmt.gov/consumer/consumers-known-data-breach-incidents/#,2018-04-20 00:00:00,Montana
5/23/2018-5/23/2018,2018-05-23 00:00:00,15 in Montana, https://media.dojmt.gov/wp-content/uploads/Boys-Town-National-Research-Hospital.pdf ,Boys Town National Research HOspital,2018-07-20 00:00:00,https://dojmt.gov/consumer/consumers-known-data-breach-incidents/#,2018-05-23 00:00:00,Montana
5/23/2018-5/23/2018,2018-05-23 00:00:00,15 in Montana, https://media.dojmt.gov/wp-content/uploads/Boys-Town-National-Research-Hospital.pdf ,Boys Town National Research Hospital,2018-07-20 00:00:00,https://dojmt.gov/consumer/consumers-known-data-breach-incidents/#,2018-05-23 00:00:00,Montana
4/19/2018-4/19/2018,2018-04-19 00:00:00,1 in Montana, https://media.dojmt.gov/wp-content/uploads/Stoneleigh-Recovery-Assoc..pdf ,"Stoneleigh Recovery Association, LLC",2018-07-20 00:00:00,https://dojmt.gov/consumer/consumers-known-data-breach-incidents/#,2018-04-19 00:00:00,Montana
4/14/2018-4/14/2018,2018-04-14 00:00:00,16 in Montana, https://media.dojmt.gov/wp-content/uploads/The-Borough-GHAP.pdf ,Fairbanks North Star Borough (GHAP),2018-07-20 00:00:00,https://dojmt.gov/consumer/consumers-known-data-breach-incidents/#,2018-04-14 00:00:00,Montana
4/6/2018-4/12/2018,2018-04-12 00:00:00,6 in Montana, https://media.dojmt.gov/wp-content/uploads/Optoma.pdf ,Optoma Technology,2018-07-23 00:00:00,https://dojmt.gov/consumer/consumers-known-data-breach-incidents/#,2018-04-06 00:00:00,Montana
11/9/2017-11/30/2017,2017-11-30 00:00:00,6 in Montana, https://media.dojmt.gov/wp-content/uploads/AutoPets.pdf ,"Automated Pet Care Products, Inc. (AutoPets)",2018-07-24 00:00:00,https://dojmt.gov/consumer/consumers-known-data-breach-incidents/#,2017-11-09 00:00:00,Montana
10/1/2017-5/31/2018,2018-05-31 00:00:00,71 in Montana, https://media.dojmt.gov/wp-content/uploads/TradeMotion.pdf ,"TradeMotion, LLC.",2018-07-25 00:00:00,https://dojmt.gov/consumer/consumers-known-data-breach-incidents/#,2017-10-01 00:00:00,Montana
12/4/2017-12/4/2017,2017-12-04 00:00:00,1 in Montana, https://media.dojmt.gov/wp-content/uploads/Welk-Resort-Group.pdf ,"Welk Resort Group, Inc.",2018-07-25 00:00:00,https://dojmt.gov/consumer/consumers-known-data-breach-incidents/#,2017-12-04 00:00:00,Montana
3/1/2018-5/17/2018,2018-05-17 00:00:00,10 in Montana, https://media.dojmt.gov/wp-content/uploads/Sunspire-Health.pdf ,Sunspire Health,2018-07-27 00:00:00,https://dojmt.gov/consumer/consumers-known-data-breach-incidents/#,2018-03-01 00:00:00,Montana
3/14/2018-4/3/2018,2018-04-03 00:00:00,144 in Montana, https://media.dojmt.gov/wp-content/uploads/Plant-Therapy.pdf ,UnityPoint,2018-07-30 00:00:00,https://dojmt.gov/consumer/consumers-known-data-breach-incidents/#,2018-03-14 00:00:00,Montana
7/17/2018-7/17/2018,2018-07-17 00:00:00,1 in Montana, https://media.dojmt.gov/wp-content/uploads/UnityPoint-Health.pdf ,Loyola University of Chicago,2018-07-30 00:00:00,https://dojmt.gov/consumer/consumers-known-data-breach-incidents/#,2018-07-17 00:00:00,Montana
3/29/2018-5/11/2018,2018-05-11 00:00:00,55 in Montana, https://media.dojmt.gov/wp-content/uploads/Loyola-Univ-of-Chicago.pdf ,Plant Therapy,2018-07-30 00:00:00,https://dojmt.gov/consumer/consumers-known-data-breach-incidents/#,2018-03-29 00:00:00,Montana
5/28/2018-5/28/2018,2018-05-28 00:00:00,1 in Montana, https://media.dojmt.gov/wp-content/uploads/JA-Carpentry.pdf ,JA Carpentry,2018-07-31 00:00:00,https://dojmt.gov/consumer/consumers-known-data-breach-incidents/#,2018-05-28 00:00:00,Montana
2/2/2018-4/20/2018,2018-04-20 00:00:00,469 in Montana, https://media.dojmt.gov/wp-content/uploads/Doyle-Associates.pdf ,Doyle & Associates,2018-08-01 00:00:00,https://dojmt.gov/consumer/consumers-known-data-breach-incidents/#,2018-02-02 00:00:00,Montana
7/5/2018-7/9/2018,2018-07-09 00:00:00,13 in Montana, https://media.dojmt.gov/wp-content/uploads/American-Express.pdf ,American Express Travel (Orbitz),2018-08-02 00:00:00,https://dojmt.gov/consumer/consumers-known-data-breach-incidents/#,2018-07-05 00:00:00,Montana
3/5/2017-7/17/2018,2018-07-17 00:00:00,53 in Montana, https://media.dojmt.gov/wp-content/uploads/Colorado-Bankers-Life-Insurance-Company.pdf ,TCM Bank,2018-08-03 00:00:00,https://dojmt.gov/consumer/consumers-known-data-breach-incidents/#,2017-03-05 00:00:00,Montana
5/10/2018-7/31/2018,2018-07-31 00:00:00,4 in Montana, https://media.dojmt.gov/wp-content/uploads/TCM-Bank.pdf ,North American Power & Gas,2018-08-03 00:00:00,https://dojmt.gov/consumer/consumers-known-data-breach-incidents/#,2018-05-10 00:00:00,Montana
3/28/2018-4/13/2018,2018-04-13 00:00:00,129 in Montana, https://media.dojmt.gov/wp-content/uploads/North-American-Power-Gas.pdf ,Colorado Bankers Life Insurance Company,2018-08-03 00:00:00,https://dojmt.gov/consumer/consumers-known-data-breach-incidents/#,2018-03-28 00:00:00,Montana
5/14/2018-5/14/2018,2018-05-14 00:00:00,4 in Montana, https://media.dojmt.gov/wp-content/uploads/Billings-Clinic.pdf ,Billings Clinic,2018-08-06 00:00:00,https://dojmt.gov/consumer/consumers-known-data-breach-incidents/#,2018-05-14 00:00:00,Montana
6/4/2018-6/6/2018,2018-06-06 00:00:00,2 in Montana, https://media.dojmt.gov/wp-content/uploads/American-Institute-of-Aeronautics-and-Astronautics-AIAA.pdf ,American Institute of Aeronautics and Astronautics (AIAA),2018-08-07 00:00:00,https://dojmt.gov/consumer/consumers-known-data-breach-incidents/#,2018-06-04 00:00:00,Montana
7/11/2018-7/16/2018,2018-07-16 00:00:00,4 in Montana, https://media.dojmt.gov/wp-content/uploads/CNG-Financial-Corporation-Inc.pdf ,CNG Financial Corporation Inc,2018-08-15 00:00:00,https://dojmt.gov/consumer/consumers-known-data-breach-incidents/#,2018-07-11 00:00:00,Montana
6/7/2018-6/21/2018,2018-06-21 00:00:00,2 in Montana, https://media.dojmt.gov/wp-content/uploads/Authentic-Recovery-LLC.pdf ,Authentic Recovery Center,2018-08-15 00:00:00,https://dojmt.gov/consumer/consumers-known-data-breach-incidents/#,2018-06-07 00:00:00,Montana
11/2/2017-1/2/2018,2018-01-02 00:00:00,Unknown in Montana, https://media.dojmt.gov/wp-content/uploads/Cheddars-Scratch-Kitchen.pdf ,Cheddar's Scratch Kitchen,2018-08-16 00:00:00,https://dojmt.gov/consumer/consumers-known-data-breach-incidents/#,2017-11-02 00:00:00,Montana
12/7/2017-5/22/2018,2018-05-22 00:00:00,1 in Montana, https://media.dojmt.gov/wp-content/uploads/LA-Fashion-Lasula.pdf ,LA Fashion (Lasula),2018-08-16 00:00:00,https://dojmt.gov/consumer/consumers-known-data-breach-incidents/#,2017-12-07 00:00:00,Montana
7/24/2018-7/26/2018,2018-07-26 00:00:00,1 in Montana, https://media.dojmt.gov/wp-content/uploads/Mondelez-Global.pdf ,Mondelez Global,2018-08-16 00:00:00,https://dojmt.gov/consumer/consumers-known-data-breach-incidents/#,2018-07-24 00:00:00,Montana
7/6/2018-7/6/2018,2018-07-06 00:00:00,1 in Montana, https://media.dojmt.gov/wp-content/uploads/Acadiana-Computer-Systems-Inc.pdf ,Acadiana Computer Systems (ACS),2018-08-17 00:00:00,https://dojmt.gov/consumer/consumers-known-data-breach-incidents/#,2018-07-06 00:00:00,Montana
5/27/2018-6/20/2018,2018-06-20 00:00:00,1 in Montana, https://media.dojmt.gov/wp-content/uploads/Monroe-Capital.pdf ,Monroe Capital holdings LLC (Newport Academy),2018-08-17 00:00:00,https://dojmt.gov/consumer/consumers-known-data-breach-incidents/#,2018-05-27 00:00:00,Montana
5/28/2018-7/22/2018,2018-07-22 00:00:00,10 in Montana, https://media.dojmt.gov/wp-content/uploads/SureFire.pdf ,SureFire,2018-08-19 00:00:00,https://dojmt.gov/consumer/consumers-known-data-breach-incidents/#,2018-05-28 00:00:00,Montana
3/2/2018-3/19/2018,2018-03-19 00:00:00,4 in Montana, https://media.dojmt.gov/wp-content/uploads/Bank-of-the-West-1.pdf ,Bank of the West,2018-08-20 00:00:00,https://dojmt.gov/consumer/consumers-known-data-breach-incidents/#,2018-03-02 00:00:00,Montana
7/16/2018-7/19/2018,2018-07-19 00:00:00,17 in Montana, https://media.dojmt.gov/wp-content/uploads/Health-Management-Concepts-Inc.pdf ,"Health Management Concepts, Inc. Pacific National Benefits Funds",2018-08-22 00:00:00,https://dojmt.gov/consumer/consumers-known-data-breach-incidents/#,2018-07-16 00:00:00,Montana
6/22/2018-6/22/2018,2018-06-22 00:00:00,244 in Montana, https://media.dojmt.gov/wp-content/uploads/The-Wellness-Institute.pdf ,The Wellness Institute of Montana and Jennings Management,2018-08-23 00:00:00,https://dojmt.gov/consumer/consumers-known-data-breach-incidents/#,2018-06-22 00:00:00,Montana
4/13/2018-5/24/2018,2018-05-24 00:00:00,7 in Montana, https://media.dojmt.gov/wp-content/uploads/TKC-Holdings.pdf ,TKC Holdings,2018-08-24 00:00:00,https://dojmt.gov/consumer/consumers-known-data-breach-incidents/#,2018-04-13 00:00:00,Montana
4/9/2018-4/9/2018,2018-04-09 00:00:00,3 in Montana, https://media.dojmt.gov/wp-content/uploads/Salter-Labs.pdf ,Salter Labs,2018-08-27 00:00:00,https://dojmt.gov/consumer/consumers-known-data-breach-incidents/#,2018-04-09 00:00:00,Montana
5/17/2018-5/17/2018,2018-05-17 00:00:00,1 in Montana, https://media.dojmt.gov/wp-content/uploads/PacificSource-Health-Plans.pdf ,Joint Resources Commission,2018-08-28 00:00:00,https://dojmt.gov/consumer/consumers-known-data-breach-incidents/#,2018-05-17 00:00:00,Montana
,,nan in Montana,,,,https://dojmt.gov/consumer/consumers-known-data-breach-incidents/#,,Montana
6/1/2018-7/9/2018,2018-07-09 00:00:00,1 in Montana, https://media.dojmt.gov/wp-content/uploads/ESJ-Towers-Inc..pdf ,LLLbaby,2018-08-28 00:00:00,https://dojmt.gov/consumer/consumers-known-data-breach-incidents/#,2018-06-01 00:00:00,Montana
7/19/2018-7/18/2018,2018-07-18 00:00:00,2 in Montana, https://media.dojmt.gov/wp-content/uploads/Sierra-Nevada-Brewing-Company.pdf ,"ESJ Towers, Inc",2018-08-28 00:00:00,https://dojmt.gov/consumer/consumers-known-data-breach-incidents/#,2018-07-19 00:00:00,Montana
8/7/2018-8/28/2018,2018-08-28 00:00:00,1 in Montana, https://media.dojmt.gov/wp-content/uploads/Joint-Commission-Resources-Inc.pdf ,Sierra Nevada Brewing Company,2018-08-28 00:00:00,https://dojmt.gov/consumer/consumers-known-data-breach-incidents/#,2018-08-07 00:00:00,Montana
4/1/2018-8/17/2018,2018-08-17 00:00:00,1 in Montana, https://media.dojmt.gov/wp-content/uploads/Gray-Inc..pdf ,"Gray, Inc.",2018-08-29 00:00:00,https://dojmt.gov/consumer/consumers-known-data-breach-incidents/#,2018-04-01 00:00:00,Montana
8/22/2018-8/24/2018,2018-08-24 00:00:00,5 in Montana, https://media.dojmt.gov/wp-content/uploads/Air-Canada.pdf ,Air Canada,2018-08-29 00:00:00,https://dojmt.gov/consumer/consumers-known-data-breach-incidents/#,2018-08-22 00:00:00,Montana
5/2/2018-5/3/2018,2018-05-03 00:00:00,1 in Montana, https://media.dojmt.gov/wp-content/uploads/Holtey-Law.pdf ,Holtey Law,2018-08-30 00:00:00,https://dojmt.gov/consumer/consumers-known-data-breach-incidents/#,2018-05-02 00:00:00,Montana
4/4/2018-5/4/2018,2018-05-04 00:00:00,3 in Montana, https://media.dojmt.gov/wp-content/uploads/Garretson-Resolution-Group.pdf ,Garretson Resolution Group,2018-08-30 00:00:00,https://dojmt.gov/consumer/consumers-known-data-breach-incidents/#,2018-04-04 00:00:00,Montana
2/4/2018-2/26/2018,2018-02-26 00:00:00,1 in Montana, https://media.dojmt.gov/wp-content/uploads/Tousley-Brain-Stephens.pdf ,Tousley Brain Stephens,2018-08-31 00:00:00,https://dojmt.gov/consumer/consumers-known-data-breach-incidents/#,2018-02-04 00:00:00,Montana
5/6/2018-5/22/2018,2018-05-22 00:00:00,1 in Montana, https://media.dojmt.gov/wp-content/uploads/St.-Josephs-Medical-Center.pdf ,St. Joseph's Medical Center,2018-08-31 00:00:00,https://dojmt.gov/consumer/consumers-known-data-breach-incidents/#,2018-05-06 00:00:00,Montana
2/7/2018-3/27/2018,2018-03-27 00:00:00,17 in Montana, https://media.dojmt.gov/wp-content/uploads/Movement-Mortgage-LLC.pdf ,Movement Mortgage LLC,2018-08-31 00:00:00,https://dojmt.gov/consumer/consumers-known-data-breach-incidents/#,2018-02-07 00:00:00,Montana
9/27/2017-7/14/2018,2018-07-14 00:00:00,66 in Montana, https://media.dojmt.gov/wp-content/uploads/Dutch-Gardens.pdf ,Dutch Gardens USA,2018-09-05 00:00:00,https://dojmt.gov/consumer/consumers-known-data-breach-incidents/#,2017-09-27 00:00:00,Montana
3/27/2018-3/29/2018,2018-03-29 00:00:00,12 in Montana, https://media.dojmt.gov/wp-content/uploads/Nardella-Taylor.pdf ,Nardella & Taylor,2018-09-07 00:00:00,https://dojmt.gov/consumer/consumers-known-data-breach-incidents/#,2018-03-27 00:00:00,Montana
5/9/2018-7/9/2018,2018-07-09 00:00:00,8 in Montana, https://media.dojmt.gov/wp-content/uploads/Title-Nine.pdf ,Title Nine,2018-09-07 00:00:00,https://dojmt.gov/consumer/consumers-known-data-breach-incidents/#,2018-05-09 00:00:00,Montana
8/8/2018-8/8/2018,2018-08-08 00:00:00,Unknown in Montana, https://media.dojmt.gov/wp-content/uploads/KLX-Energy-Services.pdf ,KLX Energy Services,2018-09-08 00:00:00,https://dojmt.gov/consumer/consumers-known-data-breach-incidents/#,2018-08-08 00:00:00,Montana
4/1/2018-4/30/2018,2018-04-30 00:00:00,16 in Montana, https://media.dojmt.gov/wp-content/uploads/Roadrunner-Transportation-Services.pdf ,Roadrunner Transportation Services,2018-09-10 00:00:00,https://dojmt.gov/consumer/consumers-known-data-breach-incidents/#,2018-04-01 00:00:00,Montana
4/29/2018-6/12/2018,2018-06-12 00:00:00,6 in Montana, https://media.dojmt.gov/wp-content/uploads/Delta-Pilots-Mutual-Aid.pdf ,Delta Pilots Mutual Aid,2018-09-11 00:00:00,https://dojmt.gov/consumer/consumers-known-data-breach-incidents/#,2018-04-29 00:00:00,Montana
8/14/2018-8/14/2018,2018-08-14 00:00:00,900 in Montana, https://media.dojmt.gov/wp-content/uploads/VenatoRX.pdf ,Legacy Properties,2018-09-12 00:00:00,https://dojmt.gov/consumer/consumers-known-data-breach-incidents/#,2018-08-14 00:00:00,Montana
4/1/2018-8/1/2018,2018-08-01 00:00:00,1 in Montana, https://media.dojmt.gov/wp-content/uploads/Peaceful-Valley-Farm-Supply.pdf ,VenatoRX,2018-09-12 00:00:00,https://dojmt.gov/consumer/consumers-known-data-breach-incidents/#,2018-04-01 00:00:00,Montana
2/9/2018-8/22/2018,2018-08-22 00:00:00,155 in Montana, https://media.dojmt.gov/wp-content/uploads/Legacy-Properties.pdf ,Peaceful Valley Family Farm,2018-09-12 00:00:00,https://dojmt.gov/consumer/consumers-known-data-breach-incidents/#,2018-02-09 00:00:00,Montana
7/13/2018-7/18/2018,2018-07-18 00:00:00,2 in Montana, https://media.dojmt.gov/wp-content/uploads/Guardant-Health.pdf ,Guardant Health,2018-09-16 00:00:00,https://dojmt.gov/consumer/consumers-known-data-breach-incidents/#,2018-07-13 00:00:00,Montana
5/16/2018-5/16/2018,2018-05-16 00:00:00,21 in Montana, https://media.dojmt.gov/wp-content/uploads/The-Affiliated-Group.pdf ,The Affiliated Group,2018-09-18 00:00:00,https://dojmt.gov/consumer/consumers-known-data-breach-incidents/#,2018-05-16 00:00:00,Montana
6/1/2018-8/22/2018,2018-08-22 00:00:00,Unknown in Montana, https://media.dojmt.gov/wp-content/uploads/Shein-1.pdf ,Shein,2018-09-21 00:00:00,https://dojmt.gov/consumer/consumers-known-data-breach-incidents/#,2018-06-01 00:00:00,Montana
6/26/2018-6/26/2018,2018-06-26 00:00:00,1 in Montana, https://media.dojmt.gov/wp-content/uploads/Smith-Freed-Eberhard.pdf ,Smith Freed & Eberhard,2018-09-21 00:00:00,https://dojmt.gov/consumer/consumers-known-data-breach-incidents/#,2018-06-26 00:00:00,Montana
7/10/2018-7/10/2018,2018-07-10 00:00:00,3 in Montana, https://media.dojmt.gov/wp-content/uploads/First-Financial-Bank-N.A..pdf ,First Financial Bank,2018-09-21 00:00:00,https://dojmt.gov/consumer/consumers-known-data-breach-incidents/#,2018-07-10 00:00:00,Montana
7/22/2018-7/22/2018,2018-07-22 00:00:00,22 in Montana, https://media.dojmt.gov/wp-content/uploads/YRC-Worldwide.pdf ,YRC Worldwide,2018-09-21 00:00:00,https://dojmt.gov/consumer/consumers-known-data-breach-incidents/#,2018-07-22 00:00:00,Montana
2/22/2017-5/22/2018,2018-05-22 00:00:00,116 in Montana, https://media.dojmt.gov/wp-content/uploads/Tech-Rabbit.pdf ,Tech Rabbit,2018-09-21 00:00:00,https://dojmt.gov/consumer/consumers-known-data-breach-incidents/#,2017-02-22 00:00:00,Montana
9/4/2014-8/23/2018,2018-08-23 00:00:00,1 in Montana, https://media.dojmt.gov/wp-content/uploads/Village-People.pdf ,Village People,2018-09-25 00:00:00,https://dojmt.gov/consumer/consumers-known-data-breach-incidents/#,2014-09-04 00:00:00,Montana
4/9/2018-4/9/2018,2018-04-09 00:00:00,5 in Montana, https://media.dojmt.gov/wp-content/uploads/Another-Planet-Entertainment.pdf ,Another Planet Entertainment,2018-09-27 00:00:00,https://dojmt.gov/consumer/consumers-known-data-breach-incidents/#,2018-04-09 00:00:00,Montana
6/20/2018-9/18/2018,2018-09-18 00:00:00,2 in Montana, https://media.dojmt.gov/wp-content/uploads/Maddison-Caison-MC.pdf ,Maddison & Caison (M&C),2018-09-28 00:00:00,https://dojmt.gov/consumer/consumers-known-data-breach-incidents/#,2018-06-20 00:00:00,Montana
7/5/2018-7/9/2018,2018-07-09 00:00:00,4 in Montana, https://media.dojmt.gov/wp-content/uploads/AEI-Fund-Management.pdf ,AEI Fund Management,2018-09-28 00:00:00,https://dojmt.gov/consumer/consumers-known-data-breach-incidents/#,2018-07-05 00:00:00,Montana
11/10/2017-11/10/2017,2017-11-10 00:00:00,1 in Montana, https://media.dojmt.gov/wp-content/uploads/Quest-Nutrition.pdf ,Quest Nutrition,2018-09-28 00:00:00,https://dojmt.gov/consumer/consumers-known-data-breach-incidents/#,2017-11-10 00:00:00,Montana
8/22/2018-8/22/2018,2018-08-22 00:00:00,10 in Montana, https://media.dojmt.gov/wp-content/uploads/Wintrust-Financial-Corporation.pdf ,Wintrust Financial Corporation,2018-09-28 00:00:00,https://dojmt.gov/consumer/consumers-known-data-breach-incidents/#,2018-08-22 00:00:00,Montana
8/15/2018-8/30/2018,2018-08-30 00:00:00,1 in Montana, https://media.dojmt.gov/wp-content/uploads/Toyota.pdf ,Toyota Industries Group North America,2018-10-01 00:00:00,https://dojmt.gov/consumer/consumers-known-data-breach-incidents/#,2018-08-15 00:00:00,Montana
2/7/2018-3/27/2018,2018-03-27 00:00:00,10 in Montana, https://media.dojmt.gov/wp-content/uploads/TransUnion-Bodies-of-America-LLC.pdf ,North American Risk Services,2018-10-05 00:00:00,https://dojmt.gov/consumer/consumers-known-data-breach-incidents/#,2018-02-07 00:00:00,Montana
2/22/2017-8/27/2018,2018-08-27 00:00:00,7 in Montana, https://media.dojmt.gov/wp-content/uploads/California-State-University-East-Bay.pdf ,TransUnion (Bodies of America LLC),2018-10-05 00:00:00,https://dojmt.gov/consumer/consumers-known-data-breach-incidents/#,2017-02-22 00:00:00,Montana
3/27/2017-9/2/2018,2018-09-02 00:00:00,6 in Montana, https://media.dojmt.gov/wp-content/uploads/Rebound-Orthopedics-Neurosurgery.pdf ,California State University East Bay,2018-10-05 00:00:00,https://dojmt.gov/consumer/consumers-known-data-breach-incidents/#,2017-03-27 00:00:00,Montana
5/22/2018-5/22/2018,2018-05-22 00:00:00,2 in Montana, https://media.dojmt.gov/wp-content/uploads/Five-Below.pdf ,Rebound Orthopedics & Neurosurgery,2018-10-05 00:00:00,https://dojmt.gov/consumer/consumers-known-data-breach-incidents/#,2018-05-22 00:00:00,Montana
8/14/2018-9/19/2018,2018-09-19 00:00:00,3 in Montana, https://media.dojmt.gov/wp-content/uploads/HealthFitness.pdf ,Five Below,2018-10-05 00:00:00,https://dojmt.gov/consumer/consumers-known-data-breach-incidents/#,2018-08-14 00:00:00,Montana
1/8/2018-12/31/2017,2017-12-31 00:00:00,123 in Montana, https://media.dojmt.gov/wp-content/uploads/North-American-Risk-Services-1.pdf ,HealthFitness,2018-10-05 00:00:00,https://dojmt.gov/consumer/consumers-known-data-breach-incidents/#,2018-01-08 00:00:00,Montana
9/1/2013-8/31/2017,2017-08-31 00:00:00,1 in Montana, https://media.dojmt.gov/wp-content/uploads/Advanced-Medical-Reviews-LLC.pdf ,"Advanced Medical Reviews, LLC",2018-10-08 00:00:00,https://dojmt.gov/consumer/consumers-known-data-breach-incidents/#,2013-09-01 00:00:00,Montana
11/1/2017-12/1/2017,2017-12-01 00:00:00,1 in Montana, https://media.dojmt.gov/wp-content/uploads/DecisionHR.pdf ,DecisionHR,2018-10-08 00:00:00,https://dojmt.gov/consumer/consumers-known-data-breach-incidents/#,2017-11-01 00:00:00,Montana
9/5/2018-9/24/2018,2018-09-24 00:00:00,6 in Montana, https://media.dojmt.gov/wp-content/uploads/Cigna.pdf ,Cigna,2018-10-10 00:00:00,https://dojmt.gov/consumer/consumers-known-data-breach-incidents/#,2018-09-05 00:00:00,Montana
7/1/2018-7/31/2018,2018-07-31 00:00:00,16 in Montana, https://media.dojmt.gov/wp-content/uploads/Envision.pdf ,Envision,2018-10-10 00:00:00,https://dojmt.gov/consumer/consumers-known-data-breach-incidents/#,2018-07-01 00:00:00,Montana
9/7/2018-9/10/2018,2018-09-10 00:00:00,1 in Montana, https://media.dojmt.gov/wp-content/uploads/Northwestern-Mutual-1.pdf ,Northwestern Mutual,2018-10-10 00:00:00,https://dojmt.gov/consumer/consumers-known-data-breach-incidents/#,2018-09-07 00:00:00,Montana
9/28/2018-9/28/2018,2018-09-28 00:00:00,2 in Montana, https://media.dojmt.gov/wp-content/uploads/United-States-Liablity-Insurance-Company-USLI.pdf ,United States Liablity Insurance Company (USLI),2018-10-11 00:00:00,https://dojmt.gov/consumer/consumers-known-data-breach-incidents/#,2018-09-28 00:00:00,Montana
,,1 in Montana, https://media.dojmt.gov/wp-content/uploads/Ameriprise-Finacial-Auto-and-Home.pdf ,Ameriprise Financial (Auto and Home),2018-10-11 00:00:00,https://dojmt.gov/consumer/consumers-known-data-breach-incidents/#,,Montana
8/12/2018-9/29/2018,2018-09-29 00:00:00,3 in Montana, https://media.dojmt.gov/wp-content/uploads/Okabena-Company.pdf ,Okabena Company,2018-10-12 00:00:00,https://dojmt.gov/consumer/consumers-known-data-breach-incidents/#,2018-08-12 00:00:00,Montana
9/15/2018-9/17/2018,2018-09-17 00:00:00,5 in Montana, https://media.dojmt.gov/wp-content/uploads/Netrition.pdf ,Netrition,2018-10-15 00:00:00,https://dojmt.gov/consumer/consumers-known-data-breach-incidents/#,2018-09-15 00:00:00,Montana
,,1 in Montana, https://media.dojmt.gov/wp-content/uploads/Landcar.pdf ,Landcar,2018-10-16 00:00:00,https://dojmt.gov/consumer/consumers-known-data-breach-incidents/#,,Montana
5/1/2018-5/31/2018,2018-05-31 00:00:00,2 in Montana, https://media.dojmt.gov/wp-content/uploads/Tallahassee-Memorial-Healthcare.pdf ,Tallahassee Memorial Healthcare,2018-10-17 00:00:00,https://dojmt.gov/consumer/consumers-known-data-breach-incidents/#,2018-05-01 00:00:00,Montana
6/1/2018-10/11/2018,2018-10-11 00:00:00,1 in Montana, https://media.dojmt.gov/wp-content/uploads/Folio-Conversant-Folio.pdf ,Folio Conversant (Folio),2018-10-18 00:00:00,https://dojmt.gov/consumer/consumers-known-data-breach-incidents/#,2018-06-01 00:00:00,Montana
6/5/2018-6/13/2018,2018-06-13 00:00:00,90 in Montana, https://media.dojmt.gov/wp-content/uploads/RenPSG-1.pdf ,RenPSG,2018-10-18 00:00:00,https://dojmt.gov/consumer/consumers-known-data-breach-incidents/#,2018-06-05 00:00:00,Montana
9/14/2018-9/17/2018,2018-09-17 00:00:00,4 in Montana, https://media.dojmt.gov/wp-content/uploads/Scrapbook.com_.pdf ,Scrapbook.com,2018-10-19 00:00:00,https://dojmt.gov/consumer/consumers-known-data-breach-incidents/#,2018-09-14 00:00:00,Montana
9/17/2018-9/18/2018,2018-09-18 00:00:00,5 in Montana, https://media.dojmt.gov/wp-content/uploads/Harvest-Wealth.pdf ,Harvest Wealth,2018-10-19 00:00:00,https://dojmt.gov/consumer/consumers-known-data-breach-incidents/#,2018-09-17 00:00:00,Montana
4/11/2018-9/13/2018,2018-09-13 00:00:00,62 in Montana, https://media.dojmt.gov/wp-content/uploads/STL-International-Teeter.pdf ,STL International (Teeter),2018-10-22 00:00:00,https://dojmt.gov/consumer/consumers-known-data-breach-incidents/#,2018-04-11 00:00:00,Montana
9/12/2018-9/12/2018,2018-09-12 00:00:00,1 in Montana, https://media.dojmt.gov/wp-content/uploads/Byram-Healthcare.pdf ,Byram Healthcare,2018-10-22 00:00:00,https://dojmt.gov/consumer/consumers-known-data-breach-incidents/#,2018-09-12 00:00:00,Montana
9/26/2018-9/27/2018,2018-09-27 00:00:00,1 in Montana, https://media.dojmt.gov/wp-content/uploads/US-Bank-2.pdf ,US Bank,2018-10-23 00:00:00,https://dojmt.gov/consumer/consumers-known-data-breach-incidents/#,2018-09-26 00:00:00,Montana
6/28/2018-7/2/2018,2018-07-02 00:00:00,1 in Montana, https://media.dojmt.gov/wp-content/uploads/Reliable-Respiratory-Reliable.pdf ,Reliable Respiratory (Reliable),2018-10-23 00:00:00,https://dojmt.gov/consumer/consumers-known-data-breach-incidents/#,2018-06-28 00:00:00,Montana
7/1/2018-8/31/2018,2018-08-31 00:00:00,1 in Montana, https://media.dojmt.gov/wp-content/uploads/Catawba-Valley-Medical-Center-CVMC.pdf ,Catawba Valley Medical Center (CVMC),2018-10-23 00:00:00,https://dojmt.gov/consumer/consumers-known-data-breach-incidents/#,2018-07-01 00:00:00,Montana
8/23/2018-8/24/2018,2018-08-24 00:00:00,1 in Montana, https://media.dojmt.gov/wp-content/uploads/CHOP.pdf ,Children's Hospital of Philadelphia (CHOP),2018-10-23 00:00:00,https://dojmt.gov/consumer/consumers-known-data-breach-incidents/#,2018-08-23 00:00:00,Montana
1/1/2014-11/10/2017,2017-11-10 00:00:00,3 in Montana, https://media.dojmt.gov/wp-content/uploads/TIO.pdf ,TIO,2018-10-23 00:00:00,https://dojmt.gov/consumer/consumers-known-data-breach-incidents/#,2014-01-01 00:00:00,Montana
6/9/2018-7/23/2018,2018-07-23 00:00:00,8 in Montana, https://media.dojmt.gov/wp-content/uploads/Capital-One-5.pdf ,Capital One,2018-10-25 00:00:00,https://dojmt.gov/consumer/consumers-known-data-breach-incidents/#,2018-06-09 00:00:00,Montana
7/7/2017-10/2/2018,2018-10-02 00:00:00,265 in Montana, https://media.dojmt.gov/wp-content/uploads/GS1-US.pdf ,GS1 US,2018-10-25 00:00:00,https://dojmt.gov/consumer/consumers-known-data-breach-incidents/#,2017-07-07 00:00:00,Montana
8/13/2018-9/25/2018,2018-09-25 00:00:00,15 in Montana, https://media.dojmt.gov/wp-content/uploads/TravisMathew.pdf ,TravisMathew,2018-10-25 00:00:00,https://dojmt.gov/consumer/consumers-known-data-breach-incidents/#,2018-08-13 00:00:00,Montana
9/22/2018-9/25/2018,2018-09-25 00:00:00,32 in Montana, https://media.dojmt.gov/wp-content/uploads/Net32.pdf ,Net32,2018-10-25 00:00:00,https://dojmt.gov/consumer/consumers-known-data-breach-incidents/#,2018-09-22 00:00:00,Montana
5/30/2018-9/13/2018,2018-09-13 00:00:00,44 in Montana, https://media.dojmt.gov/wp-content/uploads/Bankers-Life-1.pdf ,Bankers Life,2018-10-25 00:00:00,https://dojmt.gov/consumer/consumers-known-data-breach-incidents/#,2018-05-30 00:00:00,Montana
4/21/2018-10/25/2018,2018-10-25 00:00:00,20 in Montana, https://media.dojmt.gov/wp-content/uploads/British-Airways.pdf ,British Airways,2018-10-26 00:00:00,https://dojmt.gov/consumer/consumers-known-data-breach-incidents/#,2018-04-21 00:00:00,Montana
8/9/2018-10/2/2018,2018-10-02 00:00:00,2 in Montana, https://media.dojmt.gov/wp-content/uploads/International-Society-of-Explosives-Engineers-ISEE.pdf ,International Society of Explosives Engineers (ISEE),2018-10-26 00:00:00,https://dojmt.gov/consumer/consumers-known-data-breach-incidents/#,2018-08-09 00:00:00,Montana
6/1/2018-6/4/2018,2018-06-04 00:00:00,2 in Montana, https://media.dojmt.gov/wp-content/uploads/Star-Title-Partners-of-Palm-Harbor-LLC-Star-Title.pdf ,"Star Title Partners of Palm Harbor, LLC (Star Title)",2018-10-26 00:00:00,https://dojmt.gov/consumer/consumers-known-data-breach-incidents/#,2018-06-01 00:00:00,Montana
3/9/2017-4/5/2017,2017-04-05 00:00:00,27 in Montana, https://media.dojmt.gov/wp-content/uploads/Professional-Publications-2.pdf ,Professional Publications,2018-10-27 00:00:00,https://dojmt.gov/consumer/consumers-known-data-breach-incidents/#,2017-03-09 00:00:00,Montana
9/18/2018-9/18/2018,2018-09-18 00:00:00,1 in Montana, https://media.dojmt.gov/wp-content/uploads/LJCooper-Capital-Management-LLC-LJCooper.pdf ,LJCooper,2018-10-29 00:00:00,https://dojmt.gov/consumer/consumers-known-data-breach-incidents/#,2018-09-18 00:00:00,Montana
12/9/2016-9/13/2018,2018-09-13 00:00:00,18 in Montana, https://media.dojmt.gov/wp-content/uploads/El-Paso.pdf ,El Paso - Los Angles Limousine Express,2018-11-02 00:00:00,https://dojmt.gov/consumer/consumers-known-data-breach-incidents/#,2016-12-09 00:00:00,Montana
8/6/2018-8/6/2018,2018-08-06 00:00:00,1 in Montana, https://media.dojmt.gov/wp-content/uploads/Five-Guys.pdf ,Five Guys,2018-11-02 00:00:00,https://dojmt.gov/consumer/consumers-known-data-breach-incidents/#,2018-08-06 00:00:00,Montana
9/1/2018-9/1/2018,2018-09-01 00:00:00,1 in Montana, https://media.dojmt.gov/wp-content/uploads/Hemenway-Barnes-LLP-and-Hemenway-Trust-Company-Hemenway.pdf ,Hemenway & Barnes LLP and Hemenway Trust Company (Hemenway),2018-11-02 00:00:00,https://dojmt.gov/consumer/consumers-known-data-breach-incidents/#,2018-09-01 00:00:00,Montana
1/1/2017-10/31/2017,2017-10-31 00:00:00,3 in Montana, https://media.dojmt.gov/wp-content/uploads/Inova-Health-System-Inova.pdf ,Inova Health System (Inova),2018-11-02 00:00:00,https://dojmt.gov/consumer/consumers-known-data-breach-incidents/#,2017-01-01 00:00:00,Montana
8/28/2018-8/29/2018,2018-08-29 00:00:00,24 in Montana, https://media.dojmt.gov/wp-content/uploads/ImpactAssets.pdf ,ImpactAssets,2018-11-02 00:00:00,https://dojmt.gov/consumer/consumers-known-data-breach-incidents/#,2018-08-28 00:00:00,Montana
12/6/2017-6/27/2018,2018-06-27 00:00:00,684 in Montana, https://media.dojmt.gov/wp-content/uploads/Thesy.pdf ,Thesy,2018-11-05 00:00:00,https://dojmt.gov/consumer/consumers-known-data-breach-incidents/#,2017-12-06 00:00:00,Montana
10/9/2018-10/9/2018,2018-10-09 00:00:00,7 in Montana, https://media.dojmt.gov/wp-content/uploads/Nordstrom.pdf ,Nordstrom,2018-11-05 00:00:00,https://dojmt.gov/consumer/consumers-known-data-breach-incidents/#,2018-10-09 00:00:00,Montana
10/5/2018-10/9/2018,2018-10-09 00:00:00,1 in Montana, https://media.dojmt.gov/wp-content/uploads/Sirchie-Acquisition-Company-Sirchie.pdf ,Sirchie Acquisition Company (Sirchie),2018-11-05 00:00:00,https://dojmt.gov/consumer/consumers-known-data-breach-incidents/#,2018-10-05 00:00:00,Montana
12/1/2016-1/31/2017,2017-01-31 00:00:00,4 in Montana, https://media.dojmt.gov/wp-content/uploads/Collier-Heggerness-Bronk-CPAs-PS-Inc.pdf ,Collier Heggerness & Bronk CPA's PS Inc,2018-11-07 00:00:00,https://dojmt.gov/consumer/consumers-known-data-breach-incidents/#,2016-12-01 00:00:00,Montana
10/12/2018-10/16/2018,2018-10-16 00:00:00,4 in Montana, https://media.dojmt.gov/wp-content/uploads/Julep-Beauty.pdf ,Julep Beauty,2018-11-07 00:00:00,https://dojmt.gov/consumer/consumers-known-data-breach-incidents/#,2018-10-12 00:00:00,Montana
12/6/2017-2/25/2018,2018-02-25 00:00:00,167 in Montana, https://media.dojmt.gov/wp-content/uploads/Unified-Trust-Company.pdf ,United Trust Company,2018-11-07 00:00:00,https://dojmt.gov/consumer/consumers-known-data-breach-incidents/#,2017-12-06 00:00:00,Montana
10/23/2018-10/24/2018,2018-10-24 00:00:00,1 in Montana, https://media.dojmt.gov/wp-content/uploads/New-York-Life-Insurance-Company.pdf ,New York Life Insurance Company,2018-11-08 00:00:00,https://dojmt.gov/consumer/consumers-known-data-breach-incidents/#,2018-10-23 00:00:00,Montana
7/17/2018-7/17/2018,2018-07-17 00:00:00,3 in Montana, https://media.dojmt.gov/wp-content/uploads/American-Medical-Response.pdf ,American Medical Response (AMR),2018-11-09 00:00:00,https://dojmt.gov/consumer/consumers-known-data-breach-incidents/#,2018-07-17 00:00:00,Montana
10/5/2018-10/5/2018,2018-10-05 00:00:00,1 in Montana, https://media.dojmt.gov/wp-content/uploads/OrthoTexas-Physicians-and-Surgeons.pdf ,OrthoTexas Physicians and Surgeons,2018-11-09 00:00:00,https://dojmt.gov/consumer/consumers-known-data-breach-incidents/#,2018-10-05 00:00:00,Montana
10/4/2018-10/14/2018,2018-10-14 00:00:00,2 in Montana, https://media.dojmt.gov/wp-content/uploads/HSBC-Bank-USA-Nation-Association-HSBC.pdf ,HSBC,2018-11-09 00:00:00,https://dojmt.gov/consumer/consumers-known-data-breach-incidents/#,2018-10-04 00:00:00,Montana
12/28/2017-7/9/2018,2018-07-09 00:00:00,1143 in Montana, https://media.dojmt.gov/wp-content/uploads/Title-Nine-Sports.pdf ,Title Nine Sports,2018-11-12 00:00:00,https://dojmt.gov/consumer/consumers-known-data-breach-incidents/#,2017-12-28 00:00:00,Montana
2/1/2018-7/15/2018,2018-07-15 00:00:00,2 in Montana, https://media.dojmt.gov/wp-content/uploads/Jennifer-Miller-Ltd..pdf ,Jennifer Miller Ltd.,2018-11-12 00:00:00,https://dojmt.gov/consumer/consumers-known-data-breach-incidents/#,2018-02-01 00:00:00,Montana
10/15/2018-10/18/2018,2018-10-18 00:00:00,Fewer than 10 in Montana, https://media.dojmt.gov/wp-content/uploads/Marimekko.pdf ,Marimekko,2018-11-12 00:00:00,https://dojmt.gov/consumer/consumers-known-data-breach-incidents/#,2018-10-15 00:00:00,Montana
5/11/2018-7/6/2018,2018-07-06 00:00:00,165 in Montana, https://media.dojmt.gov/wp-content/uploads/StataCorp.pdf ,StataCorp,2018-11-13 00:00:00,https://dojmt.gov/consumer/consumers-known-data-breach-incidents/#,2018-05-11 00:00:00,Montana
12/28/2017-7/9/2018,2018-07-09 00:00:00,109 in Montana, https://media.dojmt.gov/wp-content/uploads/Stein-Mart.pdf ,Stein Mart,2018-11-13 00:00:00,https://dojmt.gov/consumer/consumers-known-data-breach-incidents/#,2017-12-28 00:00:00,Montana
8/18/2018-9/23/2018,2018-09-23 00:00:00,2 in Montana, https://media.dojmt.gov/wp-content/uploads/Hats.com_.pdf ,Hats.com,2018-11-14 00:00:00,https://dojmt.gov/consumer/consumers-known-data-breach-incidents/#,2018-08-18 00:00:00,Montana
9/8/2018-9/8/2018,2018-09-08 00:00:00,1 in Montana, https://media.dojmt.gov/wp-content/uploads/Washington-Initiative-for-Supported-Employment.pdf ,Washington Initiative for Supported Employment,2018-11-14 00:00:00,https://dojmt.gov/consumer/consumers-known-data-breach-incidents/#,2018-09-08 00:00:00,Montana
8/13/2018-9/19/2018,2018-09-19 00:00:00,651 in Montana, https://media.dojmt.gov/wp-content/uploads/Newegg.pdf ,Newegg,2018-11-15 00:00:00,https://dojmt.gov/consumer/consumers-known-data-breach-incidents/#,2018-08-13 00:00:00,Montana
9/4/2018-10/5/2018,2018-10-05 00:00:00,2141 in Montana, https://media.dojmt.gov/wp-content/uploads/HealthEquity-2.pdf ,HealthEquity,2018-11-15 00:00:00,https://dojmt.gov/consumer/consumers-known-data-breach-incidents/#,2018-09-04 00:00:00,Montana
10/10/2018-10/10/2018,2018-10-10 00:00:00,1 in Montana, https://media.dojmt.gov/wp-content/uploads/1-800-Contacts-1.pdf ,1-800 Contacts,2018-11-16 00:00:00,https://dojmt.gov/consumer/consumers-known-data-breach-incidents/#,2018-10-10 00:00:00,Montana
5/8/2018-5/11/2018,2018-05-11 00:00:00,5 in Montana, https://media.dojmt.gov/wp-content/uploads/El-Centro-Regional-Medical-Center-ECRMC.pdf ,El Centro Regional Medical Center (ECRMC),2018-11-16 00:00:00,https://dojmt.gov/consumer/consumers-known-data-breach-incidents/#,2018-05-08 00:00:00,Montana
4/20/2018-4/27/2018,2018-04-27 00:00:00,7 in Montana, https://media.dojmt.gov/wp-content/uploads/New-York-Oncology-Hematology-P.C.-NYOH.pdf ,"New York Oncology Hematology, P.C. (NYOH)",2018-11-16 00:00:00,https://dojmt.gov/consumer/consumers-known-data-breach-incidents/#,2018-04-20 00:00:00,Montana
3/1/2017-3/31/2017,2017-03-31 00:00:00,1 in Montana, https://media.dojmt.gov/wp-content/uploads/Cincinatti-Reds.pdf ,Cincinatti Reds,2018-11-19 00:00:00,https://dojmt.gov/consumer/consumers-known-data-breach-incidents/#,2017-03-01 00:00:00,Montana
12/28/2017-7/9/2018,2018-07-09 00:00:00,120 in Montana, https://media.dojmt.gov/wp-content/uploads/Francescas-Services-Corporation-Francescas.pdf ,Francesca's Services Corporation (Francesca's),2018-11-19 00:00:00,https://dojmt.gov/consumer/consumers-known-data-breach-incidents/#,2017-12-28 00:00:00,Montana
5/1/2018-10/23/2018,2018-10-23 00:00:00,48 in Montana, https://media.dojmt.gov/wp-content/uploads/R.R.-Bowker-LLC-Bowker.pdf ,R.R. Bowker LLC (Bowker),2018-11-20 00:00:00,https://dojmt.gov/consumer/consumers-known-data-breach-incidents/#,2018-05-01 00:00:00,Montana
10/11/2018-10/11/2018,2018-10-11 00:00:00,8 in Montana, https://media.dojmt.gov/wp-content/uploads/Medtronic-Minimed.pdf ,Medtronic Minimed,2018-11-21 00:00:00,https://dojmt.gov/consumer/consumers-known-data-breach-incidents/#,2018-10-11 00:00:00,Montana
4/24/2017-12/31/2017,2017-12-31 00:00:00,1 in Montana, https://media.dojmt.gov/wp-content/uploads/Tandigm-Health-Tandigm.pdf ,Tandigm Health (Tandigm),2018-11-21 00:00:00,https://dojmt.gov/consumer/consumers-known-data-breach-incidents/#,2017-04-24 00:00:00,Montana
10/3/2018-10/16/2018,2018-10-16 00:00:00,17 in Montana, https://media.dojmt.gov/wp-content/uploads/Prosper-Funding-LLC-Prosper.pdf ,Prosper Funding LLC (Prosper),2018-11-26 00:00:00,https://dojmt.gov/consumer/consumers-known-data-breach-incidents/#,2018-10-03 00:00:00,Montana
5/2/2018-5/5/2018,2018-05-05 00:00:00,190 in Montana, https://media.dojmt.gov/wp-content/uploads/Cancer-Treatment-Centers-of-America-CTCA.pdf ,Cancer Treatment Centers of America (CTCA),2018-11-26 00:00:00,https://dojmt.gov/consumer/consumers-known-data-breach-incidents/#,2018-05-02 00:00:00,Montana
9/22/2018-9/29/2018,2018-09-29 00:00:00,230 in Montana, https://media.dojmt.gov/wp-content/uploads/Atrium-Health.pdf ,Atrium Health,2018-11-27 00:00:00,https://dojmt.gov/consumer/consumers-known-data-breach-incidents/#,2018-09-22 00:00:00,Montana
10/5/2018-11/26/2018,2018-11-26 00:00:00,14 in Montana, https://media.dojmt.gov/wp-content/uploads/Dunkin-Brands-Inc..pdf ,Dunkin Brands Inc,2018-11-28 00:00:00,https://dojmt.gov/consumer/consumers-known-data-breach-incidents/#,2018-10-05 00:00:00,Montana
1/20/2018-6/18/2018,2018-06-18 00:00:00,1 in Montana, https://media.dojmt.gov/wp-content/uploads/Potomac-Healthcare-Solutions.pdf ,Potomac Healthcare Solutions,2018-11-28 00:00:00,https://dojmt.gov/consumer/consumers-known-data-breach-incidents/#,2018-01-20 00:00:00,Montana
9/22/2018-9/29/2018,2018-09-29 00:00:00,3 in Montana, https://media.dojmt.gov/wp-content/uploads/Baylor-Scott-White-Medical-Center-Frisco-BSWF.pdf ,Baylor Scott & White Medical Center - Frisco (BSWF),2018-11-28 00:00:00,https://dojmt.gov/consumer/consumers-known-data-breach-incidents/#,2018-09-22 00:00:00,Montana
1/24/2018-9/11/2018,2018-09-11 00:00:00,1 in Montana, https://media.dojmt.gov/wp-content/uploads/Equity-Concepts-1.pdf ,Equity Concepts,2018-11-29 00:00:00,https://dojmt.gov/consumer/consumers-known-data-breach-incidents/#,2018-01-24 00:00:00,Montana
3/1/2017-10/10/2018,2018-10-10 00:00:00,13 in Montana, https://media.dojmt.gov/wp-content/uploads/Viyet-LLC-DBA-Sothebys-Home-Sothebys-Home.pdf ,"Viyet, LLC DBA Sotheby's Home (Sotheby's Home)",2018-11-29 00:00:00,https://dojmt.gov/consumer/consumers-known-data-breach-incidents/#,2017-03-01 00:00:00,Montana
6/5/2018-6/11/2018,2018-06-11 00:00:00,3 in Montana, https://media.dojmt.gov/wp-content/uploads/Rosenberg-Manente-PLLC.pdf ,"Rosenberg & Manente, PLLC",2018-11-30 00:00:00,https://dojmt.gov/consumer/consumers-known-data-breach-incidents/#,2018-06-05 00:00:00,Montana
10/1/2018-10/15/2018,2018-10-15 00:00:00,3 in Montana, https://media.dojmt.gov/wp-content/uploads/Franciscan-University-of-Steubenville.pdf ,Franciscan University of Steubenville,2018-11-30 00:00:00,https://dojmt.gov/consumer/consumers-known-data-breach-incidents/#,2018-10-01 00:00:00,Montana
8/15/2014-9/15/2018,2018-09-15 00:00:00,19 in Montana, https://media.dojmt.gov/wp-content/uploads/Ontario-Inc.-www.1800flowers.ca_.pdf ,Ontario Inc. (www.1800flowers.ca),2018-11-30 00:00:00,https://dojmt.gov/consumer/consumers-known-data-breach-incidents/#,2014-08-15 00:00:00,Montana
8/15/2018-10/10/2018,2018-10-10 00:00:00,7 in Montana, https://media.dojmt.gov/wp-content/uploads/Walters-and-Mason-Retail-Atalrd-State.pdf ,Walters and Mason Retail (Atalr'd State),2018-11-30 00:00:00,https://dojmt.gov/consumer/consumers-known-data-breach-incidents/#,2018-08-15 00:00:00,Montana
1/1/2014-11/19/2018,2018-11-19 00:00:00,Unknown in Montana, https://media.dojmt.gov/wp-content/uploads/Marriott-International-Starwood.pdf ,Marriott International (Starwood),2018-11-30 00:00:00,https://dojmt.gov/consumer/consumers-known-data-breach-incidents/#,2014-01-01 00:00:00,Montana
9/29/2018-11/5/2018,2018-11-05 00:00:00,1 in Montana, https://media.dojmt.gov/wp-content/uploads/KMS-Financial-Services-Inc.-KMS.pdf ,"KMS Financial Services, Inc. (KMS)",2018-12-03 00:00:00,https://dojmt.gov/consumer/consumers-known-data-breach-incidents/#,2018-09-29 00:00:00,Montana
2/5/2018-8/21/2018,2018-08-21 00:00:00,80 in Montana, https://media.dojmt.gov/wp-content/uploads/San-Diego-Hardware.pdf ,San Diego Hardware,2018-12-05 00:00:00,https://dojmt.gov/consumer/consumers-known-data-breach-incidents/#,2018-02-05 00:00:00,Montana
10/31/2017-3/15/2018,2018-03-15 00:00:00,135 in Montana, https://media.dojmt.gov/wp-content/uploads/Vega.pdf ,Vega,2018-12-05 00:00:00,https://dojmt.gov/consumer/consumers-known-data-breach-incidents/#,2017-10-31 00:00:00,Montana
11/21/2018-11/21/2018,2018-11-21 00:00:00,1 in Montana, https://media.dojmt.gov/wp-content/uploads/EmployBridge.pdf ,EmployBridge,2018-12-05 00:00:00,https://dojmt.gov/consumer/consumers-known-data-breach-incidents/#,2018-11-21 00:00:00,Montana
11/6/2018-11/6/2018,2018-11-06 00:00:00,2 in Montana, https://media.dojmt.gov/wp-content/uploads/Sunquest-Information-Systems-Inc..pdf ,"Sunquest Information Systems, Inc.",2018-12-06 00:00:00,https://dojmt.gov/consumer/consumers-known-data-breach-incidents/#,2018-11-06 00:00:00,Montana
4/4/2018-9/13/2018,2018-09-13 00:00:00,1.0 in Montana, https://media.dojmt.gov/wp-content/uploads/Royal-Caribean-Cruises-LTD.pdf ,Royal Caribean Cruises LTD,2018-12-06 00:00:00,https://dojmt.gov/consumer/consumers-known-data-breach-incidents/#,2018-04-04 00:00:00,Montana
8/28/2018-9/10/2018,2018-09-10 00:00:00,2.0 in Montana, https://media.dojmt.gov/wp-content/uploads/Harley-Davidson-Motor-company-Inc.-Harley-Davidson.pdf ,"Harley-Davidson Motor company, Inc. (Harley-Davidson)",2018-12-06 00:00:00,https://dojmt.gov/consumer/consumers-known-data-breach-incidents/#,2018-08-28 00:00:00,Montana
6/7/2018-11/20/2018,2018-11-20 00:00:00,44.0 in Montana, https://media.dojmt.gov/wp-content/uploads/Piech-Sales-Company-LLC-ValuePetSupplies.com_.pdf ,"Piech Sales Company, LLC (ValuePetSupplies.com)",2018-12-07 00:00:00,https://dojmt.gov/consumer/consumers-known-data-breach-incidents/#,2018-06-07 00:00:00,Montana
9/27/2018-11/7/2018,2018-11-07 00:00:00,1.0 in Montana, https://media.dojmt.gov/wp-content/uploads/Robert-Graham-Designs-LLC.pdf ,"Robert Graham Designs, LLC",2018-12-07 00:00:00,https://dojmt.gov/consumer/consumers-known-data-breach-incidents/#,2018-09-27 00:00:00,Montana
11/9/2018-11/22/2018,2018-11-22 00:00:00,1.0 in Montana, https://media.dojmt.gov/wp-content/uploads/MUFG-Union-Bank.pdf ,MUFG Union Bank,2018-12-07 00:00:00,https://dojmt.gov/consumer/consumers-known-data-breach-incidents/#,2018-11-09 00:00:00,Montana
11/23/2017-10/25/2018,2018-10-25 00:00:00,385.0 in Montana, https://media.dojmt.gov/wp-content/uploads/Titan-Manufacturing-and-Distributing-Inc.-Titan.pdf ,"Titan Manufacturing and Distributing, Inc. (Titan)",2018-12-07 00:00:00,https://dojmt.gov/consumer/consumers-known-data-breach-incidents/#,2017-11-23 00:00:00,Montana
7/2/2018-8/14/2018,2018-08-14 00:00:00,4.0 in Montana, https://media.dojmt.gov/wp-content/uploads/Frontier-Wealth-Management-LLC-Frontier.pdf ,"Frontier Wealth Management, LLC (Frontier)",2018-12-10 00:00:00,https://dojmt.gov/consumer/consumers-known-data-breach-incidents/#,2018-07-02 00:00:00,Montana
4/1/2018-11/28/2018,2018-11-28 00:00:00,1.0 in Montana, https://media.dojmt.gov/wp-content/uploads/Kalispell-OBGYN-Associates.pdf ,Kalispell OB/GYN Associates,2018-12-11 00:00:00,https://dojmt.gov/consumer/consumers-known-data-breach-incidents/#,2018-04-01 00:00:00,Montana
,,nan in Montana,,,,https://dojmt.gov/consumer/consumers-known-data-breach-incidents/#,,Montana
8/7/2018-8/15/2017,2017-08-15 00:00:00,2.0 in Montana, https://media.dojmt.gov/wp-content/uploads/Beecher-Carlson.pdf ,Beecher Carlson,2018-12-11 00:00:00,https://dojmt.gov/consumer/consumers-known-data-breach-incidents/#,2018-08-07 00:00:00,Montana
5/1/2018-9/24/2018,2018-09-24 00:00:00,28.0 in Montana, https://media.dojmt.gov/wp-content/uploads/Farmer-Bros.-Co..pdf ,Farmer Bros. Co.,2018-12-11 00:00:00,https://dojmt.gov/consumer/consumers-known-data-breach-incidents/#,2018-05-01 00:00:00,Montana
11/24/2018-11/26/2018,2018-11-26 00:00:00,5.0 in Montana, https://media.dojmt.gov/wp-content/uploads/Backcountry-Edge.pdf ,Backcountry Edge,2018-12-11 00:00:00,https://dojmt.gov/consumer/consumers-known-data-breach-incidents/#,2018-11-24 00:00:00,Montana
9/7/2018-9/7/2018,2018-09-07 00:00:00,1.0 in Montana, https://media.dojmt.gov/wp-content/uploads/COR-Clearing-LLC-COR.pdf ,COR Clearing LLC (COR),2018-12-12 00:00:00,https://dojmt.gov/consumer/consumers-known-data-breach-incidents/#,2018-09-07 00:00:00,Montana
2/15/2018-4/12/2018,2018-04-12 00:00:00,1.0 in Montana, https://media.dojmt.gov/wp-content/uploads/Exude-Inc.-dba-Exude-Benefits-Group.pdf ,"Exude, Inc. d/b/a Exude Benefits Group",2018-12-14 00:00:00,https://dojmt.gov/consumer/consumers-known-data-breach-incidents/#,2018-02-15 00:00:00,Montana
11/12/2018-11/13/2018,2018-11-13 00:00:00,11.0 in Montana, https://media.dojmt.gov/wp-content/uploads/Free-Speech-Systems-LLC-InfoWars.pdf ,Free Speech Systems LLC (InfoWars),2018-12-14 00:00:00,https://dojmt.gov/consumer/consumers-known-data-breach-incidents/#,2018-11-12 00:00:00,Montana
7/27/2018-8/2/2018,2018-08-02 00:00:00,129.0 in Montana, https://media.dojmt.gov/wp-content/uploads/Springstone-Financial.pdf ,Springstone Financial,2018-12-14 00:00:00,https://dojmt.gov/consumer/consumers-known-data-breach-incidents/#,2018-07-27 00:00:00,Montana
9/8/2018-10/2/2018,2018-10-02 00:00:00,2.0 in Montana, https://media.dojmt.gov/wp-content/uploads/Dr.-Ben-Lynch-LLC.pdf ,"Dr. Ben Lynch, LLC",2018-12-17 00:00:00,https://dojmt.gov/consumer/consumers-known-data-breach-incidents/#,2018-09-08 00:00:00,Montana
8/2/2018-9/26/2018,2018-09-26 00:00:00,9.0 in Montana, https://media.dojmt.gov/wp-content/uploads/Beverages-More-Inc.-BevMo-1.pdf ,"Beverages & More, Inc. (BevMo)",2018-12-17 00:00:00,https://dojmt.gov/consumer/consumers-known-data-breach-incidents/#,2018-08-02 00:00:00,Montana
9/28/2018-11/20/2018,2018-11-20 00:00:00,6.0 in Montana, https://media.dojmt.gov/wp-content/uploads/GoldSilver-LLC.pdf ,GoldSilver LLC,2018-12-19 00:00:00,https://dojmt.gov/consumer/consumers-known-data-breach-incidents/#,2018-09-28 00:00:00,Montana
11/16/2018-12/20/2018,2018-12-20 00:00:00,1.0 in Montana, https://media.dojmt.gov/wp-content/uploads/Avis-Budget-Car-Rental-LLC.pdf ,"Avis Budget Car Rental, LLC",2018-12-19 00:00:00,https://dojmt.gov/consumer/consumers-known-data-breach-incidents/#,2018-11-16 00:00:00,Montana
11/4/2018-12/5/2018,2018-12-05 00:00:00,1 in Montana, https://media.dojmt.gov/wp-content/uploads/Wausau-MedMal-Management-Services-LLC-Wisconsin-Health-Care-Liability-Insurance-Plan.pdf ,"Wausau MedMal Management Services, LLC (Wisconsin Health Care Liability Insurance Plan)",2018-12-20 00:00:00,https://dojmt.gov/consumer/consumers-known-data-breach-incidents/#,2018-11-04 00:00:00,Montana
10/19/2018-11/6/2018,2018-11-06 00:00:00,6 in Montana, https://media.dojmt.gov/wp-content/uploads/Data-Facts-Inc.-Helena-Agri-Enterprise-LLC-Medaxion-O-R-Nurses-Credentialing-and-Orgill-1.pdf ,"Data Facts, Inc. (Medaxion; O R Nurses Credentialing; Orgill)",2018-12-20 00:00:00,https://dojmt.gov/consumer/consumers-known-data-breach-incidents/#,2018-10-19 00:00:00,Montana
4/8/2018-5/13/2018,2018-05-13 00:00:00,1 in Montana, https://media.dojmt.gov/wp-content/uploads/Capitol-Law-Group-PLLC.pdf ,"Capitol Law Group, PLLC",2018-12-20 00:00:00,https://dojmt.gov/consumer/consumers-known-data-breach-incidents/#,2018-04-08 00:00:00,Montana
9/25/2018-11/26/2018,2018-11-26 00:00:00,77 in Montana, https://media.dojmt.gov/wp-content/uploads/JAND-Inc.-Warby-Parker.pdf ,JAND Inc. (Warby Parker),2018-12-20 00:00:00,https://dojmt.gov/consumer/consumers-known-data-breach-incidents/#,2018-09-25 00:00:00,Montana
11/1/2018-11/1/2018,2018-11-01 00:00:00,2 in Montana, https://media.dojmt.gov/wp-content/uploads/Kestra-Investment-Services-LLC.pdf ,"Kestra Investment Services, LLC",2018-12-20 00:00:00,https://dojmt.gov/consumer/consumers-known-data-breach-incidents/#,2018-11-01 00:00:00,Montana
9/1/2018-10/10/2018,2018-10-10 00:00:00,27 in Montana, https://media.dojmt.gov/wp-content/uploads/Benchmade-Knife-Co.-Inc..pdf ,"Benchmade Knife Co., Inc.",2018-12-21 00:00:00,https://dojmt.gov/consumer/consumers-known-data-breach-incidents/#,2018-09-01 00:00:00,Montana
11/11/2018-11/11/2018,2018-11-11 00:00:00,2 in Montana, https://media.dojmt.gov/wp-content/uploads/Ameriprise-Financial-Services-Inc.-1.pdf ,"Ameriprise Financial Services, Inc.",2018-12-21 00:00:00,https://dojmt.gov/consumer/consumers-known-data-breach-incidents/#,2018-11-11 00:00:00,Montana
12/6/2017-12/12/2017,2017-12-12 00:00:00,2 in Montana, https://media.dojmt.gov/wp-content/uploads/4As-Benefits.pdf ,4A's Benefits,2018-12-26 00:00:00,https://dojmt.gov/consumer/consumers-known-data-breach-incidents/#,2017-12-06 00:00:00,Montana
2/6/2018-9/12/2018,2018-09-12 00:00:00,23 in Montana, https://media.dojmt.gov/wp-content/uploads/Prudential-Insurance-Company-of-America.pdf ,Prudential Insurance Company of America,2018-12-27 00:00:00,https://dojmt.gov/consumer/consumers-known-data-breach-incidents/#,2018-02-06 00:00:00,Montana
5/8/2018-6/8/2018,2018-06-08 00:00:00,1 in Montana, https://media.dojmt.gov/wp-content/uploads/Infinera-Corporation.pdf ,Infinera Corporation,2018-12-27 00:00:00,https://dojmt.gov/consumer/consumers-known-data-breach-incidents/#,2018-05-08 00:00:00,Montana
7/14/2018-9/12/2018,2018-09-12 00:00:00,2 in Montana, https://media.dojmt.gov/wp-content/uploads/College-of-Eastern-Idaho-CEI.pdf ,College of Eastern Idaho (CEI),2018-12-27 00:00:00,https://dojmt.gov/consumer/consumers-known-data-breach-incidents/#,2018-07-14 00:00:00,Montana
8/16/2018-9/18/2018,2018-09-18 00:00:00,3 in Montana, https://media.dojmt.gov/wp-content/uploads/Dental-Center-of-Northwest-Ohio.pdf ,Dental Center of Northwest Ohio,2018-12-28 00:00:00,https://dojmt.gov/consumer/consumers-known-data-breach-incidents/#,2018-08-16 00:00:00,Montana
10/31/2018-11/13/2018,2018-11-13 00:00:00,43 in Montana, https://media.dojmt.gov/wp-content/uploads/General-Dynamics-Information-Technology.pdf ,General Dynamics Information Technology,2018-12-28 00:00:00,https://dojmt.gov/consumer/consumers-known-data-breach-incidents/#,2018-10-31 00:00:00,Montana
5/1/2018-7/21/2018,2018-07-21 00:00:00,4 in Montana, https://media.dojmt.gov/wp-content/uploads/Westminster-College.pdf ,Westminster College,2018-12-28 00:00:00,https://dojmt.gov/consumer/consumers-known-data-breach-incidents/#,2018-05-01 00:00:00,Montana
7/9/2017-10/16/2018,2018-10-16 00:00:00,31 in Montana, https://media.dojmt.gov/wp-content/uploads/OXO-International-Ltd.-1.pdf ,OXO International Ltd.,2018-12-28 00:00:00,https://dojmt.gov/consumer/consumers-known-data-breach-incidents/#,2017-07-09 00:00:00,Montana
9/13/2018-9/25/2018,2018-09-25 00:00:00,3 in Montana, https://media.dojmt.gov/wp-content/uploads/Blauer-Manufacturing-Company.pdf ,Blauer Manufacturing Company,2018-12-31 00:00:00,https://dojmt.gov/consumer/consumers-known-data-breach-incidents/#,2018-09-13 00:00:00,Montana
6/7/2018-9/24/2018,2018-09-24 00:00:00,841 in Montana, https://media.dojmt.gov/wp-content/uploads/Aimbridge-Hospitality-Holdings-LLC-1.pdf ,"Aimbridge Hospitality Holdings, LLC",2018-12-31 00:00:00,https://dojmt.gov/consumer/consumers-known-data-breach-incidents/#,2018-06-07 00:00:00,Montana
8/5/2018-11/16/2018,2018-11-16 00:00:00,278 in Montana, https://media.dojmt.gov/wp-content/uploads/Bel-USA-LLC-DiscountMugs.com_.pdf ,"Bel USA, LLC (DiscountMugs.com)",2018-12-31 00:00:00,https://dojmt.gov/consumer/consumers-known-data-breach-incidents/#,2018-08-05 00:00:00,Montana
7/18/2018-7/18/2018,2018-07-18 00:00:00,1 in Montana, https://media.dojmt.gov/wp-content/uploads/Progress-Bank.pdf ,Progress Bank,2019-01-01 00:00:00,https://dojmt.gov/consumer/consumers-known-data-breach-incidents/#,2018-07-18 00:00:00,Montana
12/28/2017-7/9/2018,2018-07-09 00:00:00,10 in Montana, https://media.dojmt.gov/wp-content/uploads/Synchrony-Bank.pdf ,Synchrony Bank,2019-01-04 00:00:00,https://dojmt.gov/consumer/consumers-known-data-breach-incidents/#,2017-12-28 00:00:00,Montana
6/1/2018-10/11/2018,2018-10-11 00:00:00,140 in Montana, https://media.dojmt.gov/wp-content/uploads/Centerstone-Insurance-and-Financial-Services-dba-BenefitMall.pdf ,"Centerstone Insurance and Financial Services, dba BenefitMall",2019-01-04 00:00:00,https://dojmt.gov/consumer/consumers-known-data-breach-incidents/#,2018-06-01 00:00:00,Montana
12/6/2018-12/6/2018,2018-12-06 00:00:00,2 in Montana, https://media.dojmt.gov/wp-content/uploads/Auburn-University-1.pdf ,Auburn University,2019-01-04 00:00:00,https://dojmt.gov/consumer/consumers-known-data-breach-incidents/#,2018-12-06 00:00:00,Montana
6/1/2018-6/30/2018,2018-06-30 00:00:00,1 in Montana, https://media.dojmt.gov/wp-content/uploads/Oliver-Companies.pdf ,Oliver Companies,2019-01-04 00:00:00,https://dojmt.gov/consumer/consumers-known-data-breach-incidents/#,2018-06-01 00:00:00,Montana
6/25/2017-2/15/2018,2018-02-15 00:00:00,4 in Montana, https://media.dojmt.gov/wp-content/uploads/Capital-One-Bank-1.pdf ,Capital One Bank,2019-01-08 00:00:00,https://dojmt.gov/consumer/consumers-known-data-breach-incidents/#,2017-06-25 00:00:00,Montana
7/13/2018-10/2/2018,2018-10-02 00:00:00,5 in Montana, https://media.dojmt.gov/wp-content/uploads/Century-Spring-Corp..pdf ,Century Spring Corp.,2019-01-08 00:00:00,https://dojmt.gov/consumer/consumers-known-data-breach-incidents/#,2018-07-13 00:00:00,Montana
8/15/2017-1/4/2019,2019-01-04 00:00:00,456 in Montana, https://media.dojmt.gov/wp-content/uploads/Data-Breach-Sample-Letter-to-Consumer.pdf ,"A&A Global Imports, Inc",2019-01-09 00:00:00,https://dojmt.gov/consumer/consumers-known-data-breach-incidents/#,2017-08-15 00:00:00,Montana
11/14/2018-12/6/2018,2018-12-06 00:00:00,8 in Montana, https://media.dojmt.gov/wp-content/uploads/Welders-Supply.pdf ,Welders Supply,2019-01-09 00:00:00,https://dojmt.gov/consumer/consumers-known-data-breach-incidents/#,2018-11-14 00:00:00,Montana
11/27/2018-11/27/2018,2018-11-27 00:00:00,1 in Montana, https://media.dojmt.gov/wp-content/uploads/Real-Estate-Digital-LLC.pdf ,"Real Estate Digital, LLC",2019-01-10 00:00:00,https://dojmt.gov/consumer/consumers-known-data-breach-incidents/#,2018-11-27 00:00:00,Montana
8/1/2016-12/7/2018,2018-12-07 00:00:00,1 in Montana, https://media.dojmt.gov/wp-content/uploads/First-American-Payment-Systems.pdf ,First American Payment Systems,2019-01-10 00:00:00,https://dojmt.gov/consumer/consumers-known-data-breach-incidents/#,2016-08-01 00:00:00,Montana
11/6/2018-11/6/2018,2018-11-06 00:00:00,1 in Montana, https://media.dojmt.gov/wp-content/uploads/Bradley-W.-Orser-C.P.A.-Inc.-P.S..pdf ,"Bradley W. Orser, C.P.A., Inc., P.S.",2019-01-11 00:00:00,https://dojmt.gov/consumer/consumers-known-data-breach-incidents/#,2018-11-06 00:00:00,Montana
5/11/2018-8/2/2018,2018-08-02 00:00:00,32 in Montana, https://media.dojmt.gov/wp-content/uploads/International-E-Z-Up-Inc..pdf ,"International E-Z UP, Inc.",2019-01-11 00:00:00,https://dojmt.gov/consumer/consumers-known-data-breach-incidents/#,2018-05-11 00:00:00,Montana
6/28/2018-12/17/2018,2018-12-17 00:00:00,15 in Montana, https://media.dojmt.gov/wp-content/uploads/Graeters-Ice-Cream.pdf ,Graeter's Ice Cream,2019-01-15 00:00:00,https://dojmt.gov/consumer/consumers-known-data-breach-incidents/#,2018-06-28 00:00:00,Montana
9/13/2018-9/18/2018,2018-09-18 00:00:00,30 in Montana, https://media.dojmt.gov/wp-content/uploads/Reliant-Rehabilitation.pdf ,Reliant Rehabilitation,2019-01-16 00:00:00,https://dojmt.gov/consumer/consumers-known-data-breach-incidents/#,2018-09-13 00:00:00,Montana
10/29/2018-11/13/2018,2018-11-13 00:00:00,2 in Montana, https://media.dojmt.gov/wp-content/uploads/4-Ever-Life-Insurance.pdf ,4 Ever Life Insurance,2019-01-16 00:00:00,https://dojmt.gov/consumer/consumers-known-data-breach-incidents/#,2018-10-29 00:00:00,Montana
6/22/2018-11/20/2018,2018-11-20 00:00:00,35 in Montana, https://media.dojmt.gov/wp-content/uploads/Aetrex-Worldwide-Inc..pdf ,"Aetrex Worldwide, Inc.",2019-01-17 00:00:00,https://dojmt.gov/consumer/consumers-known-data-breach-incidents/#,2018-06-22 00:00:00,Montana
11/1/2018-11/1/2018,2018-11-01 00:00:00,756 in Montana, https://media.dojmt.gov/wp-content/uploads/lpl.pdf ,LPL Financial LLC (LPL),2019-01-17 00:00:00,https://dojmt.gov/consumer/consumers-known-data-breach-incidents/#,2018-11-01 00:00:00,Montana
1/8/2019-1/9/2019,2019-01-09 00:00:00,80 in Montana, https://media.dojmt.gov/wp-content/uploads/Immanuel-Lutheran-Communities.pdf ,Immanuel Lutheran Communities,2019-01-18 00:00:00,https://dojmt.gov/consumer/consumers-known-data-breach-incidents/#,2019-01-08 00:00:00,Montana
10/9/2018-10/10/2018,2018-10-10 00:00:00,49 in Montana, https://media.dojmt.gov/wp-content/uploads/Valley-Hope-Association.pdf ,Valley Hope Association,2019-01-18 00:00:00,https://dojmt.gov/consumer/consumers-known-data-breach-incidents/#,2018-10-09 00:00:00,Montana
11/23/2018-12/5/2018,2018-12-05 00:00:00,3 in Montana, https://media.dojmt.gov/wp-content/uploads/Cambridge-Healthcare-Services-LLC.pdf ,"Cambridge Healthcare Services, LLC",2019-01-18 00:00:00,https://dojmt.gov/consumer/consumers-known-data-breach-incidents/#,2018-11-23 00:00:00,Montana
6/1/2018-10/31/2018,2018-10-31 00:00:00,1 in Montana, https://media.dojmt.gov/wp-content/uploads/The-Unum-Group-Colonial-Life-and-Accident-Insurance.pdf ,The Unum Group / Colonial Life and Accident Insurance,2019-01-18 00:00:00,https://dojmt.gov/consumer/consumers-known-data-breach-incidents/#,2018-06-01 00:00:00,Montana
11/8/2018-11/9/2018,2018-11-09 00:00:00,7 in Montana, https://media.dojmt.gov/wp-content/uploads/RevolutionParts-Inc..pdf ,"RevolutionParts, Inc.",2019-01-23 00:00:00,https://dojmt.gov/consumer/consumers-known-data-breach-incidents/#,2018-11-08 00:00:00,Montana
1/1/2015-1/1/2019,2019-01-01 00:00:00,1 in Montana, https://media.dojmt.gov/wp-content/uploads/American-Councils-for-International-Education-Al-Farabi-Kazakh-National-University.pdf ,American Councils for International Education (Al-Farabi Kazakh National University),2019-01-23 00:00:00,https://dojmt.gov/consumer/consumers-known-data-breach-incidents/#,2015-01-01 00:00:00,Montana
7/7/2018-12/24/2018,2018-12-24 00:00:00,3 in Montana, https://media.dojmt.gov/wp-content/uploads/ALM-Media-LLC.pdf ,"ALM Media, LLC",2019-01-23 00:00:00,https://dojmt.gov/consumer/consumers-known-data-breach-incidents/#,2018-07-07 00:00:00,Montana
9/1/2015-12/12/2018,2018-12-12 00:00:00,8 in Montana, https://media.dojmt.gov/wp-content/uploads/Nova-Southeastern-University-1.pdf ,Nova Southeastern University,2019-01-25 00:00:00,https://dojmt.gov/consumer/consumers-known-data-breach-incidents/#,2015-09-01 00:00:00,Montana
1/1/2016-11/30/2018,2018-11-30 00:00:00,8 in Montana, https://media.dojmt.gov/wp-content/uploads/NCH-Corporation.pdf ,NCH Corporation,2019-01-25 00:00:00,https://dojmt.gov/consumer/consumers-known-data-breach-incidents/#,2016-01-01 00:00:00,Montana
8/1/2017-12/27/2018,2018-12-27 00:00:00,4 in Montana, https://media.dojmt.gov/wp-content/uploads/adv.pdf ,AdventHealth Medical Group,2019-01-25 00:00:00,https://dojmt.gov/consumer/consumers-known-data-breach-incidents/#,2017-08-01 00:00:00,Montana
11/29/2018-11/29/2018,2018-11-29 00:00:00,1 in Montana, https://media.dojmt.gov/wp-content/uploads/Dr.-DeLuca-Dr.-Marciano-Associates-P.C..pdf ,"Dr. DeLuca Dr. Marciano & Associates, P.C.",2019-01-25 00:00:00,https://dojmt.gov/consumer/consumers-known-data-breach-incidents/#,2018-11-29 00:00:00,Montana
7/27/2018-7/30/2018,2018-07-30 00:00:00,94 in Montana, https://media.dojmt.gov/wp-content/uploads/Upright-Law-LLC.pdf ,Upright Law LLC,2019-01-25 00:00:00,https://dojmt.gov/consumer/consumers-known-data-breach-incidents/#,2018-07-27 00:00:00,Montana
12/14/2018-12/14/2018,2018-12-14 00:00:00,2 in Montana, https://media.dojmt.gov/wp-content/uploads/Lutheran-Life-Communities.pdf ,Lutheran Life Communities,2019-01-28 00:00:00,https://dojmt.gov/consumer/consumers-known-data-breach-incidents/#,2018-12-14 00:00:00,Montana
7/21/2018-11/9/2018,2018-11-09 00:00:00,2 in Montana, https://media.dojmt.gov/wp-content/uploads/Applied-Data-Finance-LLC-dba-Personify-Financial-ADF.pdf ,"Applied Data Finance, LLC dba Personify Financial (ADF)",2019-01-31 00:00:00,https://dojmt.gov/consumer/consumers-known-data-breach-incidents/#,2018-07-21 00:00:00,Montana
8/1/2018-8/31/2018,2018-08-31 00:00:00,6 in Montana, https://media.dojmt.gov/wp-content/uploads/Defenders-Inc..pdf ,Defenders Inc.,2019-01-31 00:00:00,https://dojmt.gov/consumer/consumers-known-data-breach-incidents/#,2018-08-01 00:00:00,Montana
6/10/2018-6/27/2018,2018-06-27 00:00:00,3 in Montana, https://media.dojmt.gov/wp-content/uploads/United-Hospital-District.pdf ,United Hospital District,2019-02-04 00:00:00,https://dojmt.gov/consumer/consumers-known-data-breach-incidents/#,2018-06-10 00:00:00,Montana
6/6/2018-9/8/2018,2018-09-08 00:00:00,13 in Montana, https://media.dojmt.gov/wp-content/uploads/Golden-Lion-Operations-Inc..pdf ,"Golden Lion Operations, Inc.",2019-02-04 00:00:00,https://dojmt.gov/consumer/consumers-known-data-breach-incidents/#,2018-06-06 00:00:00,Montana
1/19/2019-1/30/2019,2019-01-30 00:00:00,20 in Montana, https://media.dojmt.gov/wp-content/uploads/Graf-Sons-Inc..pdf ,Graf & Sons Inc.,2019-02-06 00:00:00,https://dojmt.gov/consumer/consumers-known-data-breach-incidents/#,2019-01-19 00:00:00,Montana
10/12/2018-10/28/2018,2018-10-28 00:00:00,49 in Montana, https://media.dojmt.gov/wp-content/uploads/Don-Best-Sports-Corporation-and-DBS-Canada-Corporation-Scientific-Games-Corporation.pdf ,Don Best Sports Corporation and DBS Canada Corporation (Scientific Games Corporation),2019-02-06 00:00:00,https://dojmt.gov/consumer/consumers-known-data-breach-incidents/#,2018-10-12 00:00:00,Montana
1/9/2019-1/19/2019,2019-01-19 00:00:00,9 in Montana, https://media.dojmt.gov/wp-content/uploads/Abbott-Laboratories.pdf ,Abbott Laboratories,2019-02-06 00:00:00,https://dojmt.gov/consumer/consumers-known-data-breach-incidents/#,2019-01-09 00:00:00,Montana
5/11/2018-7/6/2018,2018-07-06 00:00:00,171 in Montana, https://media.dojmt.gov/wp-content/uploads/Pharmacy-Times-Office-of-Continuing-Professional-Education-UPDATE.pdf ,Pharmacy Times Office of Continuing Professional Education (PTCE),2019-02-06 00:00:00,https://dojmt.gov/consumer/consumers-known-data-breach-incidents/#,2018-05-11 00:00:00,Montana
7/7/2018-11/8/2018,2018-11-08 00:00:00,8 in Montana, https://media.dojmt.gov/wp-content/uploads/Capital-One-Consumer.pdf ,Capital One,2019-02-07 00:00:00,https://dojmt.gov/consumer/consumers-known-data-breach-incidents/#,2018-07-07 00:00:00,Montana
10/3/2018-10/4/2018,2018-10-04 00:00:00,1 in Montana, https://media.dojmt.gov/wp-content/uploads/Marquette-Management-Consumer-Breach-Notification.pdf ,Marquette Management,2019-02-07 00:00:00,https://dojmt.gov/consumer/consumers-known-data-breach-incidents/#,2018-10-03 00:00:00,Montana
12/5/2018-1/17/2019,2019-01-17 00:00:00,1 in Montana, https://media.dojmt.gov/wp-content/uploads/Aspire-Consumer-Breach-Notification.pdf ,"Aspire Financial Services, LLC",2019-02-08 00:00:00,https://dojmt.gov/consumer/consumers-known-data-breach-incidents/#,2018-12-05 00:00:00,Montana
1/5/2019-1/5/2019,2019-01-05 00:00:00,6 in Montana, https://media.dojmt.gov/wp-content/uploads/KSM-Consumer-Breach-Notification.pdf ,"Katz, Sapper & Miller (KSM)",2019-02-08 00:00:00,https://dojmt.gov/consumer/consumers-known-data-breach-incidents/#,2019-01-05 00:00:00,Montana
12/19/2018-1/17/2019,2019-01-17 00:00:00,1 in Montana, https://media.dojmt.gov/wp-content/uploads/Windham-Consumer-Notification-1.pdf ,Windham,2019-02-08 00:00:00,https://dojmt.gov/consumer/consumers-known-data-breach-incidents/#,2018-12-19 00:00:00,Montana
11/1/2018-11/15/2018,2018-11-15 00:00:00,573 in Montana, https://media.dojmt.gov/wp-content/uploads/Image-I-Nation-Technologies-Inc..pdf ,"Image-I-Nation Technologies, Inc.",2019-02-08 00:00:00,https://dojmt.gov/consumer/consumers-known-data-breach-incidents/#,2018-11-01 00:00:00,Montana
12/01/2018-02/17/2019,2019-02-17,912 in Montana,https://media.dojmt.gov/wp-content/uploads/CON-Coinmama-Montana-Breach_.pdf,Coinmama.com,2019-04-05,,2018-12-01,Montana
03/04/2019-03/04/2019,2019-03-04,141 in Montana,https://media.dojmt.gov/wp-content/uploads/CON-Individual-Notification-Letter-April-2019.docx,AeroGrow International Inc,2019-04-04,,2019-03-04,Montana
03/04/2019-03/04/2019,2019-03-04,2 in Montana,https://media.dojmt.gov/wp-content/uploads/CON-Kenra_AG-MT-Notice.pdf,Kenra Professional,2019-04-03,,2019-03-04,Montana
07/19/2018-01/10/2019,2019-01-10,11 in Montana,https://media.dojmt.gov/wp-content/uploads/CON-Auto-Truck-Kargo-Ad-r3prf.pdf,Auto Truck Kargo Equipment LLC,2019-04-02,,2018-07-19,Montana
11/09/2018-11/13/2018,2018-11-13,1 in Montana,https://media.dojmt.gov/wp-content/uploads/MT-Oregon-Endodontic-Group-Notice-of-Data-Event-MT.pdf,Oregon Endodontic Group,2019-04-02,,2018-11-09,Montana
02/07/2018-12/13/2018,2018-12-13,1 in Montana,https://media.dojmt.gov/wp-content/uploads/CON-J2477300.pdf,Key West Hotels LLC,2019-02-02,,2018-02-07,Montana
01/31/2019-02/14/2019,2019-02-14,8 in Montana,https://media.dojmt.gov/wp-content/uploads/CON-Creative-Memories-Notice-of-Data-Event-MT.pdf,CM Group Holdings d/b/a Creative Memories,2019-04-01,,2019-01-31,Montana
01/13/2019-01/16/2019,2019-01-16,Unknown in Montana,https://media.dojmt.gov/wp-content/uploads/CON-FOCUS-MT-AG-Notification.pdf,Fellowship of Catholic University Students (FOCUS),2019-03-29,,2019-01-13,Montana
05/23/2018-03/18/2019,2019-03-18,Unknown in Montana,https://media.dojmt.gov/wp-content/uploads/CON-Website-Notice.pdf,Earl Enterprises,2019-03-29,,2018-05-23,Montana
02/05/2019-02/05/2019,2019-02-05,1 in Montana,https://media.dojmt.gov/wp-content/uploads/CON-12584983-AG-MT-Notification-letter-Final-Gifted-Development-Center-v1.pdf,Gifted Development Center,2019-03-29,,2019-02-05,Montana
01/15/2016-02/21/2018,2018-02-21,9 in Montana,https://media.dojmt.gov/wp-content/uploads/CON-HU1900189-Availity-Mbr-Breach-Notification.pdf,Humana,2019-02-22,,2016-01-15,Montana
07/21/2012-12/11/2018,2018-12-11,1 in Montana,https://media.dojmt.gov/wp-content/uploads/CON-doc-1.pdf,OneMain Financial,2019-03-21,,2012-07-21,Montana
11/13/2018-01/16/2019,2019-01-16,2 in Montana,https://media.dojmt.gov/wp-content/uploads/CON-3.27.19-Montana-Regulator-Notice.pdf,Life Equity LLC,2019-03-27,,2018-11-13,Montana
01/14/2019-01/14/2019,2019-01-14,4 in Montana,https://media.dojmt.gov/wp-content/uploads/CON-Letter-1-SS-Debit-Card-DDA-01081897xB8DF0.pdf,American State Bank,2019-03-26,,2019-01-14,Montana
02/06/2019-02/06/2019,2019-02-06,1 in Montana,https://media.dojmt.gov/wp-content/uploads/CON-MT-AG-Letter.pdf,"Nasif, Hicks, Harris and Co LLP",2019-03-26,,2019-02-06,Montana
12/21/2018-01/23/2019,2019-01-23,2 in Montana,https://media.dojmt.gov/wp-content/uploads/CON-SDC-Notice-of-Data-Event-MT.pdf,Superior Dental Care,2019-03-25,,2018-12-21,Montana
03/07/2019-03/07/2019,2019-03-07,9 in Montana,https://media.dojmt.gov/wp-content/uploads/CON-Grinnell-College-Notification-to-Montana-AG-with-enclosure-7985645x7AB84.pdf,Grinnell College,2019-03-25,,2019-03-07,Montana
01/28/2019-02/15/2019,2019-02-15,16 in Montana,https://media.dojmt.gov/wp-content/uploads/CON-Regulatory-Letter-dated-March-22-2019_Helena-MT.pdf,Brighton Collectibles LLC,2019-03-22,,2019-01-28,Montana
12/22/2018-12/22/2018,2018-12-22,2 in Montana,https://media.dojmt.gov/wp-content/uploads/CON-Copy-of-Data-Breach-Letter.pdf,AG Source,2019-03-22,,2018-12-22,Montana
02/28/2018-12/13/2018,2018-12-13,2 in Montana,https://media.dojmt.gov/wp-content/uploads/CON-Warn-Notice-of-Data-Event-MT.pdf,Warn Industries Inc,2019-03-22,,2018-02-28,Montana
07/01/2018-01/24/2019,2019-01-24,8 in Montana,https://media.dojmt.gov/wp-content/uploads/CON-Navicent-Health-Ad-SSN-r5prf-c-c-c-c-c.pdf,Navicent Health,2019-03-22,,2018-07-01,Montana
10/10/2018-10/12/2018,2018-10-12,17 in Montana,https://media.dojmt.gov/wp-content/uploads/CON-WesternTech_MT-AG-Notice_3.21.19.pdf,Western Technical College,2019-03-21,,2018-10-10,Montana
11/06/2018-01/08/2019,2019-01-08,1 in Montana,https://media.dojmt.gov/wp-content/uploads/CON-Spectrum-Business-Resources-Notification-to-Montana-AG-with-enclosure-7977226x7AB84.pdf,Spectrum Business Resources LLC,2019-03-21,,2018-11-06,Montana
12/23/2018-12/23/2018,2018-12-23,1 in Montana,https://media.dojmt.gov/wp-content/uploads/CON-Tempo-Consumer-Notification-Letter.pdf,Tempo Inc,2019-03-21,,2018-12-23,Montana
12/01/2018-02/01/2019,2019-02-01,5 in Montana,https://media.dojmt.gov/wp-content/uploads/CON-MT-AG-notice-Wenner.pdf,Wenner Group,2019-03-21,,2018-12-01,Montana
02/24/2019-02/24/2019,2019-02-24,4 in Montana,https://media.dojmt.gov/wp-content/uploads/CON-AllClear-ID-Notification-Letter_Identity-Theft-Monitoring-Final.pdf,Eye Buy Direct Inc,2019-03-18,,2019-02-24,Montana
11/08/2018-12/28/2018,2018-12-28,445 in Montana,https://media.dojmt.gov/wp-content/uploads/CON-ZOLL-final-SSN-letter-from-Kroll.pdf,ZOLL Services LLC,2019-03-18,,2018-11-08,Montana
01/08/2019-02/12/2019,2019-02-12,Unknown in Montana,https://media.dojmt.gov/wp-content/uploads/CON-MT-Notice-of-Data-Event-3.pdf,Kathmandu UK Limited,2019-03-18,,2019-01-08,Montana
02/14/2019-02/14/2019,2019-02-14,2 in Montana,https://media.dojmt.gov/wp-content/uploads/CON-CON-Montana-Consumer-Notice-3-15-19.pdf,Cremation Society of Pennsylvania Inc,2019-03-15,,2019-02-14,Montana
07/01/2018-09/30/2018,2018-09-30,2 in Montana,https://media.dojmt.gov/wp-content/uploads/CON-IN-LCP-HITECH-Breach-Notification-Letter.pdf,LCP Transportation,2019-03-20,,2018-07-01,Montana
12/21/2018-02/06/2019,2019-02-06,7 in Montana,https://media.dojmt.gov/wp-content/uploads/CON-Rutland-Regional-Notice-of-Data-Event-MT.pdf,Rutland Regional Medical Center,2019-03-12,,2018-12-21,Montana
12/07/2018-02/25/2019,2019-02-25,39 in Montana,https://media.dojmt.gov/wp-content/uploads/CON-flexPATH_MT-Notice.pdf,flexPATH Strategies LLC,2019-03-15,,2018-12-07,Montana
01/15/2019-01/15/2019,2019-01-15,2 in Montana,https://media.dojmt.gov/wp-content/uploads/CON-Southern-Hills-Eyecare-AG-Notification-letter-MT.pdf,Southern Hills Eye Care,2019-03-15,,2019-01-15,Montana
01/08/2019-01/31/2019,2019-01-31,23 in Montana,https://media.dojmt.gov/wp-content/uploads/CON-Montana-Notice-of-Data-Event.pdf,American Cancer Society Inc,2019-03-01,,2019-01-08,Montana
01/19/2019-01/26/2019,2019-01-26,7 in Montana,https://media.dojmt.gov/wp-content/uploads/CON-2019-03-01-Notification-of-Data-Breach-Carroll-College.pdf,Carroll Saints Shoppe,2019-03-01,,2019-01-19,Montana
08/23/2018-12/17/2018,2018-12-17,5 in Montana,https://media.dojmt.gov/wp-content/uploads/RSC_Re-Solutions_MT-DOI-Notice_3.1.19.pdf,RSC Insurance Brokerage Inc,2019-03-01,,2018-08-23,Montana
01/16/2019-02/03/2019,2019-02-03,1 in Montana,https://media.dojmt.gov/wp-content/uploads/CON-Montana-c.pdf,Environmental Graphics LLC d/b/a Murals Your Way,2019-02-22,,2019-01-16,Montana
07/24/2018-08/02/2018,2018-08-02,3 in Montana,https://media.dojmt.gov/wp-content/uploads/CON-Welk-MT-Notice-of-Data-Event.pdf,Welk Resort Group,2019-02-22,,2018-07-24,Montana
08/20/2018-08/27/2018,2018-08-27,17 in Montana,https://media.dojmt.gov/wp-content/uploads/AG-Adult-No-SSN-X060_v03-c-c.pdf,UConn Health,2019-02-21,,2018-08-20,Montana
01/09/2019-01/09/2019,2019-01-09,11 in Montana,https://media.dojmt.gov/wp-content/uploads/CON-Direct-Distributors-Inc.-Notice-of-Data-Security-Incident.pdf,"Direct Distributors, Inc",2019-02-21,,2019-01-09,Montana
05/28/2018-01/18/2019,2019-01-18,4 in Montana,https://media.dojmt.gov/wp-content/uploads/CON-Rennline-MT.pdf,Rennline Automotive,2019-02-21,,2018-05-28,Montana
02/28/2018-02/28/2018,2018-02-28,26 in Montana,https://media.dojmt.gov/wp-content/uploads/CON-MT.pdf,Phillip Capital Inc,2019-02-21,,2018-02-28,Montana
08/30/2017-04/09/2018,2018-04-09,15 in Montana,https://media.dojmt.gov/wp-content/uploads/CON-Pillow-Pets-General-Master-1.pdf,Pillow Pets,2019-02-20,,2017-08-30,Montana
01/01/2012-01/30/2019,2019-01-30,3 in Montana,https://media.dojmt.gov/wp-content/uploads/CON-MTSA-Individual-notice-MAILED-2-19-2019.pdf,Middle Tennessee School of Anesthesia,2019-02-19,,2012-01-01,Montana
12/06/2018-12/21/2018,2018-12-21,02/19/2019 in Montana,https://media.dojmt.gov/wp-content/uploads/CON-Montana-Individual-Reporting-Letter-Template.pdf,"Sheltered Wings, Inc",2019-02-19,,2018-12-06,Montana
09/08/2018-09/24/2018,2018-09-24,2 in Montana,https://media.dojmt.gov/wp-content/uploads/CON-Pages-from-WIT-MT-AG-Notice_2.19.19.pdf,Wentworth Institute of Technology,2019-02-19,,2018-09-08,Montana
09/06/2018-11/29/2018,2018-11-29,1 in Montana,https://media.dojmt.gov/wp-content/uploads/CON-FirstLease-Inc.-Notice-of-Data-Event-MT.pdf,"FirstLease, Inc",2019-02-15,,2018-09-06,Montana
09/01/2016-09/23/2018,2018-09-23,Unknown in Montana,https://media.dojmt.gov/wp-content/uploads/CON-Print-EZ-MT-Notice.pdf,"Print EZ, Inc",2019-02-15,,2016-09-01,Montana
12/06/2018-12/07/2018,2018-12-07,2 in Montana,https://media.dojmt.gov/wp-content/uploads/CON-Pages-from-Gulfport_-Montana-Notification-Letter.pdf,Memorial Hospital at Gulfport,2019-02-15,,2018-12-06,Montana
11/13/2018-01/11/2019,2019-01-11,34 in Montana,https://media.dojmt.gov/wp-content/uploads/CON-FB-Master-Notice.pdf,"Five Below, Inc",2019-02-14,,2018-11-13,Montana
02/02/2018-11/20/2018,2018-11-20,1191 in Montana,https://media.dojmt.gov/wp-content/uploads/CON-doc.pdf,North 40 Outfitters,2019-02-14,,2018-02-02,Montana
12/14/2018-12/17/2018,2018-12-17,31 in Montana,https://media.dojmt.gov/wp-content/uploads/CON-Coeur-Regulator-Notice-MT-FINAL.pdf,"Coeur Alaska, Inc",2019-02-14,,2018-12-14,Montana
02/01/2018-01/31/2019,2019-01-31,131 in Montana,https://media.dojmt.gov/wp-content/uploads/CON-MT-Notice-of-Data-Event-2.pdf,Stanwich Mortgage Loan Trust,2019-02-12,,2018-02-01,Montana
07/10/2018-07/19/2018,2018-07-19,2 in Montana,https://media.dojmt.gov/wp-content/uploads/CON-Ohio-Living-Regulator-Notice-MT-FINAL.pdf,Ohio Living,2019-02-12,,2018-07-10,Montana
10/28/2018-01/25/2019,2019-01-25,14 in Montana,https://media.dojmt.gov/wp-content/uploads/CON-MT-Notice-of-Data-Event-1.pdf,Cherrydale Fundraising,2019-03-14,,2018-10-28,Montana
05/01/2018-01/22/2019,2019-01-22,Unknown in Montana,https://media.dojmt.gov/wp-content/uploads/Rush-University-Medical-Center-Consumer-Breach-Notification.pdf,Rush University Medical Center,2019-02-28,,2018-05-01,Montana
02/11/2019-02/13/2019,2019-02-13,35 in Montana,https://media.dojmt.gov/wp-content/uploads/Bamboo-Consumer-Data-Breach-Notification.pdf,Bamboo HR LLC,2019-03-04,,2019-02-11,Montana
1/4/2019-1/4/2019,2019-01-04,2 in Montana,https://media.dojmt.gov/wp-content/uploads/CON-St-Francis-Adult-SSN.pdf,St. Francis Physician Services,2019-03-04,,2019-01-04,Montana
12/18/2018-12/19/2018,2018-12-19,4 in Montana,https://media.dojmt.gov/wp-content/uploads/CON-TEMPTU-Notice-of-Data-Event-MT.pdf,TEMPTU Inc,2019-03-04,,2018-12-18,Montana
11/15/2018-11/15/2018,2018-11-15,1 in Montana,https://media.dojmt.gov/wp-content/uploads/CON-ISU-MT-AG-Notice.pdf,The Board of Trustees of Illinois State University,2019-03-05,,2018-11-15,Montana
1/22/2019-1/29/2019,2019-01-29,2.0 in Montana,https://media.dojmt.gov/wp-content/uploads/CON-Covenant-Care-MT-Notice-of-Data-Event.pdf,Covenant Care California,2019-03-06,,2019-01-22,Montana
2/5/2019-2/5/2019,2019-02-05,1.0 in Montana,https://media.dojmt.gov/wp-content/uploads/CON-2019.03.07-MT-AG-Notice-StEliz.pdf,Saint Elizabeth Medical Center Inc,2019-03-07,,2019-02-05,Montana
01/15/2019-01/22/2019,2019-01-22,nan in Montana,https://media.dojmt.gov/wp-content/uploads/Combe-Consuemr-Datat-Breach-Notification.pdf,Combe Incorporated,2019-02-28,,2019-01-15,Montana
12/3/2018-12/3/2018,2018-12-03,1.0 in Montana,https://media.dojmt.gov/wp-content/uploads/CON-Notice-to-Montana.pdf,Beacon Sales Acquisition Inc,2019-03-07,,2018-12-03,Montana
1/31/2019-1/31/2019,2019-01-31,2.0 in Montana,https://media.dojmt.gov/wp-content/uploads/REESE-CON-Regulatory-Letter-dated-March-7-2019-Helena-MT.pdf,Reese Henry & Company Inc,2019-03-07,,2019-01-31,Montana
7/25/2018-2/5/2019,2019-02-05,1.0 in Montana,https://media.dojmt.gov/wp-content/uploads/CON-NOTIF.pdf,Bumblebee Batteries,2019-03-07,,2018-07-25,Montana
5/8/2018-8/1/2018,2018-08-01,2.0 in Montana,https://media.dojmt.gov/wp-content/uploads/CON-MT-Notification.pdf,Advocate Sherman Hospital,2019-03-08,,2018-05-08,Montana
5/9/2018-5/17/2018,2018-05-17,2.0 in Montana,https://media.dojmt.gov/wp-content/uploads/CON-Emerson-Hospital-MT-c.pdf,Emerson Hospital,2019-03-08,,2018-05-09,Montana
8/10/2018-12/14/2018,2018-12-14,1.0 in Montana,https://media.dojmt.gov/wp-content/uploads/CON-MT-Notice-of-Data-Event.pdf,Discipleship Ministries,2019-03-08,,2018-08-10,Montana
6/11/2018-2/26/2019,2019-02-26,17.0 in Montana,https://media.dojmt.gov/wp-content/uploads/CON-Letter-to-Montana-Office-of-Consumer-Protection.pdf,OnCourse Learning Corporation / Relias LLC,2019-03-08,,2018-06-11,Montana
1/9/2019-1/30/2019,2019-01-30,5.0 in Montana,https://media.dojmt.gov/wp-content/uploads/CON-UofMary-MT-AG-Notification.pdf,University of Mary,2019-03-12,,2019-01-09,Montana
1/19/2018-6/30/2018,2018-06-30,29.0 in Montana,https://media.dojmt.gov/wp-content/uploads/CON-IVG-Breach-Notification-Letter.pdf,International Vapor Group,2019-03-12,,2018-01-19,Montana
1/8/2018-8/7/2018,2018-08-07,3.0 in Montana,https://media.dojmt.gov/wp-content/uploads/CON-ABM-Notice-of-Data-Event-MT.pdf,ABM Industries Incorporated,2019-03-12,,2018-01-08,Montana
5/12/2018-9/17/2018,2018-09-17,1.0 in Montana,https://media.dojmt.gov/wp-content/uploads/CON-NOTICE-2.pdf,Texas VSI LLC,2019-03-13,,2018-05-12,Montana
2/09/2019-2/21/2019,2019-02-21,2.0 in Montana,https://media.dojmt.gov/wp-content/uploads/CON-NOTICE.pdf,James Perse Enterprises Inc,2019-03-14,,2019-02-09,Montana
9/01/2018-11/15/2018,2018-11-15,5.0 in Montana,https://media.dojmt.gov/wp-content/uploads/CON-NOTICE-Yaculta-MT-Notice-of-Data-Event-FINAL-1.pdf,Yaculta Companies Inc,2019-03-15,,2018-09-01,Montana
4/5/2015-4/5/2015,2015-04-05,1.0 in Montana, https://media.dojmt.gov/wp-content/uploads/Stanislaus-Surgical-Hospital.pdf ,Stanislaus Surgical Hospital,2015-05-06,,2015-04-05,Montana
6/8/2015-6/8/2015,2015-06-08,13.0 in Montana, https://media.dojmt.gov/wp-content/uploads/State-Farm.pdf ,State Farm (1),2015-06-15,,2015-06-08,Montana
4/1/2015-4/30/2015,2015-04-30,33.0 in Montana, https://media.dojmt.gov/wp-content/uploads/Rombauer-Vineyards.pdf ,Rombauer Vineyards,2015-06-16,,2015-04-01,Montana
8/12/2015-8/12/2015,2015-08-12,6.0 in Montana, https://media.dojmt.gov/wp-content/uploads/Brunswick-Hotel-Tavern.pdf ,Brunswick Hotel & Tavern,2015-08-21,,2015-08-12,Montana
9/15/2015-9/15/2015,2015-09-15,1134 in Montana, https://media.dojmt.gov/wp-content/uploads/T-Mobile-USA-Inc..pdf ,"T-Mobile USA, Inc.",2015-10-01,,2015-09-15,Montana
9/15/2015-9/15/2015,2015-09-15,1 in Montana, https://media.dojmt.gov/wp-content/uploads/Red-Dress-Boutique.pdf ,Red Dress Boutique,2015-10-05,,2015-09-15,Montana
8/19/2015-8/19/2015,2015-08-19,6 in Montana, https://media.dojmt.gov/wp-content/uploads/Dow-Jones-Company.pdf ,Dow Jones & Company,2015-10-09,,2015-08-19,Montana
9/9/2015-9/9/2015,2015-09-09,11 in Montana, https://media.dojmt.gov/wp-content/uploads/Salt-Lake-County-Utah.pdf ,"Salt Lake County, Utah",2015-10-09,,2015-09-09,Montana
6/16/2015-6/16/2015,2015-06-16,13 in Montana, https://media.dojmt.gov/wp-content/uploads/Eyebuy-Direct.pdf ,Eyebuy Direct,2015-10-13,,2015-06-16,Montana
3/24/2015-5/20/2015,2015-05-20,Unknown in Montana, https://media.dojmt.gov/wp-content/uploads/Service-Systems-Associates-SSA.pdf ,Services Systems Associates,2015-10-13,,2015-03-24,Montana
9/23/2015-9/23/2015,2015-09-23,1 in Montana, https://media.dojmt.gov/wp-content/uploads/Schlage-Lock-Company.pdf ,Schlage Lock Company,2015-10-13,,2015-09-23,Montana
10/9/2015-10/9/2015,2015-10-09,1 in Montana, https://media.dojmt.gov/wp-content/uploads/Ameriprise-Financial.pdf ,Ameriprise Financial (1),2015-10-19,,2015-10-09,Montana
6/30/2015-6/30/2015,2015-06-30,23 in Montana, https://media.dojmt.gov/wp-content/uploads/Accuform-Manufacturing.pdf ,"Accuform Manufacturing, Inc.",2015-10-20,,2015-06-30,Montana
1/28/2015-8/3/2015,2015-08-03,22 in Montana, https://media.dojmt.gov/wp-content/uploads/Noble-House-Hotels-and-Resorts.pdf ,Noble House Hotels and Resorts (1),2015-10-22,,2015-01-28,Montana
9/16/2015-9/16/2015,2015-09-16,6 in Montana, https://media.dojmt.gov/wp-content/uploads/Stiletto-Solutions.pdf ,Stiletto Solutions,2015-10-28,,2015-09-16,Montana
9/1/2015-9/30/2015,2015-09-30,1 in Montana, https://media.dojmt.gov/wp-content/uploads/Transcontinental-Fund-Administration.pdf ,Transcontinental Fund (Wolff Co.),2015-10-28,,2015-09-01,Montana
8/31/2015-9/30/2015,2015-09-30,4 in Montana, https://media.dojmt.gov/wp-content/uploads/Dow-Corning.pdf ,Dow Corning Corporation,2015-10-30,,2015-08-31,Montana
10/24/2015-10/25/2015,2015-10-25,3 in Montana, https://media.dojmt.gov/wp-content/uploads/Brandeis-University.pdf ,Brandeis University,2015-11-12,,2015-10-24,Montana
5/18/2015-5/18/2015,2015-05-18,1 in Montana, https://media.dojmt.gov/wp-content/uploads/Integrated-Listening-Systems.pdf ,Integrated Listening Systems,2015-11-12,,2015-05-18,Montana
12/29/2014-8/11/2015,2015-08-11,165 in Montana, https://media.dojmt.gov/wp-content/uploads/Noble-House-Hotels-and-Resorts2.pdf ,Noble House Hotel and Resorts (2),2015-11-13,,2014-12-29,Montana
10/16/2015-10/16/2015,2015-10-16,3 in Montana, https://media.dojmt.gov/wp-content/uploads/Fashion-to-Figure.pdf ,Fashion to Figure,2015-11-13,,2015-10-16,Montana
9/16/2015-9/16/2015,2015-09-16,17 in Montana, https://media.dojmt.gov/wp-content/uploads/OH-Muhlenberg-LLC.pdf ,"OH Muhlenberg, LLC",2015-11-13,,2015-09-16,Montana
9/29/2015-11/2/2015,2015-11-02,1 in Montana, https://media.dojmt.gov/wp-content/uploads/Seattle-Chocolates-Company.pdf ,Seattle Chocolates Company,2015-11-16,,2015-09-29,Montana
10/12/2015-10/20/2015,2015-10-20,36 in Montana, https://media.dojmt.gov/wp-content/uploads/Intuit.pdf ,Intuit (1),2015-11-17,,2015-10-12,Montana
3/9/2015-6/8/2015,2015-06-08,Unknown in Montana, https://media.dojmt.gov/wp-content/uploads/Wilderness-Hotel-and-Golf-Resort.pdf ,Wilderness Hotel and Golf Resort,2015-11-20,,2015-03-09,Montana
4/21/2015-7/27/2015,2015-07-27,Unknown in Montana, https://media.dojmt.gov/wp-content/uploads/Hilton.pdf ,Hilton,2015-11-24,,2015-04-21,Montana
11/18/2014-12/5/2014,2014-12-05,Unknown in Montana, https://media.dojmt.gov/wp-content/uploads/Hilton.pdf ,Hilton,2015-11-24,,2014-11-18,Montana
10/23/2015-10/23/2015,2015-10-23,1 in Montana, https://media.dojmt.gov/wp-content/uploads/Intuit-2.pdf ,Intuit (2),2015-11-25,,2015-10-23,Montana
11/17/2015-11/17/2015,2015-11-17,1 in Montana, https://media.dojmt.gov/wp-content/uploads/Precision-Resource-Company.pdf ,Precision Resource Company,2015-11-30,,2015-11-17,Montana
10/26/2015-11/8/2015,2015-11-08,1 in Montana, https://media.dojmt.gov/wp-content/uploads/Cottage-Health.pdf ,Cottage Health,2015-12-03,,2015-10-26,Montana
9/24/2015-9/24/2015,2015-09-24,2 in Montana, https://media.dojmt.gov/wp-content/uploads/New-England-Calendar-and-Novelty-Company.pdf ,New England Calendar and Novelty Company,2015-12-10,,2015-09-24,Montana
8/5/2015-8/5/2015,2015-08-05,39 in Montana, https://media.dojmt.gov/wp-content/uploads/Toyota-Motor-Credit-Corporation.pdf ,Toyota Motor Credit Corporation (1),2015-12-11,,2015-08-05,Montana
11/17/2015-11/17/2015,2015-11-17,23 in Montana, https://media.dojmt.gov/wp-content/uploads/TuneCore.pdf ,TuneCore,2015-12-11,,2015-11-17,Montana
10/28/2015-10/28/2015,2015-10-28,1 in Montana, https://media.dojmt.gov/wp-content/uploads/Centerra-Group-LLC-ADP.pdf ,"Centerra Group, LLC (ADP)",2015-12-14,,2015-10-28,Montana
10/26/2015-10/26/2015,2015-10-26,2 in Montana, https://media.dojmt.gov/wp-content/uploads/State-Farm-2.pdf ,State Farm (2),2015-12-15,,2015-10-26,Montana
8/30/2015-8/30/2015,2015-08-30,4 in Montana, https://media.dojmt.gov/wp-content/uploads/Gonzaga-University.pdf ,Gonzaga University,2015-12-18,,2015-08-30,Montana
10/15/2015-11/20/2015,2015-11-20,48 in Montana, https://media.dojmt.gov/wp-content/uploads/Dungarees.pdf ,"Dungarees, LLC",2015-12-18,,2015-10-15,Montana
12/8/2015-12/8/2015,2015-12-08,1 in Montana, https://media.dojmt.gov/wp-content/uploads/Thomas-Nelson-Community-College.pdf ,Thomas Nelson Community College,2015-12-18,,2015-12-08,Montana
11/9/2015-12/7/2015,2015-12-07,43 in Montana, https://media.dojmt.gov/wp-content/uploads/Matson-Navigation-Company-and-Horizon-Lines.pdf ,Matson Navigation and Horizon Lines,2015-12-23,,2015-11-09,Montana
8/3/2015-11/18/2015,2015-11-18,5 in Montana, https://media.dojmt.gov/wp-content/uploads/Farm-to-Feet.pdf ,Farm to Feet,2015-12-23,,2015-08-03,Montana
11/27/2015-11/30/2015,2015-11-30,3 in Montana, https://media.dojmt.gov/wp-content/uploads/HDIS.pdf ,HDIS,2015-12-28,,2015-11-27,Montana
10/31/2015-10/31/2015,2015-10-31,1 in Montana, https://media.dojmt.gov/wp-content/uploads/St.-Lukes-Cornwall-Hospital.pdf ,St. Luke's Cornwall Hospital,2015-12-30,,2015-10-31,Montana
11/10/2015-11/17/2015,2015-11-17,6 in Montana, https://media.dojmt.gov/wp-content/uploads/Regional-Income-Tax-Agency.pdf ,Regional Income Tax Agency,2015-12-31,,2015-11-10,Montana
12/1/2015-12/14/2015,2015-12-14,2 in Montana, https://media.dojmt.gov/wp-content/uploads/Hyde-Park-Partners.pdf ,"Hyde Park Partners, Inc. (MROStop LLC)",2016-01-04,,2015-12-01,Montana
11/10/2015-11/10/2015,2015-11-10,1 in Montana, https://media.dojmt.gov/wp-content/uploads/Blucora.pdf ,"Blucora, Inc. (TaxAct)",2016-01-08,,2015-11-10,Montana
12/10/2015-12/10/2015,2015-12-10,1 in Montana, https://media.dojmt.gov/wp-content/uploads/Grunt-Style.pdf ,Grunt Style LLC,2016-01-08,,2015-12-10,Montana
8/1/2015-11/9/2015,2015-11-09,11 in Montana, https://media.dojmt.gov/wp-content/uploads/JB-Autosports-Inc..pdf ,"JB Autosports, Inc.",2016-01-13,,2015-08-01,Montana
12/7/2015-12/8/2015,2015-12-08,80 in Montana, https://media.dojmt.gov/wp-content/uploads/HSBC-Bank-USA.pdf ,"HSBC Bank, USA",2016-01-13,,2015-12-07,Montana
11/26/2015-11/26/2015,2015-11-26,1 in Montana, https://media.dojmt.gov/wp-content/uploads/Livongo.pdf ,"Livongo Health, Inc.",2016-01-14,,2015-11-26,Montana
7/30/2015-12/8/2015,2015-12-08,1 in Montana, https://media.dojmt.gov/wp-content/uploads/Hyatt-Hotel-Corporation.pdf ,Hyatt Hotels Corporation,2016-01-14,,2015-07-30,Montana
9/11/2015-9/12/2015,2015-09-12,10 in Montana, https://media.dojmt.gov/wp-content/uploads/MaineGeneral-Medical-Center.pdf ,MaineGeneral Medical Center,2016-01-15,,2015-09-11,Montana
12/8/2015-12/17/2015,2015-12-17,2 in Montana, https://media.dojmt.gov/wp-content/uploads/Intuit-1.pdf ,Intuit (3),2016-01-15,,2015-12-08,Montana
11/18/2015-11/18/2015,2015-11-18,25196 in Montana, https://media.dojmt.gov/wp-content/uploads/New-West-Health-Services.pdf ,New West Health Services d/b/a New West Medicare,2016-01-15,,2015-11-18,Montana
1/8/2016-1/8/2016,2016-01-08,2 in Montana, https://media.dojmt.gov/wp-content/uploads/Motivate-International-Inc-.pdf ,"Motivate International, Inc.",2016-01-19,,2016-01-08,Montana
9/24/2015-12/26/2015,2015-12-26,17 in Montana, https://media.dojmt.gov/wp-content/uploads/KickyPants.pdf ,"Kicky Pants, Inc. d/b/a KikKee Pants",2016-01-21,,2015-09-24,Montana
1/11/2016-1/11/2016,2016-01-11,5 in Montana, https://media.dojmt.gov/wp-content/uploads/HK-Financial-Services.pdf ,HK Financial Services,2016-01-22,,2016-01-11,Montana
12/1/2015-1/25/2016,2016-01-25,1 in Montana, https://media.dojmt.gov/wp-content/uploads/LifeSafer.pdf ,"#1 A LifeSafer of Montana, Inc. (LifeSafer)",2016-01-26,,2015-12-01,Montana
5/16/2015-12/9/2015,2015-12-09,4 in Montana, https://media.dojmt.gov/wp-content/uploads/Hain-Celestial-Group-Inc..pdf ,"Hain Celestial Group, Inc. (Alba Botanica)",2016-01-28,,2015-05-16,Montana
10/29/2015-11/5/2015,2015-11-05,5 in Montana, https://media.dojmt.gov/wp-content/uploads/Oiselle.pdf ,Oiselle Running Inc.,2016-01-29,,2015-10-29,Montana
12/18/2015-12/18/2015,2015-12-18,1 in Montana, https://media.dojmt.gov/wp-content/uploads/Richardson-Company.pdf ,"Richardson & Company, P.C.",2016-01-29,,2015-12-18,Montana
10/10/2015-12/21/2015,2015-12-21,27 in Montana, https://media.dojmt.gov/wp-content/uploads/TaxSlayer.pdf ,TaxSlayer,2016-01-29,,2015-10-10,Montana
12/28/2015-1/4/2016,2016-01-04,3 in Montana, https://media.dojmt.gov/wp-content/uploads/Toyota-Motor-Credit-Corporation-1.pdf ,Toyota Motor Credit Corporation (2),2016-02-02,,2015-12-28,Montana
1/5/2016-1/5/2016,2016-01-05,3 in Montana, https://media.dojmt.gov/wp-content/uploads/University-of-Mary-Washington.pdf ,University of Mary Washington,2016-02-04,,2016-01-05,Montana
1/15/2016-1/15/2016,2016-01-15,14 in Montana, https://media.dojmt.gov/wp-content/uploads/University-of-Central-Florida.pdf ,University of Central Florida,2016-02-05,,2016-01-15,Montana
10/3/2015-12/18/2015,2015-12-18,431 in Montana, https://media.dojmt.gov/wp-content/uploads/Gyft.pdf ,"Gyft, Inc.",2016-02-05,,2015-10-03,Montana
11/12/2015-11/26/2015,2015-11-26,1 in Montana, https://media.dojmt.gov/wp-content/uploads/Seirus-Innovative-Accessories.pdf ,"Seirus Innovative Accessories, Inc.",2016-02-05,,2015-11-12,Montana
12/30/2015-1/11/2016,2016-01-11,16 in Montana, https://media.dojmt.gov/wp-content/uploads/Shire-Human-Genetic-Therapies-Inc.pdf ,"Shire Human Genetic Therapies, Inc.",2016-02-08,,2015-12-30,Montana
12/16/2015-12/16/2015,2015-12-16,3 in Montana, https://media.dojmt.gov/wp-content/uploads/Baja-Bound-Insurance-Services.pdf ,Baja Bound Insurance Services,2016-02-08,,2015-12-16,Montana
12/3/2015-12/3/2015,2015-12-03,1 in Montana, https://media.dojmt.gov/wp-content/uploads/Lowcountry-Orthopaedics-and-Sports-Medicine.pdf ,Lowcountry Orthopaedics & Sports Medicine,2016-02-09,,2015-12-03,Montana
1/31/2016-2/10/2016,2016-02-10,1 in Montana, https://media.dojmt.gov/wp-content/uploads/Providence.pdf ,"Providence (St. Patrick Hospital, Missoula)",2016-02-10,,2016-01-31,Montana
10/1/2015-11/30/2015,2015-11-30,15 in Montana, https://media.dojmt.gov/wp-content/uploads/Capezio.pdf ,Capezio,2016-02-10,,2015-10-01,Montana
2/5/2016-2/6/2016,2016-02-06,1 in Montana, https://media.dojmt.gov/wp-content/uploads/Polycom-Inc.pdf ,"Polycom, Inc.",2016-02-12,,2016-02-05,Montana
1/22/2016-1/22/2016,2016-01-22,1 in Montana, https://media.dojmt.gov/wp-content/uploads/Seneca-High-School.pdf ,Seneca High School,2016-02-12,,2016-01-22,Montana
12/17/2015-12/17/2015,2015-12-17,103 in Montana, https://media.dojmt.gov/wp-content/uploads/Alliance-Health-Networks.pdf ,"Alliance Health Networks, LLC",2016-02-15,,2015-12-17,Montana
2/4/2016-2/4/2016,2016-02-04,10 in Montana, https://media.dojmt.gov/wp-content/uploads/Tetra-Technologies.pdf ,"Tetra Technologies, Inc.",2016-02-16,,2016-02-04,Montana
11/3/2015-12/11/2015,2015-12-11,34 in Montana, https://media.dojmt.gov/wp-content/uploads/Superior-Labels.pdf ,Superior Labels and Rubberstamps.net,2016-02-19,,2015-11-03,Montana
9/1/2015-9/30/2015,2015-09-30,1 in Montana, https://media.dojmt.gov/wp-content/uploads/L4-Digital.pdf ,L4 Digital,2016-02-24,,2015-09-01,Montana
1/26/2016-1/26/2016,2016-01-26,29 in Montana, https://media.dojmt.gov/wp-content/uploads/Incipio-LLC.pdf ,"Incipio, LLC",2016-02-24,,2016-01-26,Montana
2/6/2016-2/8/2016,2016-02-08,15 in Montana, https://media.dojmt.gov/wp-content/uploads/Northern-State-Bank.pdf ,Northern State Bank,2016-02-25,,2016-02-06,Montana
1/6/2016-1/6/2016,2016-01-06,3 in Montana, https://media.dojmt.gov/wp-content/uploads/Eye-Institute-of-Corpus-Christi.pdf ,Eye Institute of Corpus Christi,2016-02-26,,2016-01-06,Montana
2/25/2016-2/25/2016,2016-02-25,1 in Montana, https://media.dojmt.gov/wp-content/uploads/AmeriPride.pdf ,"AmeriPride Services, Inc.",2016-02-26,,2016-02-25,Montana
2/26/2016-2/27/2016,2016-02-27,314 in Montana, https://media.dojmt.gov/wp-content/uploads/Evening-Post-Industries.pdf ,Evening Post Industries,2016-02-27,,2016-02-26,Montana
11/1/2015-1/13/2016,2016-01-13,54 in Montana, https://media.dojmt.gov/wp-content/uploads/TN-Marketing.pdf ,TN Marketing,2016-02-29,,2015-11-01,Montana
5/4/2014-12/3/2015,2015-12-03,27 in Montana, https://media.dojmt.gov/wp-content/uploads/Landrys.pdf ,"Landry's, Inc. (Golden Nugget Atlantic City, LLC)",2016-02-29,,2014-05-04,Montana
2/15/2016-2/18/2016,2016-02-18,29 in Montana, https://media.dojmt.gov/wp-content/uploads/Online20Pharmacy20Notice.pdf ,"Wal-Mart Stores, Inc.",2016-03-01,,2016-02-15,Montana
2/4/2016-2/4/2016,2016-02-04,1 in Montana, https://media.dojmt.gov/wp-content/uploads/Intuit-3.pdf ,Intuit (4),2016-03-02,,2016-02-04,Montana
2/26/2016-2/26/2016,2016-02-26,1 in Montana, https://media.dojmt.gov/wp-content/uploads/Triple-i.pdf ,Triple-i,2016-03-03,,2016-02-26,Montana
3/4/2016-3/4/2016,2016-03-04,3 in Montana, https://media.dojmt.gov/wp-content/uploads/Numerix.pdf ,Numerex Corp.,2016-03-04,,2016-03-04,Montana
3/3/2016-3/3/2016,2016-03-03,1 in Montana, https://media.dojmt.gov/wp-content/uploads/ISCO-Industries.pdf ,"ISCO Industries, Inc.",2016-03-04,,2016-03-03,Montana
9/2/2014-2/18/2016,2016-02-18,9 in Montana, https://media.dojmt.gov/wp-content/uploads/Rosen-Hotels-Resorts.pdf ,Rosen Hotels & Resorts,2016-03-04,,2014-09-02,Montana
2/22/2016-2/22/2016,2016-02-22,3 in Montana, https://media.dojmt.gov/wp-content/uploads/eClinicalWorks.pdf ,eClinical Works,2016-03-07,,2016-02-22,Montana
2/24/2016-2/24/2016,2016-02-24,4 in Montana, https://media.dojmt.gov/wp-content/uploads/GCI.pdf ,GCI,2016-03-07,,2016-02-24,Montana
2/19/2016-2/19/2016,2016-02-19,1 in Montana, https://media.dojmt.gov/wp-content/uploads/Applied-Systems.pdf ,Applied Systems,2016-03-07,,2016-02-19,Montana
2/9/2016-2/18/2016,2016-02-18,2 in Montana, https://media.dojmt.gov/wp-content/uploads/Intuit-4.pdf ,Intuit (5),2016-03-08,,2016-02-09,Montana
2/15/2016-2/17/2016,2016-02-17,5 in Montana, https://media.dojmt.gov/wp-content/uploads/1800-flowers.pdf ,1-800 Flowers,2016-03-08,,2016-02-15,Montana
3/2/2016-3/2/2016,2016-03-02,1 in Montana, https://media.dojmt.gov/wp-content/uploads/Turner-Construction-Company.pdf ,Turner Construction Company,2016-03-08,,2016-03-02,Montana
2/29/2016-2/29/2016,2016-02-29,1 in Montana, https://media.dojmt.gov/wp-content/uploads/Seagate-US-LLC.pdf ,Seagate US LLC,2016-03-09,,2016-02-29,Montana
2/3/2016-2/3/2016,2016-02-03,4 in Montana, https://media.dojmt.gov/wp-content/uploads/Matrix-Service-Company.pdf ,Matrix Service Company,2016-03-11,,2016-02-03,Montana
3/2/2016-3/2/2016,2016-03-02,1 in Montana, https://media.dojmt.gov/wp-content/uploads/Maxim-Crane-Works.pdf ,Maxim Crane Works,2016-03-11,,2016-03-02,Montana
10/3/2015-10/3/2015,2015-10-03,264 in Montana, https://media.dojmt.gov/wp-content/uploads/21st-Century-Oncology.pdf ,21st Century Oncology,2016-03-14,,2015-10-03,Montana
2/29/2016-2/29/2016,2016-02-29,1 in Montana, https://media.dojmt.gov/wp-content/uploads/Engineering-Solutions-Products.pdf ,Engineering Solutions & Products,2016-03-14,,2016-02-29,Montana
3/3/2016-3/3/2016,2016-03-03,3 in Montana, https://media.dojmt.gov/wp-content/uploads/Intuit-6.pdf ,Intuit (6),2016-03-16,,2016-03-03,Montana
3/15/2016-3/15/2016,2016-03-15,430 in Montana, https://media.dojmt.gov/wp-content/uploads/PayneWest.pdf ,PayneWest Insurance,2016-03-17,,2016-03-15,Montana
2/6/2016-3/8/2016,2016-03-08,6 in Montana, https://media.dojmt.gov/wp-content/uploads/Northern-State-Bank-supplement.pdf ,Northern State Bank (supplemental),2016-03-17,,2016-02-06,Montana
3/7/2016-3/7/2016,2016-03-07,376 in Montana, https://media.dojmt.gov/wp-content/uploads/Advance-Auto-Parts.pdf ,Advance Auto Parts,2016-03-17,,2016-03-07,Montana
2/25/2016-2/25/2016,2016-02-25,1 in Montana, https://media.dojmt.gov/wp-content/uploads/Road-and-Highway-Builders-Sterling-Construction.pdf ,Road and Highway Builders (Sterling Construction),2016-03-21,,2016-02-25,Montana
3/1/2016-3/1/2016,2016-03-01,4 in Montana, https://media.dojmt.gov/wp-content/uploads/Kantar-Group.pdf ,Kantar Group,2016-03-21,,2016-03-01,Montana
3/10/2016-3/10/2016,2016-03-10,1 in Montana, https://media.dojmt.gov/wp-content/uploads/Lanyon-Solutions.pdf ,"Lanyon Solutions, Inc.",2016-03-21,,2016-03-10,Montana
2/7/2016-3/13/2016,2016-03-13,4 in Montana, https://media.dojmt.gov/wp-content/uploads/GlaxoSmithKline-GSK.pdf ,GlaxoSmithKline (GSK),2016-03-25,,2016-02-07,Montana
1/24/2016-2/7/2016,2016-02-07,10 in Montana, https://media.dojmt.gov/wp-content/uploads/Armstrong-Backus-Co.-myPay-Solutions.pdf ,Armstrong Backus & Co. (myPay Solutions),2016-03-25,,2016-01-24,Montana
2/19/2016-2/19/2016,2016-02-19,3098 in Montana, https://media.dojmt.gov/wp-content/uploads/Mann-Mortgage.pdf ,Mann Mortgage,2016-03-25,,2016-02-19,Montana
3/15/2016-3/15/2016,2016-03-15,3 in Montana, https://media.dojmt.gov/wp-content/uploads/Ullrich-Delevati-CPAs.pdf ,Ullrich Delevati CPAs,2016-03-28,,2016-03-15,Montana
3/24/2016-3/24/2016,2016-03-24,12 in Montana, https://media.dojmt.gov/wp-content/uploads/Examination-Management-Services-Inc.-EMSI.pdf ,Examination Management Services Inc. (EMSI),2016-03-30,,2016-03-24,Montana
2/1/2016-2/1/2016,2016-02-01,3 in Montana, https://media.dojmt.gov/wp-content/uploads/Sirius-XM.pdf ,Sirius XM Satellite Radio,2016-03-31,,2016-02-01,Montana
12/3/2015-2/16/2016,2016-02-16,29 in Montana, https://media.dojmt.gov/wp-content/uploads/St.-Vincent-Healthcare.pdf ,St. Vincent Healthcare,2016-03-31,,2015-12-03,Montana
2/9/2016-3/1/2016,2016-03-01,4 in Montana, https://media.dojmt.gov/wp-content/uploads/Block-and-Company-MMF-Industries.pdf ,Block and Company (MMF Industries),2016-03-31,,2016-02-09,Montana
3/21/2016-3/21/2016,2016-03-21,1 in Montana, https://media.dojmt.gov/wp-content/uploads/Clinton-Health-Access-CHAI.pdf ,Clinton Health Access Initiative (CHAI),2016-04-01,,2016-03-21,Montana
3/23/2016-3/23/2016,2016-03-23,2 in Montana, https://media.dojmt.gov/wp-content/uploads/Ryman-Hospitality-Properties.pdf ,Ryman Hospitality Properties,2016-04-01,,2016-03-23,Montana
3/2/2016-3/2/2016,2016-03-02,2 in Montana, https://media.dojmt.gov/wp-content/uploads/Fish-Wildlife-and-Parks.pdf ,"Fish, Wildlife and Parks",2016-04-01,,2016-03-02,Montana
3/24/2016-3/24/2016,2016-03-24,623 in Montana, https://media.dojmt.gov/wp-content/uploads/Great-Falls-Clinic.pdf ,Great Falls Clinic,2016-04-01,,2016-03-24,Montana
2/11/2016-2/11/2016,2016-02-11,3 in Montana, https://media.dojmt.gov/wp-content/uploads/OReilly-School-of-Technology.pdf ,O'Reilly School of Technology (O'Reilly Media Group),2016-04-01,,2016-02-11,Montana
2/15/2016-2/27/2016,2016-02-27,2 in Montana, https://media.dojmt.gov/wp-content/uploads/Next-Generation-Tax-and-Accounting.pdf ,Next Generation Tax and Accounting,2016-04-06,,2016-02-15,Montana
3/8/2016-3/8/2016,2016-03-08,2 in Montana, https://media.dojmt.gov/wp-content/uploads/Whiting-Turner-Contracting-Company.pdf ,Whiting-Turner Contracting Company,2016-04-06,,2016-03-08,Montana
4/4/2016-4/4/2016,2016-04-04,1 in Montana, https://media.dojmt.gov/wp-content/uploads/Midland-Paper-Packaging-Supplies.pdf ,Midland Paper Packaging & Supplies,2016-04-06,,2016-04-04,Montana
3/16/2016-3/16/2016,2016-03-16,5 in Montana, https://media.dojmt.gov/wp-content/uploads/OptumRx.pdf ,"OptumRx, Inc.",2016-04-08,,2016-03-16,Montana
4/6/2016-4/6/2016,2016-04-06,1 in Montana, https://media.dojmt.gov/wp-content/uploads/Rule-Steel.pdf ,"Rule Steel, Inc.",2016-04-11,,2016-04-06,Montana
11/1/2015-11/30/2015,2015-11-30,5 in Montana, https://media.dojmt.gov/wp-content/uploads/OnDeck-Capital.pdf ,OnDeck Capital,2016-04-11,,2015-11-01,Montana
1/22/2016-1/26/2016,2016-01-26,272 in Montana, https://media.dojmt.gov/wp-content/uploads/Schwaab-1.pdf ,Schwaab (DiscountRubberStamps.com),2016-04-11,,2016-01-22,Montana
3/12/2016-3/12/2016,2016-03-12,210 in Montana, https://media.dojmt.gov/wp-content/uploads/Pioneer-News-Group.pdf ,"Pioneer News Group of Seattle, Washington",2016-04-12,,2016-03-12,Montana
3/1/2016-3/31/2016,2016-03-31,1 in Montana, https://media.dojmt.gov/wp-content/uploads/Prime-Therapeutics.pdf ,Prime Therapeutics,2016-04-13,,2016-03-01,Montana
3/4/2016-3/4/2016,2016-03-04,3 in Montana, https://media.dojmt.gov/wp-content/uploads/Academy-of-Art-University.pdf ,Academy of Art University,2016-04-13,,2016-03-04,Montana
3/15/2016-3/15/2016,2016-03-15,2 in Montana, https://media.dojmt.gov/wp-content/uploads/Intuit-7.pdf ,Intuit (7),2016-04-13,,2016-03-15,Montana
3/29/2016-3/29/2016,2016-03-29,185 in Montana, https://media.dojmt.gov/wp-content/uploads/Department-of-Public-Health-and-Human-Services.pdf ,"Department of Health and Human Services, Early Childhood Services Bureau",2016-04-14,,2016-03-29,Montana
4/14/2016-4/14/2016,2016-04-14,2 in Montana, https://media.dojmt.gov/wp-content/uploads/O-C-Tanner.pdf ,O.C. Tanner,2016-04-15,,2016-04-14,Montana
2/29/2016-2/29/2016,2016-02-29,1 in Montana, https://media.dojmt.gov/wp-content/uploads/GoldKey-PHR.pdf ,GoldKey|PHR,2016-04-15,,2016-02-29,Montana
3/10/2016-3/10/2016,2016-03-10,12 in Montana, https://media.dojmt.gov/wp-content/uploads/Staminus-Communications.pdf ,Staminus Communications,2016-04-15,,2016-03-10,Montana
3/31/2016-3/31/2016,2016-03-31,1 in Montana, https://media.dojmt.gov/wp-content/uploads/Addus-HomeCare.pdf ,Addus HomeCare,2016-04-15,,2016-03-31,Montana
4/11/2016-4/11/2016,2016-04-11,1 in Montana, https://media.dojmt.gov/wp-content/uploads/DealerSocket.pdf ,DealerSocket Inc.,2016-04-18,,2016-04-11,Montana
3/1/2016-3/31/2016,2016-03-31,18304 in Montana, https://media.dojmt.gov/wp-content/uploads/doTerra-International.pdf ,"doTERRA International, LLC",2016-04-18,,2016-03-01,Montana
10/1/2015-11/30/2015,2015-11-30,1 in Montana, https://media.dojmt.gov/wp-content/uploads/TTI-Floor-Care-North-America.pdf ,TTI Floor Care North America,2016-04-18,,2015-10-01,Montana
1/7/2016-3/21/2016,2016-03-21,15 in Montana, https://media.dojmt.gov/wp-content/uploads/Fruitful-Yield-Health-Foods.pdf ,FruitfulYield.com; NOW-2-U.com; VitaminExperts.com,2016-04-20,,2016-01-07,Montana
10/15/2015-3/16/2016,2016-03-16,67 in Montana, https://media.dojmt.gov/wp-content/uploads/LuckyPet.pdf ,"LuckyPet, Inc.",2016-04-22,,2015-10-15,Montana
2/4/2016-3/16/2016,2016-03-16,25 in Montana, https://media.dojmt.gov/wp-content/uploads/ProSchools.pdf ,ProSchools,2016-04-22,,2016-02-04,Montana
4/8/2016-4/22/2016,2016-04-22,1 in Montana, https://media.dojmt.gov/wp-content/uploads/Total-Community-Options-dba-InnovAge.pdf ,Total Community Options dba InnovAge,2016-04-26,,2016-04-08,Montana
4/16/2016-4/16/2016,2016-04-16,34 in Montana, https://media.dojmt.gov/wp-content/uploads/Michels-Corporation.pdf ,Michels Corporation,2016-04-27,,2016-04-16,Montana
3/30/2016-4/11/2016,2016-04-11,9 in Montana, https://media.dojmt.gov/wp-content/uploads/Intuit-8.pdf ,Intuit (8),2016-04-28,,2016-03-30,Montana
2/25/2016-2/26/2016,2016-02-26,3 in Montana, https://media.dojmt.gov/wp-content/uploads/EqualizeRCM-Systems-ERCM.pdf ,EqualizeRCM Systems (ERCM),2016-04-28,,2016-02-25,Montana
1/24/2016-3/11/2016,2016-03-11,9 in Montana, https://media.dojmt.gov/wp-content/uploads/Hi-Tec.pdf ,Hi-Tec (1) (Magnum Boots),2016-04-29,,2016-01-24,Montana
3/30/2016-3/30/2016,2016-03-30,1 in Montana, https://media.dojmt.gov/wp-content/uploads/Ken-Waterman-CPA.pdf ,"Ken Waterman, CPA",2016-05-03,,2016-03-30,Montana
4/5/2016-4/5/2016,2016-04-05,68 in Montana, https://media.dojmt.gov/wp-content/uploads/Leavitt-Group.pdf ,Leavitt Group,2016-05-03,,2016-04-05,Montana
12/30/2015-3/22/2016,2016-03-22,1 in Montana, https://media.dojmt.gov/wp-content/uploads/Sanctuary-Clothing.pdf ,Sanctuary Clothing,2016-05-03,,2015-12-30,Montana
3/25/2016-3/25/2016,2016-03-25,6 in Montana, https://media.dojmt.gov/wp-content/uploads/Charles-Schwab-Co.-corrected.pdf ,Charles Schwab & Co.,2016-05-04,,2016-03-25,Montana
4/29/2016-4/29/2016,2016-04-29,1 in Montana, https://media.dojmt.gov/wp-content/uploads/Brunswick-Corporation.pdf ,Brunswick Corporation,2016-05-05,,2016-04-29,Montana
1/25/2016-3/19/2016,2016-03-19,2 in Montana, https://media.dojmt.gov/wp-content/uploads/CertifiKid-LLC.pdf ,CertifiKid LLC,2016-05-05,,2016-01-25,Montana
4/6/2016-4/27/2016,2016-04-27,8 in Montana, https://media.dojmt.gov/wp-content/uploads/Intuit9.pdf ,Intuit (9),2016-05-09,,2016-04-06,Montana
2/8/2016-2/8/2016,2016-02-08,1 in Montana, https://media.dojmt.gov/wp-content/uploads/Group-Benefit-Services.pdf ,Group Benefit Services (GBS),2016-05-09,,2016-02-08,Montana
4/19/2016-5/2/2016,2016-05-02,5 in Montana, https://media.dojmt.gov/wp-content/uploads/Distinct-Software-Solutions-dba-Golf-18-Network.pdf ,Distinct Software Solutions,2016-05-10,,2016-04-19,Montana
2/19/2016-4/6/2016,2016-04-06,10 in Montana, https://media.dojmt.gov/wp-content/uploads/MKK-Consulting-Engineers.pdf ,MKK Consulting Engineers,2016-05-11,,2016-02-19,Montana
3/8/2016-3/8/2016,2016-03-08,20 in Montana, https://media.dojmt.gov/wp-content/uploads/Medical-Colleagues-of-Texas.pdf ,Medical Colleagues of Texas,2016-05-11,,2016-03-08,Montana
4/29/2016-4/29/2016,2016-04-29,1 in Montana, https://media.dojmt.gov/wp-content/uploads/Kalamazoo-College.pdf ,Kalamazoo College,2016-05-11,,2016-04-29,Montana
9/22/2014-1/23/2016,2016-01-23,104 in Montana, https://media.dojmt.gov/wp-content/uploads/Hi-Tec2.pdf ,Hi-Tec (2) (Magnum Boots),2016-05-11,,2014-09-22,Montana
4/11/2016-4/11/2016,2016-04-11,1 in Montana, https://media.dojmt.gov/wp-content/uploads/Curse.pdf ,"Curse, Inc.",2016-05-11,,2016-04-11,Montana
4/13/2016-4/13/2016,2016-04-13,1 in Montana, https://media.dojmt.gov/wp-content/uploads/Renville-County-Hospital-Clinics.pdf ,Renville County Hospital and Clinic,2016-05-12,,2016-04-13,Montana
4/14/2016-4/14/2016,2016-04-14,28 in Montana, https://media.dojmt.gov/wp-content/uploads/MYR-Group.pdf ,"MYR Group (L.E. Myers Co., Sturgeon Electric, GSW Construction)",2016-05-12,,2016-04-14,Montana
2/1/2016-4/19/2016,2016-04-19,5 in Montana, https://media.dojmt.gov/wp-content/uploads/U.-S.-Bank.pdf ,U. S. Bank,2016-05-12,,2016-02-01,Montana
3/18/2016-3/18/2016,2016-03-18,2 in Montana, https://media.dojmt.gov/wp-content/uploads/San-Juan-County-New-Mexico.pdf ,"San Juan County, New Mexico",2016-05-13,,2016-03-18,Montana
3/21/2016-3/21/2016,2016-03-21,1 in Montana, https://media.dojmt.gov/wp-content/uploads/Block-and-Company-MMF-Industries-2.pdf ,Block and Company (MMF Industries) (2),2016-05-13,,2016-03-21,Montana
10/1/2015-4/22/2016,2016-04-22,5 in Montana, https://media.dojmt.gov/wp-content/uploads/Batdorf-Bronson-Coffee-Roasters.pdf ,"Batdorf & Bronson Coffee Roasters (Challain, Inc.)",2016-05-17,,2015-10-01,Montana
4/21/2016-4/21/2016,2016-04-21,1 in Montana, https://media.dojmt.gov/wp-content/uploads/Metropolitan-Jewish-Health-System.pdf ,"Metropolitan Jewish Health System, Inc.",2016-05-19,,2016-04-21,Montana
3/1/2016-4/7/2016,2016-04-07,5 in Montana, https://media.dojmt.gov/wp-content/uploads/Maritz-Holdings-Inc..pdf ,"Maritz Holdings, Inc.",2016-05-23,,2016-03-01,Montana
2/22/2016-4/14/2016,2016-04-14,1 in Montana, https://media.dojmt.gov/wp-content/uploads/Stamford-Podiarty-Group.pdf ,Stamford Podiatry Group,2016-05-24,,2016-02-22,Montana
1/20/2016-4/27/2016,2016-04-27,20 in Montana, https://media.dojmt.gov/wp-content/uploads/Kroger-Co..pdf ,Kroger Co.,2016-05-25,,2016-01-20,Montana
12/7/2015-5/3/2016,2016-05-03,1 in Montana, https://media.dojmt.gov/wp-content/uploads/Match-up-Solutions.pdf ,Match-Up Solutions,2016-05-26,,2015-12-07,Montana
5/2/2016-5/2/2016,2016-05-02,2 in Montana, https://media.dojmt.gov/wp-content/uploads/Intuit10.pdf ,Intuit (10),2016-05-26,,2016-05-02,Montana
4/14/2016-4/14/2016,2016-04-14,3 in Montana, https://media.dojmt.gov/wp-content/uploads/Shoes-West-Distribution-dba-Taos-Footwear.pdf ,"Shoes West Distribution, Inc dba Taos Footwear",2016-05-27,,2016-04-14,Montana
4/7/2016-4/7/2016,2016-04-07,1 in Montana, https://media.dojmt.gov/wp-content/uploads/National-Network-of-Abortion-Funds-NNAF.pdf ,National Network of Abortion Funds (NNAF),2016-05-27,,2016-04-07,Montana
5/23/2016-5/23/2016,2016-05-23,1 in Montana, https://media.dojmt.gov/wp-content/uploads/Extraction-Oil-Gas.pdf ,"Extraction Oil & Gas, LLC",2016-05-31,,2016-05-23,Montana
5/20/2016-5/21/2016,2016-05-21,1 in Montana, https://media.dojmt.gov/wp-content/uploads/Glu-Mobile.pdf ,Glu Mobile,2016-06-01,,2016-05-20,Montana
1/30/2016-3/23/2016,2016-03-23,151 in Montana, https://media.dojmt.gov/wp-content/uploads/Empathia-Inc..pdf ,"Empathia, Inc.",2016-06-03,,2016-01-30,Montana
5/12/2015-4/28/2016,2016-04-28,110 in Montana, https://media.dojmt.gov/wp-content/uploads/Acer-Service-Corporation.pdf ,Acer Service Corporation,2016-06-03,,2015-05-12,Montana
2/14/2014-8/5/2015,2015-08-05,111 in Montana, https://media.dojmt.gov/wp-content/uploads/MEI-GSR-Grand-Sierra-Resort.pdf ,MEI-GSR (Grand Sierra Resort),2016-06-06,,2014-02-14,Montana
3/21/2016-3/21/2016,2016-03-21,1 in Montana, https://media.dojmt.gov/wp-content/uploads/Trump-Hotel-Collection.pdf ,Trump Hotel Collection,2016-06-10,,2016-03-21,Montana
5/17/2016-5/17/2016,2016-05-17,3 in Montana, https://media.dojmt.gov/wp-content/uploads/Intuit11.pdf ,Intuit (11),2016-06-10,,2016-05-17,Montana
5/4/2016-5/19/2016,2016-05-19,1 in Montana, https://media.dojmt.gov/wp-content/uploads/Tiemart.pdf ,Tiemart,2016-06-13,,2016-05-04,Montana
9/1/2013-4/1/2015,2015-04-01,19 in Montana, https://media.dojmt.gov/wp-content/uploads/Universtiy-of-Connecticut.pdf ,University of Connecticut,2016-06-14,,2013-09-01,Montana
4/28/2016-4/28/2016,2016-04-28,2 in Montana, https://media.dojmt.gov/wp-content/uploads/Ameriprise-Financial-Services-2.pdf ,AmeriPrise Financial (2),2016-06-14,,2016-04-28,Montana
5/13/2014-5/13/2014,2014-05-13,1 in Montana, https://media.dojmt.gov/wp-content/uploads/Uber.pdf ,Uber,2016-06-15,,2014-05-13,Montana
3/8/2016-4/4/2016,2016-04-04,1 in Montana, https://media.dojmt.gov/wp-content/uploads/Southcentral-Foundation-SCF.pdf ,Southcentral Foundation (SCF),2016-06-17,,2016-03-08,Montana
6/2/2016-6/2/2016,2016-06-02,2 in Montana, https://media.dojmt.gov/wp-content/uploads/Intuit12.pdf ,Intuit (12),2016-06-21,,2016-06-02,Montana
6/17/2016-6/17/2016,2016-06-17,1 in Montana, https://media.dojmt.gov/wp-content/uploads/Gamesa-Wind.pdf ,"Gamesa Wind US, LLC",2016-06-27,,2016-06-17,Montana
10/15/2015-3/21/2016,2016-03-21,Unknown in Montana, https://media.dojmt.gov/wp-content/uploads/Hard-Rock-Hotel-Casino-Las-Vegas.pdf ,Hard Rock Hotel & Casino Las Vegas,2016-06-27,,2015-10-15,Montana
3/25/2014-6/1/2016,2016-06-01,1 in Montana, https://media.dojmt.gov/wp-content/uploads/Jefferson-Medical-Associates.pdf ,Jefferson Medical Associates (JMA),2016-06-28,,2014-03-25,Montana
4/18/2016-5/27/2016,2016-05-27,1 in Montana, https://media.dojmt.gov/wp-content/uploads/Rayner-Foos-Kruse-and-Irwin-CPAs-RFKI-2.pdf ,"Rayner, Foos, Kruse and Irwin, CPAs (RFKI)",2016-06-28,,2016-04-18,Montana
2/8/2016-2/8/2016,2016-02-08,1 in Montana, https://media.dojmt.gov/wp-content/uploads/Patterson-Dental-Supply-MGH.pdf ,Patterson Dental Supply (Massachusetts General Hospital),2016-06-29,,2016-02-08,Montana
10/21/2015-4/7/2016,2016-04-07,7 in Montana, https://media.dojmt.gov/wp-content/uploads/KontrolFreek-LLC.pdf ,KontrolFreek,2016-06-30,,2015-10-21,Montana
6/8/2016-6/8/2016,2016-06-08,289 in Montana, https://media.dojmt.gov/wp-content/uploads/NLU-Products-LLC-BGZ-Brands.pdf ,"NLU Products, LLC (BGZ Brands)",2016-07-05,,2016-06-08,Montana
5/20/2016-6/2/2016,2016-06-02,3 in Montana, https://media.dojmt.gov/wp-content/uploads/Blue-Cross-Blue-Shield-of-North-Dakota.pdf ,Blue Cross Blue Shield of North Dakota,2016-07-06,,2016-05-20,Montana
11/30/2015-6/8/2016,2016-06-08,Unknown in Montana, https://media.dojmt.gov/wp-content/uploads/Wendys.pdf ,Wendy's,2016-07-07,,2015-11-30,Montana
4/18/2015-1/29/2016,2016-01-29,3 in Montana, https://media.dojmt.gov/wp-content/uploads/American-Association-for-the-Advancement-of-Science-Comnet-Marketing-Group.pdf ,American Association for Advancement of Science (Comnet Marketing Group),2016-07-08,,2015-04-18,Montana
6/3/2016-6/3/2016,2016-06-03,2 in Montana, https://media.dojmt.gov/wp-content/uploads/North-Carolina-State-University.pdf ,North Carolina State University,2016-07-08,,2016-06-03,Montana
5/11/2016-5/11/2016,2016-05-11,1 in Montana, https://media.dojmt.gov/wp-content/uploads/Medtronic.pdf ,Medtronic,2016-07-08,,2016-05-11,Montana
12/23/2015-6/14/2016,2016-06-14,31 in Montana, https://media.dojmt.gov/wp-content/uploads/Omni-Hotels-and-Resorts.pdf ,Omni Hotel and Resorts,2016-07-08,,2015-12-23,Montana
6/16/2016-6/16/2016,2016-06-16,1 in Montana, https://media.dojmt.gov/wp-content/uploads/Career-Education-Corporation.pdf ,Career Education Corporation,2016-07-11,,2016-06-16,Montana
4/22/2016-4/24/2016,2016-04-24,1 in Montana, https://media.dojmt.gov/wp-content/uploads/Comnet-Marketing-Group.pdf ,Comnet Marketing Group,2016-07-12,,2016-04-22,Montana
4/26/2016-4/26/2016,2016-04-26,1 in Montana, https://media.dojmt.gov/wp-content/uploads/Primoris-Services-Corporation.pdf ,Primoris Services Corporation,2016-07-13,,2016-04-26,Montana
5/1/2016-6/14/2016,2016-06-14,15 in Montana, https://media.dojmt.gov/wp-content/uploads/IAP-Worldwide-Ingenuity-and-Purpose.pdf ,IAP Worldwide (Ingenuity and Purpose),2016-07-14,,2016-05-01,Montana
4/23/2016-4/24/2016,2016-04-24,4 in Montana, https://media.dojmt.gov/wp-content/uploads/Project-Management-Institute-PMI.pdf ,Project Management Institute (PMI),2016-07-14,,2016-04-23,Montana
4/28/2015-5/4/2016,2016-05-04,21 in Montana, https://media.dojmt.gov/wp-content/uploads/MatadorRecordings-dba-Matador-Direct.pdf ,"Matador Recordings, LLC d/b/a Matador Direct",2016-07-15,,2015-04-28,Montana
4/21/2016-6/13/2016,2016-06-13,23 in Montana, https://media.dojmt.gov/wp-content/uploads/San-Antonio-Shoemakers-Inc.pdf ,"San Antonio Shoemakers, Inc. (SAS)",2016-07-19,,2016-04-21,Montana
5/30/2016-5/30/2016,2016-05-30,2 in Montana, https://media.dojmt.gov/wp-content/uploads/Internet-Chess-Club-ICC.pdf ,"Internet Chess Club, Inc.",2016-07-19,,2016-05-30,Montana
3/1/2016-7/19/2016,2016-07-19,Unknown in Montana, https://media.dojmt.gov/wp-content/uploads/CiCi-Enterprises-Inc-1.pdf ,"CiCi Enterprises, LP",2016-07-19,,2016-03-01,Montana
4/23/2016-4/24/2016,2016-04-24,2 in Montana, https://media.dojmt.gov/wp-content/uploads/Institute-of-Management-Accountants-IMA.pdf ,Institute of Management Accountants (IMA),2016-07-20,,2016-04-23,Montana
6/6/2016-6/7/2016,2016-06-07,17 in Montana, https://media.dojmt.gov/wp-content/uploads/Skagit-Farmers-Supply-SFS.pdf ,Skagit Farmers Supply (SFS),2016-07-20,,2016-06-06,Montana
5/16/2016-5/16/2016,2016-05-16,42 in Montana, https://media.dojmt.gov/wp-content/uploads/US-Fire-CoverX-Corporation.pdf ,United States Fire Insurance (CoverX Corporation),2016-07-21,,2016-05-16,Montana
7/7/2016-7/7/2016,2016-07-07,8 in Montana, https://media.dojmt.gov/wp-content/uploads/inVentiv-Health-Inc..pdf ,"inVentiv Health, Inc.",2016-07-21,,2016-07-07,Montana
6/23/2016-6/23/2016,2016-06-23,1 in Montana, https://media.dojmt.gov/wp-content/uploads/American-College-of-Emergency-Physicians-ACEP.pdf ,American College of Emergency Physicians (ACEP) (ComNet Marketing),2016-07-22,,2016-06-23,Montana
4/23/2016-4/24/2016,2016-04-24,2 in Montana, https://media.dojmt.gov/wp-content/uploads/Specialty-Equipment-Market-Assoc-SEMA.pdf ,Specialty Equipment Market Association (SEMA),2016-07-27,,2016-04-23,Montana
4/22/2016-4/24/2016,2016-04-24,2 in Montana, https://media.dojmt.gov/wp-content/uploads/Academy-of-Nutrition-Dietetics.pdf ,Academy of Nutrition & Dietetics,2016-07-28,,2016-04-22,Montana
5/3/2016-6/29/2016,2016-06-29,8 in Montana, https://media.dojmt.gov/wp-content/uploads/MedAltus-LLC.pdf ,"MedAltus, LLC",2016-07-29,,2016-05-03,Montana
7/21/2016-7/21/2016,2016-07-21,1 in Montana, https://media.dojmt.gov/wp-content/uploads/Nordic-Consulting-Partners-Inc.pdf ,"Nordic Consulting Partners, Inc.",2016-07-29,,2016-07-21,Montana
7/1/2015-7/27/2016,2016-07-27,1 in Montana, https://media.dojmt.gov/wp-content/uploads/Pro-Performance-Sports-LLC.pdf ,"Pro Performance Sports, LLC",2016-07-30,,2015-07-01,Montana
7/27/2016-7/27/2016,2016-07-27,1 in Montana, https://media.dojmt.gov/wp-content/uploads/Green-Plains-Inc.pdf ,"Green Plains, Inc.",2016-08-01,,2016-07-27,Montana
6/23/2016-7/7/2016,2016-07-07,2155 in Montana, https://media.dojmt.gov/wp-content/uploads/Banner-Health.pdf ,Banner Health,2016-08-03,,2016-06-23,Montana
11/13/2015-6/10/2016,2016-06-10,3 in Montana, https://media.dojmt.gov/wp-content/uploads/Travel-Caddy-Inc-dba-Travelon.pdf ,"Travel Caddy, Inc. dba Travelon",2016-08-04,,2015-11-13,Montana
5/23/2016-7/6/2016,2016-07-06,818 in Montana, https://media.dojmt.gov/wp-content/uploads/HDV-Vest-Investment-Services.pdf ,HD Vest Investment Services,2016-08-04,,2016-05-23,Montana
7/16/2016-7/22/2016,2016-07-22,2 in Montana, https://media.dojmt.gov/wp-content/uploads/EBSCO-Sign.pdf ,EBSCO Sign Group a/k/a OutdoorSigns America,2016-08-08,,2016-07-16,Montana
6/13/2016-6/13/2016,2016-06-13,1 in Montana, https://media.dojmt.gov/wp-content/uploads/Rotech-Healthcare.pdf ,Rotech Healthcare,2016-08-10,,2016-06-13,Montana
6/15/2016-6/15/2016,2016-06-15,Unknown in Montana, https://media.dojmt.gov/wp-content/uploads/Taleff-Murphy.pdf ,"Taleff & Murphy, P.C.",2016-08-10,,2016-06-15,Montana
7/23/2016-7/25/2016,2016-07-25,1 in Montana, https://media.dojmt.gov/wp-content/uploads/USAA-Federal-Savings-Bank.pdf ,USAA Federal Savings Bank,2016-08-11,,2016-07-23,Montana
6/25/2016-7/22/2016,2016-07-22,10 in Montana, https://media.dojmt.gov/wp-content/uploads/PAX-Labs.pdf ,PAX Labs,2016-08-12,,2016-06-25,Montana
12/2/2015-6/12/2016,2016-06-12,Unknown in Montana, https://media.dojmt.gov/wp-content/uploads/HEI-Hotels-and-Resorts.pdf ,HEI Hotels & Resorts,2016-08-12,,2015-12-02,Montana
4/18/2016-4/21/2016,2016-04-21,45 in Montana, https://media.dojmt.gov/wp-content/uploads/Bon-Secours-Health-System.pdf ,Bon Secours Health System/R-C Healthcare Management,2016-08-12,,2016-04-18,Montana
3/30/2016-6/13/2016,2016-06-13,586 in Montana, https://media.dojmt.gov/wp-content/uploads/Valley-Anesthesiology-Consultants.pdf ,Valley Anesthesiology and Pain Consultants (VAPC),2016-08-12,,2016-03-30,Montana
10/9/2015-8/1/2016,2016-08-01,135 in Montana, https://media.dojmt.gov/wp-content/uploads/Anderson-Tackman-Co..pdf ,Schwan's Home Service,2016-08-15,,2015-10-09,Montana
7/25/2016-7/25/2016,2016-07-25,4 in Montana, https://media.dojmt.gov/wp-content/uploads/Schwans.pdf ,"Precision Pipeline, LLC, subsidiary of MasTec, Inc.",2016-08-15,,2016-07-25,Montana
7/6/2016-7/6/2016,2016-07-06,4 in Montana, https://media.dojmt.gov/wp-content/uploads/Precision-Pipeline.pdf ,"Anderson, Tackman & Co.",2016-08-15,,2016-07-06,Montana
7/16/2016-8/18/2016,2016-08-18,35 in Montana, https://media.dojmt.gov/wp-content/uploads/Presnell-Gage.pdf ,"Presnell Gage, PLLC",2016-08-18,,2016-07-16,Montana
3/24/2016-7/29/2016,2016-07-29,7 in Montana, https://media.dojmt.gov/wp-content/uploads/DXE-Medical-1.pdf ,DXE Medical,2016-08-18,,2016-03-24,Montana
6/19/2016-7/22/2016,2016-07-22,1 in Montana, https://media.dojmt.gov/wp-content/uploads/Matouk.pdf ,"Matouk Factory Store, Inc.",2016-08-18,,2016-06-19,Montana
5/21/2016-7/6/2016,2016-07-06,2072 in Montana, https://media.dojmt.gov/wp-content/uploads/Newkirk-Symphonix.pdf ,Newkirk - Symphonix,2016-08-19,,2016-05-21,Montana
8/3/2016-8/3/2016,2016-08-03,6 in Montana, https://media.dojmt.gov/wp-content/uploads/Intuit13.pdf ,Intuit (13),2016-08-19,,2016-08-03,Montana
7/15/2016-7/15/2016,2016-07-15,8492 in Montana, https://media.dojmt.gov/wp-content/uploads/Eddie-Bauer.pdf ,"Eddie Bauer, LLC",2016-08-19,,2016-07-15,Montana
6/28/2016-6/28/2016,2016-06-28,19 in Montana, https://media.dojmt.gov/wp-content/uploads/Toyota-Motor-Credit-Corporation3.pdf ,Toyota Motor Credit Corporation (3),2016-08-22,,2016-06-28,Montana
3/4/2016-6/24/2016,2016-06-24,6 in Montana, https://media.dojmt.gov/wp-content/uploads/SCAN-Health-Plan.pdf ,SCAN Health Plan,2016-08-22,,2016-03-04,Montana
10/21/2015-4/7/2016,2016-04-07,59 in Montana, https://media.dojmt.gov/wp-content/uploads/KontrolFreek-LLC2.pdf ,KontrolFreek LLC (2),2016-08-22,,2015-10-21,Montana
4/26/2016-6/8/2016,2016-06-08,1 in Montana, https://media.dojmt.gov/wp-content/uploads/Noble-House-3.pdf ,Noble House Hotels & Resorts (3),2016-08-24,,2016-04-26,Montana
7/27/2016-8/2/2016,2016-08-02,1 in Montana, https://media.dojmt.gov/wp-content/uploads/Michelle-Pecora-CPA.pdf ,Michelle A. Pecora CPA,2016-08-25,,2016-07-27,Montana
11/24/2015-11/24/2015,2015-11-24,9 in Montana, https://media.dojmt.gov/wp-content/uploads/Exterran.pdf ,Exterran,2016-08-26,,2015-11-24,Montana
2/16/2016-7/7/2016,2016-07-07,276 in Montana, https://media.dojmt.gov/wp-content/uploads/Gray-Television.pdf ,Kimpton Hotels & Restaurants,2016-08-31,,2016-02-16,Montana
8/12/2016-8/12/2016,2016-08-12,34 in Montana, https://media.dojmt.gov/wp-content/uploads/CHI-Franciscan-Healthcare-Highline-Medical-Center-R-C-Healthcare-Management.pdf ,Gray Television,2016-08-31,,2016-08-12,Montana
4/21/2016-6/13/2016,2016-06-13,15 in Montana, https://media.dojmt.gov/wp-content/uploads/M-Holdings-Securities.pdf ,CHI Franciscan Healthcare Highline Medical Center (R-C Healthcare Management),2016-08-31,,2016-04-21,Montana
8/1/2016-8/1/2016,2016-08-01,7 in Montana, https://media.dojmt.gov/wp-content/uploads/Kimpton-Hotels-Restaurants.pdf ,M Holdings Securities,2016-08-31,,2016-08-01,Montana
4/25/2016-8/3/2016,2016-08-03,50 in Montana, https://media.dojmt.gov/wp-content/uploads/Noble-House-4.pdf ,Noble House Hotels & Resorts (4),2016-09-02,,2016-04-25,Montana
7/6/2016-7/7/2016,2016-07-07,1 in Montana, https://media.dojmt.gov/wp-content/uploads/Burrell-Behavioral-Health.pdf ,Burrell Behavioral Health,2016-09-06,,2016-07-06,Montana
3/28/2016-6/5/2016,2016-06-05,3 in Montana, https://media.dojmt.gov/wp-content/uploads/King-of-Prussia-Dental-Association-KOP.pdf ,King of Prussia Dental Association (KOP),2016-09-08,,2016-03-28,Montana
4/13/2016-4/14/2016,2016-04-14,7 in Montana, https://media.dojmt.gov/wp-content/uploads/City-of-Plummer.pdf ,"City of Plummer, Idaho",2016-09-09,,2016-04-13,Montana
5/1/2016-6/14/2016,2016-06-14,2 in Montana, https://media.dojmt.gov/wp-content/uploads/IAP-Worldwide-Ingenuity-and-Purpose2.pdf ,IAP Worldwide (Ingenuity and Purpose) (2),2016-09-09,,2016-05-01,Montana
8/10/2016-8/10/2016,2016-08-10,4 in Montana, https://media.dojmt.gov/wp-content/uploads/Rebecca-Minkoff.pdf ,Rebecca Minkoff,2016-09-09,,2016-08-10,Montana
8/18/2014-7/21/2016,2016-07-21,3 in Montana, https://media.dojmt.gov/wp-content/uploads/Asante-Health-System.pdf ,Asante Health System,2016-09-09,,2014-08-18,Montana
8/8/2016-8/9/2016,2016-08-09,1 in Montana, https://media.dojmt.gov/wp-content/uploads/Pratap-Kurra-MD.pdf ,"Pratap Kurrar, M.D.",2016-09-12,,2016-08-08,Montana
8/3/2016-8/9/2016,2016-08-09,4 in Montana, https://media.dojmt.gov/wp-content/uploads/Wheeler-Egger-CPAs.pdf ,"Wheeler & Egger, CPAs",2016-09-13,,2016-08-03,Montana
4/25/2016-4/25/2016,2016-04-25,6 in Montana, https://media.dojmt.gov/wp-content/uploads/Ursus-Holdings-LLC.pdf ,Ursus Holdings,2016-09-15,,2016-04-25,Montana
6/29/2016-7/17/2016,2016-07-17,1 in Montana, https://media.dojmt.gov/wp-content/uploads/Capital-One.pdf ,Capital One,2016-09-15,,2016-06-29,Montana
8/11/2016-8/16/2016,2016-08-16,28 in Montana, https://media.dojmt.gov/wp-content/uploads/Lulus-Fashion-Lounge.pdf ,Lulu's Fashion Lounge,2016-09-16,,2016-08-11,Montana
8/22/2016-8/22/2016,2016-08-22,40370 in Montana, https://media.dojmt.gov/wp-content/uploads/ACTIVEOutdoors.pdf ,ACTIVEOutdoors,2016-09-19,,2016-08-22,Montana
7/11/2016-7/11/2016,2016-07-11,1 in Montana, https://media.dojmt.gov/wp-content/uploads/Stallcup-Associates-CPAs.pdf ,"Stallcup & Associates, CPAs",2016-09-21,,2016-07-11,Montana
8/2/2016-8/2/2016,2016-08-02,20 in Montana, https://media.dojmt.gov/wp-content/uploads/Central-Ohio-Urology-Group-COUG.pdf ,Central Ohio Urology Group (COUG),2016-09-22,,2016-08-02,Montana
8/11/2016-8/11/2016,2016-08-11,3 in Montana, https://media.dojmt.gov/wp-content/uploads/Napa-Valley-Dentistry.pdf ,"Napa Valley Dentristry of Napa, California",2016-09-22,,2016-08-11,Montana
9/1/2014-10/1/2014,2014-10-01,Unknown in Montana, http://consumerfed.org/yahoo-users-face-massive-data-breach/ ,YAHOO,2016-09-22,,2014-09-01,Montana
9/5/2016-9/12/2016,2016-09-12,4 in Montana, https://media.dojmt.gov/wp-content/uploads/Intuit14.pdf ,Intuit (14),2016-09-23,,2016-09-05,Montana
8/15/2016-9/8/2016,2016-09-08,15 in Montana, https://media.dojmt.gov/wp-content/uploads/Novation-Settlement-Solutions.pdf ,Novation Settlement Solutions,2016-09-23,,2016-08-15,Montana
8/9/2016-8/9/2016,2016-08-09,1 in Montana, https://media.dojmt.gov/wp-content/uploads/BECU.pdf ,BECU (Boeing Employees' Credit Union),2016-09-26,,2016-08-09,Montana
7/21/2016-7/21/2016,2016-07-21,1 in Montana, https://media.dojmt.gov/wp-content/uploads/Santora-CPA-and-SimpleBooks-Corp..pdf ,Santoro CPA and SimpleBooks Corp.,2016-09-27,,2016-07-21,Montana
8/8/2016-8/8/2016,2016-08-08,1 in Montana, https://media.dojmt.gov/wp-content/uploads/Thomasville-Eye-Center.pdf ,Thomasville Eye Center,2016-09-28,,2016-08-08,Montana
4/17/2016-8/26/2016,2016-08-26,12 in Montana, https://media.dojmt.gov/wp-content/uploads/VF-Outlet.pdf ,VF Outlet,2016-09-28,,2016-04-17,Montana
9/19/2012-6/10/2016,2016-06-10,19 in Montana, https://media.dojmt.gov/wp-content/uploads/Hutton-Hotel.pdf ,Hutton Hotel,2016-09-29,,2012-09-19,Montana
5/1/2016-7/12/2016,2016-07-12,9 in Montana, https://media.dojmt.gov/wp-content/uploads/Dale-A-Wein-Prof-LLC.pdf ,"Dale A. Wein, Prof. LLC",2016-10-01,,2016-05-01,Montana
8/22/2016-8/22/2016,2016-08-22,2 in Montana, https://media.dojmt.gov/wp-content/uploads/Francisco-Jaume-D.O..pdf ,"Francisco Jaume, D.O.",2016-10-03,,2016-08-22,Montana
9/12/2016-9/12/2016,2016-09-12,2 in Montana, https://media.dojmt.gov/wp-content/uploads/Vaupell.pdf ,Vaupell Holdings,2016-10-03,,2016-09-12,Montana
7/6/2016-7/6/2016,2016-07-06,3 in Montana, https://media.dojmt.gov/wp-content/uploads/Borden-Perlman-Insurance.pdf ,Borden Perlman Salisbury & Kelly Insurance,2016-10-05,,2016-07-06,Montana
7/28/2016-8/1/2016,2016-08-01,2 in Montana, https://media.dojmt.gov/wp-content/uploads/HD-Vest-Investment-Services-2.pdf ,HD Vest Investment Services (2),2016-10-05,,2016-07-28,Montana
9/12/2016-9/12/2016,2016-09-12,1 in Montana, https://media.dojmt.gov/wp-content/uploads/University-of-Montana.pdf ,University of Montana,2016-10-06,,2016-09-12,Montana
9/4/2016-9/22/2016,2016-09-22,2 in Montana, https://media.dojmt.gov/wp-content/uploads/MicroDAQ.pdf ,MicroDAQ,2016-10-07,,2016-09-04,Montana
7/25/2016-9/23/2016,2016-09-23,2 in Montana, https://media.dojmt.gov/wp-content/uploads/Vera-Bradley.pdf ,Vera Bradley,2016-10-12,,2016-07-25,Montana
7/11/2016-7/26/2016,2016-07-26,3 in Montana, https://media.dojmt.gov/wp-content/uploads/Curtis-F.-Robinson-M.D..pdf ,"Curtis F. Robinson, M.D.",2016-10-13,,2016-07-11,Montana
8/15/2016-8/15/2016,2016-08-15,2 in Montana, https://media.dojmt.gov/wp-content/uploads/Integrity-Transitional-Hospital.pdf ,Integrity Transitional Hospital,2016-10-14,,2016-08-15,Montana
7/28/2016-7/28/2016,2016-07-28,1 in Montana, https://media.dojmt.gov/wp-content/uploads/Gibson-Insurance-Agency.pdf ,Gibson Insurance Agency,2016-10-14,,2016-07-28,Montana
9/13/2016-9/13/2016,2016-09-13,4 in Montana, https://media.dojmt.gov/wp-content/uploads/Intuit15.pdf ,Intuit (15),2016-10-17,,2016-09-13,Montana
2/16/2016-8/20/2016,2016-08-20,1 in Montana, https://media.dojmt.gov/wp-content/uploads/Atlanta-Falcons-Football-Club.pdf ,Atlanta Falcons Football Club,2016-10-17,,2016-02-16,Montana
5/29/2016-7/22/2016,2016-07-22,114 in Montana, https://media.dojmt.gov/wp-content/uploads/Eastwood-Company.pdf ,Eastwood Company,2016-10-19,,2016-05-29,Montana
9/18/2016-9/23/2016,2016-09-23,3 in Montana, https://media.dojmt.gov/wp-content/uploads/Natural-Life-Collections.pdf ,Natural Life Collections,2016-10-20,,2016-09-18,Montana
4/15/2016-6/30/2016,2016-06-30,106 in Montana, https://media.dojmt.gov/wp-content/uploads/Rocky-Mountain-Credit-Union.pdf ,Rocky Mountain Credit Union,2016-10-20,,2016-04-15,Montana
9/27/2016-9/27/2016,2016-09-27,1 in Montana, https://media.dojmt.gov/wp-content/uploads/State-Farm-Mutual-Automobile-Insurance-Company.pdf ,State Farm Mutual Automobile Insurance Company,2016-10-20,,2016-09-27,Montana
9/20/2016-9/20/2016,2016-09-20,1 in Montana, https://media.dojmt.gov/wp-content/uploads/Ameriprise-Financial-Services.pdf ,Ameriprise Financial,2016-10-21,,2016-09-20,Montana
9/13/2016-9/13/2016,2016-09-13,1 in Montana, https://media.dojmt.gov/wp-content/uploads/Pacific-Concepts-Group-dba-National-Satellite-Center.pdf ,Pacific Concepts Group d/b/a National Satellite Center,2016-10-21,,2016-09-13,Montana
10/14/2016-10/15/2016,2016-10-15,55 in Montana, https://media.dojmt.gov/wp-content/uploads/National-Wholesale ,"National Wholesale Company, Inc.",2016-11-03,,2016-10-14,Montana
8/28/2016-10/3/2016,2016-10-03,2 in Montana, https://media.dojmt.gov/wp-content/uploads/Christian-Louboutin.pdf ,Christian Louboutin LLC,2016-11-03,,2016-08-28,Montana
7/12/2016-10/3/2016,2016-10-03,4 in Montana, https://media.dojmt.gov/wp-content/uploads/Sentinel-Hotel.pdf ,Sentinel Hotel,2016-11-04,,2016-07-12,Montana
8/10/2016-10/7/2016,2016-10-07,15 in Montana, https://media.dojmt.gov/wp-content/uploads/Rebecca-Minkoff-LLC.pdf ,Rebecca Minkoff LLC (2),2016-11-07,,2016-08-10,Montana
10/8/2016-10/31/2016,2016-10-31,3 in Montana, https://media.dojmt.gov/wp-content/uploads/Baker-Overby-Moore-Inc.-P.S..pdf ,"Baker, Overby & Moore, Inc., P.S.",2016-11-08,,2016-10-08,Montana
8/4/2016-8/30/2016,2016-08-30,45 in Montana, https://media.dojmt.gov/wp-content/uploads/Honigs-Whistle-Stop.pdf ,Honig's Whistle Stop,2016-11-09,,2016-08-04,Montana
9/7/2016-10/24/2016,2016-10-24,83 in Montana, https://media.dojmt.gov/wp-content/uploads/Eileen-Fisher.pdf ,"Eileen Fisher, Inc.",2016-11-09,,2016-09-07,Montana
9/13/2016-9/13/2016,2016-09-13,4 in Montana, https://media.dojmt.gov/wp-content/uploads/Politi-Magnifico-LLC.pdf ,"Politi & Magnifico, LLC",2016-11-09,,2016-09-13,Montana
7/14/2016-7/21/2016,2016-07-21,71 in Montana, https://media.dojmt.gov/wp-content/uploads/UFCW-Local-655-Food-Employers-Joint-Pension-Plan.pdf ,UFCW Local 655 Employers Joint Pension Plan,2016-11-09,,2016-07-14,Montana
10/11/2016-10/11/2016,2016-10-11,1 in Montana, https://media.dojmt.gov/wp-content/uploads/Baxter-Credit-Union.pdf ,Baxter Credit Union,2016-11-10,,2016-10-11,Montana
10/31/2016-10/31/2016,2016-10-31,2 in Montana, https://media.dojmt.gov/wp-content/uploads/Sirius-XM-Radio.pdf ,Sirius XM Radio Inc.,2016-11-11,,2016-10-31,Montana
9/9/2016-9/9/2016,2016-09-09,34 in Montana, https://media.dojmt.gov/wp-content/uploads/Aetna.pdf ,Aetna,2016-11-16,,2016-09-09,Montana
10/4/2016-11/1/2016,2016-11-01,5 in Montana, https://media.dojmt.gov/wp-content/uploads/Yummie.pdf ,Yummie,2016-11-16,,2016-10-04,Montana
7/26/2016-7/27/2016,2016-07-27,1 in Montana, https://media.dojmt.gov/wp-content/uploads/Eye-Institute-of-Marin.pdf ,Eye Institute of Marin,2016-11-16,,2016-07-26,Montana
10/5/2016-10/5/2016,2016-10-05,2 in Montana, https://media.dojmt.gov/wp-content/uploads/NRSC.pdf ,NRSC,2016-11-17,,2016-10-05,Montana
10/3/2016-11/9/2016,2016-11-09,83 in Montana, https://media.dojmt.gov/wp-content/uploads/Springfield-Armory-1.pdf ,Springfield Armory,2016-11-18,,2016-10-03,Montana
10/3/2015-10/9/2016,2016-10-09,83 in Montana, https://media.dojmt.gov/wp-content/uploads/Springfield-Armory.pdf ,Springfield Armory,2016-11-18,,2015-10-03,Montana
11/13/2016-11/13/2016,2016-11-13,460 in Montana, https://media.dojmt.gov/wp-content/uploads/Michigan-State-University.pdf ,Michigan State University,2016-11-21,,2016-11-13,Montana
10/17/2016-10/17/2016,2016-10-17,2 in Montana, https://media.dojmt.gov/wp-content/uploads/Ameriprise-Financial-Services-Inc..pdf ,"Ameriprise Financial Services, Inc.",2016-11-21,,2016-10-17,Montana
10/24/2016-11/9/2016,2016-11-09,Unknown in Montana, https://media.dojmt.gov/wp-content/uploads/Madison-Square-Garden-Company.pdf ,Madison Square Garden Company,2016-11-22,,2016-10-24,Montana
9/26/2016-11/5/2016,2016-11-05,25 in Montana, https://media.dojmt.gov/wp-content/uploads/Back-Country-Gear.pdf ,Backcountry Gear,2016-11-23,,2016-09-26,Montana
9/4/2016-9/12/2016,2016-09-12,4 in Montana, https://media.dojmt.gov/wp-content/uploads/Primerica.pdf ,Primerica,2016-11-23,,2016-09-04,Montana
7/16/2016-8/5/2016,2016-08-05,6 in Montana, https://media.dojmt.gov/wp-content/uploads/State-Street.pdf ,State Street,2016-11-28,,2016-07-16,Montana
2/10/2016-6/2/2016,2016-06-02,4 in Montana, https://media.dojmt.gov/wp-content/uploads/Swervepoint.pdf ,SwervePoint,2016-11-29,,2016-02-10,Montana
9/1/2016-10/19/2016,2016-10-19,53 in Montana, https://media.dojmt.gov/wp-content/uploads/Lang-Companies-Inc..pdf ,"Lang Companies, Inc.",2016-11-30,,2016-09-01,Montana
10/15/2016-10/31/2016,2016-10-31,1 in Montana, https://media.dojmt.gov/wp-content/uploads/Baylor-College-of-Medicine.pdf ,Baylor College of Medicine,2016-11-30,,2016-10-15,Montana
,,nan in Montana,,,,,,Montana
10/17/2016-11/2/2016,2016-11-02,1 in Montana, https://media.dojmt.gov/wp-content/uploads/Guilmartin-DiPiro-Sokolowski-LLC.pdf ,"Guilmartin, DiPiro & Sokolowski, LLC",2016-12-02,,2016-10-17,Montana
11/9/2016-12/22/2016,2016-12-22,3 in Montana, https://media.dojmt.gov/wp-content/uploads/Intuit16.pdf ,"Intuit, Inc.",2016-12-02,,2016-11-09,Montana
11/15/2016-11/15/2016,2016-11-15,2 in Montana, https://media.dojmt.gov/wp-content/uploads/Citrix-Systems-1.pdf ,Citrix Systems,2016-12-06,,2016-11-15,Montana
6/14/2014-10/22/2016,2016-10-22,1 in Montana, https://media.dojmt.gov/wp-content/uploads/Asante-Health-System-2.pdf ,Asante Health System,2016-12-09,,2014-06-14,Montana
11/23/2016-11/23/2016,2016-11-23,4 in Montana, https://media.dojmt.gov/wp-content/uploads/Intuit17.pdf ,"Intuit, Inc.",2016-12-12,,2016-11-23,Montana
9/24/2016-11/28/2016,2016-11-28,22 in Montana, https://media.dojmt.gov/wp-content/uploads/BraceAbility.pdf ,"BraceAbility, Inc.",2016-12-13,,2016-09-24,Montana
8/28/2016-8/28/2016,2016-08-28,1 in Montana, https://media.dojmt.gov/wp-content/uploads/USGB-LLC.pdf ,"USGB, LLC",2016-12-15,,2016-08-28,Montana
10/27/2016-10/27/2016,2016-10-27,1 in Montana, https://media.dojmt.gov/wp-content/uploads/Tropicana-St.-Louis-LLC.pdf ,"Tropicana St. Louis, LLC",2016-12-15,,2016-10-27,Montana
10/14/2016-10/18/2016,2016-10-18,7 in Montana, https://media.dojmt.gov/wp-content/uploads/Southcentral-Foundation-SCF-2.pdf ,Southcentral Foundation,2016-12-16,,2016-10-14,Montana
9/21/2016-9/29/2016,2016-09-29,4 in Montana, https://media.dojmt.gov/wp-content/uploads/The-Federal-Savings-Bank.pdf ,The Federal Savings Bank,2016-12-16,,2016-09-21,Montana
9/13/2016-9/13/2016,2016-09-13,9 in Montana, https://media.dojmt.gov/wp-content/uploads/Bomberg-Roach-Hanson-PLLC.pdf ,"Bomberg, Roach & Hanson, PLLC",2016-12-16,,2016-09-13,Montana
7/1/2016-7/31/2016,2016-07-31,169 in Montana, https://media.dojmt.gov/wp-content/uploads/Western-Union.pdf ,"Western Union Financial Services, Inc.",2016-12-20,,2016-07-01,Montana
10/12/2016-10/12/2016,2016-10-12,6 in Montana, https://media.dojmt.gov/wp-content/uploads/Luther-College.pdf ,Luther College,2016-12-20,,2016-10-12,Montana
12/13/2016-12/13/2016,2016-12-13,175 in Montana, https://media.dojmt.gov/wp-content/uploads/Hash-OBrien-Biby-Murray-PLLP.pdf ,"Hash, O'Brien, Biby & Murray, PLLP",2016-12-21,,2016-12-13,Montana
9/20/2016-9/20/2016,2016-09-20,36 in Montana, https://media.dojmt.gov/wp-content/uploads/Dover-Federal-Credit-Union.pdf ,Dover Federal Credit Union,2016-12-22,,2016-09-20,Montana
11/15/2016-11/15/2016,2016-11-15,1 in Montana, https://media.dojmt.gov/wp-content/uploads/Claremont-University-Consortium.pdf ,Claremont University Consortium,2016-12-22,,2016-11-15,Montana
10/25/2016-10/25/2016,2016-10-25,1 in Montana, https://media.dojmt.gov/wp-content/uploads/Brandywine-Pediatrics.pdf ,"Brandywine Pediatrics, P.A.",2016-12-23,,2016-10-25,Montana
10/28/2016-10/28/2016,2016-10-28,2 in Montana, https://media.dojmt.gov/wp-content/uploads/Madison-Trust-Company.pdf ,Madison Trust Company,2016-12-27,,2016-10-28,Montana
6/6/2016-10/28/2016,2016-10-28,4 in Montana, https://media.dojmt.gov/wp-content/uploads/Safe-For-Home-Products-LLC-DBA-Naturepedic.pdf ,Naturepedic,2016-12-27,,2016-06-06,Montana
7/30/2016-10/12/2016,2016-10-12,18 in Montana, https://media.dojmt.gov/wp-content/uploads/The-Topps-Company-Inc..pdf ,"The Topps Company, Inc.",2016-12-27,,2016-07-30,Montana
5/16/2016-10/18/2016,2016-10-18,3 in Montana, https://media.dojmt.gov/wp-content/uploads/Unison-Home.pdf ,Unison Home,2016-12-28,,2016-05-16,Montana
7/12/2016-11/30/2016,2016-11-30,61 in Montana, https://media.dojmt.gov/wp-content/uploads/Graphik-Dimensions.pdf ,"Graphik Dimensions, Ltd.",2016-12-28,,2016-07-12,Montana
11/1/2016-11/1/2016,2016-11-01,2 in Montana, https://media.dojmt.gov/wp-content/uploads/Cascade-Management-Inc.pdf ,"Cascade Management, Inc.",2016-12-28,,2016-11-01,Montana
11/30/2016-11/30/2016,2016-11-30,1 in Montana, https://media.dojmt.gov/wp-content/uploads/CommonBond.pdf ,CommonBond,2016-12-29,,2016-11-30,Montana
11/7/2016-11/7/2016,2016-11-07,18 in Montana, https://media.dojmt.gov/wp-content/uploads/Community-Health-Plan-of-Washington.pdf ,Community Health Plan of Washington,2016-12-29,,2016-11-07,Montana
4/23/2016-4/24/2016,2016-04-24,2 in Montana, https://media.dojmt.gov/wp-content/uploads/American-Pharmacists-Association.pdf ,American Pharmacists Association,2016-12-29,,2016-04-23,Montana
10/3/2016-10/3/2016,2016-10-03,29 in Montana, https://media.dojmt.gov/wp-content/uploads/Sheet-Metal-Workers-Local-Union-104.pdf ,Sheet Metal Workers' Local Union 104,2016-12-30,,2016-10-03,Montana
12/6/2016-12/6/2016,2016-12-06,1 in Montana, https://media.dojmt.gov/wp-content/uploads/Ameriprise-Financial-Services-Inc.-2.pdf ,"Ameriprise Financial Services, Inc.",2017-01-03,,2016-12-06,Montana
9/25/2016-10/31/2016,2016-10-31,21 in Montana, https://media.dojmt.gov/wp-content/uploads/LASOC-Legal-Aid-Society-of-Orange-County.pdf ,LASOC - Legal Aid Society of Orange County,2017-01-06,,2016-09-25,Montana
10/29/2016-11/7/2016,2016-11-07,17 in Montana, https://media.dojmt.gov/wp-content/uploads/DealerBuilt.pdf ,DealerBuilt,2017-01-09,,2016-10-29,Montana
5/2/2016-11/22/2016,2016-11-22,1411 in Montana, https://media.dojmt.gov/wp-content/uploads/Spiraledge-SwimOutlet-and-YogaOutlet.com_.pdf ,Spiraledge - Swim Outlet.com & YogaOutlet.com,2017-01-12,,2016-05-02,Montana
10/10/2016-10/10/2016,2016-10-10,1 in Montana, https://media.dojmt.gov/wp-content/uploads/Contech-Engineerd-Solutions.pdf ,Contech Engineered Solutions,2017-01-17,,2016-10-10,Montana
12/22/2016-12/28/2016,2016-12-28,3 in Montana, https://media.dojmt.gov/wp-content/uploads/Breville-USA-Inc..pdf ,"Breville USA, Inc.",2017-01-17,,2016-12-22,Montana
12/23/2015-12/23/2015,2015-12-23,2 in Montana, https://media.dojmt.gov/wp-content/uploads/CoPilot-Provider-Support-Services-1.pdf ,CoPilot Provider Support Services,2017-01-18,,2015-12-23,Montana
11/29/2016-11/29/2016,2016-11-29,66 in Montana, https://media.dojmt.gov/wp-content/uploads/Center-for-Mental-Health.pdf ,Center for Mental Health,2017-01-19,,2016-11-29,Montana
1/17/2017-1/17/2017,2017-01-17,4 in Montana, https://media.dojmt.gov/wp-content/uploads/Intuit-5.pdf ,"Intuit, Inc.",2017-01-26,,2017-01-17,Montana
11/16/2016-12/22/2016,2016-12-22,1 in Montana, https://media.dojmt.gov/wp-content/uploads/Capital-One-2.pdf ,Capital One,2017-01-26,,2016-11-16,Montana
3/1/2015-12/1/2016,2016-12-01,77 in Montana, https://media.dojmt.gov/wp-content/uploads/Synergy-Specialists.pdf ,"Charles Komar & Sons, Inc.",2017-01-26,,2015-03-01,Montana
12/9/2016-12/9/2016,2016-12-09,1 in Montana, https://media.dojmt.gov/wp-content/uploads/Synergy-Specialists.pdf ,Synergy Specialists Medical Group,2017-01-26,,2016-12-09,Montana
1/25/2017-1/25/2017,2017-01-25,6 in Montana, https://media.dojmt.gov/wp-content/uploads/Distribution-International.pdf ,Distribution International,2017-01-27,,2017-01-25,Montana
1/25/2017-1/25/2017,2017-01-25,6 in Montana, https://media.dojmt.gov/wp-content/uploads/Campbell-County-Health.pdf ,Campbell County Health,2017-01-27,,2017-01-25,Montana
4/25/2016-9/14/2016,2016-09-14,28 in Montana, https://media.dojmt.gov/wp-content/uploads/International-Code-Council.pdf ,International Code Council,2017-01-27,,2016-04-25,Montana
12/12/2016-12/12/2016,2016-12-12,1 in Montana, https://media.dojmt.gov/wp-content/uploads/Axis-Insurance-Services-LLC.pdf ,"Axis Insurance Services, LLC",2017-01-30,,2016-12-12,Montana
1/17/2017-1/17/2017,2017-01-17,6 in Montana, https://media.dojmt.gov/wp-content/uploads/Kuhana.pdf ,"Kuhana Associates, LLC",2017-01-30,,2017-01-17,Montana
1/18/2017-1/18/2017,2017-01-18,1 in Montana, https://media.dojmt.gov/wp-content/uploads/Persante.pdf ,Persante,2017-01-31,,2017-01-18,Montana
12/21/2016-12/21/2016,2016-12-21,67 in Montana, https://media.dojmt.gov/wp-content/uploads/Hutchinson-and-Bloodgood-LLP.pdf ,Hutchinson and Bloodgood LLP,2017-02-01,,2016-12-21,Montana
1/11/2017-1/11/2017,2017-01-11,7 in Montana, https://media.dojmt.gov/wp-content/uploads/Aero-Air.pdf ,Aero Air,2017-02-02,,2017-01-11,Montana
6/23/2016-12/13/2016,2016-12-13,3 in Montana, https://media.dojmt.gov/wp-content/uploads/King-McNamara-Moriarty.pdf ,King McNamara Moriarty,2017-02-02,,2016-06-23,Montana
2/2/2017-2/2/2017,2017-02-02,1 in Montana, https://media.dojmt.gov/wp-content/uploads/Corporate-Travel-Planners.pdf ,Corporate Travel Planners,2017-02-03,,2017-02-02,Montana
11/16/2016-11/16/2016,2016-11-16,9 in Montana, https://media.dojmt.gov/wp-content/uploads/Conover.pdf ,"Conover Capital Management, LLC / Conover Securities Corporation",2017-02-03,,2016-11-16,Montana
9/1/2016-1/9/2017,2017-01-09,353 in Montana, https://media.dojmt.gov/wp-content/uploads/Capital-One-3.pdf ,Capital One,2017-02-06,,2016-09-01,Montana
1/23/2017-1/23/2017,2017-01-23,2 in Montana, https://media.dojmt.gov/wp-content/uploads/Sky-Climber-LLC.pdf ,"Sky Climber, LLC",2017-02-06,,2017-01-23,Montana
12/31/2016-12/31/2016,2016-12-31,10 in Montana, https://media.dojmt.gov/wp-content/uploads/Berkeley.pdf ,Berkeley College,2017-02-06,,2016-12-31,Montana
12/1/2016-12/7/2016,2016-12-07,4 in Montana, https://media.dojmt.gov/wp-content/uploads/The-Federal-Savings-Bank-2.pdf ,The Federal Savings Bank,2017-02-07,,2016-12-01,Montana
3/1/2016-5/31/2016,2016-05-31,1 in Montana, https://media.dojmt.gov/wp-content/uploads/Land-Title.pdf ,Land Title,2017-02-07,,2016-03-01,Montana
11/21/2016-11/21/2016,2016-11-21,7 in Montana, https://media.dojmt.gov/wp-content/uploads/Boeing.pdf ,Boeing,2017-02-08,,2016-11-21,Montana
1/25/2017-1/25/2017,2017-01-25,3 in Montana, https://media.dojmt.gov/wp-content/uploads/SouthEast-Alaska-Regional-Health-Consortium.pdf ,SouthEast Alaska Regional Health Consortium,2017-02-08,,2017-01-25,Montana
2/2/2017-2/2/2017,2017-02-02,3 in Montana, https://media.dojmt.gov/wp-content/uploads/College-of-Southern-Idaho.pdf ,College of Southern Idaho,2017-02-08,,2017-02-02,Montana
1/20/2017-1/20/2017,2017-01-20,2 in Montana, https://media.dojmt.gov/wp-content/uploads/Klondex-Mines.pdf ,Klondex Mines,2017-02-09,,2017-01-20,Montana
1/24/2017-2/8/2017,2017-02-08,1 in Montana, https://media.dojmt.gov/wp-content/uploads/TechWise.pdf ,TechWise,2017-02-10,,2017-01-24,Montana
1/17/2017-1/17/2017,2017-01-17,1 in Montana, https://media.dojmt.gov/wp-content/uploads/TransPerfect-Global-Inc..pdf ,"TransPerfect Global, Inc.",2017-02-10,,2017-01-17,Montana
2/10/2017-2/10/2017,2017-02-10,1 in Montana, https://media.dojmt.gov/wp-content/uploads/Frosch-International-Travel.pdf ,Frosch International Travel,2017-02-13,,2017-02-10,Montana
1/19/2017-1/13/2017,2017-01-13,1 in Montana, https://media.dojmt.gov/wp-content/uploads/Petro-49.pdf ,Petro 49,2017-02-13,,2017-01-19,Montana
1/9/2017-1/10/2017,2017-01-10,1 in Montana, https://media.dojmt.gov/wp-content/uploads/Evanson-Asset-Management.pdf ,Evanson Asset Management,2017-02-14,,2017-01-09,Montana
1/25/2017-1/25/2017,2017-01-25,30 in Montana, https://media.dojmt.gov/wp-content/uploads/Driveline.pdf ,"Driveline Retail Merchandising, Inc.",2017-02-14,,2017-01-25,Montana
11/30/2016-1/17/2017,2017-01-17,26 in Montana, https://media.dojmt.gov/wp-content/uploads/The-Honest-Kitchen.pdf ,The Honest Kitchen,2017-02-15,,2016-11-30,Montana
2/1/2016-12/31/2016,2016-12-31,203 in Montana, https://media.dojmt.gov/wp-content/uploads/New-Englad-Biolabs-NEB.pdf ,New England Biolabs (NEB),2017-02-17,,2016-02-01,Montana
12/26/2016-1/25/2017,2017-01-25,7 in Montana, https://media.dojmt.gov/wp-content/uploads/Family-Services-Rochester.pdf ,Family Service Rochester,2017-02-17,,2016-12-26,Montana
2/2/2017-2/3/2017,2017-02-03,2 in Montana, https://media.dojmt.gov/wp-content/uploads/Amplify.pdf ,"Amplify Education, Inc.",2017-02-17,,2017-02-02,Montana
2/1/2016-12/31/2016,2016-12-31,107 in Montana, https://media.dojmt.gov/wp-content/uploads/Century-LLC.pdf ,"Century, LLC",2017-02-19,,2016-02-01,Montana
2/8/2017-2/8/2017,2017-02-08,1 in Montana, https://media.dojmt.gov/wp-content/uploads/Citizens-Memorial.pdf ,Citizens Memorial Hospital,2017-02-20,,2017-02-08,Montana
1/30/2017-2/1/2017,2017-02-01,26 in Montana, https://media.dojmt.gov/wp-content/uploads/CenturyLink.pdf ,CenturyLink,2017-02-20,,2017-01-30,Montana
2/1/2016-12/31/2016,2016-12-31,53 in Montana, https://media.dojmt.gov/wp-content/uploads/Movie-Mars.pdf ,MovieMars.com,2017-02-21,,2016-02-01,Montana
1/1/2017-1/1/2017,2017-01-01,10 in Montana, https://media.dojmt.gov/wp-content/uploads/Emory-Healthcare.pdf ,Emory Healthcare,2017-02-21,,2017-01-01,Montana
2/17/2017-2/17/2017,2017-02-17,75 in Montana, https://media.dojmt.gov/wp-content/uploads/TRG.pdf ,TRG,2017-02-22,,2017-02-17,Montana
1/2/2017-2/2/2017,2017-02-02,1 in Montana, https://media.dojmt.gov/wp-content/uploads/Federal-Direct-Tax-Services-1.pdf ,Federal Direct Tax Services,2017-02-22,,2017-01-02,Montana
1/27/2017-1/27/2017,2017-01-27,5 in Montana, https://media.dojmt.gov/wp-content/uploads/Roxy-Trading-Inc..pdf ,"Roxy Trading, Inc.",2017-02-22,,2017-01-27,Montana
2/9/2017-2/9/2017,2017-02-09,3 in Montana, https://media.dojmt.gov/wp-content/uploads/Arabella-Advisors.pdf ,Arabella Advisors,2017-02-22,,2017-02-09,Montana
2/3/2017-2/3/2017,2017-02-03,49 in Montana, https://media.dojmt.gov/wp-content/uploads/InterMountain-Management.pdf ,InterMountain Management,2017-02-22,,2017-02-03,Montana
4/24/2016-12/14/2016,2016-12-14,210 in Montana, https://media.dojmt.gov/wp-content/uploads/Intex-Recreation-Corp.pdf ,Intex Recreation Corp,2017-02-22,,2016-04-24,Montana
2/1/2016-12/31/2016,2016-12-31,69 in Montana, https://media.dojmt.gov/wp-content/uploads/Bluemercury-Inc.pdf ,"Bluemercury, Inc.",2017-02-23,,2016-02-01,Montana
2/20/2017-2/20/2017,2017-02-20,129 in Montana, https://media.dojmt.gov/wp-content/uploads/Nomad-Global-Communication-Solutions.pdf ,Nomad Global Communications Solutions,2017-02-23,,2017-02-20,Montana
11/2/2016-1/27/2017,2017-01-27,1 in Montana, https://media.dojmt.gov/wp-content/uploads/SunTrust.pdf ,SunTrust,2017-02-23,,2016-11-02,Montana
6/1/2013-12/31/2016,2016-12-31,193 in Montana, https://media.dojmt.gov/wp-content/uploads/Abbott-Nutrition.pdf ,Abbott Nutrition,2017-02-23,,2013-06-01,Montana
2/1/2016-12/31/2016,2016-12-31,107 in Montana, https://media.dojmt.gov/wp-content/uploads/Nutrex-Hawaii-Inc.pdf ,"Nutrex Hawaii, Inc.",2017-02-24,,2016-02-01,Montana
11/29/2016-1/17/2017,2017-01-17,13 in Montana, https://media.dojmt.gov/wp-content/uploads/JoFit.pdf ,JoFit,2017-02-24,,2016-11-29,Montana
1/2/2017-2/2/2017,2017-02-02,1 in Montana, https://media.dojmt.gov/wp-content/uploads/Federal-Direct-Tax-Services.pdf ,Federal Direct Tax Services,2017-02-24,,2017-01-02,Montana
10/23/2016-1/1/2017,2017-01-01,Unknown in Montana, https://media.dojmt.gov/wp-content/uploads/Benchmark.pdf ,Benchmark,2017-02-24,,2016-10-23,Montana
1/24/2017-1/24/2017,2017-01-24,3 in Montana, https://media.dojmt.gov/wp-content/uploads/John-Deere-Financial.pdf ,John Deere Financial,2017-02-24,,2017-01-24,Montana
7/15/2015-12/14/2016,2016-12-14,73 in Montana, https://media.dojmt.gov/wp-content/uploads/Roberts-Hawaii.pdf ,Roberts Hawaii,2017-02-24,,2015-07-15,Montana
2/1/2016-12/31/2016,2016-12-31,1 in Montana, https://media.dojmt.gov/wp-content/uploads/Liberty-Hardware-Manufacturing-Corporation.pdf ,Liberty Hardware Manufacturing Corporation,2017-02-24,,2016-02-01,Montana
10/6/2016-10/6/2016,2016-10-06,2 in Montana, https://media.dojmt.gov/wp-content/uploads/United-States-Anti-Doping-Agency.pdf ,United States Anti-Doping Agency,2017-02-24,,2016-10-06,Montana
2/8/2017-2/10/2017,2017-02-10,602 in Montana, https://media.dojmt.gov/wp-content/uploads/Rods-Western-Palace.pdf ,Rod's Western Palace,2017-02-24,,2017-02-08,Montana
2/1/2016-12/31/2016,2016-12-31,93 in Montana, https://media.dojmt.gov/wp-content/uploads/Atlantic-Cigar-Co.pdf ,Atlantic Cigar Co.,2017-02-27,,2016-02-01,Montana
2/1/2016-12/31/2016,2016-12-31,57 in Montana, https://media.dojmt.gov/wp-content/uploads/Alpha-Industries.pdf ,Alpha Industries,2017-02-27,,2016-02-01,Montana
2/10/2017-2/10/2017,2017-02-10,1 in Montana, https://media.dojmt.gov/wp-content/uploads/Wisenbaker-Builder-Services.pdf ,Wisenbaker Builder Services,2017-02-27,,2017-02-10,Montana
12/25/2016-1/14/2017,2017-01-14,17 in Montana, https://media.dojmt.gov/wp-content/uploads/Ambassador-Title-Service_RTS-Title-Escrow_DRI-Title-Escrow.pdf ,"Ambassador Title Service, RTS Title & Escrow, DRI Title & Escrow",2017-02-28,,2016-12-25,Montana
8/2/2016-2/22/2017,2017-02-22,1 in Montana, https://media.dojmt.gov/wp-content/uploads/Amquip-Crane-Rental.pdf ,AmQuip Crane Rental,2017-03-01,,2016-08-02,Montana
2/13/2017-2/13/2017,2017-02-13,2 in Montana, https://media.dojmt.gov/wp-content/uploads/Lexington-County-Health-Services-District-Inc..pdf ,"Lexington County Health Services District, Inc.",2017-03-02,,2017-02-13,Montana
1/30/2016-1/30/2017,2017-01-30,1 in Montana, https://media.dojmt.gov/wp-content/uploads/Iowa-Mutual-Insurance.pdf ,Iowa Mutual Insurance Company,2017-03-02,,2016-01-30,Montana
2/1/2016-12/31/2016,2016-12-31,10 in Montana, https://media.dojmt.gov/wp-content/uploads/Theisens-Supply-Inc.-1.pdf ,"Theisen's Supply, Inc.",2017-03-03,,2016-02-01,Montana
2/19/2017-2/19/2017,2017-02-19,3 in Montana, https://media.dojmt.gov/wp-content/uploads/Daytona-State-College.pdf ,Daytona State College,2017-03-03,,2017-02-19,Montana
2/1/2016-12/31/2016,2016-12-31,267 in Montana, https://media.dojmt.gov/wp-content/uploads/West-Music.pdf ,West Music Company,2017-03-03,,2016-02-01,Montana
2/14/2017-2/14/2017,2017-02-14,5 in Montana, https://media.dojmt.gov/wp-content/uploads/Carla-Cross-LLC.pdf ,"Carl Cross, LLC",2017-03-03,,2017-02-14,Montana
2/1/2016-12/31/2016,2016-12-31,217 in Montana, https://media.dojmt.gov/wp-content/uploads/Bambeco-Inc..pdf ,"Bambeco, Inc.",2017-03-06,,2016-02-01,Montana
1/24/2017-1/24/2017,2017-01-24,3 in Montana, https://media.dojmt.gov/wp-content/uploads/University-of-Idaho.pdf ,University of Idaho,2017-03-06,,2017-01-24,Montana
2/1/2016-12/31/2016,2016-12-31,5 in Montana, https://media.dojmt.gov/wp-content/uploads/Atwood-Distributing-LP.pdf ,"Atwood Distributing, Inc.",2017-03-07,,2016-02-01,Montana
2/4/2017-2/21/2017,2017-02-21,4 in Montana, https://media.dojmt.gov/wp-content/uploads/Maxim-Capital-Enterprises-Inc..pdf ,"Maxim Capital Enterprises, Inc.",2017-03-07,,2017-02-04,Montana
2/1/2016-12/31/2016,2016-12-31,114 in Montana, https://media.dojmt.gov/wp-content/uploads/Vapour-Organic-Beauty-LLC.pdf ,"Vapour Organic Beauty, LLC",2017-03-08,,2016-02-01,Montana
2/1/2016-12/31/2016,2016-12-31,70 in Montana, https://media.dojmt.gov/wp-content/uploads/Sport-Smart.pdf ,Sport-Smart.com,2017-03-08,,2016-02-01,Montana
2/1/2016-12/31/2016,2016-12-31,67 in Montana, https://media.dojmt.gov/wp-content/uploads/Running-Supply-Inc..pdf ,"Running Supply, Inc.",2017-03-08,,2016-02-01,Montana
2/1/2016-12/31/2016,2016-12-31,4 in Montana, https://media.dojmt.gov/wp-content/uploads/Purdys-Chocolatier.pdf ,R.C. Purdy Chocolates Ltd. dba Purdys Chocolatier,2017-03-08,,2016-02-01,Montana
12/14/2016-2/6/2017,2017-02-06,4136 in Montana, https://media.dojmt.gov/wp-content/uploads/prAna.pdf ,prAna,2017-03-08,,2016-12-14,Montana
6/15/2016-1/30/2017,2017-01-30,2 in Montana, https://media.dojmt.gov/wp-content/uploads/Friedman-Perry-CPAs.pdf ,"Friedman & Perry, CPA's",2017-03-09,,2016-06-15,Montana
12/29/2016-12/29/2016,2016-12-29,2 in Montana, https://media.dojmt.gov/wp-content/uploads/HealthTexas-Provider-Network-Denton-Heart-Group.pdf ,HealthTexas Provider Network (Denton Heart Group),2017-03-10,,2016-12-29,Montana
12/20/2016-12/27/2016,2016-12-27,4 in Montana, https://media.dojmt.gov/wp-content/uploads/Wall-Titus-LLC.pdf ,"Wall Titus, LLC",2017-03-10,,2016-12-20,Montana
3/10/2017-3/10/2017,2017-03-10,307 in Montana, https://media.dojmt.gov/wp-content/uploads/ADF-International.pdf ,ADF International,2017-03-13,,2017-03-10,Montana
11/21/2016-2/6/2017,2017-02-06,1 in Montana, https://media.dojmt.gov/wp-content/uploads/Ondracek-Company.pdf ,Ondracek & Company,2017-03-13,,2016-11-21,Montana
1/25/2017-1/25/2017,2017-01-25,3 in Montana, https://media.dojmt.gov/wp-content/uploads/Geokinetics.pdf ,"Geokinetics, Inc.",2017-03-14,,2017-01-25,Montana
2/1/2016-12/31/2016,2016-12-31,345 in Montana, https://media.dojmt.gov/wp-content/uploads/Plow-Hearth.pdf ,Plow & Hearth,2017-03-14,,2016-02-01,Montana
12/31/2013-2/4/2017,2017-02-04,27 in Montana, https://media.dojmt.gov/wp-content/uploads/Zest-Dental-Solutions.pdf ,Zest Dental Solution,2017-03-14,,2013-12-31,Montana
2/21/2017-3/21/2017,2017-03-21,1 in Montana, https://media.dojmt.gov/wp-content/uploads/Vertex-Wireless.pdf ,Vertex Wireless,2017-03-15,,2017-02-21,Montana
12/15/2016-12/15/2016,2016-12-15,1 in Montana, https://media.dojmt.gov/wp-content/uploads/Ameriprise-Financial-Services-Inc.-3.pdf ,"Ameriprise Financial Services, Inc.",2017-03-15,,2016-12-15,Montana
2/21/2017-2/21/2017,2017-02-21,1 in Montana, https://media.dojmt.gov/wp-content/uploads/Therafit-Shoes.pdf ,Therafit Shoes,2017-03-16,,2017-02-21,Montana
3/3/2017-3/3/2017,2017-03-03,1 in Montana, https://media.dojmt.gov/wp-content/uploads/Colorado-Nonprofit-Development-Center.pdf ,Colorado Nonprofit Development Center,2017-03-16,,2017-03-03,Montana
2/11/2017-2/11/2017,2017-02-11,1 in Montana, https://media.dojmt.gov/wp-content/uploads/Northwest-Christian-Schools.pdf ,"Northwest Christian Schools, Inc.",2017-03-16,,2017-02-11,Montana
3/3/2017-3/6/2017,2017-03-06,9 in Montana, https://media.dojmt.gov/wp-content/uploads/American-Tire-Distributors.pdf ,American Tire Distributors,2017-03-17,,2017-03-03,Montana
1/22/2017-1/22/2017,2017-01-22,62 in Montana, https://media.dojmt.gov/wp-content/uploads/Urology-Austin.pdf ,Urology Austin,2017-03-20,,2017-01-22,Montana
10/20/2016-2/3/2017,2017-02-03,1 in Montana, https://media.dojmt.gov/wp-content/uploads/People-for-People.pdf ,People for People,2017-03-20,,2016-10-20,Montana
10/26/2016-1/31/2017,2017-01-31,332 in Montana, https://media.dojmt.gov/wp-content/uploads/Bulletproof-360-Inc..pdf ,"Bulletproof 360, Inc.",2017-03-21,,2016-10-26,Montana
1/27/2017-2/2/2017,2017-02-02,7 in Montana, https://media.dojmt.gov/wp-content/uploads/Campbell-Taylor-Company.pdf ,Campbell Taylor & Company,2017-03-21,,2017-01-27,Montana
3/5/2017-3/5/2017,2017-03-05,26 in Montana, https://media.dojmt.gov/wp-content/uploads/Rudd-Company.pdf ,"Rudd & Company, PLLC",2017-03-22,,2017-03-05,Montana
9/1/2016-2/28/2017,2017-02-28,1 in Montana, https://media.dojmt.gov/wp-content/uploads/Coachella.com_.pdf ,Coachella.com,2017-03-23,,2016-09-01,Montana
1/24/2017-1/24/2017,2017-01-24,4 in Montana, https://media.dojmt.gov/wp-content/uploads/Washington-University-School-of-Medicine.pdf ,Washington University School of Medicine,2017-03-24,,2017-01-24,Montana
1/4/2017-2/10/2017,2017-02-10,7 in Montana, https://media.dojmt.gov/wp-content/uploads/Commonwealth-Health-Corporation.pdf ,Commonwealth Health,2017-03-24,,2017-01-04,Montana
8/18/2016-2/20/2017,2017-02-20,14 in Montana, https://media.dojmt.gov/wp-content/uploads/Virginia-Gift-Brands.pdf ,Virginia Gift Brands,2017-03-27,,2016-08-18,Montana
3/20/2017-3/27/2017,2017-03-27,2 in Montana, https://media.dojmt.gov/wp-content/uploads/Ameriflight.pdf ,Ameriflight,2017-03-28,,2017-03-20,Montana
2/15/2017-2/15/2017,2017-02-15,2 in Montana, https://media.dojmt.gov/wp-content/uploads/Maloney-Kennedy-PLLC.pdf ,"Maloney & Kennedy, PLLC",2017-03-29,,2017-02-15,Montana
2/2/2017-2/13/2017,2017-02-13,1 in Montana, https://media.dojmt.gov/wp-content/uploads/Krehbiel-and-Associates-CPA.pdf ,Krehbiel and Associates CPA,2017-03-30,,2017-02-02,Montana
2/26/2017-3/1/2017,2017-03-01,3 in Montana, https://media.dojmt.gov/wp-content/uploads/PenServ-Plan-Services-Inc..pdf ,"PenServe Plan Services, Inc.",2017-03-31,,2017-02-26,Montana
2/8/2017-3/15/2017,2017-03-15,1 in Montana, https://media.dojmt.gov/wp-content/uploads/Extreme-Ranch-Inc..pdf ,"Extreme Ranch, Inc.",2017-04-01,,2017-02-08,Montana
3/2/2017-4/6/2017,2017-04-06,2 in Montana, https://media.dojmt.gov/wp-content/uploads/C-Kirk-Holt-Associates.pdf ,C. Kirk Holt & Associates,2017-04-04,,2017-03-02,Montana
2/2/2016-12/31/2016,2016-12-31,12 in Montana, https://media.dojmt.gov/wp-content/uploads/Glasswasherparts.com_.pdf ,GlassWasherParts.com,2017-04-05,,2016-02-02,Montana
2/2/2016-12/31/2016,2016-12-31,887 in Montana, https://media.dojmt.gov/wp-content/uploads/Tempur-Pedic.pdf ,Tempur-Pedic,2017-04-05,,2016-02-02,Montana
8/27/2016-2/15/2017,2017-02-15,8 in Montana, https://media.dojmt.gov/wp-content/uploads/One-World-Distribution.pdf ,"One World Distribution, Inc.",2017-04-07,,2016-08-27,Montana
1/30/2017-2/11/2017,2017-02-11,7 in Montana, https://media.dojmt.gov/wp-content/uploads/Lake-Kennedy-McCulloch-CPAs.pdf ,Lake Kennedy McCulloch CPA's,2017-04-07,,2017-01-30,Montana
2/7/2017-2/10/2017,2017-02-10,1 in Montana, https://media.dojmt.gov/wp-content/uploads/FPI-Management.pdf ,"FPI Management, Inc.",2017-04-10,,2017-02-07,Montana
3/27/2016-3/27/2017,2017-03-27,2 in Montana, https://media.dojmt.gov/wp-content/uploads/Citibank.pdf ,Citibank,2017-04-11,,2016-03-27,Montana
2/3/2017-2/3/2017,2017-02-03,1 in Montana, https://media.dojmt.gov/wp-content/uploads/BankSouth-Mortgage.pdf ,BankSouth Mortgage,2017-04-11,,2017-02-03,Montana
2/28/2017-4/10/2017,2017-04-10,1 in Montana, https://media.dojmt.gov/wp-content/uploads/DataFile-Technologies.pdf ,DataFile Technologies,2017-04-12,,2017-02-28,Montana
3/14/2017-3/14/2017,2017-03-14,7 in Montana, https://media.dojmt.gov/wp-content/uploads/Alamo-Capital.pdf ,Alamo Capital,2017-04-13,,2017-03-14,Montana
3/24/2017-4/7/2017,2017-04-07,24 in Montana, https://media.dojmt.gov/wp-content/uploads/Bluestem-Brands.pdf ,"Bluestem Brands, Inc.",2017-04-13,,2017-03-24,Montana
3/27/2017-3/27/2017,2017-03-27,1 in Montana, https://media.dojmt.gov/wp-content/uploads/Tidewater-Transit-Company.pdf ,Tidewater Transit Company,2017-04-13,,2017-03-27,Montana
2/13/2017-2/13/2017,2017-02-13,18 in Montana, https://media.dojmt.gov/wp-content/uploads/Delta-Career-Education-Corporation.pdf ,Delta Career Education Corporation,2017-04-14,,2017-02-13,Montana
9/29/2016-12/29/2016,2016-12-29,3949 in Montana, https://media.dojmt.gov/wp-content/uploads/Combat-Brands.pdf ,Six Continents Hotels,2017-04-14,,2016-09-29,Montana
7/1/2015-2/23/2017,2017-02-23,132 in Montana, https://media.dojmt.gov/wp-content/uploads/Combat-Brands.pdf ,Combat Brands,2017-04-14,,2015-07-01,Montana
1/16/2017-1/16/2017,2017-01-16,1 in Montana, https://media.dojmt.gov/wp-content/uploads/Johnson-Hearn-Viinegar-Gee.pdf ,"Johnson, Hearn, Vinegar & Gee",2017-04-14,,2017-01-16,Montana
3/30/2017-3/30/2017,2017-03-30,1 in Montana, https://media.dojmt.gov/wp-content/uploads/Intuit-2-1.pdf ,Intuit,2017-04-17,,2017-03-30,Montana
12/26/2015-4/2/2017,2017-04-02,7 in Montana, https://media.dojmt.gov/wp-content/uploads/NMG.pdf ,Neiman Marcus Group (NMG),2017-04-17,,2015-12-26,Montana
1/23/2017-2/22/2017,2017-02-22,7 in Montana, https://media.dojmt.gov/wp-content/uploads/Pacific-Lutheran-University.pdf ,Pacific Lutheran University,2017-04-18,,2017-01-23,Montana
4/18/2016-3/29/2017,2017-03-29,1 in Montana, https://media.dojmt.gov/wp-content/uploads/Northdrop-Grumman-Systems.pdf ,Northdrop Grumman Systems,2017-04-19,,2016-04-18,Montana
10/1/2016-12/23/2016,2016-12-23,159 in Montana, https://media.dojmt.gov/wp-content/uploads/ILKB-Inc..pdf ,"ILKB, LLC",2017-04-19,,2016-10-01,Montana
4/11/2017-4/11/2017,2017-04-11,8 in Montana, https://media.dojmt.gov/wp-content/uploads/Lifespan.pdf ,George Fox University,2017-04-21,,2017-04-11,Montana
3/8/2016-3/8/2017,2017-03-08,5 in Montana, https://media.dojmt.gov/wp-content/uploads/Humana.pdf ,"Wild, Maney & Resnick",2017-04-21,,2016-03-08,Montana
2/25/2017-4/21/2017,2017-04-21,2 in Montana, https://media.dojmt.gov/wp-content/uploads/George-Fox-University.pdf ,Lifespan,2017-04-21,,2017-02-25,Montana
3/8/2017-4/3/2017,2017-04-03,5 in Montana, https://media.dojmt.gov/wp-content/uploads/Wild-Maney-Resnick.pdf ,Humana,2017-04-21,,2017-03-08,Montana
3/24/2017-3/24/2017,2017-03-24,1 in Montana, https://media.dojmt.gov/wp-content/uploads/Donaldson-Company.pdf ,Donaldson Company,2017-04-24,,2017-03-24,Montana
2/21/2017-2/21/2017,2017-02-21,3 in Montana, https://media.dojmt.gov/wp-content/uploads/Hill-Country-Memorial-Hospital.pdf ,Hill Country Memorial Hospital,2017-04-25,,2017-02-21,Montana
3/16/2017-3/16/2017,2017-03-16,1 in Montana, https://media.dojmt.gov/wp-content/uploads/Motl-Marketing.pdf ,Motl Marketing,2017-04-25,,2017-03-16,Montana
1/30/2017-1/30/2017,2017-01-30,3 in Montana, https://media.dojmt.gov/wp-content/uploads/Pacific-Quest.pdf ,Pacific Quest,2017-04-27,,2017-01-30,Montana
3/30/2017-3/30/2017,2017-03-30,90 in Montana, https://media.dojmt.gov/wp-content/uploads/Gannett-Company-Inc.pdf ,"Gannett Company, Inc.",2017-04-28,,2017-03-30,Montana
2/1/2016-12/31/2016,2016-12-31,282 in Montana, https://media.dojmt.gov/wp-content/uploads/Marbles.pdf ,"Marbles, LLC",2017-04-28,,2016-02-01,Montana
3/17/2017-3/17/2017,2017-03-17,11 in Montana, https://media.dojmt.gov/wp-content/uploads/Harrisburg-Gastroenterology.pdf ,Harrisburg Gastroenterology,2017-04-28,,2017-03-17,Montana
5/1/2016-12/31/2016,2016-12-31,7 in Montana, https://media.dojmt.gov/wp-content/uploads/Jackson-Hewitt.pdf ,Jackson Hewitt,2017-04-29,,2016-05-01,Montana
2/21/2017-3/3/2017,2017-03-03,2 in Montana, https://media.dojmt.gov/wp-content/uploads/Capital-One-4.pdf ,Yale Capital Corp,2017-05-01,,2017-02-21,Montana
2/28/2017-3/2/2017,2017-03-02,1 in Montana, https://media.dojmt.gov/wp-content/uploads/Yale-Capital-Corp.pdf ,Nova Southeastern University,2017-05-01,,2017-02-28,Montana
9/7/2016-12/28/2016,2016-12-28,1 in Montana, https://media.dojmt.gov/wp-content/uploads/Nova-Southeastern-University.pdf ,Capital One,2017-05-01,,2016-09-07,Montana
11/22/2016-4/4/2017,2017-04-04,35 in Montana, https://media.dojmt.gov/wp-content/uploads/Agri-Beef.pdf ,Agri Beef,2017-05-02,,2016-11-22,Montana
4/10/2017-4/10/2017,2017-04-10,1 in Montana, https://media.dojmt.gov/wp-content/uploads/Wesleyan-College.pdf ,Wesleyan College,2017-05-03,,2017-04-10,Montana
1/12/2017-4/2/2017,2017-04-02,31 in Montana, https://media.dojmt.gov/wp-content/uploads/Genpact.pdf ,Genpact (Scottrade Bank),2017-05-04,,2017-01-12,Montana
4/12/2016-3/2/2017,2017-03-02,48 in Montana, https://media.dojmt.gov/wp-content/uploads/RM-Acquisition-LLC.pdf ,"RM Acquisition, LLC",2017-05-05,,2016-04-12,Montana
3/28/2017-3/28/2017,2017-03-28,1 in Montana, https://media.dojmt.gov/wp-content/uploads/PolkBeder.pdf ,PolkBeder,2017-05-08,,2017-03-28,Montana
1/1/2016-4/30/2017,2017-04-30,11 in Montana, https://media.dojmt.gov/wp-content/uploads/Tatcha.pdf ,Tatcha,2017-05-09,,2016-01-01,Montana
4/27/2017-4/27/2017,2017-04-27,3 in Montana, https://media.dojmt.gov/wp-content/uploads/Bechtel-Oil-Gas-Chemicals-Construction.pdf ,"Bechtel Oil, Gas & Chemicals Construction Services",2017-05-10,,2017-04-27,Montana
5/2/2016-5/16/2017,2017-05-16,18 in Montana, https://media.dojmt.gov/wp-content/uploads/TALX.pdf ,TALX,2017-05-11,,2016-05-02,Montana
2/16/2017-5/15/2017,2017-05-15,57 in Montana, https://media.dojmt.gov/wp-content/uploads/University-of-New-Mexico-Foundation.pdf ,University of New Mexico Foundation,2017-05-15,,2017-02-16,Montana
12/20/2016-3/3/2017,2017-03-03,92 in Montana, https://media.dojmt.gov/wp-content/uploads/KURU-Footwear.pdf ,KURU Footwear,2017-05-15,,2016-12-20,Montana
4/3/2017-5/16/2017,2017-05-16,54 in Montana, https://media.dojmt.gov/wp-content/uploads/Nicopure-Labs.pdf ,Nicopure Labs,2017-05-16,,2017-04-03,Montana
1/30/2017-4/11/2017,2017-04-11,16 in Montana, https://media.dojmt.gov/wp-content/uploads/Rite-Aid-Online-Store.pdf ,Rite Aid Online Store,2017-05-17,,2017-01-30,Montana
3/23/2017-3/23/2017,2017-03-23,6 in Montana, https://media.dojmt.gov/wp-content/uploads/Barton-Oaks-Dental-Group.pdf ,Barton Oaks Dental Group,2017-05-18,,2017-03-23,Montana
3/23/2016-3/27/2017,2017-03-27,1 in Montana, https://media.dojmt.gov/wp-content/uploads/Childrens-Mercy-Hospital.pdf ,Children's Mercy Hospital,2017-05-19,,2016-03-23,Montana
1/25/2017-2/20/2017,2017-02-20,50 in Montana, https://media.dojmt.gov/wp-content/uploads/ATT.pdf ,AT&T,2017-05-19,,2017-01-25,Montana
4/19/2017-4/19/2017,2017-04-19,1 in Montana, https://media.dojmt.gov/wp-content/uploads/US-Bank.pdf ,US Bank,2017-05-24,,2017-04-19,Montana
6/1/2000-5/24/2017,2017-05-24,2 in Montana, https://media.dojmt.gov/wp-content/uploads/Options-Express.pdf ,Options Express,2017-05-24,,2000-06-01,Montana
5/15/2017-5/24/2017,2017-05-24,18 in Montana, https://media.dojmt.gov/wp-content/uploads/BMO-Harris.pdf ,BMO Harris,2017-05-24,,2017-05-15,Montana
3/22/2017-4/21/2017,2017-04-21,56 in Montana, https://media.dojmt.gov/wp-content/uploads/Char-Broil.pdf ,Char-Broil,2017-05-24,,2017-03-22,Montana
1/1/2016-3/25/2017,2017-03-25,105 in Montana, https://media.dojmt.gov/wp-content/uploads/Fast-Health.pdf ,Fast Health,2017-05-26,,2016-01-01,Montana
1/1/2017-5/3/2017,2017-05-03,9 in Montana, https://media.dojmt.gov/wp-content/uploads/Frontier-Airlines.pdf ,Frontier Airlines,2017-05-31,,2017-01-01,Montana
2/10/2017-4/30/2017,2017-04-30,1 in Montana, https://media.dojmt.gov/wp-content/uploads/Trojan-Battery.pdf ,Trojan Battery Sales,2017-06-01,,2017-02-10,Montana
2/22/2017-3/9/2017,2017-03-09,1 in Montana, https://media.dojmt.gov/wp-content/uploads/Township-of-Springfield.pdf ,"Township of Springfield, NJ",2017-06-02,,2017-02-22,Montana
4/28/2017-5/30/2017,2017-05-30,36 in Montana, https://media.dojmt.gov/wp-content/uploads/Signature-Hardware.pdf ,"Signature Hardware, Inc.",2017-06-02,,2017-04-28,Montana
6/1/2016-5/5/2017,2017-05-05,41 in Montana, https://media.dojmt.gov/wp-content/uploads/Crimson-Trace-Corporation.pdf ,Crimson Trace Corporation,2017-06-02,,2016-06-01,Montana
1/9/2017-3/10/2017,2017-03-10,10 in Montana, https://media.dojmt.gov/wp-content/uploads/Townsends.pdf ,Townsends,2017-06-05,,2017-01-09,Montana
3/24/2017-4/18/2017,2017-04-18,Unknown in Montana, https://media.dojmt.gov/wp-content/uploads/Chipotle-Mexican-Grill.pdf ,Chipotle Mexican Grill,2017-06-05,,2017-03-24,Montana
8/10/2016-2/9/2017,2017-02-09,3075 in Montana, https://media.dojmt.gov/wp-content/uploads/GameStop.pdf ,"GameStop, Inc.",2017-06-05,,2016-08-10,Montana
11/14/2016-4/17/2017,2017-04-17,134 in Montana, https://media.dojmt.gov/wp-content/uploads/Indigo-Wild.pdf ,Indigo Wild,2017-06-06,,2016-11-14,Montana
4/17/2017-4/17/2017,2017-04-17,23 in Montana, https://media.dojmt.gov/wp-content/uploads/Airway-Oxygen.pdf ,"Airway Oxygen, Inc.",2017-06-06,,2017-04-17,Montana
11/16/2016-5/1/2017,2017-05-01,18 in Montana, https://media.dojmt.gov/wp-content/uploads/Jewelry.com_.pdf ,Jewelry.com,2017-06-07,,2016-11-16,Montana
11/12/2016-4/11/2017,2017-04-11,2 in Montana, https://media.dojmt.gov/wp-content/uploads/Onia.pdf ,Onia,2017-06-08,,2016-11-12,Montana
3/19/2017-3/19/2017,2017-03-19,2 in Montana, https://media.dojmt.gov/wp-content/uploads/The-Forum-for-Youth-Investment.pdf ,The Forum for Youth Investment,2017-06-08,,2017-03-19,Montana
4/21/2017-4/26/2017,2017-04-26,6498 in Montana, https://media.dojmt.gov/wp-content/uploads/Washington-State-University.pdf ,Washington State University,2017-06-09,,2017-04-21,Montana
4/14/2017-4/14/2017,2017-04-14,1 in Montana, https://media.dojmt.gov/wp-content/uploads/Cove-Family-Sports-Medicine.pdf ,Cove Family & Sports Medicine,2017-06-12,,2017-04-14,Montana
6/3/2017-6/4/2017,2017-06-04,1 in Montana, https://media.dojmt.gov/wp-content/uploads/Bridge-Investment-Group.pdf ,Bridge Investment Group,2017-06-12,,2017-06-03,Montana
3/29/2017-5/15/2017,2017-05-15,4 in Montana, https://media.dojmt.gov/wp-content/uploads/Leavitt-Group-Enterprises.pdf ,Leavitt Group Enterprises,2017-06-12,,2017-03-29,Montana
2/28/2017-3/31/2017,2017-03-31,11 in Montana, https://media.dojmt.gov/wp-content/uploads/Intuit-3-1.pdf ,Intuit,2017-06-13,,2017-02-28,Montana
4/27/2017-6/7/2017,2017-06-07,3 in Montana, https://media.dojmt.gov/wp-content/uploads/Southern-Tide.pdf ,Southern Tide,2017-06-15,,2017-04-27,Montana
5/1/2017-5/3/2017,2017-05-03,2 in Montana, https://media.dojmt.gov/wp-content/uploads/SVHS.pdf ,SVHS,2017-06-15,,2017-05-01,Montana
8/1/2016-1/31/2017,2017-01-31,4 in Montana, https://media.dojmt.gov/wp-content/uploads/UBT.pdf ,UBT,2017-06-15,,2016-08-01,Montana
5/18/2017-5/18/2017,2017-05-18,1 in Montana, https://media.dojmt.gov/wp-content/uploads/The-Nielsen-Company.pdf ,The Nielsen Company,2017-06-19,,2017-05-18,Montana
4/18/2017-4/19/2017,2017-04-19,5 in Montana, https://media.dojmt.gov/wp-content/uploads/Torrance-Memorial-Medical-Center.pdf ,Torrance Memorial Medical Center,2017-06-19,,2017-04-18,Montana
4/24/2017-4/24/2017,2017-04-24,2 in Montana, https://media.dojmt.gov/wp-content/uploads/Family-Tree-Health-Clinic.pdf ,Family Tree Health Clinic,2017-06-19,,2017-04-24,Montana
6/1/2017-6/1/2017,2017-06-01,1 in Montana, https://media.dojmt.gov/wp-content/uploads/Occidental-College.pdf ,Occidental College,2017-06-19,,2017-06-01,Montana
11/15/2016-3/30/2017,2017-03-30,45 in Montana, https://media.dojmt.gov/wp-content/uploads/Home-Point-Financial-Corporation.pdf ,Home Point Financial Corporation,2017-06-20,,2016-11-15,Montana
2/18/2017-2/20/2017,2017-02-20,15 in Montana, https://media.dojmt.gov/wp-content/uploads/Atlantic-Digestive-Specialists.pdf ,Atlantic Digestive Specialists,2017-06-20,,2017-02-18,Montana
4/27/2017-4/27/2017,2017-04-27,11 in Montana, https://media.dojmt.gov/wp-content/uploads/Aetna-1.pdf ,Aetna,2017-06-21,,2017-04-27,Montana
6/9/2017-6/9/2017,2017-06-09,108 in Montana, https://media.dojmt.gov/wp-content/uploads/Caliber-Home-Loans-Inc..pdf ,"Caliber Home Loans, Inc.",2017-06-23,,2017-06-09,Montana
2/12/2017-4/24/2017,2017-04-24,8 in Montana, https://media.dojmt.gov/wp-content/uploads/Plastic-Surgery-Associates.pdf ,Plastic Surgery Associates,2017-06-27,,2017-02-12,Montana
4/28/2017-6/22/2017,2017-06-22,6 in Montana, https://media.dojmt.gov/wp-content/uploads/TD-Bank.pdf ,TD Bank,2017-06-27,,2017-04-28,Montana
5/31/2017-5/31/2017,2017-05-31,1 in Montana, https://media.dojmt.gov/wp-content/uploads/Epiq.pdf ,Epiq,2017-06-27,,2017-05-31,Montana
1/3/2017-5/18/2017,2017-05-18,12 in Montana, https://media.dojmt.gov/wp-content/uploads/Condie-Stoker.pdf ,Condie Stoker,2017-06-27,,2017-01-03,Montana
5/15/2017-5/15/2017,2017-05-15,12 in Montana, https://media.dojmt.gov/wp-content/uploads/Paul-Stuart.pdf ,Paul Stuart,2017-06-29,,2017-05-15,Montana
6/16/2017-6/19/2017,2017-06-19,1 in Montana, https://media.dojmt.gov/wp-content/uploads/State-Farm-1.pdf ,State Farm,2017-06-29,,2017-06-16,Montana
8/10/2016-3/9/2017,2017-03-09,3 in Montana, https://media.dojmt.gov/wp-content/uploads/Miraval-Arizona-Resort-and-Spa.pdf ,Miraval Arizona Resort and Spa,2017-06-29,,2016-08-10,Montana
6/1/2017-6/1/2017,2017-06-01,14 in Montana, https://media.dojmt.gov/wp-content/uploads/Xtant-Medical-Holdings.pdf ,Xtant Medical Holdings,2017-06-30,,2017-06-01,Montana
5/3/2017-5/3/2017,2017-05-03,1 in Montana, https://media.dojmt.gov/wp-content/uploads/Community-Link.pdf ,Community Link,2017-06-30,,2017-05-03,Montana
5/4/2017-5/4/2017,2017-05-04,29 in Montana, https://media.dojmt.gov/wp-content/uploads/PVHS-ICM-Employee-Health-and-Wellness.pdf ,PVHS-ICM Employee Health and Wellness,2017-06-30,,2017-05-04,Montana
2/17/2017-5/19/2017,2017-05-19,7 in Montana, https://media.dojmt.gov/wp-content/uploads/Betty-Lous.pdf ,Betty Lou's,2017-06-30,,2017-02-17,Montana
6/23/2017-6/23/2017,2017-06-23,1 in Montana, https://media.dojmt.gov/wp-content/uploads/Auburn-University.pdf ,Auburn University,2017-07-03,,2017-06-23,Montana
2/1/2016-12/31/2016,2016-12-31,209 in Montana, https://media.dojmt.gov/wp-content/uploads/Kayser-Roth-Inc..pdf ,"Kayser-Roth, Inc.",2017-07-03,,2016-02-01,Montana
8/29/2016-3/9/2017,2017-03-09,71 in Montana, https://media.dojmt.gov/wp-content/uploads/Loews-Hotels-Co..pdf ,Loews Hotels,2017-07-06,,2016-08-29,Montana
8/10/2016-3/9/2017,2017-03-09,1 in Montana, https://media.dojmt.gov/wp-content/uploads/Google.pdf ,Google,2017-07-06,,2016-08-10,Montana
8/10/2016-3/9/2017,2017-03-09,20 in Montana, https://media.dojmt.gov/wp-content/uploads/Aqua-Aston-Hospitality.pdf ,Aqua-Aston Hospitality,2017-07-06,,2016-08-10,Montana
3/10/2017-6/7/2017,2017-06-07,236 in Montana, https://media.dojmt.gov/wp-content/uploads/Spark-Pay-Capital-One-2.pdf ,Spark Pay (Capital One),2017-07-06,,2017-03-10,Montana
2/1/2016-5/31/2017,2017-05-31,13 in Montana, https://media.dojmt.gov/wp-content/uploads/Peachtree-Neurological-Clinic.pdf ,Peachtree Neurological Clinic,2017-07-06,,2016-02-01,Montana
8/10/2016-3/9/2017,2017-03-09,500 in Montana, https://media.dojmt.gov/wp-content/uploads/Preferred-Hotel-Group.pdf ,Preferred Hotel Group,2017-07-06,,2016-08-10,Montana
8/10/2016-3/9/2017,2017-03-09,1 in Montana, https://media.dojmt.gov/wp-content/uploads/Sabre-Hospitality.pdf ,21c Museum Hotels,2017-07-06,,2016-08-10,Montana
8/10/2016-3/9/2017,2017-03-09,5 in Montana, https://media.dojmt.gov/wp-content/uploads/Hard-Rock-Hotels-Casinos.pdf ,Hard Rock Hotels & Casinos,2017-07-07,,2016-08-10,Montana
4/18/2016-4/19/2017,2017-04-19,5 in Montana, https://media.dojmt.gov/wp-content/uploads/Torrance-Memoral-Medical-Center.pdf ,Torrance Memorial Medical Center,2017-07-07,,2016-04-18,Montana
3/8/2016-4/13/2017,2017-04-13,12 in Montana, https://media.dojmt.gov/wp-content/uploads/Golf-Ski.pdf ,Golf & Ski,2017-07-07,,2016-03-08,Montana
8/10/2016-3/9/2017,2017-03-09,7 in Montana, https://media.dojmt.gov/wp-content/uploads/Four-Seasons-Hotels.pdf ,Four Seasons Hotels,2017-07-07,,2016-08-10,Montana
8/10/2016-3/9/2017,2017-03-09,1 in Montana, https://media.dojmt.gov/wp-content/uploads/Halekulani-Corporation.pdf ,Halekulani Corporation,2017-07-07,,2016-08-10,Montana
6/23/2017-6/23/2017,2017-06-23,4 in Montana, https://media.dojmt.gov/wp-content/uploads/Costco.pdf ,Costco,2017-07-10,,2017-06-23,Montana
8/1/2016-10/15/2016,2016-10-15,2 in Montana, https://media.dojmt.gov/wp-content/uploads/Movement-Mortgage.pdf ,Movement Mortgage,2017-07-10,,2016-08-01,Montana
6/13/2017-6/21/2017,2017-06-21,1 in Montana, https://media.dojmt.gov/wp-content/uploads/Pacfic-Science-Center.pdf ,Pacific Science Center,2017-07-10,,2017-06-13,Montana
5/12/2017-5/12/2017,2017-05-12,1 in Montana, https://media.dojmt.gov/wp-content/uploads/LOGAN-Community-Resources.pdf ,LOGAN Community Resources,2017-07-11,,2017-05-12,Montana
8/10/2016-3/9/2017,2017-03-09,17 in Montana, https://media.dojmt.gov/wp-content/uploads/Trump-Towers.pdf ,Trump Towers,2017-07-11,,2016-08-10,Montana
8/10/2016-3/9/2017,2017-03-09,7 in Montana, https://media.dojmt.gov/wp-content/uploads/Club-Quarters-Hotels.pdf ,Club Quarters Hotels,2017-07-12,,2016-08-10,Montana
5/30/2017-5/30/2017,2017-05-30,125 in Montana, https://media.dojmt.gov/wp-content/uploads/Harvest-Bible-Church.pdf ,Harvest Bible Church,2017-07-13,,2017-05-30,Montana
8/10/2016-3/9/2018,2018-03-09,8 in Montana, https://media.dojmt.gov/wp-content/uploads/SBE-ENT-Holdings.pdf ,SBE ENT Holdings,2017-07-14,,2016-08-10,Montana
3/1/2017-6/30/2017,2017-06-30,1 in Montana, https://media.dojmt.gov/wp-content/uploads/Bedrock-Manufacturing-Company.pdf ,Bedrock Manufacturing Company,2017-07-14,,2017-03-01,Montana
8/10/2016-3/9/2017,2017-03-09,165 in Montana, https://media.dojmt.gov/wp-content/uploads/Two-Roads-Hospitality.pdf ,Two Roads Hospitality,2017-07-14,,2016-08-10,Montana
6/29/2017-7/3/2017,2017-07-03,5 in Montana, https://media.dojmt.gov/wp-content/uploads/Apartment-Management-Consultants.pdf ,Apartment Management Consultants,2017-07-14,,2017-06-29,Montana
8/10/2016-3/9/2017,2017-03-09,22 in Montana, https://media.dojmt.gov/wp-content/uploads/Remington-Lodging-Hospitality.pdf ,Remington Lodging & Hospitality,2017-07-17,,2016-08-10,Montana
10/12/2016-5/31/2017,2017-05-31,58 in Montana, https://media.dojmt.gov/wp-content/uploads/SportsMem.pdf ,SportsMem,2017-07-18,,2016-10-12,Montana
8/10/2016-3/9/2017,2017-03-09,3 in Montana, https://media.dojmt.gov/wp-content/uploads/Sage-Hospitality.pdf ,Sage Hospitality,2017-07-18,,2016-08-10,Montana
4/12/2017-4/12/2017,2017-04-12,11 in Montana, https://media.dojmt.gov/wp-content/uploads/Whitinger-Company.pdf ,Whitinger & Company,2017-07-18,,2017-04-12,Montana
5/6/2017-5/10/2017,2017-05-10,794 in Montana, https://media.dojmt.gov/wp-content/uploads/Keller-Williams-Realty.pdf ,Keller Williams Realty,2017-07-18,,2017-05-06,Montana
6/7/2017-6/7/2017,2017-06-07,2 in Montana, https://media.dojmt.gov/wp-content/uploads/de-Arrigoitia-Co.pdf ,de Arrigoitia & Co,2017-07-19,,2017-06-07,Montana
8/10/2016-3/9/2017,2017-03-09,2 in Montana, https://media.dojmt.gov/wp-content/uploads/Verizon.pdf ,Verizon,2017-07-20,,2016-08-10,Montana
5/31/2017-6/8/2017,2017-06-08,376 in Montana, https://media.dojmt.gov/wp-content/uploads/39DollarGlass.com_.pdf ,39DollarGlasses.com,2017-07-21,,2017-05-31,Montana
8/10/2016-3/9/2017,2017-03-09,7 in Montana, https://media.dojmt.gov/wp-content/uploads/Sydell-Partners.pdf ,Sydell Partners,2017-07-21,,2016-08-10,Montana
8/10/2016-3/9/2017,2017-03-09,16 in Montana, https://media.dojmt.gov/wp-content/uploads/Standard-International-Management.pdf ,Standard International Management,2017-07-21,,2016-08-10,Montana
7/10/2016-3/9/2017,2017-03-09,1 in Montana, https://media.dojmt.gov/wp-content/uploads/Hartz-Hotel-Services.pdf ,Hartz Hotel Services,2017-07-24,,2016-07-10,Montana
7/4/2017-7/4/2017,2017-07-04,Unknown in Montana, https://media.dojmt.gov/wp-content/uploads/Avanti.pdf ,Avanti Markets,2017-07-25,,2017-07-04,Montana
6/6/2017-6/6/2017,2017-06-06,4 in Montana, https://media.dojmt.gov/wp-content/uploads/Kelvin-J-Palmer-Co.pdf ,Kevin J Palmer & Co.,2017-07-25,,2017-06-06,Montana
8/10/2016-3/9/2017,2017-03-09,8 in Montana, https://media.dojmt.gov/wp-content/uploads/Woodside-Hotels-Resorts.pdf ,Woodside Hotels and Resorts,2017-07-25,,2016-08-10,Montana
6/29/2017-6/29/2017,2017-06-29,5 in Montana, https://media.dojmt.gov/wp-content/uploads/Hamilton-Zanze-Company.pdf ,Hamilton Zanze & Company,2017-07-25,,2017-06-29,Montana
5/23/2017-5/23/2017,2017-05-23,6 in Montana, https://media.dojmt.gov/wp-content/uploads/Delek-US-Holdings.pdf ,Delek US Holdings,2017-07-26,,2017-05-23,Montana
4/21/2017-4/21/2017,2017-04-21,2 in Montana, https://media.dojmt.gov/wp-content/uploads/Kentucky-Wesleyan-College.pdf ,Kentucky Wesleyan College,2017-07-26,,2017-04-21,Montana
12/21/2016-4/11/2017,2017-04-11,7 in Montana, https://media.dojmt.gov/wp-content/uploads/Galt-House-Hotel.pdf ,Galt House Hotels,2017-07-26,,2016-12-21,Montana
5/2/2017-5/2/2017,2017-05-02,376 in Montana, https://media.dojmt.gov/wp-content/uploads/HydroFlask.pdf ,Hydro Flask,2017-07-26,,2017-05-02,Montana
8/10/2016-3/9/2017,2017-03-09,25 in Montana, https://media.dojmt.gov/wp-content/uploads/Kimpton-Hotels-Restaurants.-2pdf.pdf ,Kimpton Hotels & Restaurants,2017-07-28,,2016-08-10,Montana
8/10/2016-3/9/2017,2017-03-09,8 in Montana, https://media.dojmt.gov/wp-content/uploads/Stout-Street.pdf ,Stout Street Hospitality,2017-07-28,,2016-08-10,Montana
8/10/2016-3/9/2017,2017-03-09,11 in Montana, https://media.dojmt.gov/wp-content/uploads/Westgate-Resorts.pdf ,Westgage Resorts,2017-07-28,,2016-08-10,Montana
8/10/2016-3/9/2017,2017-03-09,16 in Montana, https://media.dojmt.gov/wp-content/uploads/Noble-House-5.pdf ,Noble House (5),2017-07-28,,2016-08-10,Montana
8/10/2016-3/9/2017,2017-03-09,Unknown in Montana, https://media.dojmt.gov/wp-content/uploads/Yellowstone-Park-Hotel.pdf ,Yellowstone Park Hotel,2017-07-31,,2016-08-10,Montana
8/10/2016-3/9/2017,2017-03-09,Unknown in Montana, https://media.dojmt.gov/wp-content/uploads/Yavapai-Lodge.pdf ,Yavapai Lodge,2017-07-31,,2016-08-10,Montana
8/10/2016-3/9/2017,2017-03-09,Unknown in Montana, https://media.dojmt.gov/wp-content/uploads/Wuksachi-Lodge.pdf ,Wuksachi Lodge,2017-07-31,,2016-08-10,Montana
8/10/2016-3/9/2017,2017-03-09,Unknown in Montana, https://media.dojmt.gov/wp-content/uploads/Wheeling-Island-Hotel.pdf ,Wheeling Island Hotel,2017-07-31,,2016-08-10,Montana
12/18/2015-7/5/2017,2017-07-05,1 in Montana, https://media.dojmt.gov/wp-content/uploads/Boy-Scouts-of-America.pdf ,Boy Scouts of America,2017-07-31,,2015-12-18,Montana
8/10/2016-3/9/2017,2017-03-09,Unknown in Montana, https://media.dojmt.gov/wp-content/uploads/Asbury-Hotel.pdf ,Asbury Hotel,2017-07-31,,2016-08-10,Montana
8/10/2016-3/9/2017,2017-03-09,Unknown in Montana, https://media.dojmt.gov/wp-content/uploads/Trailer-Village-RV-Park.pdf ,Trailer Village RV Park,2017-07-31,,2016-08-10,Montana
8/10/2016-3/9/2017,2017-03-09,Unknown in Montana, https://media.dojmt.gov/wp-content/uploads/The-Lodge-at-Geneva.pdf ,The Lodge at Geneva,2017-07-31,,2016-08-10,Montana
8/10/2016-3/9/2017,2017-03-09,Unknown in Montana, https://media.dojmt.gov/wp-content/uploads/Tenaya-Lodge.pdf ,Tenaya Lodge,2017-07-31,,2016-08-10,Montana
8/10/2016-3/9/2017,2017-03-09,Unknown in Montana, https://media.dojmt.gov/wp-content/uploads/Skyland-Resort.pdf ,Skyland Resort,2017-07-31,,2016-08-10,Montana
8/10/2016-3/9/2017,2017-03-09,Unknown in Montana, https://media.dojmt.gov/wp-content/uploads/Sea-Crest-Beach-Hotel.pdf ,Sea Crest Beach Hotel,2017-07-31,,2016-08-10,Montana
8/10/2016-3/9/2017,2017-03-09,Unknown in Montana, https://media.dojmt.gov/wp-content/uploads/Rocky-Mountain-Park-Inn.pdf ,Rocky Mountain Park Inn,2017-07-31,,2016-08-10,Montana
8/10/2016-3/9/2017,2017-03-09,Unknown in Montana, https://media.dojmt.gov/wp-content/uploads/Pine-Lodge.pdf ,Pine Lodge,2017-07-31,,2016-08-10,Montana
8/10/2016-3/9/2017,2017-03-09,Unknown in Montana, https://media.dojmt.gov/wp-content/uploads/Lewis-Mountain-Cabins.pdf ,Lewis Mountain Cabins,2017-07-31,,2016-08-10,Montana
8/10/2016-3/9/2017,2017-03-09,Unknown in Montana, https://media.dojmt.gov/wp-content/uploads/Kalaloch-Lodge.pdf ,Kalaloch Lodge,2017-07-31,,2016-08-10,Montana
8/10/2016-3/9/2017,2017-03-09,Unknown in Montana, https://media.dojmt.gov/wp-content/uploads/Honey-Creek-Resort-State-Park.pdf ,Honey Creek Resort State Park,2017-07-31,,2016-08-10,Montana
8/10/2016-3/9/2017,2017-03-09,Unknown in Montana, https://media.dojmt.gov/wp-content/uploads/Gray-Wolf-Inn-Suites.pdf ,Gray Wolf Inn & Suites,2017-07-31,,2016-08-10,Montana
8/10/2016-3/9/2017,2017-03-09,Unknown in Montana, https://media.dojmt.gov/wp-content/uploads/Grant-Grove-Village.pdf ,Grant Grove Village,2017-07-31,,2016-08-10,Montana
8/10/2016-3/9/2017,2017-03-09,Unknown in Montana, https://media.dojmt.gov/wp-content/uploads/Gideon-Putnam-Hotel.pdf ,Gideon Putnam Hotel,2017-07-31,,2016-08-10,Montana
8/10/2016-3/9/2017,2017-03-09,Unknown in Montana, https://media.dojmt.gov/wp-content/uploads/Explorer-Cabins-at-Yellowstone.pdf ,Explorer Cabins at Yellowstone,2017-07-31,,2016-08-10,Montana
8/10/2016-3/9/2017,2017-03-09,Unknown in Montana, https://media.dojmt.gov/wp-content/uploads/Cedar-Grove.pdf ,Cedar Grove,2017-07-31,,2016-08-10,Montana
8/10/2016-3/9/2017,2017-03-09,Unknown in Montana, https://media.dojmt.gov/wp-content/uploads/Big-Meadows-Lodge.pdf ,Big Meadows Lodge,2017-07-31,,2016-08-10,Montana
1/27/2017-4/20/2017,2017-04-20,4 in Montana, https://media.dojmt.gov/wp-content/uploads/Capital-One-1.pdf ,Capital One,2017-07-31,,2017-01-27,Montana
10/27/2016-5/24/2017,2017-05-24,9 in Montana, https://media.dojmt.gov/wp-content/uploads/Juliska.pdf ,Juliska,2017-08-03,,2016-10-27,Montana
5/31/2017-6/1/2017,2017-06-01,1 in Montana, https://media.dojmt.gov/wp-content/uploads/QBE-North-America.pdf ,QBE North America,2017-08-04,,2017-05-31,Montana
2/26/2017-6/25/2017,2017-06-25,3 in Montana, https://media.dojmt.gov/wp-content/uploads/State-Industrial-Products.pdf ,State Industrial Products,2017-08-04,,2017-02-26,Montana
9/16/2016-4/28/2017,2017-04-28,2 in Montana, https://media.dojmt.gov/wp-content/uploads/Hyatt-Centric-The-Loop.pdf ,Hyatt Centric The Loop,2017-08-07,,2016-09-16,Montana
4/27/2017-6/16/2017,2017-06-16,3 in Montana, https://media.dojmt.gov/wp-content/uploads/Shoe-Station.pdf ,Shoe Station,2017-08-08,,2017-04-27,Montana
10/23/2017-7/1/2017,2017-07-01,19 in Montana, https://media.dojmt.gov/wp-content/uploads/Kayser-Roth-Inc.pdf ,"Kayser-Roth, Inc.",2017-08-09,,2017-10-23,Montana
1/1/2007-6/28/2017,2017-06-28,9 in Montana, https://media.dojmt.gov/wp-content/uploads/Wooster-Ashland-Regional-Council-of-Governments.pdf ,Wooster-Ashland Regional Council of Government,2017-08-09,,2007-01-01,Montana
7/17/2017-7/17/2017,2017-07-17,5 in Montana, https://media.dojmt.gov/wp-content/uploads/Evers-Robinson.pdf ,Logan Simpson,2017-08-10,,2017-07-17,Montana
8/10/2016-3/9/2017,2017-03-09,11 in Montana, https://media.dojmt.gov/wp-content/uploads/Pacifica.pdf ,Pacifica,2017-08-11,,2016-08-10,Montana
4/16/2017-6/19/2017,2017-06-19,14 in Montana, https://media.dojmt.gov/wp-content/uploads/Marine-Corps-Association-Foundation.pdf ,Marine Corps Association & Foundation,2017-08-11,,2017-04-16,Montana
5/19/2017-7/26/2017,2017-07-26,40 in Montana, https://media.dojmt.gov/wp-content/uploads/True-Benefits.pdf ,True Benefits,2017-08-14,,2017-05-19,Montana
5/23/2017-5/23/2017,2017-05-23,3 in Montana, https://media.dojmt.gov/wp-content/uploads/Ameriprise-Financial-Services-1.pdf ,Ameriprise Financial Services,2017-08-15,,2017-05-23,Montana
7/19/2017-7/19/2017,2017-07-19,1 in Montana, https://media.dojmt.gov/wp-content/uploads/Piersol-Construction.pdf ,Piersol Construction,2017-08-15,,2017-07-19,Montana
8/10/2016-3/9/2017,2017-03-09,12 in Montana, https://media.dojmt.gov/wp-content/uploads/Benjamin-Hotel.pdf ,Benjamin Hotel,2017-08-16,,2016-08-10,Montana
4/1/2015-6/23/2017,2017-06-23,22 in Montana, https://media.dojmt.gov/wp-content/uploads/Native-Shoes.pdf ,Native Shoes,2017-08-16,,2015-04-01,Montana
6/18/2017-6/18/2017,2017-06-18,15 in Montana, https://media.dojmt.gov/wp-content/uploads/Salina-Family-Healthcare-Center.pdf ,Salina Family Healthcare Center,2017-08-16,,2017-06-18,Montana
6/9/2016-6/6/2017,2017-06-06,11 in Montana, https://media.dojmt.gov/wp-content/uploads/Equipmentfr.com_.pdf ,Equipmentfr.com,2017-08-17,,2016-06-09,Montana
12/25/2016-6/6/2017,2017-06-06,11 in Montana, https://media.dojmt.gov/wp-content/uploads/Joie.com_.pdf ,Joie.com,2017-08-17,,2016-12-25,Montana
7/17/2017-8/16/2017,2017-08-16,1 in Montana, https://media.dojmt.gov/wp-content/uploads/Arizona-Tile.pdf ,Arizona Tile,2017-08-21,,2017-07-17,Montana
3/1/2017-4/30/2017,2017-04-30,5269 in Montana, https://media.dojmt.gov/wp-content/uploads/Rutherford-MacDonald-Olson.pdf ,"Rutherford, MacDonald & Olson",2017-08-23,,2017-03-01,Montana
2/1/2016-12/31/2016,2016-12-31,2 in Montana, https://media.dojmt.gov/wp-content/uploads/Anaheim-Portofino-Inn-Suites.pdf ,Piano Works,2017-08-24,,2016-02-01,Montana
8/10/2016-3/9/2017,2017-03-09,1 in Montana, https://media.dojmt.gov/wp-content/uploads/Queen-Mary-Hotel.pdf ,Anaheim Portofino Inn & Suites,2017-08-24,,2016-08-10,Montana
8/10/2016-3/9/2017,2017-03-09,10 in Montana, https://media.dojmt.gov/wp-content/uploads/Hard-Rock-Hotel-San-Diego.pdf ,Queen Mary Hotel,2017-08-24,,2016-08-10,Montana
8/10/2016-3/9/2017,2017-03-09,1 in Montana, https://media.dojmt.gov/wp-content/uploads/Anza-Calabasas-Hotel.pdf ,Hard Rock Sand Diego,2017-08-24,,2016-08-10,Montana
8/10/2016-3/9/2017,2017-03-09,4 in Montana, https://media.dojmt.gov/wp-content/uploads/Crescent-Mortgage-Company.pdf ,Anza Calabasas Hotel,2017-08-24,,2016-08-10,Montana
7/14/2017-8/5/2017,2017-08-05,18 in Montana, https://media.dojmt.gov/wp-content/uploads/Piano-Works.pdf ,Crescent Mortgage Company,2017-08-24,,2017-07-14,Montana
5/16/2016-7/10/2017,2017-07-10,2 in Montana, https://media.dojmt.gov/wp-content/uploads/GT-Distributors.pdf ,GT Distributors,2017-08-25,,2016-05-16,Montana
7/21/2017-8/7/2017,2017-08-07,43 in Montana, https://media.dojmt.gov/wp-content/uploads/Credco-1.pdf ,Credco,2017-08-28,,2017-07-21,Montana
3/15/2017-8/2/2017,2017-08-02,41 in Montana, https://media.dojmt.gov/wp-content/uploads/Zymo.pdf ,Zymo,2017-08-28,,2017-03-15,Montana
8/10/2016-3/9/2017,2017-03-09,6 in Montana, https://media.dojmt.gov/wp-content/uploads/Roosevelt-Hotel.pdf ,Roosevelt Hotel,2017-08-28,,2016-08-10,Montana
8/10/2016-3/9/2017,2017-03-09,1 in Montana, https://media.dojmt.gov/wp-content/uploads/Bicycle-Hotel-Casino.pdf ,The Bicycle Hotel & Casino,2017-08-28,,2016-08-10,Montana
7/10/2016-7/10/2017,2017-07-10,74 in Montana, https://media.dojmt.gov/wp-content/uploads/Cornerstone-Business-Management-Solutions.pdf ,Cornerstone Business & Management Solutions,2017-08-28,,2016-07-10,Montana
7/6/2017-7/6/2017,2017-07-06,17 in Montana, https://media.dojmt.gov/wp-content/uploads/Wells-Fargo.pdf ,Wells Fargo,2017-08-29,,2017-07-06,Montana
8/10/2016-3/9/2017,2017-03-09,5 in Montana, https://media.dojmt.gov/wp-content/uploads/Red-Roof-Inns.pdf ,Red Roof Inns,2017-08-29,,2016-08-10,Montana
7/5/2017-7/12/2017,2017-07-12,27 in Montana, https://media.dojmt.gov/wp-content/uploads/Nationstar-Mortgage.pdf.pdf ,Nationstar Mortgage,2017-08-31,,2017-07-05,Montana
5/25/2017-7/25/2017,2017-07-25,1 in Montana, https://media.dojmt.gov/wp-content/uploads/Kroeschell.pdf ,Kroeschell,2017-08-31,,2017-05-25,Montana
4/15/2017-5/25/2017,2017-05-25,1 in Montana, https://media.dojmt.gov/wp-content/uploads/Neurology-Foundation.pdf ,Neurology Foundation,2017-09-01,,2017-04-15,Montana
11/1/2016-7/31/2017,2017-07-31,12 in Montana, https://media.dojmt.gov/wp-content/uploads/Akira.pdf ,Akira,2017-09-01,,2016-11-01,Montana
7/5/2017-9/1/2017,2017-09-01,2 in Montana, https://media.dojmt.gov/wp-content/uploads/Hand-Rehabilitation-Services.pdf ,Hand Rehabilitation Services,2017-09-01,,2017-07-05,Montana
4/24/2016-6/8/2017,2017-06-08,39 in Montana, https://media.dojmt.gov/wp-content/uploads/Classic-Firearms.pdf ,Classic Firearms,2017-09-01,,2016-04-24,Montana
8/10/2016-3/9/2017,2017-03-09,8 in Montana, https://media.dojmt.gov/wp-content/uploads/Evans-Hotels.pdf ,Evans Hotels,2017-09-01,,2016-08-10,Montana
5/23/2017-5/23/2017,2017-05-23,46 in Montana, https://media.dojmt.gov/wp-content/uploads/Barer-Law-Offices.pdf ,Barer Law Offices,2017-09-05,,2017-05-23,Montana
8/10/2016-3/9/2017,2017-03-09,5 in Montana, https://media.dojmt.gov/wp-content/uploads/Sixty-Hotels.pdf ,Sixty Hotels,2017-09-05,,2016-08-10,Montana
8/7/2016-8/7/2017,2017-08-07,1 in Montana, https://media.dojmt.gov/wp-content/uploads/Fiduciary-Management.pdf ,Fiduciary Management,2017-09-06,,2016-08-07,Montana
7/11/2016-8/4/2017,2017-08-04,8 in Montana, https://media.dojmt.gov/wp-content/uploads/reThink-Group.pdf ,reThink Group,2017-09-06,,2016-07-11,Montana
8/23/2017-8/24/2017,2017-08-24,2 in Montana, https://media.dojmt.gov/wp-content/uploads/Major-League-Lacrosse.pdf ,Major League Lacrosse,2017-09-07,,2017-08-23,Montana
7/15/2017-8/21/2017,2017-08-21,66 in Montana, https://media.dojmt.gov/wp-content/uploads/SRI-1.pdf ,SRI,2017-09-07,,2017-07-15,Montana
9/1/2017-9/5/2017,2017-09-05,1 in Montana, https://media.dojmt.gov/wp-content/uploads/Jacuzzi.pdf ,Jacuzzi,2017-09-11,,2017-09-01,Montana
5/12/2017-8/22/2017,2017-08-22,8 in Montana, https://media.dojmt.gov/wp-content/uploads/Frontier-Natural-Products.pdf ,Frontier Natural Products,2017-09-11,,2017-05-12,Montana
6/1/2017-8/23/2017,2017-08-23,13 in Montana, https://media.dojmt.gov/wp-content/uploads/Signator-Investors.pdf ,Signator Investors,2017-09-11,,2017-06-01,Montana
1/27/2017-4/20/2017,2017-04-20,4 in Montana, https://media.dojmt.gov/wp-content/uploads/Capital-One-2-1.pdf ,Capital One 360,2017-09-12,,2017-01-27,Montana
6/20/2017-6/29/2017,2017-06-29,1 in Montana, https://media.dojmt.gov/wp-content/uploads/Morehead-Memorial-Hospital.pdf ,Morehead Memorial Hospital,2017-09-15,,2017-06-20,Montana
8/30/2017-8/30/2017,2017-08-30,1 in Montana, https://media.dojmt.gov/wp-content/uploads/E-J-Gallo-Winery.pdf ,E&J Gallo Winery,2017-09-15,,2017-08-30,Montana
8/9/2017-8/9/2017,2017-08-09,1 in Montana, https://media.dojmt.gov/wp-content/uploads/PeaceHealth-Southwest-Medical-Center.pdf ,PeaceHealth Southwest Medical Center,2017-09-18,,2017-08-09,Montana
8/23/2017-8/25/2017,2017-08-25,57 in Montana, https://media.dojmt.gov/wp-content/uploads/W.W.-Grainger.pdf ,"W.W. Grainger, Inc.",2017-09-18,,2017-08-23,Montana
8/25/2017-8/25/2017,2017-08-25,3 in Montana, https://media.dojmt.gov/wp-content/uploads/ABB.pdf ,ABB,2017-09-18,,2017-08-25,Montana
8/24/2017-8/24/2017,2017-08-24,2 in Montana, https://media.dojmt.gov/wp-content/uploads/Richard-Munoz-CPA.pdf ,"Richard Munoz, CPA",2017-09-20,,2017-08-24,Montana
8/28/2017-8/28/2017,2017-08-28,2 in Montana, https://media.dojmt.gov/wp-content/uploads/Clifton-Larson-Allen.pdf ,Clifton Larson Allen,2017-09-20,,2017-08-28,Montana
9/17/2016-7/20/2017,2017-07-20,6 in Montana, https://media.dojmt.gov/wp-content/uploads/Best-Western-Plus-Wine-Country-Hotel.pdf ,Best Western Plus Wine Country Hotel & Suites,2017-09-21,,2016-09-17,Montana
8/8/2017-8/8/2017,2017-08-08,1 in Montana, https://media.dojmt.gov/wp-content/uploads/NCI-Group.pdf ,NCI Group,2017-09-22,,2017-08-08,Montana
7/6/2017-9/6/2017,2017-09-06,1 in Montana, https://media.dojmt.gov/wp-content/uploads/Aero-Tech-Light-Bulb-Co.pdf ,Aero-Tech Light Bulb Co.,2017-09-22,,2017-07-06,Montana
5/4/2016-6/12/2017,2017-06-12,1 in Montana, https://media.dojmt.gov/wp-content/uploads/Capital-One-3-1.pdf ,Capital One,2017-09-22,,2016-05-04,Montana
8/1/2017-8/31/2017,2017-08-31,8 in Montana, https://media.dojmt.gov/wp-content/uploads/Century-Martial-Arts.pdf ,Century Martial Arts,2017-09-25,,2017-08-01,Montana
11/15/2016-3/3/2017,2017-03-03,1 in Montana, https://media.dojmt.gov/wp-content/uploads/The-Hartford.pdf ,The Hartford,2017-09-26,,2016-11-15,Montana
8/28/2017-8/28/2017,2017-08-28,1 in Montana, https://media.dojmt.gov/wp-content/uploads/PerfectServe.pdf ,PerfectServe,2017-09-27,,2017-08-28,Montana
7/21/2017-7/21/2017,2017-07-21,43 in Montana, https://media.dojmt.gov/wp-content/uploads/Cheddars-Casual-Cafe.pdf ,Cheddar's Casual Cafe,2017-09-29,,2017-07-21,Montana
7/25/2017-7/28/2017,2017-07-28,4 in Montana, https://media.dojmt.gov/wp-content/uploads/Briggs-Stratton.pdf ,Briggs & Stratton,2017-09-29,,2017-07-25,Montana
6/1/2017-6/1/2017,2017-06-01,26 in Montana, https://media.dojmt.gov/wp-content/uploads/BSI-Financial-Services.pdf ,BSI Financial Services,2017-09-29,,2017-06-01,Montana
8/1/2017-8/30/2017,2017-08-30,291 in Montana, https://media.dojmt.gov/wp-content/uploads/FlexShopper.pdf ,FlexShopper,2017-10-03,,2017-08-01,Montana
6/20/2014-7/26/2017,2017-07-26,85 in Montana, https://media.dojmt.gov/wp-content/uploads/Online-Traffic-Schools.pdf ,Online Traffic Schools,2017-10-04,,2014-06-20,Montana
9/18/2017-9/18/2017,2017-09-18,Unknown in Montana, https://media.dojmt.gov/wp-content/uploads/Sonic.pdf ,Sonic,2017-10-04,,2017-09-18,Montana
9/5/2017-9/5/2017,2017-09-05,6 in Montana, https://media.dojmt.gov/wp-content/uploads/Cabrillo-Community-College.pdf ,Cabrillo Community College,2017-10-05,,2017-09-05,Montana
8/22/2017-9/15/2017,2017-09-15,1 in Montana, https://media.dojmt.gov/wp-content/uploads/Aegis-Living.pdf ,Aegis Living,2017-10-05,,2017-08-22,Montana
9/12/2017-9/15/2017,2017-09-15,1 in Montana, https://media.dojmt.gov/wp-content/uploads/Lake-Champlain-Chocolates.pdf ,Lake Champlain Chocolates,2017-10-05,,2017-09-12,Montana
5/27/2017-9/12/2017,2017-09-12,123 in Montana, https://media.dojmt.gov/wp-content/uploads/Cricut.pdf ,Cricut,2017-10-05,,2017-05-27,Montana
12/1/2014-12/31/2016,2016-12-31,2 in Montana, https://media.dojmt.gov/wp-content/uploads/Navy-Federal-Credit-Union.pdf ,Navy Federal Credit Union,2017-10-06,,2014-12-01,Montana
7/26/2016-8/9/2017,2017-08-09,1 in Montana, https://media.dojmt.gov/wp-content/uploads/Nutrex-Hawaii.pdf ,Nutrex Hawaii,2017-10-06,,2016-07-26,Montana
11/12/2016-9/6/2017,2017-09-06,495 in Montana, https://media.dojmt.gov/wp-content/uploads/Catholic-United-Financial.pdf ,Catholic United Financial,2017-10-06,,2016-11-12,Montana
8/25/2017-9/29/2017,2017-09-29,181 in Montana, https://media.dojmt.gov/wp-content/uploads/Tommie-Copper.pdf ,Tommie Copper,2017-10-06,,2017-08-25,Montana
7/27/2017-8/11/2017,2017-08-11,4 in Montana, https://media.dojmt.gov/wp-content/uploads/Rivermend.pdf ,RiverMend Health,2017-10-09,,2017-07-27,Montana
1/2/2017-8/9/2017,2017-08-09,6 in Montana, https://media.dojmt.gov/wp-content/uploads/ABC-Carpet-and-Home.pdf ,ABC Carpet and Home,2017-10-09,,2017-01-02,Montana
7/21/2017-8/9/2017,2017-08-09,4 in Montana, https://media.dojmt.gov/wp-content/uploads/Atlantic-Cigar-Company.pdf ,Atlantic Cigar Company,2017-10-10,,2017-07-21,Montana
9/26/2017-9/26/2017,2017-09-26,25 in Montana, https://media.dojmt.gov/wp-content/uploads/Droege-Computing-Service.pdf ,Droege Computing Service,2017-10-11,,2017-09-26,Montana
3/1/2017-7/31/2017,2017-07-31,3 in Montana, https://media.dojmt.gov/wp-content/uploads/Phillips-Temro-Industries.pdf ,Phillips & Temro Industries,2017-10-11,,2017-03-01,Montana
3/18/2017-7/2/2017,2017-07-02,14 in Montana, https://media.dojmt.gov/wp-content/uploads/Hyatt-Hotels.pdf ,Hyatt Hotels,2017-10-12,,2017-03-18,Montana
7/21/2017-8/9/2017,2017-08-09,2 in Montana, https://media.dojmt.gov/wp-content/uploads/West-Music-1.pdf ,West Music,2017-10-13,,2017-07-21,Montana
8/10/2016-3/9/2017,2017-03-09,3 in Montana, https://media.dojmt.gov/wp-content/uploads/Rivertide-Suites.pdf ,Rivertide Suites,2017-10-13,,2016-08-10,Montana
3/24/2017-8/21/2017,2017-08-21,2 in Montana, https://media.dojmt.gov/wp-content/uploads/International-Council-of-Shopping-Centers.pdf ,International Council of Shopping Centers,2017-10-16,,2017-03-24,Montana
9/9/2017-9/9/2017,2017-09-09,1 in Montana, https://media.dojmt.gov/wp-content/uploads/Mark-Schaefer-Associates-1.pdf ,Mark Schaefer Associates,2017-10-16,,2017-09-09,Montana
2/1/2016-10/16/2017,2017-10-16,1 in Montana, https://media.dojmt.gov/wp-content/uploads/Designers-and-Planners.pdf ,Designers and Planners,2017-10-16,,2016-02-01,Montana
10/1/2017-10/2/2017,2017-10-02,255 in Montana, https://media.dojmt.gov/wp-content/uploads/Pizza-Hut.pdf ,Pizza Hut,2017-10-16,,2017-10-01,Montana
1/14/2014-9/29/2017,2017-09-29,2 in Montana, https://media.dojmt.gov/wp-content/uploads/Coincafe.pdf ,Coincafe,2017-10-18,,2014-01-14,Montana
8/5/2017-8/7/2017,2017-08-07,1 in Montana, https://media.dojmt.gov/wp-content/uploads/LightHouse-Management-Services.pdf ,Lighthouse Management Services,2017-10-20,,2017-08-05,Montana
10/11/2016-10/11/2017,2017-10-11,1 in Montana, https://media.dojmt.gov/wp-content/uploads/Advisory-Research.pdf ,Advisory Research,2017-10-24,,2016-10-11,Montana
11/1/2016-9/30/2017,2017-09-30,1 in Montana, https://media.dojmt.gov/wp-content/uploads/Memory4Less.pdf ,Memory4Less,2017-10-24,,2016-11-01,Montana
5/29/2017-8/25/2017,2017-08-25,26 in Montana, https://media.dojmt.gov/wp-content/uploads/Interstate-Plastics.pdf ,Interstate Plastics,2017-10-27,,2017-05-29,Montana
10/10/2017-10/10/2017,2017-10-10,5 in Montana, https://media.dojmt.gov/wp-content/uploads/Workfront.pdf ,Workfront,2017-10-27,,2017-10-10,Montana
9/27/2017-9/27/2017,2017-09-27,2 in Montana, https://media.dojmt.gov/wp-content/uploads/Human-Good.pdf ,Human Good,2017-10-30,,2017-09-27,Montana
6/4/2016-8/26/2017,2017-08-26,1 in Montana, https://media.dojmt.gov/wp-content/uploads/Sonabank.pdf ,Sonabank,2017-10-31,,2016-06-04,Montana
8/1/2016-3/17/2017,2017-03-17,1 in Montana, https://media.dojmt.gov/wp-content/uploads/GlaxoSmithKline.pdf ,GlaxoSmithKline,2017-10-31,,2016-08-01,Montana
8/25/2016-9/15/2017,2017-09-15,24 in Montana, https://media.dojmt.gov/wp-content/uploads/Rain-Bird.pdf ,Rain Bird,2017-11-01,,2016-08-25,Montana
9/7/2017-9/7/2017,2017-09-07,84 in Montana, https://media.dojmt.gov/wp-content/uploads/Tween-Brands-1.pdf ,Tween Brands,2017-11-03,,2017-09-07,Montana
8/10/2016-3/9/2017,2017-03-09,3 in Montana, https://media.dojmt.gov/wp-content/uploads/Oxford.pdf ,Oxford,2017-11-03,,2016-08-10,Montana
6/26/2017-6/26/2017,2017-06-26,3 in Montana, https://media.dojmt.gov/wp-content/uploads/Little-River-Healthcare.pdf ,Little River Healthcare,2017-11-07,,2017-06-26,Montana
10/15/2016-10/31/2017,2017-10-31,4 in Montana, https://media.dojmt.gov/wp-content/uploads/Baylor-College-of-Medicine-2.pdf ,Baylor College of Medicine,2017-11-08,,2016-10-15,Montana
7/2/2017-10/10/2017,2017-10-10,6 in Montana, https://media.dojmt.gov/wp-content/uploads/InTouch-Credit-Union.pdf ,InTouch Credit Union,2017-11-08,,2017-07-02,Montana
8/10/2016-3/9/2017,2017-03-09,1 in Montana, https://media.dojmt.gov/wp-content/uploads/The-Whitehall-Hotel.pdf ,The Whitehall Hotel,2017-11-10,,2016-08-10,Montana
5/15/2017-7/25/2017,2017-07-25,3 in Montana, https://media.dojmt.gov/wp-content/uploads/HBO.pdf ,HBO,2017-11-13,,2017-05-15,Montana
6/30/2015-11/2/2017,2017-11-02,4 in Montana, https://media.dojmt.gov/wp-content/uploads/GCI-1.pdf ,GCI,2017-11-13,,2015-06-30,Montana
6/18/2016-9/19/2017,2017-09-19,4026 in Montana, https://media.dojmt.gov/wp-content/uploads/GNAC.pdf ,GNAC,2017-11-13,,2016-06-18,Montana
7/21/2017-7/28/2017,2017-07-28,1 in Montana, https://media.dojmt.gov/wp-content/uploads/Brinderson-LP.pdf ,Medical College of Wisconsin,2017-11-17,,2017-07-21,Montana
11/8/2017-11/8/2017,2017-11-08,3 in Montana, https://media.dojmt.gov/wp-content/uploads/Medical-College-of-Wisconsin.pdf ,Academy of Art University,2017-11-17,,2017-11-08,Montana
2/3/2017-10/24/2017,2017-10-24,21 in Montana, https://media.dojmt.gov/wp-content/uploads/Academy-of-Art-University-1.pdf ,Brinderson LP,2017-11-17,,2017-02-03,Montana
8/10/2016-3/9/2017,2017-03-09,4 in Montana, https://media.dojmt.gov/wp-content/uploads/JRK-Hotel-Group.pdf ,JRK Hotel Group,2017-11-20,,2016-08-10,Montana
10/13/2016-11/15/2016,2016-11-15,81 in Montana, https://media.dojmt.gov/wp-content/uploads/Uber-2.pdf ,Uber,2017-11-21,,2016-10-13,Montana
9/26/2017-9/26/2017,2017-09-26,1 in Montana, https://media.dojmt.gov/wp-content/uploads/Pulmonary-Specialists-of-Louisville.pdf ,Pulmonary Specialists of Louisville,2017-11-28,,2017-09-26,Montana
7/1/2017-10/6/2017,2017-10-06,32 in Montana, https://media.dojmt.gov/wp-content/uploads/Combat-Brands-2-1.pdf ,Combat Brands,2017-11-29,,2017-07-01,Montana
8/29/2017-11/3/2017,2017-11-03,1 in Montana, https://media.dojmt.gov/wp-content/uploads/IdeaStream.pdf ,IdeaStream,2017-11-30,,2017-08-29,Montana
9/22/2017-11/3/2017,2017-11-03,5 in Montana, https://media.dojmt.gov/wp-content/uploads/Amazing-Grass.pdf ,Amazing Grass,2017-11-30,,2017-09-22,Montana
6/16/2016-11/6/2017,2017-11-06,78 in Montana, https://media.dojmt.gov/wp-content/uploads/JAM-Paper-Envelope.pdf ,JAM Paper & Envelope,2017-12-01,,2016-06-16,Montana
10/5/2017-10/5/2017,2017-10-05,2 in Montana, https://media.dojmt.gov/wp-content/uploads/Bank-of-the-West.pdf ,Bank of the West,2017-12-05,,2017-10-05,Montana
6/22/2017-8/15/2017,2017-08-15,10 in Montana, https://media.dojmt.gov/wp-content/uploads/MFTStamps.pdf ,MFT Stamps (Gorilla),2017-12-07,,2017-06-22,Montana
10/7/2017-10/7/2017,2017-10-07,1 in Montana, https://media.dojmt.gov/wp-content/uploads/Eye-Physicians.pdf ,Eye Physicians,2017-12-07,,2017-10-07,Montana
10/21/2017-11/27/2017,2017-11-27,11 in Montana, https://media.dojmt.gov/wp-content/uploads/National-Capital-Poison-Center-1.pdf ,National Capital Poison Center,2017-12-08,,2017-10-21,Montana
9/13/2017-9/28/2017,2017-09-28,11 in Montana, https://media.dojmt.gov/wp-content/uploads/WEI-Mortgage.pdf ,WEI Mortgage,2017-12-08,,2017-09-13,Montana
11/27/2017-11/27/2017,2017-11-27,25 in Montana, https://media.dojmt.gov/wp-content/uploads/Farm-Bureau-Financial-Services.pdf ,Farm Bureau Financial Services,2017-12-08,,2017-11-27,Montana
12/1/2017-12/1/2017,2017-12-01,1 in Montana, https://media.dojmt.gov/wp-content/uploads/The-Board-of-Pensions-of-the-Presbyterian-Church-U.S.A.pdf ,The Board of Pensions of the Presbyterian Church (U.S.A.),2017-12-11,,2017-12-01,Montana
1/1/2014-11/10/2017,2017-11-10,275 in Montana, https://media.dojmt.gov/wp-content/uploads/TIO-Networks-USA-1.pdf ,"TIO Networks USA (Bank of America, PageOnce)",2017-12-12,,2014-01-01,Montana
10/10/2017-11/15/2017,2017-11-15,1 in Montana, https://media.dojmt.gov/wp-content/uploads/U-Haul-Co.-Solo-Tire.pdf ,U-Haul Co. (Solo Tire),2017-12-12,,2017-10-10,Montana
10/18/2015-10/18/2017,2017-10-18,1 in Montana, https://media.dojmt.gov/wp-content/uploads/Emory-Healthcare-UAriz.pdf ,Emory Healthcare (University of Arizona College of Medicine),2017-12-15,,2015-10-18,Montana
9/5/2015-11/2/2017,2017-11-02,2 in Montana, https://media.dojmt.gov/wp-content/uploads/TRS-Healthcare.pdf ,TRS Healthcare,2017-12-15,,2015-09-05,Montana
8/3/2017-9/27/2017,2017-09-27,3 in Montana, https://media.dojmt.gov/wp-content/uploads/DJI-Technology-Inc.pdf ,"DJI Technology, Inc.",2017-12-18,,2017-08-03,Montana
11/20/2017-12/15/2017,2017-12-15,1 in Montana, https://media.dojmt.gov/wp-content/uploads/Boeing-2.pdf ,The Boeing Company,2017-12-20,,2017-11-20,Montana
4/25/2017-12/11/2017,2017-12-11,41 in Montana, https://media.dojmt.gov/wp-content/uploads/Liveglam.pdf ,Liveglam,2017-12-29,,2017-04-25,Montana
12/2/2017-12/2/2017,2017-12-02,9 in Montana, https://media.dojmt.gov/wp-content/uploads/Multnomah-Athletic-Club.pdf ,Multnomah Athletic Club,2018-01-02,,2017-12-02,Montana
10/13/2017-10/13/2017,2017-10-13,1 in Montana, https://media.dojmt.gov/wp-content/uploads/Mr.-Cooper_Redacted.pdf ,Mr. Cooper,2018-01-05,,2017-10-13,Montana
4/23/2015-10/26/2017,2017-10-26,36 in Montana, https://media.dojmt.gov/wp-content/uploads/Beautyblinders.pdf ,Beautyblinders,2018-01-05,,2015-04-23,Montana
11/11/2017-11/11/2017,2017-11-11,202 in Montana, https://media.dojmt.gov/wp-content/uploads/Montana-State-University-Billings.pdf ,Montana State University Billings,2018-01-05,,2017-11-11,Montana
9/1/2017-11/13/2017,2017-11-13,Unknown in Montana, https://media.dojmt.gov/wp-content/uploads/Columbia-Falls-School-District.pdf ,Columbia Falls School District,2018-01-05,,2017-09-01,Montana
11/8/2017-11/8/2017,2017-11-08,5 in Montana, https://media.dojmt.gov/wp-content/uploads/Cetera-Advisors-LLC.pdf ,Cetera Advisors LLC,2018-01-08,,2017-11-08,Montana
11/29/2017-11/29/2017,2017-11-29,6 in Montana, https://media.dojmt.gov/wp-content/uploads/talentReef-Inc.pdf ,talentReef Inc,2018-01-09,,2017-11-29,Montana
7/18/2016-9/8/2017,2017-09-08,8 in Montana, https://media.dojmt.gov/wp-content/uploads/Broward-College.pdf ,Broward College,2018-01-10,,2016-07-18,Montana
11/1/2016-11/30/2017,2017-11-30,3 in Montana, https://media.dojmt.gov/wp-content/uploads/Alton-Lane.pdf ,Alton Lane,2018-01-10,,2016-11-01,Montana
11/1/2017-11/30/2017,2017-11-30,1 in Montana, https://media.dojmt.gov/wp-content/uploads/Capital-One-Bank.pdf ,Capital One Bank,2018-01-10,,2017-11-01,Montana
10/30/2017-11/13/2017,2017-11-13,2 in Montana, https://media.dojmt.gov/wp-content/uploads/Arthur-Ventures-Management-LLC.pdf ,Arthur Ventures Management LLC,2018-01-12,,2017-10-30,Montana
6/9/2017-10/2/2017,2017-10-02,249 in Montana, https://media.dojmt.gov/wp-content/uploads/Guaranteed-Rate-Inc..pdf ,"Guaranteed Rate, Inc.",2018-01-12,,2017-06-09,Montana
6/8/2017-12/22/2017,2017-12-22,Unknown in Montana, https://media.dojmt.gov/wp-content/uploads/Jasons-Deli-Inc.pdf ,"Jason's Deli, Inc",2018-01-12,,2017-06-08,Montana
10/12/2017-10/27/2017,2017-10-27,60 in Montana, https://media.dojmt.gov/wp-content/uploads/Pension-Fund.pdf ,Pension Fund of the Christian Church,2018-01-16,,2017-10-12,Montana
9/14/2017-9/18/2017,2017-09-18,1 in Montana, https://media.dojmt.gov/wp-content/uploads/Employer-Leasing-Company.pdf ,Employer Leasing Company,2018-01-18,,2017-09-14,Montana
12/5/2017-12/5/2017,2017-12-05,1 in Montana, https://media.dojmt.gov/wp-content/uploads/San-Diego-County-Office-of-Education.pdf ,San Diego County Office of Education,2018-01-18,,2017-12-05,Montana
7/19/2017-7/21/2017,2017-07-21,921 in Montana, https://media.dojmt.gov/wp-content/uploads/Rosewood-Hotel-Group-1.pdf ,QBE North America,2018-01-19,,2017-07-19,Montana
5/29/2016-1/11/2017,2017-01-11,5 in Montana, https://media.dojmt.gov/wp-content/uploads/Mindlance-Inc.-1.pdf ,Rosewood Hotel Group,2018-01-19,,2016-05-29,Montana
12/28/2017-12/29/2017,2017-12-29,2 in Montana, https://media.dojmt.gov/wp-content/uploads/Westminster-Ingleside-King-Farm-Pres-Retirement-Communities.pdf ,"Mindlance, Inc.",2018-01-19,,2017-12-28,Montana
11/21/2017-11/21/2017,2017-11-21,6 in Montana, https://media.dojmt.gov/wp-content/uploads/QBE-North-America-2.pdf ,"Westminster Ingleside King Farm Presbyterian Retirement Communities, Inc.",2018-01-19,,2017-11-21,Montana
11/17/2017-1/9/2018,2018-01-09,2 in Montana, https://media.dojmt.gov/wp-content/uploads/National-Registy-of-Emergency-Medical-Technicians.pdf ,National Registry of Emergency Medical Technicians,2018-01-25,,2017-11-17,Montana
10/31/2017-12/1/2017,2017-12-01,26 in Montana, https://media.dojmt.gov/wp-content/uploads/Goldleaf.pdf ,Goldleaf,2018-01-26,,2017-10-31,Montana
10/3/2017-12/22/2017,2017-12-22,2 in Montana, https://media.dojmt.gov/wp-content/uploads/RBC-Travelocity.pdf ,RBC Travelocity,2018-01-26,,2017-10-03,Montana
12/1/2017-12/15/2017,2017-12-15,12 in Montana, https://media.dojmt.gov/wp-content/uploads/KLX-Inc.pdf ,"KLX, Inc",2018-01-31,,2017-12-01,Montana
1/1/2016-1/18/2018,2018-01-18,1 in Montana, https://media.dojmt.gov/wp-content/uploads/Blink-Health-Inc..pdf ,Blink Health Inc.,2018-02-05,,2016-01-01,Montana
12/22/2017-12/22/2017,2017-12-22,605 in Montana, https://media.dojmt.gov/wp-content/uploads/PAR-Electrical-Contractors.pdf ,PAR Electrical Contractors,2018-02-05,,2017-12-22,Montana
9/21/2017-10/29/2017,2017-10-29,1 in Montana, https://media.dojmt.gov/wp-content/uploads/1st-Mariner-Bank.pdf ,First Mariner Bank,2018-02-05,,2017-09-21,Montana
1/25/2016-1/1/2018,2018-01-01,1 in Montana, https://media.dojmt.gov/wp-content/uploads/Kinetics-Systems-Inc.pdf ,Kinetics Systems Inc,2018-02-06,,2016-01-25,Montana
1/12/2018-1/12/2018,2018-01-12,1 in Montana, https://media.dojmt.gov/wp-content/uploads/Ameriprise-Financial-1.pdf ,Ameriprise Financial,2018-02-06,,2018-01-12,Montana
1/26/2018-1/26/2018,2018-01-26,4 in Montana, https://media.dojmt.gov/wp-content/uploads/Corporate-Employment-Resources-Inc..pdf ,"Corporate Employment Resources, Inc.",2018-02-08,,2018-01-26,Montana
12/4/2017-12/19/2017,2017-12-19,7 in Montana, https://media.dojmt.gov/wp-content/uploads/Makeup-Geek-LLC.pdf ,"Makeup Geek, LLC",2018-02-08,,2017-12-04,Montana
1/29/2018-1/29/2018,2018-01-29,2 in Montana, https://media.dojmt.gov/wp-content/uploads/Medical-Science-Computing-LLC.pdf ,"Medical Science and Computing, LLC",2018-02-13,,2018-01-29,Montana
1/26/2018-1/26/2018,2018-01-26,1 in Montana, https://media.dojmt.gov/wp-content/uploads/Thomas-Edison-State-University.pdf ,Thomas Edison State University,2018-02-13,,2018-01-26,Montana
12/6/2017-1/30/2018,2018-01-30,1 in Montana, https://media.dojmt.gov/wp-content/uploads/Flexible-Benefit-Service-Corporation.pdf ,"Flexible Benefit Service Corporation (""Flex"")",2018-02-14,,2017-12-06,Montana
1/22/2018-1/22/2018,2018-01-22,1 in Montana, https://media.dojmt.gov/wp-content/uploads/PACCAR.pdf ,PACCAR,2018-02-14,,2018-01-22,Montana
1/4/2018-1/18/2018,2018-01-18,19 in Montana, https://media.dojmt.gov/wp-content/uploads/Chapman-Mortgage-Services.pdf ,Chapman Mortgage Services (Motto Mortgage of Billings),2018-02-15,,2018-01-04,Montana
6/27/2016-12/21/2017,2017-12-21,9 in Montana, https://media.dojmt.gov/wp-content/uploads/LendKey.pdf ,"LendKey Technologies, Inc.",2018-02-15,,2016-06-27,Montana
11/16/2017-11/17/2017,2017-11-17,1 in Montana, https://media.dojmt.gov/wp-content/uploads/Bialy-Thomas-and-Associates.pdf ,Bialy/Thomas & Associates,2018-02-16,,2017-11-16,Montana
1/18/2018-1/18/2018,2018-01-18,200 in Montana, https://media.dojmt.gov/wp-content/uploads/Bed-Bath-Beyond.pdf ,Bed Bath & Beyond,2018-02-21,,2018-01-18,Montana
12/17/2017-12/17/2017,2017-12-17,4 in Montana, https://media.dojmt.gov/wp-content/uploads/Santa-Cruz-Biotechnology-Inc..pdf ,"Santa Cruz Biotechnology, Inc.",2018-02-22,,2017-12-17,Montana
1/29/2018-1/29/2018,2018-01-29,5 in Montana, https://media.dojmt.gov/wp-content/uploads/Walmart.pdf ,"Walmart, Inc.",2018-02-22,,2018-01-29,Montana
2/5/2018-2/5/2018,2018-02-05,7 in Montana, https://media.dojmt.gov/wp-content/uploads/University-of-WI.pdf ,University of Wisconsin-Superior,2018-02-22,,2018-02-05,Montana
12/1/2016-9/30/2017,2017-09-30,1 in Montana, https://media.dojmt.gov/wp-content/uploads/Active-Network.pdf ,Active Network,2018-02-23,,2016-12-01,Montana
1/20/2017-1/29/2018,2018-01-29,1289 in Montana, https://media.dojmt.gov/wp-content/uploads/North-40-Outfitters.pdf ,North 40 Outfitters,2018-02-23,,2017-01-20,Montana
1/5/2018-1/5/2018,2018-01-05,1 in Montana, https://media.dojmt.gov/wp-content/uploads/Country-Mutual-Insurance-Company-Country-Financial.pdf ,Country Mutual Insurance Company (Country Financial),2018-02-23,,2018-01-05,Montana
